"","BIN","Borough","House","Street.Name","Job.Type","Work.Type","Permit.Status","Filing.Date","Expiration.Date","Job.Start.Date","Lat","Long"
"1",1088749,"MANHATTAN","1","MADISON AVE","A3","EQ","ISSUED","05/10/2022","05/10/2023",2022-05-10,40.740909,-73.987947
"2",3039744,"BROOKLYN","91","RALPH AVENUE","A3","EQ","ISSUED","05/10/2022","05/10/2023",2021-05-06,40.686912,-73.923501
"3",3244226,"BROOKLYN","2236","EAST 63RD STREET","A1","PL","ISSUED","05/10/2022","05/10/2023",2021-05-06,40.61377,-73.910697
"4",3325917,"BROOKLYN","235","ADAMS STREET","A2","OT","ISSUED","05/10/2022","05/04/2023",2022-03-18,40.696502,-73.98873
"5",3337046,"BROOKLYN","2525","LINDEN BLVD","A2","PL","ISSUED","05/10/2022","05/10/2023",2022-05-10,40.667404,-73.870801
"6",3032216,"BROOKLYN","179","ROGERS AVENUE","A2","OT","ISSUED","05/10/2022","12/18/2022",2022-05-10,40.671238,-73.953144
"7",3131254,"BROOKLYN","5706","21 AVE","A2","OT","ISSUED","05/10/2022","05/17/2023",2021-10-29,40.619652,-73.979032
"8",5174885,"STATEN ISLAND","71","MEADOW AVENUE","NB","","ISSUED","05/10/2022","09/08/2022",2021-05-04,40.601585,-74.093892
"9",4618858,"QUEENS","43-16","166 ST","NB","","ISSUED","05/11/2022","04/29/2023",2021-05-28,40.758079,-73.800534
"10",3426347,"BROOKLYN","689","FRANKLIN AVE","NB","PL","ISSUED","05/11/2022","05/11/2023",2022-05-11,40.674915,-73.956422
"11",2010402,"BRONX","1323","CHISHOLM ST","DM","","ISSUED","06/17/2020","02/21/2021",2020-06-17,40.830992,-73.895698
"12",5032708,"STATEN ISLAND","136","ADA DRIVE","A2","OT","ISSUED","05/11/2022","10/01/2022",2022-05-11,40.620541,-74.15861
"13",3000370,"BROOKLYN","9","DEKALB AVENUE","A3","EQ","ISSUED","05/11/2022","05/11/2023",2020-06-03,40.689985,-73.98254
"14",3000370,"BROOKLYN","9","DEKALB AVENUE","A3","EQ","ISSUED","05/11/2022","05/11/2023",2020-06-03,40.689985,-73.98254
"15",3000370,"BROOKLYN","9","DEKALB  AVENUE","A3","EQ","ISSUED","05/11/2022","05/11/2023",2020-06-03,40.689985,-73.98254
"16",3338507,"BROOKLYN","1388","BUSHWICK AVENUE","A1","","ISSUED","05/11/2022","10/03/2022",2022-05-11,40.684868,-73.910025
"17",3338507,"BROOKLYN","1388","BUSHWICK AVENUE","A1","","ISSUED","05/11/2022","10/03/2022",2022-05-11,40.684868,-73.910025
"18",3327107,"BROOKLYN","2864","ATLANTIC AVENUE","DM","EQ","ISSUED","05/11/2022","05/17/2023",2022-05-17,40.676977,-73.888458
"19",4451550,"QUEENS","162-5","71ST AVE","A2","OT","ISSUED","05/11/2022","05/01/2023",2022-01-14,40.730433,-73.806956
"20",1811452,"MANHATTAN","20","RANDALLS ISLAND","A2","OT","ISSUED","05/11/2022","01/01/2023",2022-05-11,NA,NA
"21",3004546,"BROOKLYN","207","PRESIDENT STREET","A1","","ISSUED","05/10/2022","01/01/2023",2020-12-21,40.682482,-73.998861
"22",1022581,"MANHATTAN","1","TIMES SQUARE","A2","OT","ISSUED","05/10/2022","10/01/2022",2022-05-16,40.756628,-73.986287
"23",1013637,"MANHATTAN","341","WEST 38TH STREET","A1","PL","ISSUED","05/12/2022","05/12/2023",2022-05-12,40.755237,-73.992864
"24",1009430,"MANHATTAN","16","FIFTH AVENUE","NB","","ISSUED","03/18/2024","03/17/2025",2022-09-23,40.732624,-73.996092
"25",5017765,"STATEN ISLAND","139","TILLMAN STREET","A2","OT","ISSUED","08/08/2022","07/06/2023",2020-02-06,40.604675,-74.116178
"26",3332224,"BROOKLYN","748","HENRY STREET","A2","PL","ISSUED","08/08/2022","08/08/2023",2021-08-27,40.675409,-74.003612
"27",3428627,"BROOKLYN","3192","ATLANTIC AVENUE","NB","","ISSUED","05/12/2022","05/23/2023",2020-06-09,40.679952,-73.877619
"28",3338507,"BROOKLYN","1388","BUSHWICK AVENUE","A1","","ISSUED","05/11/2022","10/03/2022",2022-05-12,40.684868,-73.910025
"29",4531123,"QUEENS","147-48","HOOK CREEK BOULEVARD","A2","OT","ISSUED","08/08/2022","10/01/2022",2022-08-08,40.655744,-73.726614
"30",3047675,"BROOKLYN","327","BAINBRIDGE  STREET","A2","OT","ISSUED","05/13/2022","12/18/2022",2022-05-13,40.681817,-73.923654
"31",2000697,"BRONX","265","ALEXANDER AVENUE","A1","","ISSUED","05/13/2022","05/16/2023",2020-10-09,40.810473,-73.924847
"32",2130558,"BRONX","6327","BROADWAY","NB","","ISSUED","05/13/2022","05/23/2023",2020-12-23,NA,NA
"33",1091717,"MANHATTAN","155","WEST 29TH STREET","NB","","ISSUED","05/13/2022","10/01/2022",2021-07-13,40.747308,-73.991587
"34",4099366,"QUEENS","144-07","21 AVENUE","A2","OT","ISSUED","05/13/2022","10/01/2022",2022-05-13,40.78061,-73.823615
"35",5106483,"STATEN ISLAND","105","HAMILTON AVENUE","A2","MH","ISSUED","05/13/2022","02/22/2023",2021-07-21,40.644735,-74.081222
"36",2007580,"BRONX","1840","ANTHONY AVENUE","A1","","ISSUED","05/13/2022","10/08/2022",2021-12-16,40.847574,-73.903653
"37",3094480,"BROOKLYN","521","ELDERT LANE","A2","OT","ISSUED","05/02/2022","09/16/2022",2022-05-13,40.678242,-73.864972
"38",3053387,"BROOKLYN","121","MACDONOUGH ST","A1","","ISSUED","08/18/2021","12/24/2022",2022-05-19,40.681263,-73.941646
"39",1019603,"MANHATTAN","245","EAST 19TH STREET","A2","OT","ISSUED","05/15/2022","06/22/2022",2022-03-22,40.735828,-73.983614
"40",5042638,"STATEN ISLAND","61","ANDERSON STREET","A2","OT","ISSUED","05/16/2022","10/01/2022",2022-05-24,40.615914,-74.069758
"41",3202030,"BROOKLYN","1719","AVENUE X","A2","OT","ISSUED","05/16/2022","05/23/2023",2020-12-08,40.592449,-73.952994
"42",1045894,"MANHATTAN","425","EAST 74TH STREET","A2","OT","ISSUED","05/16/2022","05/06/2023",2021-01-28,40.768821,-73.95431
"43",1044935,"MANHATTAN","330","E 75TH STREET","A2","OT","ISSUED","05/16/2022","12/09/2022",2021-08-06,40.770383,-73.956085
"44",1035371,"MANHATTAN","343","MADISON AVENUE","DM","","ISSUED","05/16/2022","01/28/2023",2022-02-22,40.754253,-73.97821
"45",4618544,"QUEENS","147-25","94TH AVENUE","A2","BL","ISSUED","05/16/2022","05/01/2023",2021-03-23,40.699222,-73.806426
"46",3335882,"BROOKLYN","172","CADMAN PLAZA EAST","A2","OT","ISSUED","05/17/2022","05/14/2023",2020-02-19,40.698511,-73.989906
"47",3428829,"BROOKLYN","46","STOCKHOLM STREET","NB","PL","ISSUED","05/17/2022","05/17/2023",2021-05-26,40.696204,-73.926003
"48",2092082,"BRONX","3603","THIRD AVENUE","A2","OT","ISSUED","05/17/2022","05/15/2023",2021-02-19,40.83308,-73.904809
"49",4619876,"QUEENS","131-19","FOWLER AVENUE","A3","EQ","ISSUED","06/19/2020","06/19/2021",2020-06-19,40.751837,-73.83296
"50",1078053,"MANHATTAN","725","FDR DRIVE","A2","OT","ISSUED","05/17/2022","05/15/2023",2020-07-08,40.721318,-73.974812
"51",1078053,"MANHATTAN","725","FDR DRIVE","A2","OT","ISSUED","05/17/2022","05/15/2023",2020-07-08,40.721318,-73.974812
"52",1078053,"MANHATTAN","725","FDR DRIVE","A2","OT","ISSUED","05/17/2022","05/15/2023",2020-07-08,40.721318,-73.974812
"53",1078053,"MANHATTAN","725","FDR DRIVE","A2","OT","ISSUED","05/17/2022","05/15/2023",2020-07-08,40.721318,-73.974812
"54",4451550,"QUEENS","162-5","71ST AVE","A2","OT","ISSUED","05/17/2022","05/01/2023",2022-01-14,40.730433,-73.806956
"55",4430785,"QUEENS","1-05","ASTORIA BOULEVARD","A2","OT","ISSUED","05/17/2022","05/15/2023",2021-03-04,40.773895,-73.936539
"56",4430795,"QUEENS","2-08","ASTORIA BOULEVARD","A2","OT","ISSUED","05/17/2022","05/15/2023",2021-04-13,40.77367,-73.936088
"57",2046058,"BRONX","1618","CROSBY AVENUE","DM","","ISSUED","05/13/2022","09/30/2022",2022-05-17,40.844432,-73.830584
"58",4252623,"QUEENS","125-17","ROCKAWAY BLVD","A2","OT","ISSUED","05/18/2022","01/14/2023",2020-04-28,40.675355,-73.812404
"59",2087014,"BRONX","1025","MORRISON AVENUE","A2","FS","ISSUED","05/18/2022","05/01/2023",2022-01-25,40.825403,-73.873666
"60",2087014,"BRONX","1025","MORRISON AVENUE","A2","FB","ISSUED","05/18/2022","05/01/2023",2022-01-25,40.825403,-73.873666
"61",2087014,"BRONX","1025","MORRISON AVENUE","A2","BL","ISSUED","05/18/2022","05/01/2023",2022-01-25,40.825403,-73.873666
"62",2058773,"BRONX","937","EAST 213 STREET","A2","OT","ISSUED","05/18/2022","12/11/2022",2022-05-18,40.877409,-73.858257
"63",2046144,"BRONX","3066","ROBERTS AVENUE","A1","","ISSUED","05/18/2022","03/15/2023",2022-02-02,40.84606,-73.829102
"64",5170925,"STATEN ISLAND","435","TOMPKINS AVENUE","NB","","ISSUED","05/18/2022","11/16/2022",2020-06-18,40.614957,-74.073096
"65",1009430,"MANHATTAN","16","FIFTH AVENUE","NB","","ISSUED","03/18/2024","03/17/2025",2022-09-23,40.732624,-73.996092
"66",3429094,"BROOKLYN","170","FREEMAN STREET","NB","","ISSUED","05/18/2022","05/18/2023",2022-05-18,40.734481,-73.954532
"67",3429094,"BROOKLYN","170","FREEMAN STREET","NB","","ISSUED","05/18/2022","05/18/2023",2022-05-18,40.734481,-73.954532
"68",1016041,"MANHATTAN","25","WEST 39TH STREET","A2","OT","ISSUED","05/18/2022","01/23/2023",2020-07-02,40.752022,-73.983304
"69",4192720,"QUEENS","86-20","116 STREET","A2","OT","ISSUED","05/18/2022","12/05/2022",2021-12-01,40.699695,-73.833541
"70",3416888,"BROOKLYN","4910","14TH AVENUE","NB","","ISSUED","03/08/2023","03/07/2024",2021-10-08,40.633578,-73.990052
"71",1053313,"MANHATTAN","194","LENOX AVE","A2","OT","ISSUED","01/05/2022","03/19/2023",2020-12-11,40.804384,-73.94795
"72",3325166,"BROOKLYN","321","PROSPECT AVENUE","A2","OT","ISSUED","03/08/2023","06/12/2023",2023-03-08,40.662478,-73.987781
"73",3327107,"BROOKLYN","2864","ATLANTIC AVENUE","DM","","ISSUED","05/12/2022","05/18/2023",2022-05-18,40.676977,-73.888458
"74",5084790,"STATEN ISLAND","1888","DRUMGOOLE ROAD WEST","A1","","ISSUED","05/13/2022","10/06/2022",2022-05-18,40.531552,-74.206474
"75",5007133,"STATEN ISLAND","959","BARD AVENUE","A2","OT","ISSUED","05/19/2022","08/31/2022",2022-05-31,40.621027,-74.109049
"76",3056884,"BROOKLYN","57","PUTNAM AVENUE","A2","OT","ISSUED","05/19/2022","12/18/2022",2022-05-19,40.682901,-73.959925
"77",5018738,"STATEN ISLAND","95","SHERADEN AVENUE","A2","OT","ISSUED","05/19/2022","11/15/2022",2022-05-19,40.60916,-74.138181
"78",4216226,"QUEENS","165-20","ARCHER AVENUE","NB","EQ","ISSUED","05/19/2022","05/19/2023",2022-05-19,40.70414,-73.79351
"79",5863316,"STATEN ISLAND","114","NORTHFIELD AVENUE","NB","","ISSUED","05/19/2022","05/19/2023",2022-05-19,40.637658,-74.168217
"80",5048615,"STATEN ISLAND","99","ALTER AVENUE","A2","OT","ISSUED","05/19/2022","10/01/2022",2022-05-19,40.592017,-74.097195
"81",1079184,"MANHATTAN","224","12TH AVENUE","A1","","RE-ISSUED","05/13/2022","03/11/2023",2020-09-28,40.752641,-74.007576
"82",1087645,"MANHATTAN","3880","9 AVENUE","DM","","ISSUED","05/18/2022","05/10/2023",2022-05-20,40.864107,-73.916771
"83",2005347,"BRONX","830","REV JAMES A POLITE AVENUE","A2","OT","ISSUED","05/20/2022","04/25/2023",2022-03-02,40.81875,-73.898886
"84",5082634,"STATEN ISLAND","100","LUTEN AVENUE","A2","OT","ISSUED","05/20/2022","05/19/2023",2022-01-28,40.528092,-74.192032
"85",5082634,"STATEN ISLAND","100","LUTEN AVENUE","A2","OT","ISSUED","05/20/2022","05/19/2023",2022-01-28,40.528092,-74.192032
"86",4012524,"QUEENS","44-04","31ST AVENUE","A2","OT","ISSUED","05/20/2022","03/08/2023",2022-05-20,40.759745,-73.913757
"87",1087645,"MANHATTAN","3880","9 AVENUE","DM","EQ","ISSUED","05/20/2022","05/20/2023",2022-05-20,40.864107,-73.916771
"88",3027721,"BROOKLYN","819","DEAN STREET","A1","","ISSUED","05/20/2022","05/22/2023",2027-08-30,40.679133,-73.962862
"89",3027721,"BROOKLYN","819","DEAN STREET","A1","","ISSUED","05/20/2022","05/22/2023",2021-08-30,40.679133,-73.962862
"90",3027721,"BROOKLYN","819","DEAN STREET","A1","","ISSUED","05/20/2022","05/22/2023",2021-08-30,40.679133,-73.962862
"91",2130518,"BRONX","3019","CORLEAR AVENUE","NB","","ISSUED","08/08/2022","06/29/2023",2020-07-16,40.879381,-73.908648
"92",4225215,"QUEENS","91-26","211TH STREET","A2","OT","ISSUED","05/20/2022","04/21/2023",2022-05-20,40.718837,-73.751283
"93",4267054,"QUEENS","114-22","166TH STREET","A2","OT","ISSUED","08/08/2022","06/29/2023",2021-12-17,40.689502,-73.782994
"94",2130763,"BRONX","101","LINCOLN AVENUE","A2","OT","ISSUED","04/20/2020","06/07/2020",2020-04-20,40.807149,-73.929969
"95",2130763,"BRONX","101","LINCOLN AVENUE","A2","OT","ISSUED","06/11/2020","04/22/2021",2020-06-12,40.807149,-73.929969
"96",2130763,"BRONX","101","LINCOLN AVENUE","A2","OT","ISSUED","06/03/2020","01/31/2021",2020-04-20,40.807149,-73.929969
"97",2130763,"BRONX","101","LINCOLN AVENUE","NB","","ISSUED","06/26/2020","07/08/2020",2020-06-30,40.807149,-73.929969
"98",2130763,"BRONX","101","LINCOLN AVENUE","NB","","ISSUED","06/26/2020","07/01/2020",2020-06-30,40.807149,-73.929969
"99",2130763,"BRONX","101","LINCOLN AVENUE","NB","","ISSUED","07/01/2020","07/01/2021",2020-06-30,40.807149,-73.929969
"100",2130763,"BRONX","101","LINCOLN AVENUE","NB","","ISSUED","07/01/2020","07/01/2021",2020-06-30,40.807149,-73.929969
"101",2130763,"BRONX","101","LINCOLN AVENUE","NB","","ISSUED","02/09/2021","07/01/2021",2021-02-10,40.807149,-73.929969
"102",2130763,"BRONX","101","LINCOLN AVENUE","NB","PL","ISSUED","03/10/2021","03/10/2022",2021-03-10,40.807149,-73.929969
"103",2130763,"BRONX","101","LINCOLN AVENUE","A2","EQ","ISSUED","03/18/2021","03/18/2022",2021-03-18,40.807149,-73.929969
"104",2130763,"BRONX","101","LINCOLN AVENUE","A2","EQ","ISSUED","04/06/2021","04/06/2022",2021-04-06,40.807149,-73.929969
"105",2130763,"BRONX","101","LINCOLN AVENUE","A2","EQ","ISSUED","04/15/2021","04/15/2022",2021-04-15,40.807149,-73.929969
"106",2130763,"BRONX","101","LINCOLN AVENUE","A2","EQ","ISSUED","04/29/2021","04/29/2022",2021-04-29,40.807149,-73.929969
"107",2130763,"BRONX","101","LINCOLN AVENUE","A2","EQ","ISSUED","05/06/2021","05/06/2022",2021-05-06,40.807149,-73.929969
"108",2130763,"BRONX","101","LINCOLN AVE","A3","EQ","ISSUED","05/13/2021","05/13/2022",2021-05-13,40.807149,-73.929969
"109",2130763,"BRONX","101","LINCOLN AVENUE","NB","","ISSUED","06/16/2021","03/31/2022",2021-02-10,40.807149,-73.929969
"110",2130763,"BRONX","101","LINCOLN AVENUE","NB","","ISSUED","06/16/2021","03/31/2022",2020-06-30,40.807149,-73.929969
"111",2130763,"BRONX","101","LINCOLN AVENUE","NB","","ISSUED","06/16/2021","03/31/2022",2020-06-30,40.807149,-73.929969
"112",2130763,"BRONX","101","LINCOLN AVENUE","A2","EQ","ISSUED","07/23/2021","07/23/2022",2021-07-23,40.807149,-73.929969
"113",2130763,"BRONX","101","LINCOLN AVE","A3","EQ","ISSUED","07/27/2021","07/27/2022",2021-05-13,40.807149,-73.929969
"114",2130763,"BRONX","101","LINCOLN AVENUE","NB","PL","ISSUED","02/08/2022","02/08/2023",2021-03-10,40.807149,-73.929969
"115",2130763,"BRONX","101","LINCOLN AVENUE","NB","","ISSUED","03/25/2022","07/01/2022",2021-02-10,40.807149,-73.929969
"116",4196510,"QUEENS","89-13","118 STREET","A1","","IN PROCESS","09/25/2020","12/06/2022",2022-06-03,40.696855,-73.83035
"117",3429356,"BROOKLYN","83","APOLLO STREET","NB","","ISSUED","05/23/2022","05/23/2023",2022-05-23,40.727137,-73.93807
"118",5042946,"STATEN ISLAND","81","BELAIR ROAD","A2","OT","ISSUED","05/23/2022","10/21/2022",2022-05-23,40.610462,-74.066824
"119",2130558,"BRONX","6327","BROADWAY","NB","","ISSUED","05/23/2022","05/23/2023",2020-12-23,NA,NA
"120",3039569,"BROOKLYN","1443","PITKIN AVENUE","A2","OT","ISSUED","05/23/2022","12/18/2022",2022-05-23,40.668418,-73.920656
"121",3177264,"BROOKLYN","1809","EAST 2 STREET","A1","","ISSUED","05/23/2022","05/10/2023",2020-12-08,40.605315,-73.971215
"122",1009774,"MANHATTAN","422","HUDSON STREET","A2","OT","ISSUED","05/23/2022","05/20/2023",2021-01-25,40.730485,-74.006801
"123",1009774,"MANHATTAN","422","HUDSON STREET","A2","OT","ISSUED","05/23/2022","05/20/2023",2021-01-21,40.730485,-74.006801
"124",1091675,"MANHATTAN","202","E 23 ST","NB","","ISSUED","05/23/2022","01/01/2023",2021-06-28,40.738669,-73.982784
"125",2009646,"BRONX","1511","FULTON AVENUE","A1","PL","ISSUED","05/23/2022","05/23/2023",2021-05-19,40.836743,-73.900492
"126",1080074,"MANHATTAN","358","BOWERY","DM","EQ","ISSUED","05/23/2022","05/23/2023",2022-05-23,40.726772,-73.991673
"127",4623202,"QUEENS","35-15","19TH AVENUE","A3","EQ","ISSUED","04/19/2022","06/03/2023",2022-06-03,40.780124,-73.902028
"128",4253515,"QUEENS","116-64","120 STREET","A2","OT","ISSUED","05/24/2022","05/24/2023",2022-05-24,40.67565,-73.818301
"129",3057705,"BROOKLYN","1084","FULTON STREET","A2","SP","ISSUED","05/24/2022","05/24/2023",2021-05-07,40.681528,-73.957603
"130",3205691,"BROOKLYN","2670","COYLE STREET","A2","OT","ISSUED","05/24/2022","10/22/2022",2022-05-24,40.588353,-73.934778
"131",1048273,"MANHATTAN","150","EAST 91ST STREET","DM","EQ","ISSUED","05/24/2022","05/24/2023",2022-05-24,40.782533,-73.952924
"132",1048273,"MANHATTAN","150","EAST 91ST STREET","DM","EQ","ISSUED","05/24/2022","05/24/2023",2022-05-24,40.782533,-73.952924
"133",1048273,"MANHATTAN","150","EAST 91ST STREET","DM","","ISSUED","05/24/2022","04/03/2023",2022-05-24,40.782533,-73.952924
"134",3428561,"BROOKLYN","12","HALSEY STREET","NB","","ISSUED","12/18/2023","12/17/2024",2023-04-17,40.681446,-73.952902
"135",1052455,"MANHATTAN","2005","3RD AVENUE","DM","","ISSUED","05/24/2022","02/20/2023",2022-05-24,40.794223,-73.942732
"136",1088749,"MANHATTAN","1","MADISON AVE","A3","EQ","ISSUED","05/24/2022","05/24/2023",2022-05-24,40.740909,-73.987947
"137",2069800,"BRONX","4317","FURMAN AVENUE","A2","OT","ISSUED","05/25/2022","05/04/2023",2022-05-25,40.895923,-73.854948
"138",3428561,"BROOKLYN","12","HALSEY STREET","NB","","ISSUED","12/18/2023","12/17/2024",2022-03-21,40.681446,-73.952902
"139",3058228,"BROOKLYN","111","WILLOUGHBY STREET","NB","","ISSUED","05/25/2022","05/25/2023",2022-05-25,40.69214,-73.984628
"140",3332217,"BROOKLYN","92","CENTRE MALL","A2","PL","ISSUED","05/25/2022","05/25/2023",2020-07-06,40.674833,-74.003558
"141",1016077,"MANHATTAN","16","EAST 16TH STREET","DM","","ISSUED","05/25/2022","05/25/2023",2021-09-16,40.737122,-73.99218
"142",3200239,"BROOKLYN","2137","EAST 28TH ST","A2","OT","ISSUED","11/14/2022","08/03/2023",2022-11-14,40.599161,-73.943605
"143",3332224,"BROOKLYN","748","HENRY STREET","A2","PL","ISSUED","05/25/2022","05/25/2023",2020-06-26,40.675409,-74.003612
"144",3069262,"BROOKLYN","302","GRAHAM AVENUE","NB","","ISSUED","05/25/2022","01/28/2023",2020-02-12,40.712768,-73.944086
"145",1053747,"MANHATTAN","28","WEST 130 STREET","DM","","ISSUED","05/24/2022","01/26/2023",2022-05-25,40.810024,-73.94102
"146",3428817,"BROOKLYN","268","BARBEY STREET","A2","SD","ISSUED","05/26/2022","05/26/2023",2022-05-26,40.676365,-73.888452
"147",4536859,"QUEENS","23-47","99 STREET","A2","OT","ISSUED","05/26/2022","10/01/2022",2022-05-26,40.767605,-73.871375
"148",3206005,"BROOKLYN","3308","GLENWOOD RD","DM","","ISSUED","05/26/2022","05/10/2023",2022-05-26,40.634183,-73.944678
"149",2010077,"BRONX","813","ELSMERE PLACE","NB","","ISSUED","05/26/2022","08/12/2022",2022-05-26,40.843169,-73.88831
"150",3153319,"BROOKLYN","14","86 STREET","A2","OT","ISSUED","05/26/2022","12/18/2022",2022-05-26,40.625549,-74.040073
"151",4095526,"QUEENS","97-10","72 DR","A2","OT","ISSUED","05/26/2022","12/18/2022",2022-05-26,40.708741,-73.846551
"152",3429227,"BROOKLYN","57","DUPONT STREET","DM","EQ","ISSUED","05/26/2022","05/26/2023",2022-05-26,40.735643,-73.957648
"153",3429227,"BROOKLYN","57","DUPONT STREET","DM","","ISSUED","05/26/2022","02/24/2023",2022-05-26,40.735643,-73.957648
"154",2023810,"BRONX","1120","WHEELER AVE","A2","OT","ISSUED","05/26/2022","05/01/2023",2022-02-11,40.826672,-73.879669
"155",3069262,"BROOKLYN","302","GRAHAM AVENUE","NB","","ISSUED","05/26/2022","01/28/2023",2020-02-12,40.712768,-73.944086
"156",3069262,"BROOKLYN","302","GRAHAM AVENUE","NB","","ISSUED","05/26/2022","05/26/2023",2020-02-12,40.712768,-73.944086
"157",3069262,"BROOKLYN","302","GRAHAM AVENUE","NB","","ISSUED","05/26/2022","05/26/2023",2020-02-12,40.712768,-73.944086
"158",2128709,"BRONX","3187","GRAND CONCOURSE","NB","","ISSUED","05/26/2022","11/05/2022",2020-05-08,40.876341,-73.885774
"159",2128709,"BRONX","3187","GRAND CONCOURSE","NB","","ISSUED","05/26/2022","11/05/2022",2020-05-08,40.876341,-73.885774
"160",1017074,"MANHATTAN","335","5TH AVENUE","DM","EQ","ISSUED","05/26/2022","06/01/2023",2021-05-25,40.74787,-73.984961
"161",1017074,"MANHATTAN","335","5TH AVENUE","DM","EQ","ISSUED","05/26/2022","06/01/2023",2021-05-25,40.74787,-73.984961
"162",2128709,"BRONX","3187","GRAND CONCOURSE","NB","","ISSUED","05/26/2022","11/05/2022",2020-05-08,40.876341,-73.885774
"163",3157466,"BROOKLYN","7000","21 AVENUE","A3","EQ","ISSUED","05/26/2022","05/26/2023",2020-05-27,40.612273,-73.986713
"164",3157466,"BROOKLYN","7000","21 AVENUE","A3","EQ","ISSUED","05/26/2022","05/26/2023",2020-06-19,40.612273,-73.986713
"165",4159192,"QUEENS","217-63","54 AVENUE","A2","OT","ISSUED","05/26/2022","10/01/2022",2022-05-26,40.752569,-73.762392
"166",1019544,"MANHATTAN","220","EAST 17TH STREET","A2","OT","ISSUED","05/24/2022","01/18/2023",2022-05-26,40.734772,-73.98478
"167",1019544,"MANHATTAN","220","EAST 17TH STREET","A2","OT","ISSUED","05/24/2022","01/18/2023",2022-05-26,40.734772,-73.98478
"168",4225215,"QUEENS","91-26","211TH STREET","A2","OT","ISSUED","05/27/2022","04/21/2023",2022-05-27,40.718837,-73.751283
"169",4464276,"QUEENS","300","HILLSIDE AVENUE","NB","PL","ISSUED","05/27/2022","05/27/2023",2022-05-27,40.56693,-73.891133
"170",4257797,"QUEENS","109-44","143RD STREET","A2","OT","ISSUED","05/27/2022","04/21/2023",2022-05-27,40.687482,-73.802746
"171",1014251,"MANHATTAN","220","WEST 28TH STREET","A1","","ISSUED","05/27/2022","01/01/2023",2021-12-29,40.747582,-73.994197
"172",1083689,"MANHATTAN","511","EAST 20TH STREET","A2","OT","ISSUED","05/27/2022","06/01/2023",2020-10-21,40.733824,-73.97734
"173",4464276,"QUEENS","300","HILLSIDE AVENUE","NB","PL","ISSUED","06/19/2023","06/18/2024",2022-05-27,40.56693,-73.891133
"174",4200791,"QUEENS","101-50","126 ST","A2","OT","ISSUED","05/31/2022","10/01/2022",2022-05-31,40.691278,-73.819874
"175",4170096,"QUEENS","46-19","241 STREET","A1","","ISSUED","05/31/2022","01/25/2023",2021-05-19,40.763512,-73.744239
"176",4017069,"QUEENS","22-50","33 STREET","NB","","ISSUED","05/31/2022","11/19/2022",2020-09-17,40.774507,-73.910684
"177",1013637,"MANHATTAN","341","WEST 38TH STREET","A1","","ISSUED","05/31/2022","05/31/2023",2021-10-25,40.755237,-73.992864
"178",1013637,"MANHATTAN","341","WEST 38TH STREET","A1","","ISSUED","05/31/2022","05/31/2023",2021-09-16,40.755237,-73.992864
"179",1013637,"MANHATTAN","341","WEST 38TH STREET","A1","","ISSUED","05/31/2022","05/31/2023",2021-10-25,40.755237,-73.992864
"180",3080248,"BROOKLYN","720","CHAUNCEY STREET","A2","OT","ISSUED","05/31/2022","12/18/2022",2022-05-31,40.685014,-73.907706
"181",4623739,"QUEENS","2-21","MALT DRIVE","NB","","ISSUED","05/31/2022","05/31/2023",2022-03-03,NA,NA
"182",1088749,"MANHATTAN","1","MADISON AVENUE","A2","EQ","ISSUED","12/10/2020","12/11/2021",2020-12-11,40.740909,-73.987947
"183",2011872,"BRONX","16","WADE SQUARE","NB","","ISSUED","05/27/2022","07/01/2022",2022-05-31,40.85193,-73.891082
"184",4135975,"QUEENS","214-33","35TH AVENUE","A2","OT","ISSUED","03/18/2024","03/18/2025",2022-01-14,40.769536,-73.771148
"185",4083970,"QUEENS","67-20","60 STREET","A2","OT","ISSUED","06/01/2022","12/18/2022",2022-06-01,40.704485,-73.900333
"186",3034354,"BROOKLYN","687","MONTGOMERY STREET","A1","","ISSUED","06/01/2022","03/16/2023",2021-05-21,40.664909,-73.941772
"187",3424338,"BROOKLYN","26","BROADWAY","A2","PL","ISSUED","06/01/2022","06/01/2023",2022-06-01,40.710752,-73.967973
"188",3387625,"BROOKLYN","2015","FLATBUSH AVENUE","A1","","ISSUED","06/01/2022","05/13/2023",2021-05-28,40.620583,-73.934671
"189",2129483,"BRONX","2680","MORRIS AVENUE","NB","","ISSUED","06/01/2022","06/29/2022",2022-06-01,40.867472,-73.895959
"190",2129483,"BRONX","2680","MORRIS AVENUE","NB","","ISSUED","06/01/2022","06/29/2022",2022-06-01,40.867472,-73.895959
"191",2129483,"BRONX","2680","MORRIS AVENUE","NB","","ISSUED","06/01/2022","06/29/2022",2022-06-01,40.867472,-73.895959
"192",3107131,"BROOKLYN","460","SCHENECTADY AVENUE","A1","","ISSUED","06/01/2022","03/07/2023",2022-06-01,40.662421,-73.934464
"193",3107131,"BROOKLYN","460","SCHENECTADY AVENUE","A1","","ISSUED","06/01/2022","03/07/2023",2022-06-01,40.662421,-73.934464
"194",3107131,"BROOKLYN","460","SCHENECTADY AVENUE","A1","","ISSUED","06/01/2022","03/07/2023",2022-06-01,40.662421,-73.934464
"195",1007359,"MANHATTAN","182","SPRING STREET","DM","EQ","ISSUED","05/04/2022","06/01/2023",2022-06-01,40.72493,-74.002738
"196",3429084,"BROOKLYN","624","METROPOLITAN AVENUE","NB","","ISSUED","05/31/2022","02/28/2023",2022-06-01,40.714156,-73.948301
"197",3428817,"BROOKLYN","268","BARBEY STREET","NB","","ISSUED","06/02/2022","06/02/2023",2022-06-02,40.676365,-73.888452
"198",3324620,"BROOKLYN","1610","BERGEN ST","DM","","ISSUED","06/02/2022","12/21/2022",2022-06-02,40.674973,-73.929452
"199",4079271,"QUEENS","82-77","116 STREET","NB","","ISSUED","06/02/2022","06/02/2023",2021-12-17,40.707094,-73.836484
"200",4617668,"QUEENS","148-18","HILLSIDE AVE","A2","OT","ISSUED","06/02/2022","09/30/2022",2022-06-02,40.706166,-73.808184
"201",4617668,"QUEENS","148-18","HILLSIDE AVE","A2","OT","ISSUED","06/02/2022","09/30/2022",2022-06-02,40.706166,-73.808184
"202",4536087,"QUEENS","133-26","128 STREET","A2","OT","ISSUED","06/02/2022","11/15/2022",2022-06-02,40.670404,-73.811261
"203",4227778,"QUEENS","89-25","214 STREET","A2","OT","ISSUED","06/02/2022","12/18/2022",2022-06-02,40.724205,-73.749686
"204",4618544,"QUEENS","147-25","94 AVENUE","NB","PL","ISSUED","06/02/2022","06/02/2023",2020-07-07,40.699222,-73.806426
"205",5104468,"STATEN ISLAND","4855","HYLAN BOULEVARD","A1","","ISSUED","06/02/2022","01/19/2023",2021-11-26,40.526708,-74.167895
"206",1083026,"MANHATTAN","2","PENN PLAZA","A2","EQ","ISSUED","06/02/2022","06/02/2023",2021-05-06,40.750017,-73.991345
"207",1011013,"MANHATTAN","246","WEST 12 STREET","A1","","ISSUED","06/02/2022","06/01/2023",2020-01-28,40.737608,-74.002699
"208",1080352,"MANHATTAN","450","11TH AVENUE","NB","","ISSUED","06/02/2022","04/01/2023",2020-07-14,40.757486,-74.000729
"209",3205777,"BROOKLYN","750","E 23RD ST","A2","OT","ISSUED","05/02/2022","04/27/2023",2022-06-02,40.632134,-73.954666
"210",3335129,"BROOKLYN","63","FLUSHING AVENUE","A2","OT","ISSUED","05/18/2022","04/01/2023",2021-03-01,40.69802,-73.974986
"211",4137632,"QUEENS","39-01","CORPORAL STONE STREET","NB","PL","ISSUED","05/24/2022","06/02/2023",2022-06-02,40.765344,-73.770823
"212",3425387,"BROOKLYN","2818","WEST 16 STREET","A2","OT","ISSUED","11/14/2022","10/21/2023",2022-11-14,40.578407,-73.984038
"213",4270151,"QUEENS","172-28","128TH AVENUE","A2","OT","ISSUED","06/03/2022","04/21/2023",2022-06-03,40.679905,-73.771066
"214",1085735,"MANHATTAN","200","PARK AVENUE","A2","PL","ISSUED","08/09/2022","08/09/2023",2020-05-11,40.754162,-73.976557
"215",3131055,"BROOKLYN","1117","EAST 5TH STREET","A1","","ISSUED","06/03/2022","05/06/2023",2021-08-11,40.623702,-73.971772
"216",1041237,"MANHATTAN","20","EAST 68 STREET","A3","EQ","ISSUED","06/03/2022","06/03/2023",2020-05-28,40.769465,-73.967894
"217",4211185,"QUEENS","8253","172ND STREET","A2","OT","ISSUED","06/03/2022","04/21/2023",2022-06-03,40.718257,-73.793791
"218",2089064,"BRONX","11B","EDGEWATER PARK","A2","OT","ISSUED","06/03/2022","10/01/2022",2022-06-03,40.823623,-73.807151
"219",3117258,"BROOKLYN","2700","CHURCH AVE","DM","","RE-ISSUED","05/11/2022","06/02/2023",2022-06-03,40.650669,-73.952304
"220",4208920,"QUEENS","87-85","153 STREET","DM","","ISSUED","05/27/2022","09/07/2022",2022-06-23,40.706654,-73.804222
"221",3231879,"BROOKLYN","1332","EAST 98TH STREET","A2","OT","ISSUED","06/06/2022","04/21/2023",2022-06-06,40.640052,-73.89515
"222",2057045,"BRONX","800","EAST GUN HILL ROAD","A2","PL","ISSUED","11/14/2022","11/14/2023",2021-11-22,40.875953,-73.86197
"223",1031115,"MANHATTAN","315","WEST 78 STREET","A1","PL","ISSUED","08/09/2022","08/09/2023",2020-02-04,40.783806,-73.981981
"224",5166607,"STATEN ISLAND","80","SCARBORO AVENUE","NB","PL","ISSUED","06/06/2022","06/06/2023",2021-05-04,40.613706,-74.062592
"225",4267435,"QUEENS","116-29","166 STREET","A2","OT","ISSUED","06/06/2022","10/01/2022",2022-06-06,40.686229,-73.781061
"226",4290537,"QUEENS","147-44","259TH ST","A2","OT","ISSUED","06/06/2022","10/01/2022",2022-06-06,40.656144,-73.729596
"227",2057045,"BRONX","800","EAST GUN HILL ROAD","A2","PL","ISSUED","11/14/2022","11/14/2023",2021-11-22,40.875953,-73.86197
"228",3047923,"BROOKLYN","31","SUMPTER ST","NB","","ISSUED","06/06/2022","02/02/2023",2022-06-06,40.679299,-73.926174
"229",1036075,"MANHATTAN","601","MADISON AVENUE","A2","OT","ISSUED","06/06/2022","04/01/2023",2021-12-09,40.762563,-73.97215
"230",3047923,"BROOKLYN","31","SUMPTER ST","NB","","ISSUED","06/06/2022","02/02/2023",2022-06-06,40.679299,-73.926174
"231",3047923,"BROOKLYN","31","SUMPTER ST","NB","","ISSUED","06/06/2022","02/02/2023",2022-06-06,40.679299,-73.926174
"232",4618544,"QUEENS","147-25","94 AVENUE","NB","","ISSUED","06/06/2022","06/06/2023",2020-03-12,40.699222,-73.806426
"233",4618544,"QUEENS","147-25","94 AVENUE","NB","","ISSUED","06/06/2022","06/06/2023",2020-07-14,40.699222,-73.806426
"234",4618544,"QUEENS","147-25","94 AVENUE","NB","","ISSUED","06/06/2022","06/06/2023",2020-03-12,40.699222,-73.806426
"235",3063807,"BROOKLYN","54","DUPONT STREET","A1","PL","ISSUED","06/07/2022","06/07/2023",2022-06-07,40.73561,-73.957825
"236",4198662,"QUEENS","101-43","108 STREET","A2","OT","ISSUED","08/09/2022","08/25/2022",2022-08-09,40.686319,-73.834739
"237",4135975,"QUEENS","214-33","35TH AVENUE","A2","OT","ISSUED","03/18/2024","03/18/2025",2022-01-14,40.769536,-73.771148
"238",3429094,"BROOKLYN","170","FREEMAN STREET","NB","","ISSUED","06/07/2022","06/07/2023",2022-05-18,40.734481,-73.954532
"239",3429094,"BROOKLYN","170","FREEMAN STREET","NB","","ISSUED","06/07/2022","06/07/2023",2022-05-18,40.734481,-73.954532
"240",1062504,"MANHATTAN","537","EDGECOMBE AVENUE","A2","OT","ISSUED","06/07/2022","04/25/2023",2022-04-04,40.833142,-73.939363
"241",4623202,"QUEENS","35-15","19TH AVE","A3","EQ","ISSUED","06/07/2022","06/07/2023",2022-06-07,40.780124,-73.902028
"242",1035721,"MANHATTAN","665","5 AVENUE","DM","EQ","ISSUED","06/07/2022","06/07/2023",2022-06-07,40.760184,-73.975548
"243",1035721,"MANHATTAN","665","5 AVENUE","DM","","ISSUED","06/07/2022","01/12/2023",2022-06-07,40.760184,-73.975548
"244",1001005,"MANHATTAN","48","WALL STREET","A2","OT","ISSUED","06/07/2022","05/21/2023",2020-10-21,40.706331,-74.009396
"245",4617668,"QUEENS","148-18","HILLSIDE AVE","NB","EQ","ISSUED","06/07/2022","06/07/2023",2022-06-07,40.706166,-73.808184
"246",4135732,"QUEENS","34-07","CORPORAL  KENNEDY STREET","DM","","ISSUED","06/07/2022","03/23/2023",2022-06-07,40.769029,-73.778879
"247",4560984,"QUEENS","104-22 REAR","CORONA AVE","DM","","ISSUED","06/07/2022","09/24/2022",2022-06-28,40.743965,-73.85796
"248",1045212,"MANHATTAN","1487","1 AVENUE","DM","EQ","ISSUED","06/07/2022","06/07/2023",2022-06-07,40.771378,-73.953405
"249",1045212,"MANHATTAN","1487","1 AVENUE","DM","EQ","ISSUED","06/07/2022","06/07/2023",2022-06-07,40.771378,-73.953405
"250",4618544,"QUEENS","147-25","94 AVENUE","NB","","RE-ISSUED","06/10/2021","06/07/2023",2022-06-06,40.699222,-73.806426
"251",1000877,"MANHATTAN","88","WALL STREET","A3","OT","ISSUED","08/09/2022","08/09/2023",2022-02-22,40.705286,-74.007534
"252",3428908,"BROOKLYN","4622","FORT HAMILTON PARKWAY","NB","","ISSUED","06/06/2022","08/26/2022",2022-06-07,40.639669,-73.995737
"253",4063042,"QUEENS","5746","75TH STREET","A2","OT","ISSUED","11/14/2022","04/21/2023",2022-11-14,40.726965,-73.886167
"254",1028714,"MANHATTAN","145","CENTRAL PARK WEST","A3","EQ","ISSUED","08/09/2022","08/09/2023",2020-08-06,40.777819,-73.974801
"255",1005188,"MANHATTAN","533","EAST 11TH STREET","A1","","ISSUED","08/09/2022","03/01/2023",2021-11-24,40.728085,-73.980907
"256",3055876,"BROOKLYN","62","GREENE AVE","A1","","ISSUED","06/08/2022","06/15/2023",2021-07-14,40.686219,-73.970015
"257",2100247,"BRONX","160","HALL OF FAME TERRACE","A2","PL","ISSUED","06/08/2022","06/08/2023",2022-06-08,40.858971,-73.91147
"258",4145738,"QUEENS","150-01","COOLIDGE AVE","A2","OT","ISSUED","06/08/2022","10/01/2022",2022-06-08,40.715013,-73.809825
"259",4234775,"QUEENS","111-26","203 ST","A2","OT","ISSUED","06/08/2022","10/01/2022",2022-06-08,40.704309,-73.753627
"260",1033691,"MANHATTAN","720","WEST END AVENUE","A2","OT","ISSUED","06/08/2022","03/17/2023",2020-01-08,40.794723,-73.973581
"261",3428817,"BROOKLYN","268","BARBEY STREET","NB","PL","ISSUED","06/08/2022","06/08/2023",2022-04-08,40.676365,-73.888452
"262",4017069,"QUEENS","22-50","33 STREET","NB","PL","ISSUED","06/08/2022","06/08/2023",2021-05-19,40.774507,-73.910684
"263",1008467,"MANHATTAN","670","BROADWAY","A2","OT","RE-ISSUED","05/21/2019","06/08/2023",2022-06-08,40.727299,-73.995183
"264",1008467,"MANHATTAN","670","BROADWAY","A2","MH","RE-ISSUED","05/21/2019","06/08/2023",2022-06-08,40.727299,-73.995183
"265",4135975,"QUEENS","214-33","35TH AVENUE","A2","OT","ISSUED","03/18/2024","03/18/2025",2022-01-14,40.769536,-73.771148
"266",1046667,"MANHATTAN","1076","MADISON AVENUE","A1","","ISSUED","06/09/2022","08/15/2022",2021-06-01,40.777826,-73.961041
"267",3429205,"BROOKLYN","1538","BROOKLYN AVENUE","NB","","ISSUED","08/09/2022","08/09/2023",2021-05-25,40.635598,-73.942154
"268",4289783,"QUEENS","245-59","148 DRIVE","A2","OT","ISSUED","06/09/2022","10/01/2022",2022-06-09,40.653773,-73.737927
"269",2051283,"BRONX","2500","BARKER AVENUE","NB","","ISSUED","06/09/2022","05/16/2023",2020-09-30,40.863569,-73.86936
"270",2051283,"BRONX","2500","BARKER AVENUE","NB","","ISSUED","06/09/2022","05/16/2023",2020-09-30,40.863569,-73.86936
"271",2051283,"BRONX","2500","BARKER AVENUE","NB","","ISSUED","06/09/2022","05/16/2023",2020-09-30,40.863569,-73.86936
"272",3429205,"BROOKLYN","1538","BROOKLYN AVENUE","NB","","ISSUED","08/09/2022","08/09/2023",2021-05-25,40.635598,-73.942154
"273",1083026,"MANHATTAN","2","PENN PLAZA","A1","PL","ISSUED","06/09/2022","06/09/2023",2021-07-02,40.750017,-73.991345
"274",3429205,"BROOKLYN","1538","BROOKLYN AVENUE","NB","","ISSUED","08/09/2022","08/09/2023",2021-05-25,40.635598,-73.942154
"275",2060747,"BRONX","3349","FENTON AVE","A2","OT","IN PROCESS","06/09/2022","",2022-06-09,40.875282,-73.847547
"276",2069863,"BRONX","763","WHITEHALL PLACE","A2","OT","ISSUED","06/09/2022","12/18/2022",2022-06-09,40.895814,-73.853548
"277",3115866,"BROOKLYN","601","PARKSIDE AVENUE","A2","MH","ISSUED","06/10/2024","06/02/2025",2020-02-21,40.656046,-73.953742
"278",1045212,"MANHATTAN","1487","1 AVENUE","DM","","ISSUED","06/08/2022","04/26/2023",2022-06-09,40.771378,-73.953405
"279",2016005,"BRONX","3852","BAILEY AVENUE","A1","","ISSUED","06/10/2022","06/10/2023",2021-06-07,40.885183,-73.896138
"280",1082653,"MANHATTAN","413","GRAND STREET","A2","OT","ISSUED","08/09/2022","12/10/2022",2020-12-16,40.715828,-73.986336
"281",4617668,"QUEENS","148-18","HILLSIDE AVE","NB","","ISSUED","06/10/2022","09/30/2022",2022-06-10,40.706166,-73.808184
"282",2100247,"BRONX","160","HALL OF FAME TERRACE","A2","MH","ISSUED","06/10/2022","03/24/2023",2022-06-10,40.858971,-73.91147
"283",2079699,"BRONX","920","BRINSMADE AVENUE","A2","OT","ISSUED","08/09/2022","04/01/2023",2022-08-09,40.828075,-73.829693
"284",1083026,"MANHATTAN","2","PENN PLAZA","A2","OT","ISSUED","06/10/2022","06/11/2023",2021-05-06,40.750017,-73.991345
"285",3058177,"BROOKLYN","134","VANDERBILT AVENUE","DM","EQ","ISSUED","06/10/2022","06/10/2023",2022-06-10,40.693855,-73.969986
"286",1001021,"MANHATTAN","28","LIBERTY STREET","A2","OT","ISSUED","07/05/2020","09/30/2020",2020-07-05,40.708115,-74.008768
"287",1023724,"MANHATTAN","123","WEST 57TH STREET","DM","","ISSUED","06/13/2022","06/11/2023",2022-03-04,40.764705,-73.978084
"288",4222089,"QUEENS","188-17","91 AVENUE","A2","OT","ISSUED","06/13/2022","10/01/2022",2022-06-13,40.71189,-73.771137
"289",4537043,"QUEENS","503","127TH ST","A2","OT","ISSUED","06/13/2022","10/01/2022",2022-06-13,40.792335,-73.840756
"290",3429047,"BROOKLYN","461","FULTON STREET","NB","","ISSUED","06/13/2022","03/26/2023",2021-04-21,40.691254,-73.986817
"291",4218972,"QUEENS","11036","173RD STREET","A2","OT","ISSUED","06/13/2022","04/21/2023",2022-06-13,40.696221,-73.780257
"292",3421881,"BROOKLYN","8516","AVE J","NB","PL","ISSUED","06/13/2022","06/13/2023",2020-01-30,40.636341,-73.907583
"293",3426085,"BROOKLYN","831","HART STREET","NB","","ISSUED","06/13/2022","02/21/2023",2022-06-13,40.702065,-73.922625
"294",3426085,"BROOKLYN","831","HART STREET","NB","","ISSUED","06/13/2022","02/21/2023",2022-06-13,40.702065,-73.922625
"295",3157466,"BROOKLYN","7000","21 AVE.","A2","PL","ISSUED","06/13/2022","06/13/2023",2020-06-19,40.612273,-73.986713
"296",3329179,"BROOKLYN","1894","CONEY ISLAND AVENUE","DM","EQ","ISSUED","06/13/2022","06/13/2023",2022-06-13,40.611197,-73.962615
"297",3329179,"BROOKLYN","1894","CONEY ISLAND AVENUE","DM","","ISSUED","06/13/2022","11/23/2022",2022-06-13,40.611197,-73.962615
"298",2010077,"BRONX","813","ELSMERE PLACE","NB","","ISSUED","06/10/2022","08/12/2022",2022-05-26,40.843169,-73.88831
"299",4142453,"QUEENS","135-19","78 ROAD","NB","","ISSUED","08/09/2022","01/20/2023",2022-05-02,40.718783,-73.824681
"300",4242453,"QUEENS","22326","114TH AVENUE","A2","OT","ISSUED","06/14/2022","04/21/2023",2022-06-14,40.701751,-73.734013
"301",3157466,"BROOKLYN","7000","21 AVE.","A2","MH","ISSUED","06/14/2022","06/02/2023",2020-06-19,40.612273,-73.986713
"302",4435247,"QUEENS","109-30","160TH STREET","A2","OT","ISSUED","06/14/2022","08/01/2022",2022-06-14,40.693495,-73.791683
"303",4163005,"QUEENS","67-53","212 ST","A2","OT","ISSUED","06/14/2022","10/01/2022",2022-06-14,40.74261,-73.763193
"304",2077789,"BRONX","1006","WILCOX AVENUE","A2","OT","ISSUED","06/14/2022","04/21/2023",2022-06-14,40.834026,-73.81931
"305",3153881,"BROOKLYN","650","86TH STREET","A2","OT","ISSUED","06/14/2022","09/10/2022",2022-06-14,40.618851,-74.021875
"306",1083026,"MANHATTAN","2","PENN PLAZA","A2","OT","ISSUED","06/14/2022","06/11/2023",2021-03-22,40.750017,-73.991345
"307",1083026,"MANHATTAN","2","PENN PLAZA","A2","OT","ISSUED","06/14/2022","06/11/2023",2021-03-19,40.750017,-73.991345
"308",1009430,"MANHATTAN","14","FIFTH AVENUE","DM","EQ","ISSUED","06/14/2022","06/14/2023",2022-06-14,40.732555,-73.996143
"309",2015709,"BRONX","2731","KINGSBRIDGE TERRACE","NB","","ISSUED","06/14/2022","08/18/2022",2022-06-14,40.871757,-73.903506
"310",5171142,"STATEN ISLAND","109","FINGERBOARD RD","NB","","ISSUED","08/09/2022","01/30/2023",2020-11-09,40.607501,-74.066004
"311",1009430,"MANHATTAN","14","FIFTH AVENUE","DM","","ISSUED","06/14/2022","09/20/2022",2022-06-14,40.732555,-73.996143
"312",1091571,"MANHATTAN","172","EAST 122 STREET","NB","","ISSUED","06/14/2022","09/21/2022",2022-06-14,40.802109,-73.938058
"313",5019660,"STATEN ISLAND","20","SUFFOLK AVENUE","A1","","ISSUED","06/14/2022","06/14/2023",2022-06-14,40.605271,-74.128157
"314",5175245,"STATEN ISLAND","839","FATHER CAPODANNO BOULEVARD","NB","","ISSUED","06/14/2022","09/16/2022",2021-04-23,40.575512,-74.083478
"315",1090459,"MANHATTAN","255","WEST 34 STREET","A3","EQ","ISSUED","06/14/2022","06/14/2023",2020-06-17,40.751823,-73.992569
"316",1035347,"MANHATTAN","6","EAST 43RD STREET","A2","OT","ISSUED","06/14/2022","06/29/2023",2020-09-10,40.753979,-73.979997
"317",3428829,"BROOKLYN","46","STOCKHOLM STREET","NB","","ISSUED","06/14/2022","09/22/2022",2020-08-12,40.696204,-73.926003
"318",5174428,"STATEN ISLAND","117","FINGERBOARD RD","NB","","ISSUED","08/09/2022","01/30/2023",2020-11-09,40.607424,-74.066191
"319",4210752,"QUEENS","85-27","168 PL","A2","MH","ISSUED","07/06/2020","01/16/2021",2020-07-06,40.713522,-73.795458
"320",1017224,"MANHATTAN","415","5TH AVE","A3","EQ","ISSUED","06/15/2022","06/15/2023",2022-06-15,40.750603,-73.982972
"321",1022687,"MANHATTAN","711","7 AVENUE","DM","EQ","ISSUED","03/08/2023","03/07/2024",2023-03-08,40.759543,-73.98437
"322",3117258,"BROOKLYN","2700","CHURCH AVE","DM","","ISSUED","06/15/2022","06/02/2023",2022-06-03,40.650669,-73.952304
"323",1083026,"MANHATTAN","2","PENN PLAZA","A2","EQ","ISSUED","06/15/2022","06/15/2023",2021-05-06,40.750017,-73.991345
"324",1083026,"MANHATTAN","2","PENN PLAZA","A2","OT","ISSUED","06/15/2022","06/11/2023",2021-05-06,40.750017,-73.991345
"325",4060077,"QUEENS","59-10","57TH RD","A2","OT","ISSUED","06/15/2022","04/27/2023",2022-06-15,40.722464,-73.90782
"326",2009646,"BRONX","1511","FULTON AVENUE","A2","SD","ISSUED","06/15/2022","06/15/2023",2021-06-11,40.836743,-73.900492
"327",2009646,"BRONX","1511","FULTON AVENUE","A2","SP","ISSUED","06/15/2022","06/15/2023",2021-06-11,40.836743,-73.900492
"328",4623202,"QUEENS","35-15","19TH AVENUE","A2","EQ","ISSUED","06/08/2022","06/15/2023",2022-06-15,40.780124,-73.902028
"329",4556074,"QUEENS","88-28 REAR","43 AVE","DM","","ISSUED","06/14/2022","05/08/2023",2022-04-20,40.742371,-73.877642
"330",3153881,"BROOKLYN","650","86TH STREET","NB","","ISSUED","06/16/2022","04/01/2023",2022-06-16,40.618851,-74.021875
"331",3153881,"BROOKLYN","650","86TH STREET","NB","","ISSUED","06/16/2022","04/01/2023",2022-06-16,40.618851,-74.021875
"332",3153881,"BROOKLYN","650","86TH STREET","NB","PL","ISSUED","06/16/2022","06/16/2023",2022-06-16,40.618851,-74.021875
"333",1008832,"MANHATTAN","1","UNIVERSITY PLACE","A2","OT","ISSUED","06/16/2022","06/29/2023",2021-05-21,40.730785,-73.995486
"334",3392611,"BROOKLYN","630 GAR","AVENUE K","DM","","ISSUED","06/16/2022","06/16/2023",2022-06-16,40.621857,-73.969349
"335",3320833,"BROOKLYN","142","AVENUE O","DM","","ISSUED","04/22/2022","06/16/2023",2022-06-16,40.610682,-73.979647
"336",1015733,"MANHATTAN","262","FIFTH AVENUE","NB","","RE-ISSUED","06/15/2022","06/16/2023",2022-06-16,40.745081,-73.987019
"337",3428829,"BROOKLYN","46","STOCKHOLM STREET","NB","","ISSUED","06/14/2022","09/22/2022",2020-08-15,40.696204,-73.926003
"338",4623971,"QUEENS","31-29","CRESCENT STREET","NB","","ISSUED","06/17/2022","09/24/2022",2022-06-17,40.764934,-73.926923
"339",3076057,"BROOKLYN","1333","BROADWAY","NB","","ISSUED","06/17/2022","12/05/2022",2022-01-13,40.690065,-73.923046
"340",3076057,"BROOKLYN","1333","BROADWAY","NB","","ISSUED","06/18/2022","01/01/2023",2021-07-01,40.690065,-73.923046
"341",3076057,"BROOKLYN","1333","BROADWAY","NB","","ISSUED","06/18/2022","01/01/2023",2021-07-29,40.690065,-73.923046
"342",3426347,"BROOKLYN","689","FRANKLIN AVE","NB","","ISSUED","06/18/2022","12/31/2022",2021-06-28,40.674915,-73.956422
"343",1001027,"MANHATTAN","140","BROADWAY","A2","OT","ISSUED","06/20/2022","04/20/2023",2020-08-24,40.709043,-74.010626
"344",3429327,"BROOKLYN","625","FULTON STREET","NB","","ISSUED","06/20/2022","07/08/2023",2021-03-25,40.688566,-73.980045
"345",3429327,"BROOKLYN","625","FULTON STREET","NB","","ISSUED","06/20/2022","07/08/2023",2020-11-13,40.688566,-73.980045
"346",3179458,"BROOKLYN","1360","OCEAN AVE","A3","OT","ISSUED","06/20/2022","06/22/2023",2020-12-08,40.628998,-73.957024
"347",4105078,"QUEENS","23-19","PARSONS BLVD","NB","PL","ISSUED","06/20/2022","06/20/2023",2021-01-20,40.778178,-73.823874
"348",2012457,"BRONX","2321","BELMONT AVE","A2","SP","ISSUED","06/20/2022","06/20/2023",2021-03-29,40.85329,-73.88684
"349",5005226,"STATEN ISLAND","127","ALASKA STREET","A2","OT","ISSUED","06/21/2022","10/01/2022",2022-06-25,40.636052,-74.120531
"350",2130750,"BRONX","1600","GRAND AVENUE","NB","","ISSUED","06/21/2022","06/21/2023",2022-06-21,40.8465,-73.916612
"351",4436311,"QUEENS","81-03","HAMMELS BLVD","A2","OT","ISSUED","06/21/2022","12/21/2022",2020-02-28,40.589896,-73.807556
"352",4436311,"QUEENS","81-03","HAMMELS BLVD","A2","OT","ISSUED","06/21/2022","12/21/2022",2020-02-28,40.589896,-73.807556
"353",4436311,"QUEENS","81-03","HAMMELS BLVD","A2","OT","ISSUED","06/21/2022","12/21/2022",2020-02-28,40.589896,-73.807556
"354",4436311,"QUEENS","81-03","HAMMELS BLVD","A2","OT","ISSUED","06/21/2022","12/21/2022",2020-03-03,40.589896,-73.807556
"355",1078053,"MANHATTAN","725","FDR DRIVE","A2","PL","ISSUED","06/21/2022","06/21/2023",2020-07-10,40.721318,-73.974812
"356",1052384,"MANHATTAN","232","EAST 103 STREET","A2","PL","ISSUED","06/21/2022","06/21/2023",2020-06-24,40.788952,-73.944538
"357",2129483,"BRONX","2680","MORRIS AVENUE","NB","","ISSUED","06/21/2022","06/29/2022",2022-06-01,40.867472,-73.895959
"358",2129483,"BRONX","2680","MORRIS AVENUE","NB","","ISSUED","06/21/2022","06/29/2022",2022-06-01,40.867472,-73.895959
"359",2129483,"BRONX","2680","MORRIS AVENUE","NB","","ISSUED","06/21/2022","06/29/2022",2022-06-01,40.867472,-73.895959
"360",3117838,"BROOKLYN","2801","TILDEN AVENUE","NB","","ISSUED","06/21/2022","04/01/2023",2021-06-24,40.646825,-73.950919
"361",3117838,"BROOKLYN","2801","TILDEN AVENUE","NB","","ISSUED","06/21/2022","04/01/2023",2021-06-24,40.646825,-73.950919
"362",3117838,"BROOKLYN","2801","TILDEN AVENUE","NB","","ISSUED","06/21/2022","04/01/2023",2021-06-24,40.646825,-73.950919
"363",3221821,"BROOKLYN","8614","AVENUE B","A1","","ISSUED","06/22/2022","06/08/2023",2021-06-16,40.647754,-73.919044
"364",2012457,"BRONX","2321","BELMONT AVE","NB","","ISSUED","06/22/2022","12/24/2022",2020-01-03,40.85329,-73.88684
"365",1090655,"MANHATTAN","401","WEST STREET","A3","EQ","ISSUED","06/22/2022","06/22/2023",2020-12-08,40.733488,-74.01024
"366",1090655,"MANHATTAN","401","WEST STREET","A3","EQ","ISSUED","06/22/2022","06/22/2023",2020-02-04,40.733488,-74.01024
"367",4623877,"QUEENS","148-17 GAR","59 AV","NB","","ISSUED","06/22/2022","06/22/2023",2022-06-22,40.742505,-73.820482
"368",3428543,"BROOKLYN","353","20TH STREET","NB","","ISSUED","06/22/2022","06/27/2023",2021-11-05,40.659703,-73.989162
"369",3428850,"BROOKLYN","1120","SAINT JOHNS PLACE","NB","","ISSUED","06/22/2022","10/29/2022",2020-08-04,40.671134,-73.941251
"370",1085816,"MANHATTAN","26","BEAVER ST","A2","OT","ISSUED","06/22/2022","07/01/2023",2021-09-20,40.704959,-74.011902
"371",4155261,"QUEENS","75-51","195 STREET","A1","","ISSUED","06/22/2022","04/01/2023",2022-06-22,40.731712,-73.776279
"372",4155261,"QUEENS","75-51","195 STREET","A1","","ISSUED","06/22/2022","04/01/2023",2022-06-22,40.731712,-73.776279
"373",4155261,"QUEENS","75-51","195 STREET","A1","","ISSUED","06/22/2022","04/01/2023",2022-06-22,40.731712,-73.776279
"374",2130518,"BRONX","3019","CORLEAR AVENUE","NB","","ISSUED","06/22/2022","08/12/2022",2020-07-16,40.879381,-73.908648
"375",2130518,"BRONX","3019","CORLEAR AVENUE","NB","EQ","ISSUED","06/22/2022","06/22/2023",2020-07-16,40.879381,-73.908648
"376",2013607,"BRONX","203","EAST FORDHAM ROAD","A2","OT","ISSUED","06/22/2022","10/01/2022",2021-02-18,40.862417,-73.896734
"377",2001874,"BRONX","333","E 151ST STREET","A2","OT","ISSUED","06/23/2022","06/23/2023",2021-12-28,40.818232,-73.919867
"378",3236798,"BROOKLYN","2049","EAST 60TH STREET","A2","OT","ISSUED","06/23/2022","04/21/2023",2022-06-23,40.61529,-73.916296
"379",3001453,"BROOKLYN","52","4TH AVE","NB","","ISSUED","06/23/2022","08/19/2023",2021-11-17,40.683038,-73.979261
"380",1086331,"MANHATTAN","111","ANDES ROAD","A1","","ISSUED","06/23/2022","06/23/2023",2021-06-26,40.692552,-74.016281
"381",4051200,"QUEENS","64-35","102ND STREET","A2","OT","ISSUED","06/23/2022","04/29/2023",2022-06-23,40.730941,-73.853164
"382",1086331,"MANHATTAN","111","ANDES ROAD","A1","","ISSUED","06/23/2022","06/23/2023",2021-06-25,40.692552,-74.016281
"383",2020806,"BRONX","423","THIERIOT AVE","A2","OT","ISSUED","06/23/2022","04/27/2023",2022-06-23,40.813693,-73.860224
"384",1086331,"MANHATTAN","111","ANDES ROAD","A1","","ISSUED","06/23/2022","06/23/2023",2021-06-25,40.692552,-74.016281
"385",2129483,"BRONX","2680","MORRIS AVENUE","NB","","ISSUED","06/23/2022","06/29/2023",2022-06-01,40.867472,-73.895959
"386",2129483,"BRONX","2680","MORRIS AVENUE","NB","","ISSUED","06/23/2022","06/29/2023",2022-06-01,40.867472,-73.895959
"387",4266822,"QUEENS","140-05","158 STREET","A2","OT","ISSUED","06/23/2022","12/11/2022",2022-06-23,40.669004,-73.777156
"388",2129483,"BRONX","2680","MORRIS AVENUE","NB","","ISSUED","06/23/2022","06/29/2023",2022-06-01,40.867472,-73.895959
"389",1033298,"MANHATTAN","592","AMSTERDAM AVE","A1","","ISSUED","06/23/2022","05/12/2023",2020-01-09,40.789393,-73.973782
"390",4299390,"QUEENS","242","BEACH 20TH STREET","A2","SP","ISSUED","06/23/2022","06/23/2023",2020-06-26,40.596162,-73.754105
"391",1033299,"MANHATTAN","594","AMSTERDAM AVE","A1","","ISSUED","06/23/2022","05/12/2023",2020-01-09,40.789453,-73.973739
"392",4285233,"QUEENS","176-16","145 AVE","A2","OT","ISSUED","06/23/2022","10/01/2022",2022-06-23,40.664956,-73.772123
"393",3245283,"BROOKLYN","2","BRIGHTON 10TH LANE","A1","","ISSUED","06/23/2022","09/01/2022",2020-01-15,40.580484,-73.959619
"394",3245283,"BROOKLYN","2","BRIGHTON 10TH LANE","A1","","ISSUED","06/23/2022","09/01/2022",2020-01-15,40.580484,-73.959619
"395",5162986,"STATEN ISLAND","4187GAR","RICHMOND AVE","DM","","ISSUED","06/23/2022","06/23/2023",2022-06-24,40.536529,-74.157817
"396",3327682,"BROOKLYN","1442","44 STREET","A1","PL","ISSUED","06/23/2022","06/23/2023",2021-04-19,40.635889,-73.986013
"397",3069262,"BROOKLYN","302","GRAHAM AVENUE","NB","","ISSUED","06/23/2022","12/10/2022",2020-02-12,40.712768,-73.944086
"398",3069262,"BROOKLYN","302","GRAHAM AVENUE","NB","","ISSUED","06/23/2022","12/10/2022",2020-02-12,40.712768,-73.944086
"399",3069262,"BROOKLYN","302","GRAHAM AVENUE","NB","","ISSUED","06/23/2022","12/10/2022",2020-02-12,40.712768,-73.944086
"400",1091731,"MANHATTAN","1307","3 AVENUE","DM","EQ","ISSUED","08/26/2021","08/26/2022",2021-08-26,40.771553,-73.959272
"401",1091731,"MANHATTAN","1307","3 AVENUE","DM","EQ","ISSUED","08/26/2021","08/26/2022",2021-08-26,40.771553,-73.959272
"402",1091731,"MANHATTAN","1307","3 AVENUE","DM","","ISSUED","08/26/2021","04/03/2022",2021-08-31,40.771553,-73.959272
"403",1091731,"MANHATTAN","1305","THIRD AVENUE","DM","EQ","ISSUED","08/26/2021","08/26/2022",2021-08-26,40.771509,-73.959304
"404",1091731,"MANHATTAN","1305","THIRD AVENUE","DM","EQ","ISSUED","08/26/2021","08/26/2022",2021-08-26,40.771509,-73.959304
"405",1091731,"MANHATTAN","1305","THIRD AVENUE","DM","","ISSUED","08/26/2021","04/03/2022",2021-08-31,40.771509,-73.959304
"406",1091731,"MANHATTAN","202","E 75TH STREET","DM","EQ","RE-ISSUED","09/09/2021","09/09/2022",2021-09-09,40.771534,-73.958817
"407",1091731,"MANHATTAN","202","E 75TH STREET","DM","EQ","ISSUED","09/09/2021","09/09/2022",2021-09-09,40.771534,-73.958817
"408",1091731,"MANHATTAN","202","E 75TH STREET","DM","","ISSUED","09/09/2021","04/03/2022",2021-09-09,40.771534,-73.958817
"409",1090655,"MANHATTAN","401","WEST STREET","A3","EQ","ISSUED","06/22/2022","06/22/2023",2020-03-18,40.733488,-74.01024
"410",3041658,"BROOKLYN","190","MACDOUGAL STREET","A1","PL","ISSUED","04/27/2022","07/27/2023",2021-03-03,40.680037,-73.91293
"411",2022962,"BRONX","2137","QUIMBY AVENUE","A2","OT","ISSUED","06/24/2022","04/01/2023",2022-06-24,40.825945,-73.851519
"412",3426451,"BROOKLYN","230","EXETER STREET","NB","PL","ISSUED","06/24/2022","06/24/2023",2020-09-24,40.576511,-73.94808
"413",3206748,"BROOKLYN","2402","AVENUE I","A2","OT","ISSUED","06/24/2022","07/01/2023",2021-01-26,40.628549,-73.952875
"414",3244226,"BROOKLYN","2236","EAST 63RD STREET","A1","PL","ISSUED","06/24/2022","06/24/2023",2021-05-06,40.61377,-73.910697
"415",4051200,"QUEENS","64-35","102ND STREET","A2","OT","ISSUED","06/24/2022","04/29/2023",2022-01-11,40.730941,-73.853164
"416",3058177,"BROOKLYN","134","VANDERBILT AVENUE","DM","","ISSUED","06/24/2022","11/23/2022",2022-06-24,40.693855,-73.969986
"417",1043220,"MANHATTAN","106","EAST 78 STREET","A1","","ISSUED","06/24/2022","09/06/2022",2020-10-06,40.774743,-73.960534
"418",1064097,"MANHATTAN","49","WADSWORTH TERRACE","A2","OT","ISSUED","06/24/2022","07/11/2023",2021-02-10,40.856004,-73.931487
"419",4016142,"QUEENS","36-08","24 AVE","DM","EQ","ISSUED","06/24/2022","06/24/2023",2022-06-24,40.770413,-73.912747
"420",4016142,"QUEENS","36-08","24 AVE","DM","","ISSUED","06/24/2022","05/19/2023",2022-06-24,40.770413,-73.912747
"421",1036505,"MANHATTAN","425","PARK AVENUE","A2","SP","IN PROCESS","06/24/2022","",2022-06-24,40.760512,-73.971541
"422",1088294,"MANHATTAN","250","MAIN STREET","A2","OT","ISSUED","06/27/2022","06/29/2023",2021-04-20,40.75687,-73.955574
"423",1088294,"MANHATTAN","250","MAIN STREET","A2","OT","ISSUED","06/27/2022","06/29/2023",2021-07-22,40.75687,-73.955574
"424",4232797,"QUEENS","190-19","105TH AVE","A2","OT","ISSUED","06/27/2022","04/27/2023",2022-06-27,40.705535,-73.766816
"425",4258870,"QUEENS","146-19","LINDEN BOULEVARD","A2","OT","ISSUED","06/27/2022","10/01/2022",2022-06-27,40.685435,-73.796983
"426",1036505,"MANHATTAN","425","PARK AVENUE","A2","SP","ISSUED","06/27/2022","06/27/2023",2022-06-27,40.760512,-73.971541
"427",3246888,"BROOKLYN","2971","CONEY ISLAND AVENUE","NB","","ISSUED","04/08/2022","03/01/2023",2020-08-28,40.583965,-73.959991
"428",4209575,"QUEENS","89-63","163RD STREET","A2","MH","ISSUED","06/28/2022","10/01/2022",2022-06-28,40.706648,-73.798015
"429",4433859,"QUEENS","104-60","QUEENS BOULEVARD","A2","OT","ISSUED","06/28/2022","07/01/2023",2020-02-19,40.723485,-73.84849
"430",4455400,"QUEENS","65-43","PARSONS BLVD","A2","OT","ISSUED","06/28/2022","04/01/2023",2022-06-28,40.735224,-73.810579
"431",4433860,"QUEENS","104-20","QUEENS BOULEVARD","A2","OT","ISSUED","06/28/2022","07/01/2023",2020-02-19,40.72378,-73.848991
"432",1041237,"MANHATTAN","20","EAST 68 STREET","A3","EQ","ISSUED","06/28/2022","06/28/2023",2022-06-28,40.769465,-73.967894
"433",1086331,"MANHATTAN","111","ANDES ROAD","A1","PL","ISSUED","06/28/2022","06/28/2023",2021-08-02,40.692552,-74.016281
"434",3016509,"BROOKLYN","511","7TH AVENUE","A2","OT","ISSUED","06/28/2022","05/31/2023",2022-06-28,40.661061,-73.986534
"435",3016509,"BROOKLYN","511","7TH AVENUE","A2","MH","ISSUED","06/28/2022","05/31/2023",2022-06-28,40.661061,-73.986534
"436",3125585,"BROOKLYN","230","EAST 9TH STREET","A2","OT","ISSUED","06/28/2022","04/01/2023",2022-06-28,40.642805,-73.970561
"437",2130750,"BRONX","1600","GRAND AVENUE","NB","","ISSUED","06/28/2022","06/28/2023",2022-06-28,40.8465,-73.916612
"438",2130750,"BRONX","1600","GRAND AVENUE","NB","","ISSUED","06/28/2022","06/28/2023",2022-06-28,40.8465,-73.916612
"439",1005723,"MANHATTAN","183","CHRYSTIE STREET","DM","EQ","ISSUED","06/28/2022","06/28/2023",2022-06-28,40.721548,-73.992096
"440",1005723,"MANHATTAN","183","CHRYSTIE STREET","DM","","ISSUED","06/28/2022","04/16/2023",2022-06-28,40.721548,-73.992096
"441",1087511,"MANHATTAN","27","WEST 72ND STREET","A2","OT","ISSUED","06/28/2022","12/29/2022",2022-03-31,40.776979,-73.977748
"442",1047045,"MANHATTAN","1107","5 AVENUE","A2","OT","ISSUED","06/28/2022","07/01/2023",2020-06-29,40.785246,-73.957696
"443",1087511,"MANHATTAN","27","WEST 72ND STREET","A2","OT","ISSUED","06/28/2022","12/29/2022",2022-04-01,40.776979,-73.977748
"444",3016509,"BROOKLYN","511","7TH AVENUE","A2","PL","ISSUED","06/28/2022","06/28/2023",2022-06-28,40.661061,-73.986534
"445",1046919,"MANHATTAN","1070","PARK AVENUE","A2","OT","ISSUED","06/28/2022","07/01/2023",2020-09-01,40.781293,-73.956399
"446",2013297,"BRONX","2075","WEBSTER AVENUE","A2","PL","ISSUED","06/28/2022","06/28/2023",2021-06-29,40.851741,-73.898493
"447",2013297,"BRONX","2075","WEBSTER AVENUE","A2","PL","ISSUED","06/28/2022","06/28/2023",2021-06-29,40.851741,-73.898493
"448",2011872,"BRONX","16","WADE SQUARE","NB","","ISSUED","06/28/2022","09/19/2022",2022-05-31,40.85193,-73.891082
"449",4139463,"QUEENS","57-21","136 ST","DM","","ISSUED","06/28/2022","01/14/2023",2022-06-28,40.746613,-73.829119
"450",2013607,"BRONX","203","EAST FORDHAM ROAD","A2","OT","ISSUED","06/28/2022","10/01/2022",2021-02-19,40.862417,-73.896734
"451",4007659,"QUEENS","30-38","31ST STREET","A1","","ISSUED","06/28/2022","01/28/2023",2022-08-01,40.765993,-73.922132
"452",4039475,"QUEENS","88-28","43 AVE","DM","","ISSUED","06/23/2022","12/23/2022",2022-04-20,40.742371,-73.877642
"453",3325557,"BROOKLYN","21","NOSTRAND AVENUE","A2","OT","ISSUED","06/23/2022","02/10/2023",2022-06-28,40.699394,-73.953355
"454",3128660,"BROOKLYN","4609","16 AVE","DM","","ISSUED","11/15/2022","06/01/2023",2022-11-15,40.632598,-73.983874
"455",1016889,"MANHATTAN","28","EAST 28TH STREET","A2","MH","ISSUED","06/29/2022","06/29/2023",2020-07-08,40.743876,-73.985406
"456",3237614,"BROOKLYN","2151","EAST 69 STREET","A1","PL","ISSUED","06/29/2022","06/29/2023",2022-06-29,40.618056,-73.90799
"457",1001394,"MANHATTAN","1","CENTRE STREET","A2","OT","ISSUED","06/29/2022","04/15/2023",2021-11-22,40.713001,-74.004181
"458",1016889,"MANHATTAN","28","EAST 28TH STREET","A2","OT","ISSUED","06/29/2022","06/29/2023",2020-01-09,40.743876,-73.985406
"459",1016889,"MANHATTAN","28","EAST 28TH STREET","A1","","ISSUED","06/29/2022","06/29/2023",2020-02-12,40.743876,-73.985406
"460",1016889,"MANHATTAN","28","EAST 28TH STREET","A2","OT","ISSUED","06/29/2022","06/29/2023",2020-01-08,40.743876,-73.985406
"461",4250687,"QUEENS","11123","124 STREET","A2","OT","ISSUED","06/29/2022","06/01/2023",2022-06-29,40.681101,-73.816606
"462",4074432,"QUEENS","67-47","ALDERTON STREET","NB","PL","ISSUED","06/29/2022","06/29/2023",2021-04-15,40.716587,-73.858754
"463",1054420,"MANHATTAN","120","EAST 123RD STREET","A2","OT","ISSUED","06/29/2022","07/01/2023",2021-10-05,40.8034,-73.939173
"464",3325589,"BROOKLYN","41","NOSTRAND AVENUE","A2","OT","ISSUED","06/28/2022","02/10/2023",2022-06-29,40.698579,-73.953193
"465",4617668,"QUEENS","148-18","HILLSIDE AVE","NB","","ISSUED","03/08/2023","06/29/2023",2022-06-10,40.706166,-73.808184
"466",4032931,"QUEENS","26-24","96TH ST","A2","OT","ISSUED","08/10/2022","04/27/2023",2022-08-10,40.762032,-73.873148
"467",2011872,"BRONX","16","WADE SQUARE","NB","","ISSUED","06/30/2022","07/01/2023",2021-10-25,40.85193,-73.891082
"468",2085610,"BRONX","6171","TYNDALL AVENUE","A2","OT","ISSUED","06/30/2022","10/01/2022",2022-06-30,40.911415,-73.900037
"469",2011872,"BRONX","16","WADE SQUARE","NB","","ISSUED","06/30/2022","07/01/2023",2021-10-25,40.85193,-73.891082
"470",1022687,"MANHATTAN","711","7 AVENUE","DM","","ISSUED","03/08/2023","10/18/2023",2023-03-08,40.759543,-73.98437
"471",3355253,"BROOKLYN","1244 GAR","NEW YORK AVE","DM","","ISSUED","06/30/2022","06/30/2023",2022-06-30,40.64253,-73.945788
"472",3079253,"BROOKLYN","162","COVERT STREET","DM","","ISSUED","06/30/2022","05/10/2023",2022-06-30,40.689421,-73.909233
"473",3195246,"BROOKLYN","2423","EAST 1 STREET","A2","OT","ISSUED","06/30/2022","08/25/2022",2022-06-30,40.589998,-73.969165
"474",2091244,"BRONX","1005","JEROME AVENUE","A2","OT","ISSUED","06/30/2022","06/02/2023",2022-06-30,40.831608,-73.926276
"475",1091733,"MANHATTAN","333","EAST 82 STREET","A3","EQ","ISSUED","02/18/2020","02/17/2021",2020-02-18,40.774921,-73.952724
"476",1091733,"MANHATTAN","333","EAST 82 STREET","A3","EQ","ISSUED","10/22/2020","10/22/2021",2020-10-22,40.774921,-73.952724
"477",1091733,"MANHATTAN","333","EAST 82 STREET","A3","EQ","ISSUED","10/21/2021","10/21/2022",2020-10-22,40.774921,-73.952724
"478",1091733,"MANHATTAN","331","EAST 82 STREET","NB","PL","ISSUED","11/01/2021","11/01/2022",2020-11-03,40.774935,-73.95276
"479",3428829,"BROOKLYN","46","STOCKHOLM STREET","NB","","ISSUED","06/14/2022","09/22/2022",2020-08-15,40.696204,-73.926003
"480",3341331,"BROOKLYN","590","6 STREET","A1","","RE-ISSUED","02/24/2022","10/03/2022",2020-12-14,40.667057,-73.976674
"481",2087855,"BRONX","2101","SEWARD AVENUE","A2","OT","ISSUED","08/10/2022","04/21/2023",2022-08-10,40.820733,-73.851481
"482",5082634,"STATEN ISLAND","100","LUTEN AVENUE","A2","OT","ISSUED","03/18/2024","04/01/2024",2024-03-18,40.528092,-74.192032
"483",1017223,"MANHATTAN","10","EAST 38TH STREET","A2","SP","ISSUED","07/01/2022","07/01/2023",2020-06-12,40.750642,-73.98199
"484",4217983,"QUEENS","173-35","103 ROAD","A2","OT","ISSUED","07/01/2022","12/18/2022",2022-07-01,40.704079,-73.784054
"485",4532481,"QUEENS","191-28","120 AVENUE","A2","OT","ISSUED","07/01/2022","10/01/2022",2022-07-01,40.687678,-73.75777
"486",3154286,"BROOKLYN","8853","FORT HAMILTON PARKWAY","A2","OT","ISSUED","07/01/2022","07/24/2022",2022-07-01,40.619015,-74.025694
"487",4127009,"QUEENS","47-42","196TH PL","A2","OT","ISSUED","07/01/2022","04/27/2023",2022-07-13,40.751876,-73.783874
"488",1036505,"MANHATTAN","425","PARK AVENUE","A2","OT","ISSUED","12/16/2020","11/01/2021",2020-01-09,40.760512,-73.971541
"489",5082634,"STATEN ISLAND","100","LUTEN AVENUE","A2","PL","ISSUED","03/18/2024","03/18/2025",2024-03-18,40.528092,-74.192032
"490",3429519,"BROOKLYN","20","VITAL AVENUE","NB","","ISSUED","12/19/2023","04/08/2024",2022-09-08,NA,NA
"491",3019260,"BROOKLYN","17","ST JOHNS PLACE","A2","MH","ISSUED","07/05/2022","07/01/2023",2021-06-23,40.678135,-73.978379
"492",3019260,"BROOKLYN","17","ST JOHNS PLACE","A2","OT","ISSUED","07/05/2022","07/01/2023",2021-06-23,40.678135,-73.978379
"493",1085735,"MANHATTAN","200","PARK AVENUE","A2","PL","ISSUED","07/05/2022","07/05/2023",2020-05-11,40.754162,-73.976557
"494",4617668,"QUEENS","148-18","HILLSIDE AVE","A2","OT","ISSUED","03/08/2023","06/29/2023",2022-06-02,40.706166,-73.808184
"495",3117838,"BROOKLYN","2801","TILDEN AVENUE","NB","","ISSUED","07/05/2022","07/09/2022",2021-06-24,40.646825,-73.950919
"496",4174242,"QUEENS","76-35","HEWLETT STREET","A1","","ISSUED","07/05/2022","05/06/2023",2020-02-12,40.75396,-73.705027
"497",3201629,"BROOKLYN","3117","AVENUE W","A2","OT","ISSUED","07/05/2022","07/03/2023",2021-11-17,40.596757,-73.933499
"498",1007359,"MANHATTAN","182","SPRING STREET","DM","","IN PROCESS","07/05/2022","",2022-06-01,40.72493,-74.002738
"499",1036505,"MANHATTAN","425","PARK AVENUE","A2","PL","ISSUED","07/05/2022","07/05/2023",2022-07-05,40.760512,-73.971541
"500",4042866,"QUEENS","33-16","112 STREET","A1","","ISSUED","08/10/2022","05/01/2023",2020-08-12,40.757658,-73.857469
"501",5174506,"STATEN ISLAND","48","ERASTINA PL","NB","","ISSUED","07/05/2022","03/12/2023",2022-07-05,40.635339,-74.156087
"502",3249062,"BROOKLYN","115","IVAN COURT","NB","","ISSUED","07/05/2022","08/15/2022",2021-06-28,40.588905,-73.926144
"503",3246888,"BROOKLYN","2971","CONEY ISLAND AVENUE","NB","","ISSUED","07/05/2022","03/01/2023",2020-08-28,40.583965,-73.959991
"504",3059909,"BROOKLYN","37","LEE AVENUE","A2","OT","ISSUED","07/05/2022","06/28/2023",2021-12-16,40.706657,-73.960978
"505",1011884,"MANHATTAN","557","HUDSON STREET","A1","","ISSUED","07/06/2022","07/19/2023",2021-05-28,40.735429,-74.006037
"506",2092788,"BRONX","1020","SOUNDVIEW AVENUE","A2","OT","ISSUED","07/06/2022","10/25/2022",2022-07-06,40.82563,-73.870573
"507",2092788,"BRONX","1020","SOUNDVIEW AVENUE","A2","OT","ISSUED","07/06/2022","10/25/2022",2022-07-06,40.82563,-73.870573
"508",2092788,"BRONX","1020","SOUNDVIEW AVENUE","A2","MH","ISSUED","07/06/2022","10/25/2022",2022-07-06,40.82563,-73.870573
"509",3429283,"BROOKLYN","763","PARK AVENUE","NB","","ISSUED","07/06/2022","07/06/2023",2021-11-30,40.698136,-73.944805
"510",3429283,"BROOKLYN","763","PARK AVENUE","NB","","ISSUED","07/06/2022","07/06/2023",2021-11-30,40.698136,-73.944805
"511",3429283,"BROOKLYN","763","PARK AVENUE","NB","","ISSUED","07/06/2022","07/06/2023",2021-11-30,40.698136,-73.944805
"512",1083026,"MANHATTAN","2","PENN PLAZA","A3","OT","ISSUED","03/08/2023","03/01/2024",2023-02-15,40.750017,-73.991345
"513",2001874,"BRONX","333","EAST 151 STREET","A2","SP","ISSUED","07/06/2022","07/06/2023",2021-06-16,40.818232,-73.919867
"514",3023848,"BROOKLYN","100","15 STREET","A1","","ISSUED","07/06/2022","01/01/2023",2022-01-21,40.66746,-73.993248
"515",1084081,"MANHATTAN","160","CONVENT AVE","A2","OT","ISSUED","07/01/2022","01/14/2023",2020-08-13,40.819196,-73.950221
"516",4098729,"QUEENS","14-49","141ST ST","A2","OT","ISSUED","07/07/2022","10/01/2022",2022-07-07,40.785617,-73.82804
"517",2076670,"BRONX","2928","SCOTT PLACE","A2","OT","ISSUED","07/07/2022","12/18/2022",2022-07-07,40.828675,-73.823719
"518",2024509,"BRONX","1129","WHITEPLAINS ROAD","A2","OT","ISSUED","07/07/2022","06/01/2023",2022-07-07,40.829146,-73.861016
"519",3246888,"BROOKLYN","2971","CONEY ISLAND AVENUE","NB","EQ","ISSUED","07/07/2022","07/07/2023",2020-08-28,40.583965,-73.959991
"520",2056055,"BRONX","3024","BOUCK AVE","DM","","ISSUED","08/11/2022","08/02/2023",2022-08-11,40.869845,-73.849939
"521",1009774,"MANHATTAN","422","HUDSON STREET","A1","","ISSUED","07/02/2022","07/07/2023",2022-07-07,40.730485,-74.006801
"522",1036505,"MANHATTAN","425","PARK AVENUE","A3","CC","ISSUED","06/14/2022","10/01/2022",2022-07-21,40.760512,-73.971541
"523",3073909,"BROOKLYN","1562","DEKALB AVENUE","NB","","RE-ISSUED","07/06/2022","12/21/2022",2021-07-01,40.703189,-73.920322
"524",3073909,"BROOKLYN","1562","DEKALB AVENUE","NB","","RE-ISSUED","07/06/2022","12/21/2022",2021-08-26,40.703189,-73.920322
"525",3073909,"BROOKLYN","1562","DEKALB AVENUE","NB","","RE-ISSUED","07/06/2022","12/21/2022",2021-10-04,40.703189,-73.920322
"526",2129168,"BRONX","980","WESTCHESTER AVENUE","NB","PL","ISSUED","07/08/2022","07/08/2023",2020-05-21,40.823204,-73.894731
"527",5017382,"STATEN ISLAND","76","WINDSOR ROAD","A2","OT","ISSUED","07/08/2022","10/01/2022",2022-07-08,40.61224,-74.115773
"528",1033691,"MANHATTAN","720","WEST END AVENUE","A1","","ISSUED","07/08/2022","03/17/2023",2022-07-08,40.794723,-73.973581
"529",3071418,"BROOKLYN","325","BUSHWICK AVENUE","A2","MH","ISSUED","07/08/2022","07/08/2023",2020-02-14,40.705204,-73.939407
"530",4190929,"QUEENS","107-23","92 ST","A2","OT","ISSUED","07/08/2022","04/21/2023",2022-07-08,40.678251,-73.845932
"531",4531878,"QUEENS","153-31","110 AVENUE","A2","OT","ISSUED","07/08/2022","10/01/2022",2022-07-08,40.690594,-73.795027
"532",4116436,"QUEENS","46-21","COLDEN STREET","A2","OT","ISSUED","07/08/2022","08/03/2022",2020-03-02,40.749545,-73.822073
"533",4116436,"QUEENS","46-21","COLDEN STREET","A2","OT","ISSUED","07/08/2022","08/03/2022",2020-11-03,40.749545,-73.822073
"534",1090655,"MANHATTAN","401","WEST STREET","A2","SP","ISSUED","07/08/2022","07/08/2023",2022-07-08,40.733488,-74.01024
"535",1090655,"MANHATTAN","401","WEST STREET","A2","SD","ISSUED","07/08/2022","07/08/2023",2022-07-08,40.733488,-74.01024
"536",3113084,"BROOKLYN","1318","SCHENECTADY AVENUE","A2","OT","ISSUED","07/08/2022","08/25/2022",2022-07-08,40.640547,-73.932126
"537",3157436,"BROOKLYN","7023","20 AVENUE","A2","MH","ISSUED","07/08/2022","07/08/2023",2022-07-08,40.613505,-73.988986
"538",4272114,"QUEENS","118-46","202 STREET","A2","OT","ISSUED","07/08/2022","10/01/2022",2022-07-08,40.693257,-73.749146
"539",1091677,"MANHATTAN","58","WEST 39TH STREET","A3","EQ","ISSUED","07/08/2022","07/08/2023",2020-01-15,40.75233,-73.984076
"540",4055016,"QUEENS","53-82","66 ST","A2","OT","ISSUED","08/11/2022","10/01/2022",2022-08-11,40.729116,-73.899257
"541",4286206,"QUEENS","147-20","223 STREET","A2","OT","ISSUED","08/11/2022","12/18/2022",2022-08-11,40.659033,-73.758534
"542",4164521,"QUEENS","80-43","208 ST","A2","OT","ISSUED","07/11/2022","10/01/2022",2022-07-11,40.732126,-73.762274
"543",5170925,"STATEN ISLAND","435","TOMPKINS AVENUE","NB","","ISSUED","07/11/2022","11/16/2022",2020-06-05,40.614957,-74.073096
"544",5170925,"STATEN ISLAND","435","TOMPKINS AVENUE","NB","","ISSUED","07/11/2022","11/16/2022",2020-06-05,40.614957,-74.073096
"545",4099917,"QUEENS","125-01","25 AVE","DM","","ISSUED","07/11/2022","01/21/2023",2022-07-11,40.776587,-73.843365
"546",4623089,"QUEENS","99-16","218 STREET","NB","","ISSUED","07/11/2022","06/23/2023",2021-09-03,40.71519,-73.737873
"547",2071288,"BRONX","4422","EDSON AVENUE","A2","OT","ISSUED","07/11/2022","04/21/2023",2022-07-11,40.899734,-73.847213
"548",5814491,"STATEN ISLAND","40","PINE STREET","NB","","ISSUED","07/12/2022","01/13/2023",2020-02-03,40.636169,-74.087456
"549",3112424,"BROOKLYN","575","EAST 35TH STREET","A2","OT","ISSUED","07/12/2022","04/21/2023",2022-07-12,40.640805,-73.94366
"550",3039905,"BROOKLYN","1510","BROADWAY","NB","","ISSUED","07/12/2022","07/12/2023",2022-07-12,40.686811,-73.917364
"551",3039905,"BROOKLYN","1510","BROADWAY","NB","","ISSUED","07/12/2022","07/12/2023",2022-07-12,40.686811,-73.917364
"552",4039603,"QUEENS","94-08","40 DRIVE","A1","PL","ISSUED","07/13/2022","07/13/2023",2022-07-13,40.747508,-73.871782
"553",2065340,"BRONX","1033","EAST 232 STREET","A2","OT","ISSUED","07/13/2022","04/21/2023",2022-07-13,40.889667,-73.848021
"554",1017224,"MANHATTAN","415","5TH AVE","A3","EQ","ISSUED","07/13/2022","07/13/2023",2022-07-13,40.750603,-73.982972
"555",1009242,"MANHATTAN","17","EAST 9TH STREET","A1","PL","ISSUED","07/13/2022","07/13/2023",2022-03-31,40.732434,-73.994916
"556",4261244,"QUEENS","12001","142ND STREET","A2","OT","ISSUED","07/13/2022","09/16/2022",2022-07-13,40.676008,-73.799182
"557",4116436,"QUEENS","46-21","COLDEN STREET","A2","OT","ISSUED","07/13/2022","07/13/2023",2020-03-02,40.749545,-73.822073
"558",4116436,"QUEENS","46-21","COLDEN STREET","A2","OT","ISSUED","07/13/2022","07/13/2023",2020-11-03,40.749545,-73.822073
"559",1081114,"MANHATTAN","2130","MADISON AVENUE","A2","OT","ISSUED","07/13/2022","08/03/2023",2020-09-18,40.811232,-73.936648
"560",1031039,"MANHATTAN","36","RIVERSIDE DRIVE","A2","BL","ISSUED","07/13/2022","04/29/2023",2022-01-05,40.782983,-73.984534
"561",3060114,"BROOKLYN","575","BEDFORD AVENUE","A2","OT","ISSUED","07/14/2022","07/14/2023",2021-02-08,40.703877,-73.960824
"562",2068061,"BRONX","650","EAST 234 STREET","A2","OT","ISSUED","07/14/2022","10/21/2022",2022-07-14,40.894695,-73.858629
"563",3400905,"BROOKLYN","1038","JEFFERSON AVENUE","NB","","RE-ISSUED","09/13/2023","04/25/2024",2022-03-08,40.68739,-73.917085
"564",1080032,"MANHATTAN","3758","10TH AVENUE","A2","PL","ISSUED","07/14/2022","07/14/2023",2021-02-10,40.860935,-73.921518
"565",1033691,"MANHATTAN","720","WEST END AVENUE","A1","","ISSUED","07/15/2022","03/17/2023",2022-07-08,40.794723,-73.973581
"566",4121819,"QUEENS","42-15","165TH STREET","NB","PL","ISSUED","07/15/2022","07/15/2023",2020-03-13,40.759502,-73.801276
"567",4619737,"QUEENS","137-48","75 ROAD","NB","","ISSUED","07/15/2022","03/22/2023",2020-09-25,40.722757,-73.823011
"568",3429283,"BROOKLYN","763","PARK AVENUE","NB","","ISSUED","08/11/2022","07/23/2023",2021-11-30,40.698136,-73.944805
"569",3429283,"BROOKLYN","763","PARK AVENUE","NB","","ISSUED","08/11/2022","07/23/2023",2021-11-30,40.698136,-73.944805
"570",3429283,"BROOKLYN","763","PARK AVENUE","NB","","ISSUED","08/11/2022","07/23/2023",2021-11-30,40.698136,-73.944805
"571",3337037,"BROOKLYN","385","FOUNTAIN AVENUE","A2","OT","ISSUED","07/18/2022","04/01/2023",2020-08-04,40.669944,-73.87399
"572",3337037,"BROOKLYN","385","FOUNTAIN AVENUE","A2","MH","ISSUED","07/18/2022","04/01/2023",2020-08-04,40.669944,-73.87399
"573",3054140,"BROOKLYN","275","PARK AVE","A2","OT","ISSUED","07/18/2022","12/17/2022",2020-08-20,40.696012,-73.967562
"574",4020675,"QUEENS","2646","4TH STREET","NB","","ISSUED","07/18/2022","10/12/2022",2020-08-05,40.775472,-73.932996
"575",3337046,"BROOKLYN","2525","LINDEN BOULEVARD","A2","MH","ISSUED","07/18/2022","04/01/2023",2020-02-14,40.667404,-73.870801
"576",3337046,"BROOKLYN","2525","LINDEN BOULEVARD","A2","OT","ISSUED","07/18/2022","04/01/2023",2020-02-14,40.667404,-73.870801
"577",1080482,"MANHATTAN","356","EAST 78 STREET","DM","EQ","ISSUED","07/18/2022","08/11/2023",2022-08-11,40.7721,-73.954257
"578",1080482,"MANHATTAN","356","EAST 78 STREET","DM","EQ","ISSUED","07/18/2022","08/11/2023",2022-08-11,40.7721,-73.954257
"579",1090883,"MANHATTAN","370","WEST END AVENUE","A2","SP","ISSUED","07/18/2022","07/18/2023",2021-05-10,40.783364,-73.981866
"580",1090883,"MANHATTAN","370","WEST END AVENUE","A2","SD","ISSUED","07/18/2022","07/18/2023",2021-05-10,40.783364,-73.981866
"581",3058599,"BROOKLYN","19","ROCKWELL PLACE","DM","","ISSUED","07/18/2022","11/20/2022",2022-10-03,40.689285,-73.979418
"582",1036505,"MANHATTAN","425","PARK AVENUE","A3","CC","ISSUED","07/02/2022","10/01/2022",2022-07-18,40.760512,-73.971541
"583",4205639,"QUEENS","10735","121ST STREET","A2","OT","ISSUED","07/19/2022","04/01/2023",2022-07-19,40.683973,-73.821008
"584",3117838,"BROOKLYN","2801","TILDEN AVENUE","NB","","ISSUED","08/11/2022","01/16/2023",2021-06-24,40.646825,-73.950919
"585",5089046,"STATEN ISLAND","26","PARKER STREET","A2","OT","ISSUED","07/19/2022","04/01/2023",2022-07-19,40.514067,-74.23804
"586",3118557,"BROOKLYN","1070","FLATBUSH AVENUE","A1","","ISSUED","07/19/2022","07/19/2023",2022-07-19,40.644512,-73.95798
"587",3429214,"BROOKLYN","955","STERLING PLACE","NB","","ISSUED","07/19/2022","07/19/2023",2022-07-19,40.672347,-73.946733
"588",1036207,"MANHATTAN","750","3RD AVE","A1","","ISSUED","07/19/2022","07/19/2023",2022-07-19,40.753722,-73.972309
"589",4624066,"QUEENS","23-30","BORDEN AVENUE","NB","","ISSUED","09/13/2023","01/01/2024",2021-12-09,40.739918,-73.947213
"590",4619732,"QUEENS","46-11","QUEENS BOULEVARD","NB","","ISSUED","07/19/2022","12/02/2022",2020-05-21,40.74314,-73.918488
"591",4289474,"QUEENS","24830","S CONDUIT AVENUE","DM","","ISSUED","07/15/2022","11/30/2022",2022-08-23,40.665338,-73.729216
"592",4223737,"QUEENS","86-06","SANTIAGO STREET","NB","","ISSUED","08/11/2022","08/02/2023",2020-02-13,40.720269,-73.77491
"593",3429214,"BROOKLYN","955","STERLING PLACE","NB","PL","ISSUED","07/20/2022","07/20/2023",2022-07-20,40.672347,-73.946733
"594",3324253,"BROOKLYN","744","PARK AVENUE","A2","OT","ISSUED","07/20/2022","04/01/2023",2022-05-05,40.698027,-73.945627
"595",3205691,"BROOKLYN","2670","COYLE STREET","A2","OT","ISSUED","07/20/2022","10/22/2022",2022-07-20,40.588353,-73.934778
"596",3189474,"BROOKLYN","4405","BEACH 44TH STREET","A2","OT","ISSUED","07/20/2022","02/17/2023",2020-09-11,40.574949,-74.010158
"597",1004054,"MANHATTAN","228","E BROADWAY","A1","","RE-ISSUED","07/20/2022","01/27/2023",2022-07-20,40.714359,-73.986707
"598",2011872,"BRONX","16","WADE SQUARE","NB","","ISSUED","07/20/2022","07/01/2023",2021-10-25,40.85193,-73.891082
"599",2011872,"BRONX","16","WADE SQUARE","NB","","ISSUED","07/20/2022","07/01/2023",2021-10-25,40.85193,-73.891082
"600",3245804,"BROOKLYN","89","WEST END AVE","NB","","ISSUED","07/21/2022","03/10/2023",2021-04-16,40.579694,-73.953413
"601",5052861,"STATEN ISLAND","355","NEW DORP LANE","A2","PL","ISSUED","07/21/2022","07/21/2023",2021-04-23,40.570999,-74.110727
"602",1079184,"MANHATTAN","224","12TH AVENUE","A2","OT","ISSUED","07/21/2022","07/01/2023",2020-09-28,40.752641,-74.007576
"603",1079184,"MANHATTAN","224","12TH AVENUE","A2","OT","ISSUED","07/21/2022","07/01/2023",2021-01-13,40.752641,-74.007576
"604",3429430,"BROOKLYN","462","EAST 29TH STREET","NB","","ISSUED","12/28/2021","12/02/2022",2022-01-27,40.639318,-73.949325
"605",4535833,"QUEENS","72-04","ALMEDA AVENUE","A2","OT","ISSUED","07/22/2022","04/01/2023",2022-07-22,40.596709,-73.801448
"606",4060553,"QUEENS","61-12","56 ROAD","NB","","ISSUED","07/22/2022","09/17/2022",2020-11-12,40.724355,-73.903976
"607",4060553,"QUEENS","61-12","56 ROAD","NB","","ISSUED","07/22/2022","09/17/2022",2020-12-04,40.724355,-73.903976
"608",4282632,"QUEENS","134-25","FRANCIS LEWIS BOULEVARD","A2","OT","ISSUED","08/12/2022","04/21/2023",2022-08-12,40.67526,-73.739855
"609",1084081,"MANHATTAN","160","CONVENT AVENUE","A2","OT","ISSUED","04/11/2022","06/19/2023",2020-10-15,40.819196,-73.950221
"610",5014999,"STATEN ISLAND","95","LOUIS STREET","A2","OT","ISSUED","07/25/2022","06/11/2023",2022-07-25,40.62952,-74.08552
"611",3408058,"BROOKLYN","1903 GAR","HOMECREST AVENUE","DM","","ISSUED","07/25/2022","02/19/2023",2022-07-25,40.602778,-73.95998
"612",3336897,"BROOKLYN","67","34 STREET","A1","","ISSUED","07/25/2022","07/25/2023",2022-07-25,40.657359,-74.006423
"613",1000868,"MANHATTAN","111","WALL STREET","A2","OT","ISSUED","07/25/2022","01/01/2023",2021-08-11,40.704553,-74.006636
"614",3861070,"BROOKLYN","171 REAR","YORK STREET","DM","","ISSUED","07/25/2022","09/20/2022",2022-07-25,40.70142,-73.984077
"615",4299523,"QUEENS","1","DIX AVENUE","A2","OT","ISSUED","07/25/2022","12/18/2022",2022-07-25,40.606485,-73.755223
"616",4020675,"QUEENS","2646","4TH STREET","NB","PL","ISSUED","07/25/2022","07/25/2023",2020-08-05,40.775472,-73.932996
"617",4623971,"QUEENS","31-29","CRESCENT STREET","NB","","ISSUED","07/25/2022","09/24/2022",2022-06-17,40.764934,-73.926923
"618",4188586,"QUEENS","97-15","94 STREET","A2","OT","ISSUED","07/26/2022","12/18/2022",2022-07-26,40.685469,-73.847473
"619",4435247,"QUEENS","109-30","160TH STREET","A2","OT","ISSUED","07/26/2022","04/01/2023",2022-06-14,40.693495,-73.791683
"620",4273934,"QUEENS","186-04","NASHVILLE BOULEVARD","A2","OT","ISSUED","07/26/2022","10/01/2022",2022-07-26,40.681596,-73.757857
"621",2053813,"BRONX","2721","BRONXWOOD AVE","A1","","ISSUED","07/26/2022","06/26/2023",2020-10-29,40.866395,-73.861545
"622",1007953,"MANHATTAN","152","MERCER STREET","A2","OT","ISSUED","08/12/2022","04/26/2023",2021-06-17,40.725051,-73.998221
"623",4256909,"QUEENS","149-17","118 ST","A2","OT","ISSUED","07/26/2022","10/01/2022",2022-07-26,40.668413,-73.822528
"624",4614889,"QUEENS","9204","ROCKAWAY FREEWAY","A2","OT","ISSUED","07/26/2022","04/21/2023",2022-07-26,40.587066,-73.816133
"625",2071256,"BRONX","4411","GRACE AVE","A2","OT","ISSUED","08/12/2022","04/21/2023",2022-08-12,40.899309,-73.848035
"626",1090655,"MANHATTAN","401","WEST STREET","A3","EQ","ISSUED","07/27/2022","07/27/2023",2020-02-04,40.733488,-74.01024
"627",3088594,"BROOKLYN","348","WARWICK ST","A1","","ISSUED","07/27/2022","06/17/2023",2021-09-24,40.675249,-73.886331
"628",3046212,"BROOKLYN","682","HANCOCK ST","A1","PL","ISSUED","07/27/2022","07/27/2023",2021-03-12,40.685037,-73.928219
"629",2013638,"BRONX","2065","ANTHONY AVENUE","DM","","ISSUED","07/27/2022","06/13/2023",2022-07-27,40.852598,-73.902146
"630",4177121,"QUEENS","8835","249 STREET","A2","OT","ISSUED","08/12/2022","04/21/2023",2022-08-12,40.727932,-73.716161
"631",5048404,"STATEN ISLAND","33","BURGHER AVENUE","A2","PL","ISSUED","07/28/2022","07/28/2023",2021-07-23,40.594848,-74.096231
"632",4143669,"QUEENS","141-07","COOLIDGE AVENUE","A2","OT","ISSUED","07/28/2022","10/21/2022",2022-07-28,40.71497,-73.817613
"633",5170723,"STATEN ISLAND","4132","VICTORY BOULEVARD","NB","","ISSUED","07/28/2022","07/22/2023",2022-07-28,40.591375,-74.191216
"634",1083026,"MANHATTAN","2","PENN PLAZA","A3","EQ","ISSUED","07/29/2022","07/29/2023",2021-08-11,40.750017,-73.991345
"635",2013607,"BRONX","203","EAST FORDHAM ROAD","A2","OT","ISSUED","07/29/2022","12/08/2022",2021-02-19,40.862417,-73.896734
"636",2013607,"BRONX","203","EAST FORDHAM ROAD","A2","OT","ISSUED","07/29/2022","12/08/2022",2021-02-18,40.862417,-73.896734
"637",2130573,"BRONX","1940","TURNBULL AVENUE","NB","","ISSUED","07/29/2022","12/30/2022",2022-07-29,40.822911,-73.857365
"638",2130573,"BRONX","1940","TURNBULL AVENUE","NB","","ISSUED","07/29/2022","12/30/2022",2022-07-29,40.822911,-73.857365
"639",2130573,"BRONX","1940","TURNBULL AVENUE","NB","","ISSUED","07/29/2022","12/30/2022",2022-07-29,40.822911,-73.857365
"640",1001289,"MANHATTAN","100","GOLD STREET","A2","OT","ISSUED","07/29/2022","06/29/2023",2021-09-02,40.710353,-74.004007
"641",1001027,"MANHATTAN","140","BROADWAY","A2","PL","ISSUED","08/12/2022","08/12/2023",2020-09-30,40.709043,-74.010626
"642",2071256,"BRONX","4411","GRACE AVENUE","A2","OT","ISSUED","07/29/2022","04/21/2023",2022-07-29,40.899309,-73.848035
"643",2095236,"BRONX","1047","WHITE PLAINS ROAD","DM","","ISSUED","07/29/2022","01/29/2023",2022-07-29,40.827298,-73.860178
"644",2015302,"BRONX","2777","RESERVOIR AVENUE","A2","OT","ISSUED","07/29/2022","12/18/2022",2022-07-29,40.869991,-73.898617
"645",4623550,"QUEENS","45-43","211 STREET","NB","","ISSUED","08/01/2022","10/12/2022",2021-08-31,40.75851,-73.771258
"646",4004827,"QUEENS","28-10","39 AVE","DM","","ISSUED","08/01/2022","09/30/2022",2022-08-01,40.753836,-73.935075
"647",4286180,"QUEENS","179-02","150TH AVENUE","A2","OT","ISSUED","08/01/2022","05/01/2023",2022-08-01,40.657063,-73.767231
"648",4279055,"QUEENS","131-56","232 STREET","A2","OT","ISSUED","08/01/2022","12/18/2022",2022-08-01,40.678356,-73.736093
"649",4191896,"QUEENS","8521","106TH STREET","A2","OT","ISSUED","08/01/2022","04/21/2023",2022-08-01,40.698657,-73.842809
"650",4623130,"QUEENS","139-20","LAKEWOOD AVENUE","NB","","ISSUED","08/01/2022","05/15/2023",2022-08-01,40.686727,-73.805986
"651",4623130,"QUEENS","139-20","LAKEWOOD AVENUE","NB","","ISSUED","08/01/2022","05/15/2023",2022-08-01,40.686727,-73.805986
"652",4623130,"QUEENS","139-20","LAKEWOOD AVENUE","NB","","ISSUED","08/01/2022","05/15/2023",2022-08-01,40.686727,-73.805986
"653",5169006,"STATEN ISLAND","134","DETROIT AVENUE","A2","OT","ISSUED","08/01/2022","10/21/2022",2022-08-03,40.544975,-74.178397
"654",3056002,"BROOKLYN","388","WAVERLY AVENUE","A2","OT","ISSUED","08/01/2022","02/18/2023",2021-06-02,40.686035,-73.96642
"655",3079255,"BROOKLYN","166","COVERT STREET","A2","OT","ISSUED","08/01/2022","08/01/2023",2020-09-09,40.68949,-73.909164
"656",1033691,"MANHATTAN","720","WEST END AVENUE","A1","PL","ISSUED","09/23/2024","09/23/2025",2023-11-30,40.794723,-73.973581
"657",4007659,"QUEENS","30-38","31ST STREET","A1","","ISSUED","06/28/2022","01/28/2023",2022-08-01,40.765993,-73.922132
"658",4007659,"QUEENS","30-38","31ST STREET","A1","","ISSUED","06/28/2022","01/28/2023",2022-10-04,40.765993,-73.922132
"659",3390614,"BROOKLYN","707","SCHENCK AVENUE","A2","OT","ISSUED","08/02/2022","12/18/2022",2022-08-02,40.663094,-73.885364
"660",1013637,"MANHATTAN","341","WEST 38TH STREET","A1","","ISSUED","08/02/2022","08/02/2023",2021-10-25,40.755237,-73.992864
"661",1013637,"MANHATTAN","341","WEST 38TH STREET","A1","","ISSUED","08/02/2022","08/02/2023",2021-09-16,40.755237,-73.992864
"662",1013637,"MANHATTAN","341","WEST 38TH STREET","A1","","ISSUED","08/02/2022","08/02/2023",2021-10-25,40.755237,-73.992864
"663",2085572,"BRONX","403","WEST 261 STREET","A2","OT","ISSUED","08/02/2022","04/03/2023",2022-08-02,40.909717,-73.900712
"664",2082606,"BRONX","179","HAWKINS STREET","A1","","ISSUED","08/02/2022","07/23/2023",2020-10-08,40.846471,-73.78447
"665",3099411,"BROOKLYN","1012","EAST NEW YORK AVE","A1","","ISSUED","07/25/2022","06/20/2023",2022-08-02,40.664279,-73.929196
"666",3115866,"BROOKLYN","601","PARKSIDE AVENUE","A2","MH","ISSUED","08/03/2022","06/02/2023",2020-02-21,40.656046,-73.953742
"667",5015935,"STATEN ISLAND","18","CEDARCLIFF ROAD","A2","OT","ISSUED","08/03/2022","04/01/2023",2022-08-03,40.617265,-74.088281
"668",4167445,"QUEENS","89-25","237 STREET","A2","OT","ISSUED","08/03/2022","12/18/2022",2022-08-03,40.728262,-73.730483
"669",4177628,"QUEENS","7903","261 STREET","A2","OT","ISSUED","08/03/2022","06/01/2023",2022-08-03,40.746547,-73.710755
"670",1030525,"MANHATTAN","250","W 73RD STREET","A1","","ISSUED","08/03/2022","12/28/2022",2021-06-14,40.780076,-73.983022
"671",1030525,"MANHATTAN","250","W 73 ST","A2","OT","ISSUED","08/03/2022","12/28/2022",2021-03-10,40.780076,-73.983022
"672",2013639,"BRONX","2063","ANTHONY AVENUE","DM","","ISSUED","08/03/2022","06/13/2023",2022-08-03,40.852546,-73.902186
"673",1082816,"MANHATTAN","388","GREENWICH STREET","A2","FP","ISSUED","07/21/2022","04/01/2023",2023-02-18,40.720659,-74.010098
"674",2004358,"BRONX","844","ST ANNS AVENUE","A1","","ISSUED","11/14/2022","08/31/2023",2021-03-31,40.821781,-73.909692
"675",1022581,"MANHATTAN","1","TIMES SQUARE","A3","EQ","ISSUED","08/04/2022","08/04/2023",2020-08-28,40.756628,-73.986287
"676",3216080,"BROOKLYN","1868","TROY AVENUE","A2","OT","ISSUED","08/04/2022","05/04/2023",2022-08-04,40.6269,-73.933563
"677",4266592,"QUEENS","13440","161ST STREET","A2","OT","ISSUED","08/04/2022","04/21/2023",2022-08-04,40.672763,-73.776379
"678",1091641,"MANHATTAN","443","WEST 54 STREET","A3","EQ","ISSUED","11/16/2022","11/16/2023",2020-11-23,40.766537,-73.988397
"679",3429448,"BROOKLYN","402","METROPOLITAN AVENUE","NB","","ISSUED","11/05/2021","11/08/2022",2021-11-08,40.714068,-73.954942
"680",3429448,"BROOKLYN","402","METROPOLITAN AVENUE","NB","","ISSUED","11/05/2021","11/08/2022",2021-11-08,40.714068,-73.954942
"681",3429448,"BROOKLYN","402","METROPOLITAN AVENUE","NB","","ISSUED","03/07/2022","03/07/2023",2022-03-07,40.714068,-73.954942
"682",3114028,"BROOKLYN","653","EAST 32 STREET","A2","OT","ISSUED","08/10/2022","12/18/2022",2022-08-16,40.635204,-73.945974
"683",2010077,"BRONX","813","ELSMERE PLACE","NB","","ISSUED","08/05/2022","11/11/2022",2022-05-26,40.843169,-73.88831
"684",2004136,"BRONX","581","AUSTIN PLACE","NB","","ISSUED","08/05/2022","04/08/2023",2020-06-29,40.811268,-73.901513
"685",2004136,"BRONX","581","AUSTIN PLACE","NB","","ISSUED","08/05/2022","04/08/2023",2020-06-29,40.811268,-73.901513
"686",4087327,"QUEENS","65-22","METROPOLITAN AVENUE","A2","OT","ISSUED","08/05/2022","04/21/2023",2022-08-05,40.712479,-73.895321
"687",4239928,"QUEENS","111-22","WITTHOFF ST","A2","OT","ISSUED","08/05/2022","10/01/2022",2022-08-05,40.706919,-73.742541
"688",3049020,"BROOKLYN","195","SANFORD STREET","A2","OT","ISSUED","08/05/2022","04/23/2023",2022-08-05,40.693018,-73.953034
"689",3058599,"BROOKLYN","19","ROCKWELL PLACE","DM","EQ","ISSUED","07/18/2022","08/05/2023",2022-08-05,40.689285,-73.979418
"690",5010914,"STATEN ISLAND","173","CHANDLER AVE","A2","OT","ISSUED","08/15/2022","11/15/2022",2022-08-15,40.614106,-74.128999
"691",1079184,"MANHATTAN","224","12TH AVENUE","A2","OT","ISSUED","08/15/2022","02/13/2023",2020-09-28,40.752641,-74.007576
"692",4137632,"QUEENS","39-01","CORPORAL STONE STREET","NB","","ISSUED","08/15/2022","08/12/2023",2021-10-25,40.765344,-73.770823
"693",3099411,"BROOKLYN","1012","EAST NEW YORK AVE","A1","PL","ISSUED","08/15/2022","08/15/2023",2022-08-15,40.664279,-73.929196
"694",3059089,"BROOKLYN","294","CLERMONT AVENUE","A2","OT","ISSUED","08/15/2022","11/08/2022",2021-11-12,40.688948,-73.970032
"695",3244213,"BROOKLYN","2251","MILL AVENUE","A1","PL","ISSUED","08/16/2022","08/16/2023",2020-01-07,40.613137,-73.911335
"696",3039905,"BROOKLYN","1510","BROADWAY","NB","","ISSUED","08/16/2022","08/16/2023",2022-07-12,40.686811,-73.917364
"697",3039905,"BROOKLYN","1510","BROADWAY","NB","","ISSUED","08/16/2022","08/16/2023",2022-07-12,40.686811,-73.917364
"698",3019597,"BROOKLYN","180","6TH AVENUE","A2","MH","ISSUED","08/16/2022","08/16/2023",2021-12-13,40.67634,-73.977367
"699",3019597,"BROOKLYN","180","6TH AVENUE","A2","BL","ISSUED","08/16/2022","08/16/2023",2021-12-13,40.67634,-73.977367
"700",3019597,"BROOKLYN","180","6TH AVENUE","A2","OT","ISSUED","08/16/2022","08/16/2023",2021-12-13,40.67634,-73.977367
"701",3019597,"BROOKLYN","180","6TH AVENUE","A2","OT","ISSUED","08/16/2022","08/16/2023",2021-12-13,40.67634,-73.977367
"702",3019597,"BROOKLYN","180","6TH AVENUE","A2","PL","ISSUED","08/16/2022","08/16/2023",2021-12-13,40.67634,-73.977367
"703",3019597,"BROOKLYN","180","6TH AVENUE","A2","FB","ISSUED","08/16/2022","08/16/2023",2021-12-13,40.67634,-73.977367
"704",3019597,"BROOKLYN","180","6TH AVENUE","A2","OT","ISSUED","08/16/2022","08/16/2023",2021-12-13,40.67634,-73.977367
"705",3244730,"BROOKLYN","244","OCEAN VIEW AVE","A2","OT","ISSUED","08/16/2022","10/01/2022",2022-08-16,40.578853,-73.965545
"706",1063346,"MANHATTAN","99","FORT WASHINGTON AVENUE","A2","OT","ISSUED","08/16/2022","07/01/2023",2022-08-16,40.83851,-73.943738
"707",2001874,"BRONX","333","E 151ST STREET","A2","MH","ISSUED","08/16/2022","03/29/2023",2022-01-05,40.818232,-73.919867
"708",1046667,"MANHATTAN","1076","MADISON AVENUE","A1","","RE-ISSUED","08/12/2022","08/15/2023",2021-06-01,40.777826,-73.961041
"709",3429327,"BROOKLYN","625","FULTON STREET","NB","","ISSUED","08/15/2022","08/16/2023",2022-08-16,40.688566,-73.980045
"710",1088749,"MANHATTAN","1","MADISON AVENUE","A3","EQ","ISSUED","08/17/2022","08/17/2023",2020-09-02,40.740909,-73.987947
"711",3132042,"BROOKLYN","1514","60 ST","DM","","ISSUED","08/17/2022","05/10/2023",2022-08-17,40.625882,-73.993667
"712",3039905,"BROOKLYN","1510","BROADWAY","NB","","ISSUED","08/17/2022","08/17/2023",2022-08-17,40.686811,-73.917364
"713",3030260,"BROOKLYN","1078","DEAN STREET","A2","OT","ISSUED","08/17/2022","06/12/2023",2022-08-17,40.677332,-73.954275
"714",1011013,"MANHATTAN","246","WEST 12 STREET","A1","PL","ISSUED","08/17/2022","08/17/2023",2021-04-29,40.737608,-74.002699
"715",3429457,"BROOKLYN","373","PALMETTO STREET","NB","","ISSUED","02/04/2021","11/09/2021",2021-02-04,40.698629,-73.911939
"716",3429457,"BROOKLYN","373","PALMETTO STREET","NB","","ISSUED","02/04/2021","11/09/2021",2021-02-04,40.698629,-73.911939
"717",3429457,"BROOKLYN","373","PALMETTO STREET","NB","","ISSUED","01/27/2021","11/09/2021",2021-02-04,40.698629,-73.911939
"718",3429457,"BROOKLYN","373","PALMETTO STREET","NB","","ISSUED","10/18/2021","11/09/2022",2021-02-04,40.698629,-73.911939
"719",3429457,"BROOKLYN","373","PALMETTO STREET","NB","","ISSUED","10/18/2021","11/09/2022",2021-02-04,40.698629,-73.911939
"720",3429457,"BROOKLYN","373","PALMETTO STREET","NB","","ISSUED","10/18/2021","11/09/2022",2021-02-04,40.698629,-73.911939
"721",3332354,"BROOKLYN","255","BRISTOL STREET","A2","OT","ISSUED","08/18/2022","04/21/2023",2022-08-18,40.664901,-73.911432
"722",5163883,"STATEN ISLAND","449","DARLINGTON AVENUE","A2","OT","ISSUED","08/18/2022","01/22/2023",2022-08-18,40.534722,-74.200484
"723",2085478,"BRONX","425","WEST 260 STREET","A2","OT","ISSUED","08/18/2022","06/01/2023",2022-08-18,40.908197,-73.902115
"724",4618179,"QUEENS","108-55","171 STREET","NB","","ISSUED","08/18/2022","03/01/2023",2022-01-28,40.697643,-73.784468
"725",4192015,"QUEENS","86-29","104 STREET","A2","OT","ISSUED","08/16/2022","04/21/2023",2022-08-18,40.696262,-73.843467
"726",4303478,"QUEENS","3-54","BEACH 90TH STREET","A2","OT","ISSUED","08/19/2022","04/01/2023",2022-08-19,40.588626,-73.814991
"727",4135975,"QUEENS","214-43","35TH AVENUE","A2","PL","ISSUED","08/19/2022","08/19/2023",2021-08-13,40.769601,-73.770863
"728",4115121,"QUEENS","132-14","POPLE AVE","A1","","ISSUED","11/16/2022","08/11/2023",2020-07-21,40.753227,-73.831978
"729",1016749,"MANHATTAN","41","MADISON AVENUE","A2","OT","ISSUED","08/19/2022","06/30/2023",2020-01-13,40.742616,-73.986698
"730",4156124,"QUEENS","186-10","UNION TURNPIKE","A1","","ISSUED","08/17/2022","01/18/2023",2022-09-22,40.728691,-73.782726
"731",1080482,"MANHATTAN","356","EAST 78 STREET","DM","","ISSUED","08/11/2022","04/26/2023",2022-08-25,40.7721,-73.954257
"732",1090883,"MANHATTAN","378","WEST END AVENUE","A1","","ISSUED","08/22/2022","04/01/2023",2020-06-02,40.783559,-73.981721
"733",1014251,"MANHATTAN","220","WEST 28TH STREET","A1","PL","ISSUED","08/22/2022","08/22/2023",2022-08-22,40.747582,-73.994197
"734",1086429,"MANHATTAN","114","ANDES ROAD","A3","OT","ISSUED","08/22/2022","08/22/2023",2022-08-22,40.692694,-74.018557
"735",4204522,"QUEENS","104-20","125 ST","DM","EQ","ISSUED","08/22/2022","08/22/2023",2022-08-22,40.687742,-73.819162
"736",4204522,"QUEENS","104-20","125 ST","DM","","ISSUED","08/22/2022","10/18/2022",2022-08-22,40.687742,-73.819162
"737",1091739,"MANHATTAN","22","WEST 137TH STREET","A2","EQ","ISSUED","09/11/2020","09/11/2021",2020-09-11,40.81443,-73.937624
"738",1091739,"MANHATTAN","22","WEST 137TH STREET","A2","OT","ISSUED","10/19/2020","06/28/2021",2020-10-19,40.81443,-73.937624
"739",1091739,"MANHATTAN","22","WEST 137TH STREET","A2","OT","ISSUED","10/22/2020","06/28/2021",2020-10-22,40.81443,-73.937624
"740",1091739,"MANHATTAN","22","WEST 137TH STREET","A2","EQ","ISSUED","10/22/2020","10/22/2021",2020-10-22,40.81443,-73.937624
"741",1091739,"MANHATTAN","22","WEST 137TH STREET","A2","EQ","ISSUED","06/04/2021","06/04/2022",2020-10-22,40.81443,-73.937624
"742",1091739,"MANHATTAN","22","WEST 137TH STREET","A2","OT","ISSUED","06/04/2021","04/01/2022",2020-10-22,40.81443,-73.937624
"743",1091739,"MANHATTAN","22","WEST 137 STREET","A3","EQ","ISSUED","08/20/2021","08/20/2022",2020-08-21,40.81443,-73.937624
"744",1091739,"MANHATTAN","40","WEST 137 STREET","NB","","ISSUED","05/23/2022","06/07/2022",2022-05-24,40.814603,-73.938039
"745",1091739,"MANHATTAN","40","WEST 137 STREET","NB","","ISSUED","05/25/2022","08/31/2022",2022-05-24,40.814603,-73.938039
"746",1091739,"MANHATTAN","40","WEST 137 STREET","NB","","ISSUED","08/04/2022","04/26/2023",2022-05-24,40.814603,-73.938039
"747",1036505,"MANHATTAN","425","PARK AVENUE","A2","SP","ISSUED","08/23/2022","08/23/2023",2021-04-30,40.760512,-73.971541
"748",1036505,"MANHATTAN","425","PARK AVENUE","A2","SD","ISSUED","08/23/2022","08/23/2023",2021-04-30,40.760512,-73.971541
"749",3027014,"BROOKLYN","508A","16TH STREET","A2","OT","ISSUED","08/23/2022","06/12/2023",2022-08-23,40.659007,-73.977513
"750",2826970,"BRONX","334","EAST 176TH STREET","NB","","ISSUED","08/23/2022","05/07/2023",2022-04-27,40.847527,-73.903028
"751",2826970,"BRONX","334","EAST 176TH STREET","NB","","ISSUED","08/23/2022","05/07/2023",2022-04-27,40.847527,-73.903028
"752",2826970,"BRONX","334","EAST 176TH STREET","NB","","ISSUED","08/23/2022","05/07/2023",2022-04-27,40.847527,-73.903028
"753",3429205,"BROOKLYN","1538","BROOKLYN AVENUE","NB","","ISSUED","08/23/2022","08/23/2023",2021-05-25,40.635598,-73.942154
"754",1016880,"MANHATTAN","51","MADISON  AVENUE","A1","","ISSUED","08/19/2022","02/16/2024",2023-02-16,40.743023,-73.986402
"755",1050618,"MANHATTAN","421","EAST 88 STREET","A2","PL","ISSUED","03/09/2023","03/08/2024",2021-04-06,40.777911,-73.947757
"756",4011826,"QUEENS","31-63","42 STREET","A2","OT","ISSUED","08/24/2022","04/21/2023",2022-08-24,40.759174,-73.916617
"757",3071418,"BROOKLYN","325","BUSHWICK AVENUE","A2","PL","ISSUED","03/09/2023","03/08/2024",2020-02-13,40.705204,-73.939407
"758",1007174,"MANHATTAN","178","MOTT STREET","A1","","ISSUED","11/16/2022","09/30/2023",2020-12-09,40.720429,-73.995923
"759",5130512,"STATEN ISLAND","25","AUGUSTA AVENUE","A2","PL","ISSUED","03/09/2023","03/08/2024",2020-03-02,40.551882,-74.168869
"760",4623550,"QUEENS","45-43","211 STREET","NB","","ISSUED","11/17/2022","07/31/2023",2021-08-31,40.75851,-73.771258
"761",3153881,"BROOKLYN","650","86TH STREET","NB","","ISSUED","11/17/2022","04/01/2023",2022-10-24,40.618851,-74.021875
"762",2013297,"BRONX","2075","WEBSTER AVENUE","NB","","ISSUED","11/17/2022","04/01/2023",2022-11-17,40.851741,-73.898493
"763",2013297,"BRONX","2075","WEBSTER AVENUE","NB","PL","ISSUED","11/17/2022","11/17/2023",2022-11-17,40.851741,-73.898493
"764",1046927,"MANHATTAN","60","EAST 88TH STREET","A2","OT","ISSUED","11/17/2022","10/24/2023",2020-06-24,40.78187,-73.957197
"765",3042560,"BROOKLYN","22","GUNTHER PLACE","A2","PL","ISSUED","11/17/2022","11/17/2023",2021-03-02,40.676951,-73.911824
"766",2006622,"BRONX","660","CASANOVA STREET","DM","EQ","ISSUED","11/17/2022","11/17/2023",2022-11-17,40.812945,-73.889896
"767",2006622,"BRONX","660","CASANOVA STREET","DM","","ISSUED","11/17/2022","05/01/2023",2022-11-17,40.812945,-73.889896
"768",2013607,"BRONX","203","EAST FORDHAM ROAD","A2","OT","ISSUED","11/17/2022","03/31/2023",2021-02-19,40.862417,-73.896734
"769",2013607,"BRONX","203","EAST FORDHAM ROAD","A2","OT","ISSUED","11/17/2022","03/31/2023",2021-02-18,40.862417,-73.896734
"770",5069440,"STATEN ISLAND","163","SEIDMAN AVENUE","A2","OT","ISSUED","11/17/2022","10/01/2023",2022-11-28,40.536192,-74.16521
"771",4061134,"QUEENS","58-18","61 STREET","A2","OT","ISSUED","11/17/2022","06/17/2023",2022-11-17,40.720509,-73.903808
"772",1054420,"MANHATTAN","120","EAST 123RD STREET","A2","OT","ISSUED","11/17/2022","12/01/2023",2022-02-04,40.8034,-73.939173
"773",1063346,"MANHATTAN","99","FORT WASHINGTON AVENUE","A2","OT","ISSUED","11/17/2022","12/01/2023",2021-01-28,40.83851,-73.943738
"774",1063346,"MANHATTAN","99","FORT WASHINGTON AVENUE","A2","OT","ISSUED","11/17/2022","12/01/2023",2021-02-08,40.83851,-73.943738
"775",1089192,"MANHATTAN","375","WEST 207 STREET","NB","PL","ISSUED","03/09/2023","03/08/2024",2023-03-09,40.864015,-73.917834
"776",4623245,"QUEENS","331","BEACH 35 STREET","NB","","ISSUED","03/09/2023","04/01/2023",2023-03-09,40.596108,-73.767699
"777",4623245,"QUEENS","331","BEACH 35 STREET","NB","","ISSUED","03/09/2023","04/01/2023",2023-03-09,40.596108,-73.767699
"778",4623245,"QUEENS","331","BEACH 35 STREET","NB","","ISSUED","03/09/2023","04/01/2023",2023-03-09,40.596108,-73.767699
"779",5085087,"STATEN ISLAND","600","FOSTER ROAD","A2","OT","ISSUED","11/18/2022","06/01/2023",2022-11-18,40.540807,-74.206809
"780",3042334,"BROOKLYN","1911","ATLANTIC AVENUE","NB","","ISSUED","11/18/2022","04/09/2023",2020-09-15,40.676891,-73.920823
"781",4274176,"QUEENS","191-10","PINEVILLE LN","A2","OT","ISSUED","11/18/2022","10/01/2023",2022-11-18,40.683723,-73.752636
"782",3069561,"BROOKLYN","628","GRAND STREET","DM","","ISSUED","11/18/2022","08/02/2023",2022-11-18,40.71135,-73.946893
"783",1010396,"MANHATTAN","39","CLARKSON ST","A1","PL","ISSUED","03/09/2023","03/08/2024",2020-07-09,40.729571,-74.007689
"784",1078247,"MANHATTAN","131","CHARLES STREET","A1","","ISSUED","11/21/2022","04/01/2023",2020-07-23,40.734232,-74.007642
"785",3039905,"BROOKLYN","1510","BROADWAY","NB","PL","ISSUED","11/21/2022","11/21/2023",2022-11-21,40.686811,-73.917364
"786",4061830,"QUEENS","61-19","62 ST","A2","OT","ISSUED","11/21/2022","11/02/2023",2021-01-12,40.714997,-73.89983
"787",1060202,"MANHATTAN","253","WEST 137TH STREET","A2","BL","ISSUED","11/21/2022","11/14/2023",2022-01-04,40.81725,-73.944269
"788",4210884,"QUEENS","168-10","84 AVENUE","A2","OT","ISSUED","03/09/2023","06/01/2023",2023-03-09,40.715869,-73.797182
"789",1014251,"MANHATTAN","220","WEST 28TH STREET","A2","SP","ISSUED","11/22/2022","11/22/2023",2022-11-22,40.747582,-73.994197
"790",1014251,"MANHATTAN","220","WEST 28TH STREET","A2","SD","ISSUED","11/22/2022","11/22/2023",2022-11-22,40.747582,-73.994197
"791",1054002,"MANHATTAN","13","EAST 124 STREET","A2","OT","ISSUED","11/22/2022","05/27/2023",2021-06-30,40.80543,-73.941996
"792",2103283,"BRONX","1","BANES COURT","A2","OT","ISSUED","11/22/2022","04/21/2023",2022-11-22,40.808293,-73.855222
"793",2019911,"BRONX","819","HARDING PARK","A2","OT","ISSUED","11/22/2022","07/01/2023",2022-11-22,40.806792,-73.855875
"794",2003157,"BRONX","1182","WOODYCREST AVENUE","A2","OT","ISSUED","11/22/2022","04/25/2023",2022-11-22,40.836723,-73.924835
"795",2128709,"BRONX","3187","GRAND CONCOURSE","A2","SD","ISSUED","03/09/2023","03/08/2024",2023-03-09,40.876341,-73.885774
"796",2128709,"BRONX","3187","GRAND CONCOURSE","A2","SP","ISSUED","03/09/2023","03/08/2024",2023-03-09,40.876341,-73.885774
"797",3052541,"BROOKLYN","421","HANCOCK STREET","A2","OT","ISSUED","03/09/2023","02/23/2024",2020-10-22,40.683784,-73.939242
"798",3076057,"BROOKLYN","1333","BROADWAY","NB","","ISSUED","09/09/2022","11/22/2023",2022-01-13,40.690065,-73.923046
"799",2060959,"BRONX","1417","BURKE AVE","A2","OT","ISSUED","11/15/2022","04/21/2023",2022-11-22,40.87233,-73.846564
"800",3256090,"BROOKLYN","75","ROSS ST","A1","EQ","ISSUED","06/10/2024","06/10/2025",2022-01-27,40.703803,-73.963396
"801",1088749,"MANHATTAN","1","MADISON AVENUE","A2","EQ","ISSUED","11/23/2022","11/23/2023",2022-11-23,40.740909,-73.987947
"802",3429327,"BROOKLYN","625","FULTON STREET","NB","","ISSUED","06/20/2023","07/08/2024",2022-08-16,40.688566,-73.980045
"803",3034354,"BROOKLYN","687","MONTGOMERY STREET","A1","","ISSUED","03/03/2023","02/26/2024",2021-05-21,40.664909,-73.941772
"804",3429464,"BROOKLYN","2440","FULTON STREET","NB","","ISSUED","12/19/2023","05/22/2024",2022-07-11,40.677869,-73.903473
"805",4165348,"QUEENS","213-11","86 AVENUE","A2","OT","ISSUED","11/23/2022","11/01/2023",2021-11-16,40.728326,-73.755212
"806",1053247,"MANHATTAN","53","W 119 STREET","A1","","ISSUED","10/31/2022","07/31/2023",2021-09-08,40.803244,-73.946556
"807",1053247,"MANHATTAN","53","W 119 STREET","A1","","ISSUED","10/31/2022","07/31/2023",2021-08-27,40.803244,-73.946556
"808",1083026,"MANHATTAN","2","PENN PLAZA","A1","","ISSUED","11/22/2022","03/31/2023",2021-01-22,40.750017,-73.991345
"809",4217730,"QUEENS","173-07","LIBERTY AVENUE","DM","EQ","ISSUED","06/20/2023","06/19/2024",2023-06-20,40.704621,-73.784788
"810",3429464,"BROOKLYN","2440","FULTON STREET","NB","","ISSUED","12/19/2023","12/31/2024",2022-07-11,40.677869,-73.903473
"811",4217730,"QUEENS","173-07","LIBERTY AVENUE","DM","","ISSUED","06/20/2023","10/25/2023",2023-06-20,40.704621,-73.784788
"812",3429464,"BROOKLYN","2440","FULTON STREET","NB","","ISSUED","12/19/2023","12/31/2024",2022-07-11,40.677869,-73.903473
"813",3429430,"BROOKLYN","462","EAST 29TH STREET","NB","","ISSUED","03/10/2023","12/02/2023",2022-01-27,40.639318,-73.949325
"814",4620750,"QUEENS","150-60","SULLIVAN DRIVE","A2","SP","ISSUED","08/29/2022","08/29/2023",2021-03-11,NA,NA
"815",3414113,"BROOKLYN","24","HUNTINGTON STREET","NB","","ISSUED","11/28/2022","11/28/2023",2022-01-31,40.677588,-74.005314
"816",3414113,"BROOKLYN","24","HUNTINGTON STREET","NB","","ISSUED","11/28/2022","11/28/2023",2022-01-28,40.677588,-74.005314
"817",3414113,"BROOKLYN","24","HUNTINGTON STREET","NB","","ISSUED","11/28/2022","11/28/2023",2022-01-28,40.677588,-74.005314
"818",3201629,"BROOKLYN","3117","AVENUE W","A2","PL","ISSUED","11/28/2022","11/28/2023",2021-11-17,40.596757,-73.933499
"819",3141047,"BROOKLYN","1271","60 STREET","A2","EQ","ISSUED","11/28/2022","11/28/2023",2022-11-28,40.629319,-73.999308
"820",3101816,"BROOKLYN","417","EAST 93 STREET","A2","OT","ISSUED","11/28/2022","12/18/2022",2022-11-28,40.656346,-73.920126
"821",1090459,"MANHATTAN","255","WEST 34 STREET","A3","EQ","ISSUED","06/10/2024","06/10/2025",2020-06-17,40.751823,-73.992569
"822",4116436,"QUEENS","46-21","COLDEN STREET","A3","EQ","ISSUED","03/10/2023","03/09/2024",2020-01-14,40.749545,-73.822073
"823",4116436,"QUEENS","46-21","COLDEN STREET","A3","EQ","ISSUED","03/10/2023","03/09/2024",2020-02-18,40.749545,-73.822073
"824",4116436,"QUEENS","46-21","COLDEN STREET","A2","OT","ISSUED","03/10/2023","04/01/2023",2020-11-03,40.749545,-73.822073
"825",4116436,"QUEENS","46-21","COLDEN STREET","A2","OT","ISSUED","03/10/2023","04/01/2023",2020-11-03,40.749545,-73.822073
"826",4116436,"QUEENS","46-21","COLDEN STREET","A2","OT","ISSUED","03/10/2023","04/01/2023",2020-11-03,40.749545,-73.822073
"827",3327429,"BROOKLYN","399","STANLEY AVE","A2","OT","ISSUED","11/25/2022","01/12/2023",2022-12-05,40.655355,-73.893216
"828",2092082,"BRONX","3603","THIRD AVENUE","A2","PL","ISSUED","03/10/2023","03/09/2024",2021-03-01,40.83308,-73.904809
"829",1088749,"MANHATTAN","1","MADISON AVE","A3","EQ","ISSUED","11/29/2022","11/29/2023",2022-11-29,40.740909,-73.987947
"830",1025061,"MANHATTAN","322","WEST 47 STREET","A2","OT","ISSUED","11/29/2022","07/14/2023",2022-11-29,40.760768,-73.988351
"831",3009585,"BROOKLYN","737","4TH AVE","DM","EQ","ISSUED","11/29/2022","11/29/2023",2022-11-29,40.660799,-73.997661
"832",3009585,"BROOKLYN","737","4TH AVE","DM","","ISSUED","11/29/2022","09/11/2023",2022-11-29,40.660799,-73.997661
"833",4623971,"QUEENS","31-29","CRESCENT STREET","NB","","ISSUED","11/29/2022","09/24/2023",2022-06-17,40.764934,-73.926923
"834",4620316,"QUEENS","82-53","164 STREET","A1","","ISSUED","11/29/2022","10/04/2023",2022-08-25,40.71759,-73.803505
"835",1088749,"MANHATTAN","1","MADISON AVE","A3","EQ","ISSUED","11/30/2022","11/30/2023",2022-11-30,40.740909,-73.987947
"836",1088749,"MANHATTAN","1","MADISON AVE","A3","EQ","ISSUED","11/30/2022","11/30/2023",2022-11-30,40.740909,-73.987947
"837",5132415,"STATEN ISLAND","118","COVINGTON CIRCLE","A2","OT","ISSUED","11/30/2022","10/01/2023",2022-12-29,40.545163,-74.202584
"838",3332217,"BROOKLYN","92","CENTRE MALL","A2","PL","ISSUED","11/30/2022","11/30/2023",2021-08-27,40.674833,-74.003558
"839",3332221,"BROOKLYN","465","COLUMBIA STREET","A2","PL","ISSUED","11/30/2022","11/30/2023",2021-08-27,40.676375,-74.006861
"840",4044779,"QUEENS","38-22","111 STREET","A2","OT","ISSUED","11/30/2022","07/01/2023",2022-11-30,40.752944,-73.856548
"841",1083464,"MANHATTAN","1809","3 AVENUE","A2","OT","ISSUED","11/30/2022","05/15/2023",2022-11-30,40.787957,-73.947298
"842",3332221,"BROOKLYN","465","COLUMBIA STREET","A2","PL","ISSUED","11/30/2022","11/30/2023",2021-08-27,40.676375,-74.006861
"843",4149327,"QUEENS","6515","172ND STREET","A2","OT","ISSUED","11/30/2022","09/16/2023",2022-11-30,40.7362,-73.797427
"844",3001453,"BROOKLYN","52","4TH AVE","NB","","ISSUED","11/30/2022","08/19/2023",2021-11-16,40.683038,-73.979261
"845",1001084,"MANHATTAN","55","LIBERTY STREET","A2","OT","ISSUED","11/30/2022","07/01/2023",2021-03-09,40.708692,-74.009508
"846",2116415,"BRONX","400","EAST FORDHAM ROAD","A1","","ISSUED","11/30/2022","10/02/2023",2021-02-26,40.8609,-73.891931
"847",4160541,"QUEENS","58-56","207TH STREET","A2","OT","ISSUED","03/10/2023","11/15/2023",2023-03-10,40.746321,-73.770033
"848",4227481,"QUEENS","9008","215TH PL","A2","OT","ISSUED","03/10/2023","04/21/2023",2023-03-10,40.723853,-73.745693
"849",3057705,"BROOKLYN","1084","FULTON STREET","A1","PL","ISSUED","12/01/2022","12/01/2023",2021-01-27,40.681528,-73.957603
"850",3032611,"BROOKLYN","716","LINCOLN PLACE","NB","PL","ISSUED","12/01/2022","12/01/2023",2021-08-25,40.670851,-73.952488
"851",2130500,"BRONX","6375","BROADWAY","NB","","ISSUED","01/14/2021","05/23/2021",2021-01-14,40.901704,-73.896738
"852",4620747,"QUEENS","150-50","SULLIVAN DRIVE","A2","SP","ISSUED","08/29/2022","08/29/2023",2021-03-11,NA,NA
"853",4619459,"QUEENS","23-15","44 ROAD","NB","PL","ISSUED","12/01/2022","12/01/2023",2022-08-25,40.748365,-73.944557
"854",1082653,"MANHATTAN","413","GRAND STREET","A2","OT","ISSUED","12/01/2022","12/10/2023",2020-12-16,40.715828,-73.986336
"855",2057045,"BRONX","800","EAST GUN HILL ROAD","A2","OT","ISSUED","12/01/2022","04/20/2023",2021-11-22,40.875953,-73.86197
"856",4462757,"QUEENS","112-63","BEDELL STREET","A2","OT","ISSUED","12/01/2022","04/03/2023",2022-12-01,40.688803,-73.788207
"857",4623739,"QUEENS","2-21","MALT DRIVE","NB","","ISSUED","12/01/2022","12/01/2023",2022-03-03,NA,NA
"858",3338507,"BROOKLYN","1388","BUSHWICK AVENUE","A1","","ISSUED","10/03/2022","10/03/2023",2022-05-11,40.684868,-73.910025
"859",3256921,"BROOKLYN","10502","AVENUE D","A2","OT","ISSUED","11/22/2022","09/27/2023",2022-12-01,40.653831,-73.901511
"860",3161593,"BROOKLYN","2046","77TH STREET","A2","PL","ISSUED","12/02/2022","12/02/2023",2020-08-09,40.60904,-73.991929
"861",4623835,"QUEENS","36-45","31ST STREET","NB","","ISSUED","11/29/2022","12/18/2022",2021-05-07,40.755831,-73.930348
"862",4620316,"QUEENS","82-53","164 STREET","A1","","ISSUED","11/30/2022","10/04/2023",2022-08-25,40.71759,-73.803505
"863",2089236,"BRONX","74B","5TH AVE","A2","OT","ISSUED","06/20/2023","04/21/2024",2023-06-20,40.823661,-73.808188
"864",2089815,"BRONX","470","EAST 146TH STREET","A2","OT","ISSUED","06/20/2023","04/13/2024",2023-07-10,40.813248,-73.916986
"865",3143886,"BROOKLYN","6102","8TH AVENUE","A1","","ISSUED","12/05/2022","12/05/2023",2022-12-05,40.634852,-74.010236
"866",4534737,"QUEENS","189-22","113TH ROAD","A2","OT","ISSUED","12/05/2022","04/01/2023",2022-12-05,40.69809,-73.763311
"867",4020682,"QUEENS","26-19","2ND STREET","NB","","ISSUED","12/05/2022","12/01/2023",2020-09-15,40.776365,-73.934728
"868",4211244,"QUEENS","172-28","HENLEY ROAD","DM","EQ","ISSUED","12/05/2022","12/05/2023",2022-12-05,40.71409,-73.79076
"869",2057045,"BRONX","800","EAST GUN HILL ROAD","A2","OT","ISSUED","12/05/2022","04/20/2023",2021-11-22,40.875953,-73.86197
"870",2053813,"BRONX","2721","BRONXWOOD AVE","A1","PL","ISSUED","12/05/2022","12/05/2023",2021-11-24,40.866395,-73.861545
"871",1050618,"MANHATTAN","421","EAST 88 STREET","A2","OT","ISSUED","12/06/2022","11/30/2023",2021-04-06,40.777911,-73.947757
"872",2027768,"BRONX","1339","ROSEDALE AVENUE","A2","OT","ISSUED","12/06/2022","11/10/2023",2020-11-05,40.83349,-73.869651
"873",5050455,"STATEN ISLAND","21","PEARSALL STREET","A2","OT","ISSUED","12/07/2022","10/01/2023",2022-12-16,40.590527,-74.074258
"874",3069262,"BROOKLYN","302","GRAHAM AVENUE","NB","","ISSUED","12/07/2022","01/28/2023",2020-02-12,40.712768,-73.944086
"875",4620316,"QUEENS","82-53","164 STREET","A1","","ISSUED","12/07/2022","12/02/2023",2022-08-25,40.71759,-73.803505
"876",4436854,"QUEENS","27-16","21 STREET","DM","EQ","ISSUED","12/07/2022","12/07/2023",2022-12-07,40.771855,-73.926244
"877",4436854,"QUEENS","27-16","21 STREET","DM","","ISSUED","12/07/2022","06/01/2023",2022-12-07,40.771855,-73.926244
"878",3069262,"BROOKLYN","302","GRAHAM AVENUE","NB","","ISSUED","12/07/2022","05/26/2023",2020-02-12,40.712768,-73.944086
"879",3069262,"BROOKLYN","302","GRAHAM AVENUE","NB","","ISSUED","12/07/2022","05/26/2023",2020-02-12,40.712768,-73.944086
"880",3069262,"BROOKLYN","302","GRAHAM AVENUE","NB","","ISSUED","12/07/2022","05/26/2023",2020-02-12,40.712768,-73.944086
"881",1091675,"MANHATTAN","202","E 23 ST","NB","","ISSUED","12/07/2022","12/01/2023",2021-06-28,40.738669,-73.982784
"882",4623971,"QUEENS","31-29","CRESCENT STREET","NB","","ISSUED","12/19/2023","09/24/2024",2022-06-17,40.764934,-73.926923
"883",4211244,"QUEENS","172-28","HENLEY ROAD","DM","","ISSUED","12/05/2022","05/22/2023",2022-12-07,40.71409,-73.79076
"884",4623130,"QUEENS","139-20","LAKEWOOD AVENUE","NB","","ISSUED","06/20/2023","08/29/2023",2022-08-01,40.686727,-73.805986
"885",1015702,"MANHATTAN","34","WEST 28","A2","OT","ISSUED","12/08/2022","12/18/2022",2021-03-02,40.745488,-73.989227
"886",2017263,"BRONX","261","E 202 ST","NB","","ISSUED","12/08/2022","01/01/2024",2020-12-04,40.872791,-73.884688
"887",2017263,"BRONX","261","E 202 ST","NB","","ISSUED","12/08/2022","01/01/2024",2020-12-04,40.872791,-73.884688
"888",2017263,"BRONX","261","E 202 ST","NB","","ISSUED","12/08/2022","01/01/2024",2020-12-04,40.872791,-73.884688
"889",4530260,"QUEENS","11-03","BEACH CHANNEL DRIVE","A2","OT","ISSUED","12/08/2022","08/25/2023",2022-12-08,40.604219,-73.755819
"890",2129043,"BRONX","1561","EAST 174 STREET","A2","BL","ISSUED","12/08/2022","09/28/2023",2022-12-08,40.83415,-73.878442
"891",1050618,"MANHATTAN","421","EAST 88 STREET","A2","OT","ISSUED","12/08/2022","11/30/2023",2021-04-06,40.777911,-73.947757
"892",1050618,"MANHATTAN","421","EAST 88 STREET","A2","OT","ISSUED","12/08/2022","11/30/2023",2021-04-06,40.777911,-73.947757
"893",1050618,"MANHATTAN","421","EAST 88 STREET","A2","OT","ISSUED","12/08/2022","11/30/2023",2021-04-06,40.777911,-73.947757
"894",4623130,"QUEENS","139-20","LAKEWOOD AVENUE","NB","","ISSUED","06/20/2023","08/29/2023",2022-08-01,40.686727,-73.805986
"895",3126303,"BROOKLYN","401","EAST 8 STREET","A2","OT","ISSUED","08/29/2022","08/09/2023",2021-03-03,40.640242,-73.971005
"896",1079184,"MANHATTAN","224","12TH AVENUE","A1","","ISSUED","12/09/2022","03/11/2023",2020-09-28,40.752641,-74.007576
"897",3429464,"BROOKLYN","2440","FULTON STREET","NB","","ISSUED","07/11/2022","07/11/2023",2022-07-11,40.677869,-73.903473
"898",3429464,"BROOKLYN","2440","FULTON STREET","NB","","ISSUED","07/11/2022","07/11/2023",2022-07-11,40.677869,-73.903473
"899",3429464,"BROOKLYN","2440","FULTON STREET","NB","","ISSUED","07/11/2022","07/11/2023",2022-07-11,40.677869,-73.903473
"900",3398454,"BROOKLYN","8","GRAND AVENUE","A1","","ISSUED","07/19/2022","10/07/2022",2022-08-26,40.697354,-73.964813
"901",3429087,"BROOKLYN","675","EAST 32ND","NB","","ISSUED","08/25/2022","02/18/2023",2021-04-15,40.634848,-73.945934
"902",4619459,"QUEENS","23-15","44 ROAD","NB","PL","ISSUED","08/25/2022","08/25/2023",2022-08-25,40.748365,-73.944557
"903",3153881,"BROOKLYN","650","86TH STREET","NB","","ISSUED","08/25/2022","04/01/2023",2022-06-16,40.618851,-74.021875
"904",3178962,"BROOKLYN","1304","GLENWOOD ROAD","A2","OT","ISSUED","08/25/2022","04/01/2023",2022-08-25,40.632143,-73.964433
"905",3324426,"BROOKLYN","355","53RD ST","NB","PL","ISSUED","08/25/2022","08/26/2023",2022-08-26,40.645325,-74.015196
"906",3126188,"BROOKLYN","501","E 5TH ST","A2","OT","ISSUED","08/25/2022","01/06/2023",2022-08-25,40.639908,-73.974842
"907",4620316,"QUEENS","82-53","164 STREET","A1","","ISSUED","08/25/2022","12/02/2022",2022-08-25,40.71759,-73.803505
"908",4620316,"QUEENS","82-53","164 STREET","A1","","ISSUED","08/25/2022","12/02/2022",2022-08-25,40.71759,-73.803505
"909",4620316,"QUEENS","82-53","164 STREET","A1","","ISSUED","08/25/2022","12/02/2022",2022-08-25,40.71759,-73.803505
"910",3060114,"BROOKLYN","575","BEDFORD AVE","A1","","ISSUED","08/25/2022","08/25/2023",2022-08-25,40.703877,-73.960824
"911",5042517,"STATEN ISLAND","175","LYNHURST AVENUE","A1","","ISSUED","08/26/2022","08/26/2023",2020-08-25,40.616348,-74.073267
"912",3428908,"BROOKLYN","4622","FORT HAMILTON PARKWAY","NB","","ISSUED","08/26/2022","01/14/2023",2022-06-07,40.639669,-73.995737
"913",1079184,"MANHATTAN","261","11 AVENUE","A3","OT","ISSUED","08/26/2022","08/07/2023",2021-05-18,40.751502,-74.005118
"914",3417058,"BROOKLYN","1002GAR","AVE N","DM","","ISSUED","08/26/2022","05/01/2023",2022-08-26,40.615106,-73.964194
"915",3153881,"BROOKLYN","650","86TH STREET","NB","","ISSUED","08/29/2022","04/01/2023",2022-06-16,40.618851,-74.021875
"916",3125127,"BROOKLYN","230","DAHILL ROAD","A2","OT","ISSUED","08/29/2022","06/12/2023",2022-08-29,40.641677,-73.980297
"917",3101783,"BROOKLYN","421","EAST 92 STREET","A2","OT","ISSUED","08/29/2022","12/18/2022",2022-08-29,40.655762,-73.920703
"918",4180451,"QUEENS","258-19","87TH AVENUE","A2","OT","ISSUED","08/29/2022","05/04/2023",2022-08-29,40.731394,-73.707793
"919",4525050,"QUEENS","91-06 REAR","101 AVE","DM","","ISSUED","08/29/2022","08/12/2023",2022-08-29,40.683336,-73.849248
"920",3032611,"BROOKLYN","716","LINCOLN PLACE","NB","PL","ISSUED","08/29/2022","08/29/2023",2021-08-25,40.670851,-73.952488
"921",4187230,"QUEENS","95-15","82ND ST","A2","OT","ISSUED","12/09/2022","04/21/2023",2022-12-09,40.683482,-73.85819
"922",1030307,"MANHATTAN","537","WEST 59TH ST","DM","EQ","ISSUED","03/13/2023","03/12/2024",2023-03-13,40.77091,-73.988768
"923",1030307,"MANHATTAN","537","WEST 59TH ST","DM","","ISSUED","03/13/2023","05/01/2023",2023-03-13,40.77091,-73.988768
"924",1079184,"MANHATTAN","261","11 AVENUE","A3","EQ","ISSUED","03/13/2023","03/12/2024",2021-03-23,40.751502,-74.005118
"925",3035761,"BROOKLYN","1580","DEAN STREET","A2","PL","ISSUED","03/13/2023","03/12/2024",2022-03-04,40.676094,-73.935688
"926",1080352,"MANHATTAN","450","11 AVENUE","A3","EQ","ISSUED","12/12/2022","12/12/2023",2020-06-19,40.757486,-74.000729
"927",4298426,"QUEENS","7-95","CORNAGA AVENUE","DM","EQ","ISSUED","08/30/2022","09/12/2023",2022-09-12,40.603713,-73.743922
"928",3429464,"BROOKLYN","2440","FULTON STREET","NB","","ISSUED","12/12/2022","12/12/2023",2022-07-11,40.677869,-73.903473
"929",3429464,"BROOKLYN","2440","FULTON STREET","NB","","ISSUED","12/12/2022","12/12/2023",2022-07-11,40.677869,-73.903473
"930",3429464,"BROOKLYN","2440","FULTON STREET","NB","","ISSUED","12/12/2022","12/12/2023",2022-07-11,40.677869,-73.903473
"931",2130763,"BRONX","101","LINCOLN AVENUE","NB","","ISSUED","06/20/2023","06/19/2024",2021-02-10,40.807149,-73.929969
"932",2826970,"BRONX","334","EAST 176TH STREET","NB","","ISSUED","12/12/2022","05/07/2023",2022-04-27,40.847527,-73.903028
"933",2826970,"BRONX","334","EAST 176TH STREET","NB","","ISSUED","12/12/2022","05/07/2023",2022-04-27,40.847527,-73.903028
"934",2826970,"BRONX","334","EAST 176TH STREET","NB","","ISSUED","12/12/2022","05/07/2023",2022-04-27,40.847527,-73.903028
"935",2128709,"BRONX","3187","GRAND CONCOURSE","NB","","ISSUED","12/12/2022","12/06/2023",2020-05-08,40.876341,-73.885774
"936",2097312,"BRONX","2850","GOULDEN AVENUE","A2","MH","ISSUED","12/13/2022","04/01/2023",2022-12-13,40.872898,-73.896175
"937",4085982,"QUEENS","17-22","STEPHEN STREET","A2","OT","ISSUED","12/13/2022","07/01/2023",2022-12-13,40.69794,-73.901579
"938",3039270,"BROOKLYN","1694","ST MARKS AVE","NB","","ISSUED","12/13/2022","01/27/2023",2021-11-22,40.673005,-73.910265
"939",1017122,"MANHATTAN","200","MADISON AVENUE","A2","OT","ISSUED","12/14/2022","01/01/2024",2020-08-21,40.748528,-73.982413
"940",4150096,"QUEENS","69-16","173 STREET","A2","OT","ISSUED","12/14/2022","06/03/2023",2022-12-14,40.732409,-73.7968
"941",3429228,"BROOKLYN","75","DUPONT STREET","NB","","ISSUED","12/14/2022","12/14/2023",2022-05-02,40.735698,-73.957082
"942",3429228,"BROOKLYN","75","DUPONT STREET","NB","","ISSUED","12/14/2022","12/14/2023",2022-05-02,40.735698,-73.957082
"943",3429228,"BROOKLYN","75","DUPONT STREET","NB","","ISSUED","12/14/2022","12/14/2023",2022-12-14,40.735698,-73.957082
"944",3429227,"BROOKLYN","65","DUPONT STREET","NB","","ISSUED","12/14/2022","12/20/2023",2022-04-28,40.735668,-73.957396
"945",4623739,"QUEENS","2-21","MALT DRIVE","A2","OT","ISSUED","12/14/2022","12/14/2023",2022-12-14,NA,NA
"946",1042490,"MANHATTAN","147","EAST 69TH STREET","A2","OT","ISSUED","12/14/2022","04/01/2023",2020-07-02,40.76828,-73.963108
"947",1042490,"MANHATTAN","147","EAST 69TH STREET","A2","OT","ISSUED","12/14/2022","04/01/2023",2021-04-08,40.76828,-73.963108
"948",5024368,"STATEN ISLAND","322","JEWETT AVENUE","A1","","ISSUED","12/14/2022","02/19/2023",2022-12-14,40.629083,-74.130447
"949",3083337,"BROOKLYN","100","WYONA STREET","A2","OT","ISSUED","03/13/2023","11/22/2023",2023-03-13,40.676875,-73.894205
"950",1028168,"MANHATTAN","36","WEST 66 STREET","A2","EQ","ISSUED","12/15/2022","12/15/2023",2022-12-15,40.772885,-73.979865
"951",2003895,"BRONX","452","CONCORD AVENUE","A2","OT","ISSUED","03/13/2023","11/25/2023",2023-03-13,40.810637,-73.90901
"952",4624506,"QUEENS","52-35","74TH STREET","NB","","RE-ISSUED","12/15/2022","04/08/2023",2023-03-09,40.73288,-73.888332
"953",1091646,"MANHATTAN","212","WEST 124 STREET","NB","","ISSUED","12/15/2022","12/15/2023",2022-12-15,40.808595,-73.949557
"954",4260545,"QUEENS","117-28","141 STREET","A2","OT","ISSUED","12/15/2022","12/11/2023",2022-12-15,40.678069,-73.800502
"955",3115866,"BROOKLYN","601","PARKSIDE AVENUE","A2","OT","ISSUED","12/15/2022","10/25/2023",2021-10-25,40.656046,-73.953742
"956",3115866,"BROOKLYN","601","PARKSIDE AVENUE","A2","MH","ISSUED","12/15/2022","10/25/2023",2021-10-25,40.656046,-73.953742
"957",3428802,"BROOKLYN","760","STERLING PLACE","NB","","ISSUED","12/15/2022","12/15/2023",2021-09-30,40.672699,-73.953481
"958",3842240,"BROOKLYN","15","HUDSON AVE","DM","","ISSUED","06/11/2024","06/11/2025",2023-10-03,40.704645,-73.980975
"959",4192720,"QUEENS","86-20","116 STREET","A2","OT","ISSUED","12/09/2022","05/26/2023",2021-12-01,40.699695,-73.833541
"960",1015702,"MANHATTAN","34","WEST 28TH STRET","A1","","ISSUED","12/09/2022","01/22/2023",2022-12-14,40.745488,-73.989227
"961",3245840,"BROOKLYN","201","HAMPTON AVENUE","A1","","ISSUED","12/09/2022","02/15/2023",2020-11-10,40.579397,-73.952232
"962",5010121,"STATEN ISLAND","97","MAINE AVE","A2","OT","ISSUED","12/16/2022","11/15/2023",2022-12-16,40.620745,-74.127085
"963",3426233,"BROOKLYN","559","PARK AVENUE","NB","PL","ISSUED","12/16/2022","12/16/2023",2021-09-20,40.697144,-73.953529
"964",1015702,"MANHATTAN","34","WEST 28","A2","OT","ISSUED","12/16/2022","12/18/2023",2021-03-02,40.745488,-73.989227
"965",1015702,"MANHATTAN","34","WEST 28TH STRET","A1","","ISSUED","12/16/2022","12/18/2023",2022-12-14,40.745488,-73.989227
"966",1000868,"MANHATTAN","111","WALL STREET","A2","OT","ISSUED","12/16/2022","01/01/2024",2020-08-13,40.704553,-74.006636
"967",1000868,"MANHATTAN","111","WALL STREET","A2","OT","ISSUED","12/16/2022","01/01/2024",2021-08-30,40.704553,-74.006636
"968",1000868,"MANHATTAN","111","WALL STREET","A2","OT","ISSUED","12/16/2022","01/01/2024",2021-08-18,40.704553,-74.006636
"969",3034590,"BROOKLYN","582","MONTGOMERY STREET","A1","","ISSUED","02/17/2022","12/16/2023",2022-12-16,40.665117,-73.945845
"970",5047657,"STATEN ISLAND","84","KENSINGTON AVE","A2","OT","ISSUED","03/13/2023","08/03/2023",2023-03-13,40.596223,-74.077155
"971",5058346,"STATEN ISLAND","16","CLARENCE PLACE","A2","OT","ISSUED","03/13/2023","08/03/2023",2023-03-13,40.565792,-74.124353
"972",1033691,"MANHATTAN","720","WEST END AVENUE","A1","","ISSUED","03/13/2023","03/17/2024",2022-07-08,40.794723,-73.973581
"973",1033691,"MANHATTAN","720","WEST END AVENUE","A2","OT","ISSUED","03/13/2023","03/17/2024",2020-01-08,40.794723,-73.973581
"974",3076057,"BROOKLYN","1333","BROADWAY","NB","","ISSUED","12/19/2022","02/18/2023",2021-07-01,40.690065,-73.923046
"975",1019544,"MANHATTAN","220","EAST 17TH STREET","A2","OT","ISSUED","12/19/2022","12/12/2023",2022-05-26,40.734772,-73.98478
"976",1019544,"MANHATTAN","220","EAST 17TH STREET","A2","OT","ISSUED","12/19/2022","12/12/2023",2022-05-26,40.734772,-73.98478
"977",3058228,"BROOKLYN","111","WILLOUGHBY STREET","NB","","ISSUED","12/19/2022","12/19/2023",2022-05-25,40.69214,-73.984628
"978",1030525,"MANHATTAN","250","W 73RD STREET","A1","","ISSUED","12/19/2022","12/28/2023",2021-06-14,40.780076,-73.983022
"979",2000697,"BRONX","265","ALEXANDER AVENUE","A1","PL","ISSUED","12/19/2022","12/19/2023",2021-01-08,40.810473,-73.924847
"980",3056489,"BROOKLYN","10","QUINCY STREET","A1","","ISSUED","12/19/2022","12/19/2023",2022-12-19,40.685786,-73.960774
"981",1030525,"MANHATTAN","250","W 73 ST","A2","OT","IN PROCESS","12/19/2022","12/28/2023",2021-03-10,40.780076,-73.983022
"982",3429227,"BROOKLYN","65","DUPONT STREET","NB","","ISSUED","12/14/2022","12/20/2023",2022-04-28,40.735668,-73.957396
"983",3110120,"BROOKLYN","143","EAST 32ND STREET","A2","OT","ISSUED","12/20/2022","06/12/2023",2022-12-20,40.647493,-73.947286
"984",1811452,"MANHATTAN","20","RANDALLS ISLAND","A2","OT","ISSUED","12/20/2022","01/01/2024",2022-05-05,NA,NA
"985",1811452,"MANHATTAN","20","RANDALLS ISLAND","A2","OT","ISSUED","12/20/2022","01/01/2024",2022-05-11,NA,NA
"986",1811452,"MANHATTAN","20","RANDALLS ISLAND","A2","OT","ISSUED","12/20/2022","01/01/2024",2022-05-05,NA,NA
"987",3425949,"BROOKLYN","414","VANDALIA AVENUE","NB","","ISSUED","12/20/2022","12/20/2023",2022-12-20,40.654526,-73.876642
"988",3425949,"BROOKLYN","414","VANDALIA AVENUE","NB","","ISSUED","12/20/2022","12/20/2023",2022-12-20,40.654526,-73.876642
"989",3425949,"BROOKLYN","414","VANDALIA AVENUE","NB","","ISSUED","12/20/2022","12/20/2023",2022-12-20,40.654526,-73.876642
"990",2087014,"BRONX","1025","MORRISON AVENUE","A2","PL","ISSUED","12/20/2022","12/20/2023",2022-01-25,40.825403,-73.873666
"991",3430047,"BROOKLYN","156","BAY 29 STREET","NB","","ISSUED","12/20/2022","08/21/2023",2020-10-21,40.59945,-73.997674
"992",3426078,"BROOKLYN","85","GATEWAY DRIVE","NB","","ISSUED","12/20/2022","12/20/2023",2022-12-20,40.654231,-73.877789
"993",3426078,"BROOKLYN","85","GATEWAY DRIVE","NB","","ISSUED","12/20/2022","12/20/2023",2022-12-20,40.654231,-73.877789
"994",3426078,"BROOKLYN","85","GATEWAY DRIVE","NB","","ISSUED","12/20/2022","12/20/2023",2022-12-20,40.654231,-73.877789
"995",1042490,"MANHATTAN","147","EAST 69TH STREET","A1","","ISSUED","12/14/2022","04/01/2023",2021-04-22,40.76828,-73.963108
"996",5075618,"STATEN ISLAND","15","WATKINS AVE","A2","OT","ISSUED","12/21/2022","11/15/2023",2022-12-21,40.560004,-74.173942
"997",3426079,"BROOKLYN","83","GATEWAY DRIVE","NB","","ISSUED","12/21/2022","12/21/2023",2022-12-21,40.65425,-73.877789
"998",3426079,"BROOKLYN","83","GATEWAY DRIVE","NB","","ISSUED","12/21/2022","12/21/2023",2022-12-21,40.65425,-73.877789
"999",3426079,"BROOKLYN","83","GATEWAY DRIVE","NB","","ISSUED","12/21/2022","12/21/2023",2022-12-21,40.65425,-73.877789
"1000",3219044,"BROOKLYN","1261","EAST 57TH STREET","A2","OT","ISSUED","12/21/2022","09/16/2023",2022-12-21,40.622706,-73.92048
"1001",3080756,"BROOKLYN","326","ROCKAWAY AVENUE","DM","EQ","ISSUED","12/21/2022","12/21/2023",2022-12-21,40.671905,-73.911308
"1002",3058599,"BROOKLYN","19","ROCKWELL PLACE","DM","","ISSUED","12/21/2022","11/20/2023",2022-10-03,40.689285,-73.979418
"1003",3080756,"BROOKLYN","326","ROCKAWAY AVENUE","DM","","IN PROCESS","12/21/2022","09/11/2023",2022-12-21,40.671905,-73.911308
"1004",4266977,"QUEENS","140-49","LATHAM LANE","A2","OT","ISSUED","12/21/2022","10/21/2023",2022-12-21,40.669782,-73.773621
"1005",4161893,"QUEENS","58-51","230TH ST","A2","OT","ISSUED","12/21/2022","10/01/2023",2022-12-21,40.752161,-73.748657
"1006",4532374,"QUEENS","104-48","164TH ST","A2","OT","ISSUED","12/21/2022","10/01/2023",2022-12-21,40.699606,-73.792406
"1007",2129342,"BRONX","1746","ANDREWS AVE SO","NB","","ISSUED","12/21/2022","04/30/2023",2022-03-22,40.85037,-73.917222
"1008",2129342,"BRONX","1746","ANDREWS AVE SO","NB","","ISSUED","12/21/2022","04/30/2023",2022-03-25,40.85037,-73.917222
"1009",4623835,"QUEENS","36-45","31ST STREET","NB","","ISSUED","12/21/2022","04/16/2023",2021-05-07,40.755831,-73.930348
"1010",2129342,"BRONX","1746","ANDREWS AVE SO","NB","","ISSUED","12/14/2022","04/30/2023",2022-03-22,40.85037,-73.917222
"1011",4007935,"QUEENS","36-23","32 STREET","A1","","ISSUED","02/27/2023","07/21/2023",2021-01-27,40.755696,-73.929359
"1012",1079184,"MANHATTAN","261","11 AVENUE","A3","EQ","ISSUED","03/07/2023","03/12/2024",2021-03-24,40.751502,-74.005118
"1013",1091635,"MANHATTAN","600","WEST 125TH STREET","NB","","ISSUED","12/22/2022","12/22/2023",2021-02-18,40.815974,-73.958569
"1014",3080756,"BROOKLYN","326","ROCKAWAY AVENUE","DM","","ISSUED","12/22/2022","09/11/2023",2022-12-22,40.671905,-73.911308
"1015",1028138,"MANHATTAN","50","CENTRAL PARK WEST","A3","EQ","ISSUED","12/22/2022","12/22/2023",2020-01-15,40.77169,-73.979273
"1016",2129684,"BRONX","2528","GRAND AVENUE","NB","","ISSUED","12/09/2021","06/09/2022",2021-12-09,40.865215,-73.901429
"1017",3073909,"BROOKLYN","1562","DEKALB AVENUE","NB","","ISSUED","12/22/2022","11/06/2023",2021-10-04,40.703189,-73.920322
"1018",3131055,"BROOKLYN","1117","EAST 5TH STREET","A1","","ISSUED","12/22/2022","05/06/2023",2021-08-11,40.623702,-73.971772
"1019",1091643,"MANHATTAN","310","HUDSON STREET","NB","","ISSUED","12/22/2022","12/22/2023",2021-01-21,40.726168,-74.007494
"1020",3193844,"BROOKLYN","2255","EAST 2 STREET","A1","","ISSUED","12/22/2022","05/06/2023",2020-03-03,40.594189,-73.969016
"1021",3400905,"BROOKLYN","1038","JEFFERSON AVENUE","NB","","IN PROCESS","12/22/2022","",2022-03-08,40.68739,-73.917085
"1022",1091635,"MANHATTAN","600","WEST 125TH STREET","NB","","ISSUED","12/22/2022","01/01/2024",2020-10-06,40.815974,-73.958569
"1023",1091635,"MANHATTAN","600","WEST 125TH STREET","NB","","ISSUED","12/22/2022","01/01/2024",2020-10-06,40.815974,-73.958569
"1024",2129684,"BRONX","2528","GRAND AVENUE","NB","","ISSUED","06/06/2022","05/19/2023",2021-12-09,40.865215,-73.901429
"1025",4623440,"QUEENS","97-22","BRISTOL AVE","NB","","ISSUED","01/27/2021","01/25/2022",2020-08-25,40.671111,-73.837315
"1026",1091739,"MANHATTAN","40","WEST 137 STREET","NB","","ISSUED","12/27/2022","12/27/2023",2022-12-27,40.814603,-73.938039
"1027",2129684,"BRONX","2528","GRAND AVENUE","NB","","ISSUED","10/14/2022","08/18/2023",2021-12-09,40.865215,-73.901429
"1028",1036505,"MANHATTAN","425","PARK AVENUE","A2","OT","ISSUED","12/27/2022","01/01/2024",2022-02-01,40.760512,-73.971541
"1029",1036505,"MANHATTAN","425","PARK AVENUE","A2","OT","ISSUED","12/27/2022","01/01/2024",2021-05-10,40.760512,-73.971541
"1030",1036505,"MANHATTAN","425","PARK AVENUE","A2","OT","ISSUED","12/27/2022","01/01/2024",2021-05-10,40.760512,-73.971541
"1031",2001874,"BRONX","333","E 151ST STREET","A2","PL","ISSUED","12/27/2022","12/27/2023",2022-01-05,40.818232,-73.919867
"1032",1036505,"MANHATTAN","425","PARK AVENUE","A2","OT","ISSUED","12/27/2022","01/01/2024",2021-07-08,40.760512,-73.971541
"1033",3332217,"BROOKLYN","92","CENTRE MALL","A2","OT","ISSUED","12/27/2022","01/01/2024",2021-08-19,40.674833,-74.003558
"1034",3332217,"BROOKLYN","92","CENTRE MALL","A2","OT","ISSUED","12/27/2022","01/01/2024",2021-08-19,40.674833,-74.003558
"1035",3332217,"BROOKLYN","92","CENTRE MALL","A2","OT","ISSUED","12/27/2022","01/01/2024",2021-08-19,40.674833,-74.003558
"1036",3332224,"BROOKLYN","748","HENRY STREET","A2","OT","ISSUED","12/27/2022","01/01/2024",2020-12-17,40.675409,-74.003612
"1037",3115866,"BROOKLYN","601","PARKSIDE AVENUE","A2","OT","ISSUED","12/27/2022","06/21/2023",2021-08-31,40.656046,-73.953742
"1038",3332224,"BROOKLYN","748","HENRY STREET","A2","OT","ISSUED","12/27/2022","01/01/2024",2020-12-17,40.675409,-74.003612
"1039",3332224,"BROOKLYN","748","HENRY STREET","A2","OT","ISSUED","12/27/2022","01/01/2024",2020-12-17,40.675409,-74.003612
"1040",2129684,"BRONX","2528","GRAND AVENUE","NB","","ISSUED","08/22/2023","08/14/2024",2021-12-09,40.865215,-73.901429
"1041",2001874,"BRONX","333","EAST 151 STREET","A2","PL","ISSUED","12/28/2022","12/28/2023",2021-01-26,40.818232,-73.919867
"1042",3332221,"BROOKLYN","465","COLUMBIA STREET","A2","OT","ISSUED","12/28/2022","01/01/2024",2021-08-02,40.676375,-74.006861
"1043",3332221,"BROOKLYN","465","COLUMBIA STREET","A2","OT","ISSUED","12/28/2022","01/01/2024",2021-08-02,40.676375,-74.006861
"1044",3332221,"BROOKLYN","465","COLUMBIA STREET","A2","OT","ISSUED","12/28/2022","01/01/2024",2021-08-02,40.676375,-74.006861
"1045",5164972,"STATEN ISLAND","20","SILVER COURT","A2","OT","ISSUED","12/28/2022","12/06/2023",2022-12-28,40.625418,-74.100965
"1046",4209632,"QUEENS","166-20","90 AVE","NB","","ISSUED","12/28/2022","01/31/2023",2022-04-26,40.70729,-73.794633
"1047",4209632,"QUEENS","166-20","90 AVE","NB","","ISSUED","12/28/2022","01/31/2023",2022-04-26,40.70729,-73.794633
"1048",4433860,"QUEENS","104-20","QUEENS BOULEVARD","A2","OT","ISSUED","12/28/2022","12/06/2023",2020-01-07,40.72378,-73.848991
"1049",3428561,"BROOKLYN","1215","FULTON STREET","NB","","ISSUED","12/28/2022","03/31/2023",2022-03-21,40.680609,-73.952845
"1050",3428561,"BROOKLYN","1215","FULTON STREET","NB","","ISSUED","12/28/2022","03/31/2023",2022-03-21,40.680609,-73.952845
"1051",3002035,"BROOKLYN","68","MONTAGUE STREET","A2","OT","ISSUED","12/28/2022","01/01/2024",2020-08-24,40.695416,-73.996589
"1052",2826970,"BRONX","334","EAST 176TH STREET","NB","","ISSUED","12/28/2022","05/07/2023",2022-04-27,40.847527,-73.903028
"1053",2826970,"BRONX","334","EAST 176TH STREET","NB","","ISSUED","12/28/2022","05/07/2023",2022-04-27,40.847527,-73.903028
"1054",3429519,"BROOKLYN","20","VITAL AVENUE","NB","","ISSUED","08/10/2022","04/08/2023",2022-09-08,NA,NA
"1055",2826970,"BRONX","334","EAST 176TH STREET","NB","","ISSUED","12/28/2022","05/07/2023",2022-04-27,40.847527,-73.903028
"1056",2076337,"BRONX","3300","WATT AVENUE","A2","OT","ISSUED","12/27/2022","08/25/2023",2022-12-28,40.848541,-73.816444
"1057",4135975,"QUEENS","214-33","35TH AVENUE","A2","PL","ISSUED","12/29/2022","12/29/2023",2022-01-14,40.769536,-73.771148
"1058",1012540,"MANHATTAN","436","WEST 15TH ST","A1","","ISSUED","12/29/2022","12/10/2023",2021-02-05,40.742285,-74.006416
"1059",3426347,"BROOKLYN","689","FRANKLIN AVE","NB","","ISSUED","12/30/2022","12/31/2023",2021-06-28,40.674915,-73.956422
"1060",1064452,"MANHATTAN","100","OVERLOOK TERRACE","A2","OT","ISSUED","12/30/2022","01/01/2024",2020-08-03,40.855967,-73.935412
"1061",2130763,"BRONX","101","LINCOLN AVENUE","NB","","ISSUED","06/24/2022","06/23/2023",2021-02-10,40.807149,-73.929969
"1062",3115866,"BROOKLYN","601","PARKSIDE AVENUE","A2","OT","ISSUED","12/30/2022","12/30/2023",2020-02-21,40.656046,-73.953742
"1063",3115866,"BROOKLYN","601","PARKSIDE AVENUE","A2","OT","ISSUED","12/30/2022","12/30/2023",2020-02-21,40.656046,-73.953742
"1064",3115866,"BROOKLYN","601","PARKSIDE AVENUE","A3","EQ","ISSUED","12/30/2022","12/30/2023",2020-01-14,40.656046,-73.953742
"1065",5130512,"STATEN ISLAND","25","AUGUSTA AVENUE","A2","OT","ISSUED","12/30/2022","12/30/2023",2020-03-04,40.551882,-74.168869
"1066",5130512,"STATEN ISLAND","25","AUGUSTA AVENUE","A2","OT","ISSUED","12/30/2022","12/30/2023",2020-02-05,40.551882,-74.168869
"1067",1014251,"MANHATTAN","220","WEST 28TH STREET","A1","","ISSUED","12/30/2022","01/01/2024",2021-12-29,40.747582,-73.994197
"1068",1080458,"MANHATTAN","936","2ND AVE","DM","EQ","ISSUED","05/17/2023","06/19/2024",2023-06-20,40.754632,-73.968688
"1069",3053387,"BROOKLYN","121","MACDONOUGH ST","A1","","ISSUED","12/30/2022","12/24/2023",2022-05-19,40.681263,-73.941646
"1070",4205027,"QUEENS","10501","130TH ST","A2","OT","ISSUED","03/14/2023","04/21/2023",2023-03-14,40.688289,-73.814794
"1071",1090972,"MANHATTAN","42","TRINITY PLACE","A2","PL","ISSUED","01/02/2023","01/02/2024",2020-11-23,40.707437,-74.013194
"1072",1080352,"MANHATTAN","450","11TH AVENUE","NB","PL","ISSUED","01/03/2023","01/03/2024",2021-06-08,40.757486,-74.000729
"1073",4121118,"QUEENS","42-27","192 STREET","A2","OT","ISSUED","01/03/2023","08/25/2023",2023-01-03,40.75891,-73.789554
"1074",1080458,"MANHATTAN","304","E 50 ST","DM","EQ","ISSUED","05/17/2023","06/19/2024",2023-06-20,40.754692,-73.968104
"1075",5855252,"STATEN ISLAND","35","VAN DUZER STREET","NB","","ISSUED","01/03/2023","04/29/2023",2021-05-21,40.637291,-74.077682
"1076",1009271,"MANHATTAN","3","EAST 10 STREET","A2","OT","ISSUED","01/03/2023","12/13/2023",2021-06-17,40.733288,-73.995114
"1077",3429228,"BROOKLYN","75","DUPONT STREET","NB","PL","ISSUED","01/03/2023","01/03/2024",2023-01-03,40.735698,-73.957082
"1078",2090472,"BRONX","2151","WASHINGTON AVENUE","A2","OT","ISSUED","01/03/2023","07/01/2023",2021-04-23,40.85294,-73.894742
"1079",3046095,"BROOKLYN","491","HALSEY STREET","A2","OT","ISSUED","01/03/2023","12/06/2023",2023-01-03,40.683723,-73.933264
"1080",1080458,"MANHATTAN","304","E 50 ST","DM","EQ","ISSUED","05/17/2023","06/19/2024",2023-06-20,40.754692,-73.968104
"1081",4007659,"QUEENS","30-38","31ST STREET","A1","","ISSUED","01/04/2023","01/28/2023",2022-10-04,40.765993,-73.922132
"1082",2129043,"BRONX","1561","EAST 174 STREET","A2","MH","ISSUED","01/04/2023","08/03/2023",2023-01-10,40.83415,-73.878442
"1083",4061863,"QUEENS","61-21","63 STREET","A2","OT","ISSUED","01/04/2023","02/11/2023",2023-01-04,40.71526,-73.89913
"1084",1079647,"MANHATTAN","83","CANAL STREET","A1","","ISSUED","12/22/2022","03/21/2023",2020-06-17,40.71529,-73.99315
"1085",1080458,"MANHATTAN","302","E 50TH ST","DM","EQ","ISSUED","05/17/2023","06/19/2024",2023-06-20,40.754706,-73.96814
"1086",1090883,"MANHATTAN","378","WEST END AVENUE","A1","PL","ISSUED","01/05/2023","01/05/2024",2020-02-10,40.783559,-73.981721
"1087",1080458,"MANHATTAN","302","E 50TH ST","DM","EQ","ISSUED","05/17/2023","06/19/2024",2023-06-20,40.754706,-73.96814
"1088",4253683,"QUEENS","132-50","114TH STREET","A2","OT","ISSUED","01/05/2023","04/21/2023",2023-01-05,40.67425,-73.825551
"1089",2026804,"BRONX","2249","POWELL AVE","A2","OT","ISSUED","01/05/2023","12/06/2023",2023-01-05,40.831448,-73.849176
"1090",4197663,"QUEENS","97-45","101 STREET","A2","OT","ISSUED","01/05/2023","07/01/2023",2023-01-05,40.686933,-73.842299
"1091",1080458,"MANHATTAN","300","EAST 50TH STREET","DM","EQ","ISSUED","05/17/2023","06/19/2024",2023-06-20,40.75472,-73.968172
"1092",4623835,"QUEENS","36-45","31ST STREET","NB","","ISSUED","01/06/2023","04/16/2023",2021-05-07,40.755831,-73.930348
"1093",4623835,"QUEENS","36-45","31ST STREET","NB","","ISSUED","01/06/2023","04/16/2023",2021-05-07,40.755831,-73.930348
"1094",3162711,"BROOKLYN","1601","80TH STREET","A2","OT","ISSUED","01/06/2023","05/01/2023",2023-01-06,40.613262,-74.003404
"1095",1080458,"MANHATTAN","300","EAST 50TH STREET","DM","EQ","ISSUED","05/17/2023","06/19/2024",2023-06-20,40.75472,-73.968172
"1096",4260122,"QUEENS","116-21","141 STREET","A2","OT","ISSUED","01/06/2023","04/21/2023",2023-01-06,40.679774,-73.800786
"1097",3234068,"BROOKLYN","1366","E 105 ST","A2","OT","ISSUED","01/06/2023","04/21/2023",2023-01-06,40.639772,-73.886052
"1098",4261332,"QUEENS","142-43","123 AVENUE","A2","OT","ISSUED","01/06/2023","06/01/2023",2023-01-06,40.674632,-73.79729
"1099",1080458,"MANHATTAN","308","EAST 50 STREET","DM","EQ","ISSUED","05/17/2023","06/19/2024",2023-06-20,40.754662,-73.968039
"1100",1059460,"MANHATTAN","6","EDGECOMBE AVENUE","A2","PL","ISSUED","01/06/2023","01/06/2024",2023-01-06,40.817372,-73.947712
"1101",3327906,"BROOKLYN","13","SCHOLES STREET","A1","","ISSUED","01/06/2023","01/13/2024",2023-01-13,40.708182,-73.949824
"1102",1080458,"MANHATTAN","308","EAST 50 STREET","DM","EQ","ISSUED","05/17/2023","06/19/2024",2323-06-20,40.754662,-73.968039
"1103",1080458,"MANHATTAN","936","2ND AVE","DM","","ISSUED","05/17/2023","04/26/2024",2023-06-20,40.754632,-73.968688
"1104",1080458,"MANHATTAN","300","EAST 50TH STREET","DM","","ISSUED","05/17/2023","06/19/2024",2023-06-20,40.75472,-73.968172
"1105",1080458,"MANHATTAN","302","E 50TH ST","DM","","ISSUED","05/17/2023","04/26/2024",2023-06-20,40.754706,-73.96814
"1106",1080458,"MANHATTAN","304","E 50 ST","DM","","ISSUED","05/17/2023","04/26/2024",2023-06-20,40.754692,-73.968104
"1107",1080641,"MANHATTAN","65","EAST 112 STREET","A2","PL","ISSUED","01/03/2023","01/06/2024",2020-07-21,40.796994,-73.945611
"1108",3117838,"BROOKLYN","2801","TILDEN AVENUE","NB","","ISSUED","03/02/2023","04/01/2023",2021-06-24,40.646825,-73.950919
"1109",3046515,"BROOKLYN","268","MALCOLM X BLVD","A2","OT","ISSUED","01/09/2023","01/09/2024",2023-01-09,40.683836,-73.929251
"1110",3174476,"BROOKLYN","1560","W 4TH ST","A2","OT","ISSUED","01/09/2023","04/27/2023",2023-01-09,40.609387,-73.977994
"1111",1000868,"MANHATTAN","111","WALL STREET","A2","OT","ISSUED","12/01/2023","12/18/2024",2021-08-30,40.704553,-74.006636
"1112",3051680,"BROOKLYN","360","TOMPKINS AVE","A1","","ISSUED","01/09/2023","12/24/2023",2021-12-02,40.685134,-73.944278
"1113",3082176,"BROOKLYN","9","NEWPORT STREET","A1","PL","ISSUED","12/28/2022","01/09/2024",2020-08-27,40.658451,-73.915193
"1114",2128709,"BRONX","3187","GRAND CONCOURSE","NB","PL","ISSUED","01/10/2023","01/10/2024",2022-01-03,40.876341,-73.885774
"1115",3429327,"BROOKLYN","625","FULTON STREET","NB","","ISSUED","06/11/2024","12/15/2024",2022-08-16,40.688566,-73.980045
"1116",4263445,"QUEENS","110-10","156TH ST","A2","OT","ISSUED","01/10/2023","10/01/2023",2023-01-10,40.690883,-73.793757
"1117",1041930,"MANHATTAN","1026","3RD AVE","DM","EQ","ISSUED","01/10/2023","01/10/2024",2023-01-10,40.762668,-73.965786
"1118",1041930,"MANHATTAN","1026","3RD AVE","DM","EQ","ISSUED","01/10/2023","01/10/2024",2023-01-10,40.762668,-73.965786
"1119",1041930,"MANHATTAN","1026","3RD AVE","DM","","ISSUED","01/10/2023","04/26/2023",2023-01-10,40.762668,-73.965786
"1120",1079184,"MANHATTAN","224","12TH AVENUE","A1","PL","ISSUED","01/10/2023","01/10/2024",2021-01-28,40.752641,-74.007576
"1121",3004019,"BROOKLYN","15","TOMPKINS PLACE","A2","OT","ISSUED","01/10/2023","01/15/2024",2020-08-12,40.685249,-73.995626
"1122",3004019,"BROOKLYN","15","TOMPKINS PLACE","A2","OT","ISSUED","01/10/2023","01/15/2024",2020-08-14,40.685249,-73.995626
"1123",1087511,"MANHATTAN","27","WEST 72ND STREET","A2","OT","ISSUED","01/08/2023","12/29/2023",2022-03-31,40.776979,-73.977748
"1124",4087416,"QUEENS","63-35","FRESH POND ROAD","A2","OT","ISSUED","01/09/2023","12/31/2023",2023-01-31,40.711388,-73.899907
"1125",3117838,"BROOKLYN","2801","TILDEN AVENUE","NB","","ISSUED","03/15/2023","04/01/2023",2021-06-24,40.646825,-73.950919
"1126",3100921,"BROOKLYN","120","EAST 54 STREET","A2","OT","ISSUED","01/11/2023","12/06/2023",2023-01-11,40.656197,-73.926963
"1127",4607880,"QUEENS","122-06","MERRICK BOULEVARD","NB","","ISSUED","01/11/2023","11/09/2023",2022-03-22,40.683649,-73.769525
"1128",4607880,"QUEENS","122-06","MERRICK BOULEVARD","NB","","ISSUED","01/11/2023","11/09/2023",2022-03-22,40.683649,-73.769525
"1129",4607880,"QUEENS","122-06","MERRICK BOULEVARD","NB","","ISSUED","01/11/2023","11/09/2023",2022-03-22,40.683649,-73.769525
"1130",4156295,"QUEENS","186-28","AVON ROAD","A1","","RE-ISSUED","01/12/2023","08/30/2023",2020-11-13,40.722633,-73.779791
"1131",4435247,"QUEENS","109-30","160TH STREET","A2","OT","ISSUED","03/15/2023","04/01/2024",2022-06-14,40.693495,-73.791683
"1132",3059089,"BROOKLYN","294","CLERMONT AVENUE","A2","OT","ISSUED","01/13/2023","11/08/2023",2021-11-12,40.688948,-73.970032
"1133",1009242,"MANHATTAN","17","EAST 9TH STREET","A1","","ISSUED","01/13/2023","01/13/2024",2021-05-24,40.732434,-73.994916
"1134",1009242,"MANHATTAN","17","EAST 9TH STREET","A1","","ISSUED","01/13/2023","01/13/2024",2021-05-24,40.732434,-73.994916
"1135",1009242,"MANHATTAN","17","EAST 9TH STREET","A1","","ISSUED","01/13/2023","01/13/2024",2021-05-24,40.732434,-73.994916
"1136",2129043,"BRONX","1561","EAST 174 STREET","A2","PL","ISSUED","06/21/2023","06/20/2024",2021-04-20,40.83415,-73.878442
"1137",1002688,"MANHATTAN","126","LAFAYETTE STREET","DM","EQ","ISSUED","01/13/2023","01/13/2024",2023-01-13,40.718727,-74.000274
"1138",1002688,"MANHATTAN","126","LAFAYETTE STREET","DM","EQ","ISSUED","01/13/2023","01/13/2024",2023-01-13,40.718727,-74.000274
"1139",1002688,"MANHATTAN","126","LAFAYETTE STREET","DM","","ISSUED","01/13/2023","02/19/2023",2023-01-13,40.718727,-74.000274
"1140",1058151,"MANHATTAN","135","WEST 132ND STREET","A1","","ISSUED","01/13/2023","01/01/2024",2020-08-07,40.812676,-73.94337
"1141",2129043,"BRONX","1561","EAST 174 STREET","A2","BL","ISSUED","06/21/2023","09/19/2023",2022-12-08,40.83415,-73.878442
"1142",1028138,"MANHATTAN","50","CENTRAL PARK WEST","A2","PL","ISSUED","01/13/2023","01/13/2024",2020-07-28,40.77169,-73.979273
"1143",3048084,"BROOKLYN","40","TROY AVENUE","A2","OT","ISSUED","01/10/2023","07/01/2023",2023-01-13,40.67832,-73.935801
"1144",1009242,"MANHATTAN","17","EAST 9TH STREET","A2","SP","ISSUED","01/17/2023","01/17/2024",2023-01-17,40.732434,-73.994916
"1145",4263445,"QUEENS","110-10","156TH STREET","A2","OT","ISSUED","01/17/2023","04/01/2023",2023-01-17,40.690883,-73.793757
"1146",2046144,"BRONX","3066","ROBERTS AVENUE","A1","","ISSUED","03/15/2023","03/15/2024",2022-02-02,40.84606,-73.829102
"1147",4094247,"QUEENS","88-34","AUBREY AVENUE","A2","OT","ISSUED","01/17/2023","04/01/2023",2023-01-17,40.710672,-73.863279
"1148",3004559,"BROOKLYN","407","CLINTON STREET","A1","","ISSUED","03/17/2022","03/26/2023",2020-07-01,40.682444,-73.998107
"1149",1000868,"MANHATTAN","111","WALL STREET","A2","OT","RE-ISSUED","08/24/2022","01/01/2023",2021-08-30,40.704553,-74.006636
"1150",2130726,"BRONX","1525","BRYANT AVENUE","NB","","ISSUED","08/24/2022","10/01/2022",2020-01-27,40.833484,-73.88691
"1151",3177549,"BROOKLYN","813","KINGS HIGHWAY","DM","","ISSUED","08/30/2022","08/06/2023",2021-10-05,40.606553,-73.964411
"1152",4011826,"QUEENS","31-63","42 STREET","A2","OT","ISSUED","08/30/2022","06/15/2023",2022-08-30,40.759174,-73.916617
"1153",1058151,"MANHATTAN","135","WEST 132ND STREET","A1","PL","ISSUED","08/30/2022","08/30/2023",2020-09-17,40.812676,-73.94337
"1154",2004136,"BRONX","581","AUSTIN PLACE","DM","EQ","ISSUED","08/30/2022","08/30/2023",2022-08-30,40.811268,-73.901513
"1155",2004136,"BRONX","581","AUSTIN PLACE","DM","","ISSUED","08/30/2022","03/15/2023",2022-08-30,40.811268,-73.901513
"1156",3126565,"BROOKLYN","3","DITMAS AVENUE","A2","MH","ISSUED","08/30/2022","08/31/2023",2021-06-08,40.635468,-73.978937
"1157",3137285,"BROOKLYN","4720","15 AVENUE","NB","","ISSUED","08/30/2022","08/31/2023",2021-11-03,40.633328,-73.986727
"1158",4096384,"QUEENS","6-14","125 ST","DM","EQ","ISSUED","08/30/2022","08/30/2023",2022-08-30,40.791358,-73.842695
"1159",2073776,"BRONX","1369","GILLESPIE AVENUE","A2","OT","ISSUED","08/30/2022","06/01/2023",2022-08-30,40.839651,-73.830397
"1160",3236695,"BROOKLYN","2066","PEARSON STREET","A2","OT","ISSUED","08/31/2022","12/18/2022",2022-08-31,40.613195,-73.918986
"1161",3378389,"BROOKLYN","91","SOUTH 3 STREET","A2","MH","ISSUED","08/31/2022","03/15/2023",2022-08-31,40.712985,-73.963784
"1162",2025696,"BRONX","1075","PUGSLEY AVE","A2","OT","ISSUED","08/31/2022","08/31/2023",2020-01-31,40.828518,-73.856569
"1163",3245283,"BROOKLYN","2","BRIGHTON 10TH LANE","A1","","ISSUED","08/31/2022","09/01/2023",2020-01-15,40.580484,-73.959619
"1164",3245283,"BROOKLYN","2","BRIGHTON 10TH LANE","A1","","ISSUED","08/31/2022","09/01/2023",2020-01-15,40.580484,-73.959619
"1165",3245283,"BROOKLYN","2","BRIGHTON 10TH LANE","A1","","ISSUED","08/31/2022","09/01/2023",2020-01-15,40.580484,-73.959619
"1166",3428802,"BROOKLYN","116","ROGERS AVENUE","A3","EQ","ISSUED","09/01/2022","09/01/2023",2020-09-22,40.67255,-73.953042
"1167",2025696,"BRONX","1075","PUGSLEY AVE","A2","OT","ISSUED","09/01/2022","09/01/2023",2020-01-31,40.828518,-73.856569
"1168",2025696,"BRONX","1075","PUGSLEY AVE","A2","OT","ISSUED","09/01/2022","09/01/2023",2020-01-31,40.828518,-73.856569
"1169",5021970,"STATEN ISLAND","14","HOLLY STREET","A2","OT","ISSUED","09/02/2022","10/01/2022",2022-09-02,40.6008,-74.094262
"1170",5171250,"STATEN ISLAND","10","EUGENE STREET","A2","OT","ISSUED","09/02/2022","10/01/2022",2022-09-02,40.51715,-74.231408
"1171",2059586,"BRONX","1024","EAST 219 STREET","A2","OT","ISSUED","09/02/2022","12/18/2022",2022-09-02,40.88068,-73.853748
"1172",4209027,"QUEENS","8843","162ND STREET","A2","OT","ISSUED","09/02/2022","09/16/2022",2022-09-02,40.707659,-73.799725
"1173",4221005,"QUEENS","105-40","FARMERS BOULEVARD","A2","OT","ISSUED","09/02/2022","06/01/2023",2022-09-02,40.70472,-73.766931
"1174",5000709,"STATEN ISLAND","73","BROOK STREET","NB","","ISSUED","09/05/2022","10/01/2022",2021-10-28,40.636996,-74.083014
"1175",3090032,"BROOKLYN","607","BARBEY STREET","A2","OT","ISSUED","09/06/2022","11/15/2022",2022-09-06,40.667794,-73.886239
"1176",3249062,"BROOKLYN","115","IVAN COURT","NB","","ISSUED","09/06/2022","07/04/2023",2021-06-28,40.588905,-73.926144
"1177",2003321,"BRONX","1305","SHAKESPEARE AVE","A1","","ISSUED","09/06/2022","01/29/2023",2020-12-24,40.839955,-73.922468
"1178",4439453,"QUEENS","257-09","UNION TURNPIKE","A2","OT","ISSUED","09/07/2022","06/15/2023",2022-09-07,40.745834,-73.714223
"1179",3153881,"BROOKLYN","650","86TH STREET","A2","OT","ISSUED","09/07/2022","09/07/2023",2022-06-14,40.618851,-74.021875
"1180",3425955,"BROOKLYN","2286","CROPSEY AVENUE","NB","PL","ISSUED","09/07/2022","09/07/2023",2020-12-21,40.595843,-73.997001
"1181",1088749,"MANHATTAN","1","MADISON AVENUE","A3","EQ","ISSUED","09/07/2022","09/07/2023",2020-10-15,40.740909,-73.987947
"1182",4061830,"QUEENS","61-19","62 ST","A2","OT","ISSUED","09/07/2022","11/02/2022",2021-01-12,40.714997,-73.89983
"1183",3115866,"BROOKLYN","601","PARKSIDE AVENUE","A3","EQ","ISSUED","03/15/2023","03/14/2024",2020-01-24,40.656046,-73.953742
"1184",2001965,"BRONX","943","TELLER AVENUE","A2","OT","ISSUED","09/08/2022","09/01/2023",2021-07-19,40.826292,-73.915467
"1185",2001965,"BRONX","943","TELLER AVENUE","A2","MH","ISSUED","09/08/2022","09/01/2023",2021-07-21,40.826292,-73.915467
"1186",4531578,"QUEENS","60-08","HEWLETT STREET","A2","OT","ISSUED","09/08/2022","04/21/2023",2022-09-08,40.761251,-73.716571
"1187",4048427,"QUEENS","110-72","CORONA AVE","NB","","ISSUED","09/08/2022","09/01/2023",2022-09-08,40.740912,-73.850807
"1188",4048427,"QUEENS","110-72","CORONA AVE","NB","","ISSUED","09/08/2022","09/01/2023",2022-09-08,40.740912,-73.850807
"1189",4464668,"QUEENS","36","REID AVE","NB","","ISSUED","09/08/2022","08/03/2023",2022-04-14,40.563083,-73.911377
"1190",1015733,"MANHATTAN","262","FIFTH AVENUE","NB","","ISSUED","09/08/2022","03/17/2023",2021-09-29,40.745081,-73.987019
"1191",1015733,"MANHATTAN","262","FIFTH AVENUE","NB","EQ","ISSUED","09/08/2022","09/08/2023",2021-09-29,40.745081,-73.987019
"1192",3115866,"BROOKLYN","601","PARKSIDE AVENUE","A3","EQ","ISSUED","03/15/2023","03/14/2024",2020-01-22,40.656046,-73.953742
"1193",4624027,"QUEENS","20-50","NAMEOKE AVENUE","NB","","ISSUED","09/08/2022","06/29/2023",2021-12-02,40.607683,-73.75205
"1194",4624027,"QUEENS","20-50","NAMEOKE AVENUE","NB","","ISSUED","09/08/2022","06/29/2023",2021-06-30,40.607683,-73.75205
"1195",4624027,"QUEENS","20-50","NAMEOKE AVENUE","NB","","ISSUED","09/08/2022","06/29/2023",2021-06-30,40.607683,-73.75205
"1196",1014251,"MANHATTAN","227","WEST 27 STREET","A2","EQ","ISSUED","09/08/2022","09/08/2023",2022-09-08,40.747127,-73.994991
"1197",5077680,"STATEN ISLAND","63","HOLCOMB AVENUE","NB","","ISSUED","09/09/2022","09/10/2023",2021-12-15,40.547784,-74.191534
"1198",3047923,"BROOKLYN","31","SUMPTER STREET","DM","","IN PROCESS","09/09/2022","",2020-01-30,40.679299,-73.926174
"1199",4299390,"QUEENS","242","BEACH 20TH STREET","A2","PL","ISSUED","09/09/2022","09/09/2023",2020-04-14,40.596162,-73.754105
"1200",1043220,"MANHATTAN","106","EAST 78 STREET","A1","","ISSUED","09/09/2022","07/01/2023",2020-10-06,40.774743,-73.960534
"1201",5003649,"STATEN ISLAND","33","ST AUSTINS PL","A2","OT","ISSUED","09/10/2022","09/30/2023",2021-06-09,40.636152,-74.108007
"1202",1062189,"MANHATTAN","1840","AMSTERDAM AVE","A2","OT","IN PROCESS","09/27/2021","02/11/2022",2022-09-07,40.829121,-73.944779
"1203",2097312,"BRONX","2850","GOULDEN AVENUE","A2","OT","ISSUED","09/02/2022","08/31/2023",2022-09-07,40.872898,-73.896175
"1204",4135975,"QUEENS","214-33","35TH AVENUE","A2","PL","ISSUED","09/12/2022","09/12/2023",2021-09-17,40.769536,-73.771148
"1205",4298426,"QUEENS","7-95","CORNAGA AVENUE","DM","","ISSUED","09/12/2022","04/21/2023",2022-09-12,40.603713,-73.743922
"1206",2009646,"BRONX","1511","FULTON AVENUE","A1","EQ","ISSUED","09/12/2022","09/12/2023",2020-12-15,40.836743,-73.900492
"1207",3428561,"BROOKLYN","1215","FULTON STREET","NB","","ISSUED","03/15/2023","03/14/2024",2022-03-21,40.680609,-73.952845
"1208",1088749,"MANHATTAN","1","MADISON AVE","A3","EQ","ISSUED","09/12/2022","09/12/2023",2022-09-23,40.740909,-73.987947
"1209",3341331,"BROOKLYN","590","6 STREET","A1","","ISSUED","09/12/2022","07/03/2023",2020-12-14,40.667057,-73.976674
"1210",4096384,"QUEENS","6-14","125 ST","DM","","ISSUED","08/30/2022","01/01/2023",2022-10-31,40.791358,-73.842695
"1211",1017224,"MANHATTAN","415","5TH AVE","A3","EQ","ISSUED","09/13/2022","09/13/2023",2022-09-13,40.750603,-73.982972
"1212",3057705,"BROOKLYN","1084","FULTON STREET","A2","PL","ISSUED","09/13/2022","09/13/2023",2022-09-13,40.681528,-73.957603
"1213",3428561,"BROOKLYN","1215","FULTON STREET","NB","","ISSUED","03/15/2023","03/14/2024",2022-03-21,40.680609,-73.952845
"1214",3054370,"BROOKLYN","100","WASHINGTON AVENUE","DM","","ISSUED","09/07/2022","01/26/2023",2022-09-13,40.695301,-73.967285
"1215",1083503,"MANHATTAN","160","BLEECKER STREET","A3","EQ","ISSUED","09/12/2022","09/13/2023",2020-08-20,40.728526,-73.999906
"1216",3332217,"BROOKLYN","92","CENTRE MALL","A2","OT","ISSUED","01/17/2023","01/17/2024",2020-06-29,40.674833,-74.003558
"1217",4618910,"QUEENS","35-32","LEAVITT STREET","NB","PL","ISSUED","09/14/2022","09/14/2023",2021-09-16,40.764245,-73.828835
"1218",3428627,"BROOKLYN","3192","ATLANTIC AVENUE","NB","PL","ISSUED","09/14/2022","09/14/2023",2020-08-18,40.679952,-73.877619
"1219",4118670,"QUEENS","33-22","164 STREET","A2","OT","ISSUED","09/14/2022","12/18/2022",2022-09-14,40.767401,-73.801148
"1220",3107131,"BROOKLYN","460","SCHENECTADY AVENUE","A1","","ISSUED","09/14/2022","03/07/2023",2022-06-01,40.662421,-73.934464
"1221",3107131,"BROOKLYN","460","SCHENECTADY AVENUE","A1","","ISSUED","09/14/2022","03/07/2023",2022-06-01,40.662421,-73.934464
"1222",3107131,"BROOKLYN","460","SCHENECTADY AVENUE","A1","","ISSUED","09/14/2022","03/07/2023",2022-06-01,40.662421,-73.934464
"1223",4189098,"QUEENS","88-19","102 ROAD","A2","OT","ISSUED","09/14/2023","04/21/2024",2023-09-14,40.681318,-73.851088
"1224",4546628,"QUEENS","68","HILLSIDE AVENUE","A2","OT","ISSUED","03/15/2023","05/04/2023",2023-03-15,40.566801,-73.888387
"1225",1067116,"MANHATTAN","421","HUDSON STREET","A2","OT","ISSUED","09/13/2022","05/06/2023",2023-01-11,40.730063,-74.006891
"1226",3332217,"BROOKLYN","92","CENTRE MALL","A2","OT","ISSUED","01/17/2023","01/17/2024",2020-06-29,40.674833,-74.003558
"1227",3332217,"BROOKLYN","92","CENTRE MALL","A2","OT","ISSUED","01/17/2023","01/17/2024",2020-06-29,40.674833,-74.003558
"1228",3332224,"BROOKLYN","748","HENRY STREET","A2","OT","ISSUED","01/17/2023","04/10/2023",2020-06-26,40.675409,-74.003612
"1229",3332224,"BROOKLYN","748","HENRY STREET","A2","OT","ISSUED","01/17/2023","04/10/2023",2020-06-26,40.675409,-74.003612
"1230",3332224,"BROOKLYN","748","HENRY STREET","A2","OT","ISSUED","01/17/2023","01/17/2024",2020-06-26,40.675409,-74.003612
"1231",3323702,"BROOKLYN","100","DWIGHT STREET","NB","","ISSUED","01/17/2023","01/17/2024",2020-05-06,40.675752,-74.009377
"1232",2130573,"BRONX","1940","TURNBULL AVENUE","NB","","ISSUED","01/17/2023","12/30/2023",2022-07-29,40.822911,-73.857365
"1233",2130573,"BRONX","1940","TURNBULL AVENUE","NB","","ISSUED","01/17/2023","12/30/2023",2022-07-29,40.822911,-73.857365
"1234",2130573,"BRONX","1940","TURNBULL AVENUE","NB","","ISSUED","01/17/2023","12/30/2023",2022-07-29,40.822911,-73.857365
"1235",3428908,"BROOKLYN","4622","FORT HAMILTON PARKWAY","NB","","ISSUED","01/17/2023","12/30/2023",2022-06-07,40.639669,-73.995737
"1236",3117838,"BROOKLYN","2801","TILDEN AVENUE","NB","","ISSUED","01/18/2023","03/16/2023",2021-06-24,40.646825,-73.950919
"1237",4482540,"QUEENS","146-28 GAR","32 AVE","DM","","ISSUED","01/18/2023","05/02/2023",2023-01-18,40.769796,-73.820788
"1238",4171477,"QUEENS","54-03","252ND ST","A2","OT","ISSUED","01/18/2023","10/01/2023",2023-01-18,40.764138,-73.72884
"1239",4623739,"QUEENS","2-21","MALT DRIVE","NB","","ISSUED","01/18/2023","01/18/2024",2022-03-03,NA,NA
"1240",1088749,"MANHATTAN","1","MADISON AVENUE","A2","EQ","ISSUED","01/18/2023","01/18/2024",2022-01-29,40.740909,-73.987947
"1241",4229115,"QUEENS","218-48","94TH ROAD","A2","OT","ISSUED","01/18/2023","05/04/2023",2023-01-18,40.720309,-73.736937
"1242",4206127,"QUEENS","107-23","130 STREET","A2","OT","ISSUED","01/18/2023","12/07/2023",2023-01-18,40.686388,-73.813844
"1243",4123451,"QUEENS","45-51","167TH ST","A2","OT","ISSUED","01/18/2023","10/01/2023",2023-01-18,40.754891,-73.800005
"1244",2003157,"BRONX","1182","WOODYCREST AVENUE","A3","EQ","ISSUED","03/15/2023","03/14/2024",2020-09-02,40.836723,-73.924835
"1245",4006079,"QUEENS","14-30","ASTORIA BLVD","DM","","ISSUED","09/12/2022","07/31/2023",2022-09-15,40.772156,-73.928746
"1246",4048427,"QUEENS","110-72","CORONA AVE","NB","","ISSUED","09/13/2022","09/01/2023",2022-09-15,40.740912,-73.850807
"1247",3111286,"BROOKLYN","1815 GAR","NOSTRAND AVE","DM","","ISSUED","01/18/2023","01/18/2024",2023-01-18,40.641692,-73.948581
"1248",3111286,"BROOKLYN","1815","NOSTRAND AVE","DM","","ISSUED","01/18/2023","01/18/2024",2023-01-18,40.641692,-73.948581
"1249",3119279,"BROOKLYN","509","STRATFORD ROAD","A2","OT","ISSUED","01/18/2023","10/21/2023",2023-01-18,40.636113,-73.967238
"1250",1035336,"MANHATTAN","315","MADISON AVENUE","A2","MH","IN PROCESS","01/18/2023","",2020-09-28,40.752661,-73.979376
"1251",5053088,"STATEN ISLAND","302","SEAVER AVENUE","A2","OT","ISSUED","01/19/2023","10/01/2023",2023-01-22,40.582382,-74.094909
"1252",1044935,"MANHATTAN","330","E 75TH STREET","A2","OT","ISSUED","01/19/2023","12/09/2023",2021-08-06,40.770383,-73.956085
"1253",3216783,"BROOKLYN","1031","EAST 57 STREET","A2","OT","ISSUED","09/15/2022","12/18/2022",2022-09-15,40.627738,-73.921018
"1254",3335119,"BROOKLYN","963","ATLANTIC AVENUE","A3","OT","ISSUED","09/15/2022","09/15/2023",2022-09-15,40.680263,-73.960337
"1255",4624066,"QUEENS","23-30","BORDEN AVENUE","NB","","ISSUED","09/15/2022","09/15/2023",2021-12-09,40.739918,-73.947213
"1256",3421392,"BROOKLYN","508A","LEXINGTON AVENUE","NB","PL","ISSUED","09/15/2022","09/15/2023",2021-03-05,40.688887,-73.940348
"1257",4623971,"QUEENS","31-29","CRESCENT STREET","NB","","ISSUED","09/15/2022","01/01/2023",2022-06-17,40.764934,-73.926923
"1258",3000519,"BROOKLYN","285","SCHERMERHORN","A2","OT","ISSUED","09/15/2022","01/01/2023",2020-10-13,40.687759,-73.982898
"1259",4233459,"QUEENS","109-30","205 PL","A2","OT","ISSUED","09/16/2022","09/16/2023",2022-09-16,40.708061,-73.75252
"1260",2070531,"BRONX","4362","WILDER AVENUE","A2","OT","ISSUED","09/16/2022","12/18/2022",2022-09-16,40.89859,-73.843938
"1261",4072332,"QUEENS","62-75","WETHEROLE STREET","A2","OT","ISSUED","09/16/2022","06/01/2023",2022-09-16,40.729176,-73.866824
"1262",5175245,"STATEN ISLAND","839","FATHER CAPODANNO BOULEVARD","NB","","ISSUED","09/16/2022","07/10/2023",2021-04-23,40.575512,-74.083478
"1263",3246888,"BROOKLYN","2971","CONEY ISLAND AVENUE","NB","PL","ISSUED","09/16/2022","09/16/2023",2020-09-03,40.583965,-73.959991
"1264",3358450,"BROOKLYN","5907 GAR","17 AVENUE","DM","","ISSUED","09/16/2022","05/10/2023",2022-10-28,40.623834,-73.988991
"1265",4089335,"QUEENS","66-05","MYRTLE AVENUE","A2","OT","ISSUED","09/16/2022","03/01/2023",2021-04-13,40.701345,-73.888144
"1266",2091300,"BRONX","324","POWERS AVENUE","A2","OT","ISSUED","09/16/2022","09/19/2023",2021-02-09,40.807516,-73.912388
"1267",4057415,"QUEENS","69-46","52 AVE","DM","","ISSUED","09/16/2022","05/25/2023",2022-09-26,40.733561,-73.894682
"1268",5000831,"STATEN ISLAND","53","WINTER AVENUE","A2","OT","ISSUED","09/19/2022","09/19/2023",2022-09-19,40.639032,-74.083431
"1269",3059243,"BROOKLYN","123","FORT GREENE PLACE","A2","OT","ISSUED","09/19/2022","01/26/2023",2022-09-19,40.686161,-73.976365
"1270",2097312,"BRONX","2850","GOULDEN AVENUE","A2","OT","ISSUED","09/19/2022","08/31/2023",2022-09-19,40.872898,-73.896175
"1271",4196501,"QUEENS","89-48","LEFFERTS BLVD","A2","OT","IN PROCESS","09/19/2022","02/10/2023",2022-10-18,40.69706,-73.829487
"1272",4618910,"QUEENS","35-32","LEAVITT STREET","NB","","ISSUED","09/19/2022","09/01/2023",2020-09-29,40.764245,-73.828835
"1273",1046258,"MANHATTAN","537","EAST 71 STREET","A1","","ISSUED","09/19/2022","10/01/2023",2021-10-07,40.765809,-73.953377
"1274",4078805,"QUEENS","73-37","AUSTIN STREET","A2","OT","ISSUED","09/19/2022","09/20/2023",2020-09-10,40.717717,-73.839409
"1275",2011872,"BRONX","16","WADE SQUARE","NB","","ISSUED","09/19/2022","07/01/2023",2022-05-31,40.85193,-73.891082
"1276",2072575,"BRONX","2385","HOLLERS AVE","A2","OT","ISSUED","09/19/2022","12/31/2022",2022-09-19,40.885519,-73.823973
"1277",1016278,"MANHATTAN","175","FIFTH AVENUE","A1","","ISSUED","09/19/2022","09/19/2023",2022-09-19,40.741132,-73.98987
"1278",4054351,"QUEENS","53-59","61 STREET","A1","","ISSUED","09/19/2022","04/13/2023",2021-06-22,40.728812,-73.904027
"1279",1088749,"MANHATTAN","1","MADISON AVE","A3","EQ","ISSUED","09/20/2022","09/20/2023",2022-09-20,40.740909,-73.987947
"1280",1028168,"MANHATTAN","36","WEST 66TH STREET","A2","EQ","ISSUED","09/20/2022","09/20/2023",2022-09-20,40.772885,-73.979865
"1281",1088749,"MANHATTAN","1","MADISON AVENUE","A1","","ISSUED","09/20/2022","10/01/2023",2021-01-26,40.740909,-73.987947
"1282",1088749,"MANHATTAN","1","MADISON AVENUE","A2","OT","ISSUED","09/20/2022","10/01/2023",2021-01-21,40.740909,-73.987947
"1283",1088749,"MANHATTAN","1","MADISON AVENUE","A2","OT","ISSUED","09/20/2022","10/01/2023",2021-05-05,40.740909,-73.987947
"1284",1088749,"MANHATTAN","1","MADISON AVENUE","A2","OT","ISSUED","09/20/2022","10/01/2023",2021-08-04,40.740909,-73.987947
"1285",1088749,"MANHATTAN","1","MADISON AVENUE","A2","OT","ISSUED","09/20/2022","10/01/2023",2021-01-21,40.740909,-73.987947
"1286",1088749,"MANHATTAN","1","MADISON AVENUE","A3","OT","ISSUED","09/20/2022","10/01/2023",2021-12-03,40.740909,-73.987947
"1287",1088749,"MANHATTAN","308","PARK AVENUE SOUTH","A3","OT","ISSUED","09/20/2022","10/01/2023",2021-11-29,40.740091,-73.986446
"1288",1001838,"MANHATTAN","101","LEONARD STREET","A2","OT","ISSUED","09/17/2020","08/12/2021",2020-09-17,40.716825,-74.00391
"1289",3223508,"BROOKLYN","666","EAST 79 STREET","A2","OT","ISSUED","09/20/2022","04/21/2023",2022-09-20,40.637158,-73.916452
"1290",3112194,"BROOKLYN","4524","CLARENDON ROAD","A2","OT","ISSUED","09/20/2022","06/01/2023",2022-09-20,40.644146,-73.934108
"1291",3076057,"BROOKLYN","1333","BROADWAY","NB","","ISSUED","09/20/2022","11/22/2023",2021-07-29,40.690065,-73.923046
"1292",1081114,"MANHATTAN","2130","MADISON AVENUE","A2","PL","ISSUED","09/20/2022","09/20/2023",2020-09-25,40.811232,-73.936648
"1293",4258011,"QUEENS","144-15","111 AVENUE","A2","OT","ISSUED","09/20/2022","06/15/2023",2022-09-20,40.687116,-73.799307
"1294",1017224,"MANHATTAN","415","5TH AVE","A3","EQ","ISSUED","09/20/2022","09/20/2023",2022-09-20,40.750603,-73.982972
"1295",2129082,"BRONX","2486","HOFFMAN STREET","NB","","ISSUED","09/20/2022","09/28/2023",2021-08-18,40.857955,-73.886745
"1296",4007659,"QUEENS","30-38","31ST STREET","A1","","ISSUED","01/20/2023","01/28/2023",2022-10-04,40.765993,-73.922132
"1297",5020691,"STATEN ISLAND","489","MOUNTAINVIEW AVENUE","A2","OT","ISSUED","09/21/2022","09/21/2023",2022-09-21,40.599239,-74.124696
"1298",4135975,"QUEENS","214-33","35TH AVENUE","A2","PL","ISSUED","09/21/2022","09/21/2023",2021-09-27,40.769536,-73.771148
"1299",1028168,"MANHATTAN","36","WEST 66TH STREET","A3","EQ","ISSUED","09/21/2022","09/21/2023",2022-09-21,40.772885,-73.979865
"1300",4262971,"QUEENS","130-15","149 STREET","A2","OT","ISSUED","09/21/2022","04/21/2023",2022-09-21,40.669725,-73.789817
"1301",4090665,"QUEENS","61-18","COOPER AVE","A2","OT","ISSUED","09/21/2022","09/20/2023",2022-01-20,40.697268,-73.893261
"1302",3429356,"BROOKLYN","83","APOLLO STREET","NB","","ISSUED","09/21/2022","09/21/2023",2022-05-23,40.727137,-73.93807
"1303",3429356,"BROOKLYN","83","APOLLO STREET","NB","","ISSUED","09/21/2022","09/21/2023",2021-10-01,40.727137,-73.93807
"1304",3429356,"BROOKLYN","83","APOLLO STREET","NB","","ISSUED","09/21/2022","09/21/2023",2021-10-01,40.727137,-73.93807
"1305",1036505,"MANHATTAN","425","PARK AVENUE","A2","OT","ISSUED","09/21/2022","10/01/2023",2020-10-21,40.760512,-73.971541
"1306",3429327,"BROOKLYN","625","FULTON STREET","NB","PL","ISSUED","03/16/2023","03/15/2024",2023-03-16,40.688566,-73.980045
"1307",2130625,"BRONX","240","DRAKE STREET","A2","OT","ISSUED","09/22/2022","02/17/2023",2022-04-06,40.806362,-73.880504
"1308",2130726,"BRONX","1525","BRYANT AVENUE","NB","","ISSUED","09/22/2022","10/17/2023",2020-01-27,40.833484,-73.88691
"1309",1075615,"MANHATTAN","500","WEST 204 STREET","DM","EQ","ISSUED","09/22/2022","09/22/2023",2022-09-22,40.862677,-73.920337
"1310",1075615,"MANHATTAN","500","WEST 204 STREET","DM","","ISSUED","09/22/2022","06/01/2023",2022-09-22,40.862677,-73.920337
"1311",3429283,"BROOKLYN","763","PARK AVENUE","NB","","ISSUED","09/22/2022","07/23/2023",2021-11-30,40.698136,-73.944805
"1312",3429283,"BROOKLYN","763","PARK AVENUE","NB","","ISSUED","09/22/2022","07/23/2023",2021-11-30,40.698136,-73.944805
"1313",3429283,"BROOKLYN","763","PARK AVENUE","NB","","ISSUED","09/22/2022","07/23/2023",2021-11-30,40.698136,-73.944805
"1314",3051878,"BROOKLYN","167","JEFFERSON AVENUE","A2","OT","ISSUED","09/23/2022","12/18/2022",2022-09-23,40.683164,-73.951141
"1315",3109524,"BROOKLYN","207","EAST 35 STREET","A2","OT","ISSUED","09/23/2022","11/15/2022",2022-09-23,40.650199,-73.944671
"1316",1009430,"MANHATTAN","16","FIFTH AVENUE","NB","","ISSUED","09/23/2022","09/23/2023",2022-09-23,40.732624,-73.996092
"1317",4252857,"QUEENS","116-37","131 ST","A2","OT","ISSUED","09/23/2022","09/23/2023",2022-09-23,40.677336,-73.808595
"1318",1009430,"MANHATTAN","16","FIFTH AVENUE","NB","","ISSUED","09/23/2022","09/23/2023",2022-09-23,40.732624,-73.996092
"1319",4060553,"QUEENS","61-12","56 ROAD","NB","","ISSUED","09/23/2022","07/23/2023",2020-12-04,40.724355,-73.903976
"1320",3017120,"BROOKLYN","273","19 STREET","A1","","ISSUED","09/23/2022","08/04/2023",2020-09-23,40.661762,-73.991068
"1321",4060553,"QUEENS","61-12","56 ROAD","NB","","ISSUED","09/23/2022","07/23/2023",2020-11-12,40.724355,-73.903976
"1322",4302640,"QUEENS","515","BEACH 65TH STREET","A2","OT","ISSUED","09/23/2022","04/01/2023",2022-09-23,40.595571,-73.794462
"1323",1091739,"MANHATTAN","40","WEST 137 STREET","NB","","ISSUED","09/23/2022","04/26/2023",2022-05-24,40.814603,-73.938039
"1324",1022581,"MANHATTAN","1","TIMES SQUARE","A2","OT","ISSUED","09/23/2022","10/01/2023",2022-02-18,40.756628,-73.986287
"1325",1022581,"MANHATTAN","1","TIMES SQUARE","A2","OT","ISSUED","09/23/2022","10/01/2023",2022-05-16,40.756628,-73.986287
"1326",3001453,"BROOKLYN","52","4TH AVE","NB","","ISSUED","09/23/2022","08/19/2023",2021-11-16,40.683038,-73.979261
"1327",5000064,"STATEN ISLAND","18","RICHMOND TERRACE","A2","OT","ISSUED","09/23/2022","03/04/2023",2022-03-24,40.643004,-74.075772
"1328",3429430,"BROOKLYN","462","EAST 29TH STREET","NB","","IN PROCESS","12/20/2023","",2022-01-27,40.639318,-73.949325
"1329",1083955,"MANHATTAN","2120","1ST AVENUE","A2","OT","ISSUED","09/12/2022","03/01/2023",2020-02-04,40.791737,-73.938508
"1330",5174428,"STATEN ISLAND","117","FINGERBOARD RD","NB","","ISSUED","01/20/2023","08/10/2023",2020-11-09,40.607424,-74.066191
"1331",4105078,"QUEENS","23-19","PARSONS BLVD","A2","OT","ISSUED","09/24/2022","05/02/2023",2021-11-01,40.778178,-73.823874
"1332",4105078,"QUEENS","23-19","PARSONS BLVD","NB","","ISSUED","09/24/2022","05/02/2023",2020-11-27,40.778178,-73.823874
"1333",4623381,"QUEENS","219-02","43 AVE","NB","","ISSUED","09/24/2022","05/02/2023",2021-05-13,40.762572,-73.763158
"1334",1007411,"MANHATTAN","9","SPRING STREET","A2","OT","ISSUED","09/26/2022","08/31/2023",2022-09-26,40.721216,-73.994452
"1335",2831766,"BRONX","1163","GARRISON AVENUE","NB","","ISSUED","09/26/2022","02/01/2023",2022-03-29,40.820261,-73.888493
"1336",3001453,"BROOKLYN","52","4TH AVE","NB","","ISSUED","09/26/2022","08/19/2023",2021-11-16,40.683038,-73.979261
"1337",1000868,"MANHATTAN","111","WALL STREET","A2","OT","ISSUED","09/26/2022","09/25/2023",2021-08-03,40.704553,-74.006636
"1338",1088961,"MANHATTAN","500","WEST 33RD STREET","A2","OT","ISSUED","09/26/2022","04/13/2023",2022-09-26,40.753992,-73.99983
"1339",4262705,"QUEENS","126-20","149 STREET","A2","OT","ISSUED","09/26/2022","04/01/2023",2022-09-26,40.672883,-73.789094
"1340",5025279,"STATEN ISLAND","70","PORT RICHMOND AVE","A1","","ISSUED","09/26/2022","09/23/2023",2021-03-09,40.639236,-74.132424
"1341",5171142,"STATEN ISLAND","109","FINGERBOARD RD","NB","","ISSUED","01/20/2023","08/10/2023",2020-11-09,40.607501,-74.066004
"1342",1091717,"MANHATTAN","155","WEST 29TH STREET","NB","","ISSUED","09/27/2022","10/01/2023",2021-07-13,40.747308,-73.991587
"1343",3429214,"BROOKLYN","955","STERLING PLACE","NB","","ISSUED","09/27/2022","09/27/2023",2021-12-23,40.672347,-73.946733
"1344",1091717,"MANHATTAN","155","WEST 29TH STREET","NB","","ISSUED","09/27/2022","10/01/2023",2021-07-13,40.747308,-73.991587
"1345",1091717,"MANHATTAN","155","WEST 29TH STREET","NB","","ISSUED","09/27/2022","10/01/2023",2021-07-13,40.747308,-73.991587
"1346",4264551,"QUEENS","157-18","115TH RD","A2","OT","ISSUED","09/27/2022","09/27/2023",2022-09-27,40.686292,-73.788056
"1347",3428829,"BROOKLYN","46","STOCKHOLM STREET","NB","","ISSUED","09/27/2022","07/28/2023",2020-08-15,40.696204,-73.926003
"1348",1088749,"MANHATTAN","1","MADISON AVENUE","A2","OT","ISSUED","09/27/2022","10/01/2023",2020-06-30,40.740909,-73.987947
"1349",1009430,"MANHATTAN","16","FIFTH AVENUE","NB","","ISSUED","09/27/2022","09/27/2023",2022-09-27,40.732624,-73.996092
"1350",4623141,"QUEENS","53-16","NORTHERN BOULEVARD","NB","","ISSUED","09/27/2022","04/01/2023",2022-09-27,40.753192,-73.907839
"1351",4623141,"QUEENS","53-16","NORTHERN BOULEVARD","NB","PL","ISSUED","09/27/2022","09/27/2023",2022-09-27,40.753192,-73.907839
"1352",1046258,"MANHATTAN","537","EAST 71 STREET","A1","","ISSUED","09/27/2022","10/01/2022",2021-11-16,40.765809,-73.953377
"1353",4249317,"QUEENS","109-36","116 STREET","A2","OT","ISSUED","06/09/2022","10/21/2023",2022-12-05,40.68122,-73.824588
"1354",1088749,"MANHATTAN","1","MADISON AVENUE","A3","EQ","ISSUED","09/28/2022","09/28/2023",2021-09-30,40.740909,-73.987947
"1355",3323702,"BROOKLYN","100","DWIGHT STREET","NB","PL","ISSUED","09/28/2022","09/28/2023",2020-05-27,40.675752,-74.009377
"1356",4116436,"QUEENS","46-21","COLDEN STREET","A2","SP","ISSUED","09/28/2022","09/28/2023",2020-11-03,40.749545,-73.822073
"1357",4116436,"QUEENS","46-21","COLDEN STREET","A2","PL","ISSUED","09/28/2022","09/28/2023",2020-11-03,40.749545,-73.822073
"1358",1009271,"MANHATTAN","3","EAST 10 STREET","A2","OT","ISSUED","12/20/2023","12/13/2024",2021-06-17,40.733288,-73.995114
"1359",3082389,"BROOKLYN","411","THATFORD AVENUE","A2","OT","ISSUED","01/20/2023","05/01/2023",2023-01-20,40.660306,-73.907355
"1360",1050434,"MANHATTAN","420","EAST 83RD STREET","A1","","ISSUED","09/28/2022","03/28/2023",2021-01-04,40.774643,-73.950146
"1361",4623158,"QUEENS","11-12","30TH DRIVE","NB","","ISSUED","09/28/2022","05/27/2023",2020-06-08,40.770235,-73.934066
"1362",4533696,"QUEENS","102-52","1ST STREET","A2","OT","ISSUED","08/19/2015","05/10/2023",2022-09-28,40.655514,-73.829197
"1363",3232415,"BROOKLYN","10566","FLATLANDS 3 STREET","A2","OT","ISSUED","01/20/2023","04/21/2023",2023-01-20,40.644636,-73.888913
"1364",4623141,"QUEENS","53-16","NORTHERN BOULEVARD","NB","PL","ISSUED","01/20/2023","01/20/2024",2022-02-08,40.753192,-73.907839
"1365",4623202,"QUEENS","35-15","19 AVENUE","NB","","ISSUED","09/29/2022","09/29/2023",2022-01-25,40.780124,-73.902028
"1366",1024785,"MANHATTAN","250","WEST 49TH STREET","DM","","ISSUED","09/29/2022","11/20/2022",2022-03-08,40.761193,-73.985478
"1367",1090459,"MANHATTAN","255","WEST 34TH STREET","NB","","ISSUED","09/29/2022","08/10/2023",2020-06-05,40.751823,-73.992569
"1368",3001453,"BROOKLYN","52","4TH AVE","NB","","ISSUED","06/12/2024","06/02/2026",2021-11-16,40.683038,-73.979261
"1369",3337258,"BROOKLYN","5216","4 AVE","A1","PL","ISSUED","09/29/2022","09/29/2023",2022-09-29,40.645207,-74.013906
"1370",5000064,"STATEN ISLAND","18","RICHMOND TERRACE","A2","OT","ISSUED","09/29/2022","09/22/2023",2022-05-04,40.643004,-74.075772
"1371",4617668,"QUEENS","148-18","HILLSIDE AVE","NB","","ISSUED","09/29/2022","01/01/2023",2022-06-10,40.706166,-73.808184
"1372",4617668,"QUEENS","148-18","HILLSIDE AVE","A2","OT","ISSUED","09/29/2022","01/01/2023",2022-06-02,40.706166,-73.808184
"1373",3325318,"BROOKLYN","128","WOODPOINT ROAD","DM","","ISSUED","09/29/2022","12/15/2022",2022-10-12,40.717886,-73.941134
"1374",4617668,"QUEENS","148-18","HILLSIDE AVE","A2","OT","ISSUED","09/29/2022","01/01/2023",2022-06-02,40.706166,-73.808184
"1375",1017122,"MANHATTAN","200","MADISON AVENUE","A3","EQ","ISSUED","09/30/2022","09/30/2023",2022-09-30,40.748528,-73.982413
"1376",1091777,"MANHATTAN","740","EIGHTH AVENUE","NB","","RE-ISSUED","09/30/2022","09/30/2023",2022-09-30,40.759546,-73.988095
"1377",2130750,"BRONX","1600","GRAND AVENUE","NB","","ISSUED","06/21/2023","01/01/2024",2022-06-28,40.8465,-73.916612
"1378",3428829,"BROOKLYN","46","STOCKHOLM STREET","NB","","ISSUED","09/30/2022","09/22/2023",2020-08-15,40.696204,-73.926003
"1379",4253690,"QUEENS","114-19","133 AVE","A2","OT","ISSUED","09/30/2022","04/21/2023",2022-10-25,40.673242,-73.825154
"1380",2833842,"BRONX","1119 GAR","EDISON AVE","DM","EQ","ISSUED","09/30/2022","09/30/2023",2022-09-30,40.834206,-73.827311
"1381",2833842,"BRONX","1119 GAR","EDISON AVE","DM","","ISSUED","09/30/2022","03/30/2023",2022-09-30,40.834206,-73.827311
"1382",3416888,"BROOKLYN","4910","14TH AVENUE","NB","","ISSUED","09/30/2022","03/07/2023",2021-10-08,40.633578,-73.990052
"1383",2000421,"BRONX","422","E 143RD ST","DM","EQ","ISSUED","09/30/2022","09/30/2023",2022-09-30,40.811941,-73.919824
"1384",2000421,"BRONX","422","E 143RD ST","DM","","ISSUED","09/30/2022","03/26/2023",2022-09-30,40.811941,-73.919824
"1385",2069676,"BRONX","4330","MATILDA  AVE","A2","OT","ISSUED","09/30/2022","11/15/2022",2022-09-30,40.897123,-73.857586
"1386",3429214,"BROOKLYN","955","STERLING PLACE","NB","","RE-ISSUED","09/27/2022","09/30/2023",2021-12-23,40.672347,-73.946733
"1387",1009531,"MANHATTAN","26","WEST 11TH STREET","A2","OT","ISSUED","09/29/2022","07/01/2023",2022-09-30,40.734468,-73.996103
"1388",3429214,"BROOKLYN","955","STERLING PLACE","NB","","RE-ISSUED","09/27/2022","10/04/2023",2022-07-19,40.672347,-73.946733
"1389",2009646,"BRONX","1511","FULTON AVENUE","A1","","ISSUED","10/03/2022","10/01/2023",2020-12-15,40.836743,-73.900492
"1390",1000868,"MANHATTAN","111","WALL STREET","A2","OT","ISSUED","12/20/2023","12/19/2024",2021-08-30,40.704553,-74.006636
"1391",3338507,"BROOKLYN","1388","BUSHWICK AVENUE","A1","","ISSUED","10/03/2022","10/03/2023",2022-05-12,40.684868,-73.910025
"1392",3338507,"BROOKLYN","1388","BUSHWICK AVENUE","A1","","ISSUED","10/03/2022","10/03/2023",2022-05-11,40.684868,-73.910025
"1393",1091643,"MANHATTAN","304","HUDSON STREET","A2","EQ","ISSUED","10/03/2022","10/03/2023",2022-10-03,40.726009,-74.007519
"1394",1079773,"MANHATTAN","2569","ADAM CLAYTON POWELL BOULEVARD","A3","EQ","ISSUED","10/03/2022","10/03/2023",2020-10-24,40.823872,-73.937438
"1395",1046258,"MANHATTAN","537","EAST 71 STREET","A1","","ISSUED","10/03/2022","10/01/2023",2021-11-16,40.765809,-73.953377
"1396",3065463,"BROOKLYN","341","KINGSLAND AVE","A1","","ISSUED","09/21/2022","12/31/2022",2022-10-04,40.728574,-73.942139
"1397",1011884,"MANHATTAN","557","HUDSON STREET","A1","","ISSUED","09/30/2022","02/28/2023",2021-05-28,40.735429,-74.006037
"1398",3010981,"BROOKLYN","467","44TH STREET","A2","OT","ISSUED","10/04/2022","06/12/2023",2022-10-04,40.648971,-74.007651
"1399",2007580,"BRONX","1840","ANTHONY AVENUE","A1","","ISSUED","10/04/2022","10/15/2023",2021-12-16,40.847574,-73.903653
"1400",1015733,"MANHATTAN","262","FIFTH AVENUE","NB","","ISSUED","10/04/2022","10/04/2023",2021-09-29,40.745081,-73.987019
"1401",1015733,"MANHATTAN","262","FIFTH AVENUE","NB","","ISSUED","10/04/2022","10/04/2023",2022-06-16,40.745081,-73.987019
"1402",5105123,"STATEN ISLAND","81","SHARROTTS ROAD","A2","OT","ISSUED","10/04/2022","11/15/2022",2022-10-04,40.537524,-74.220653
"1403",4249665,"QUEENS","109-23","123RD STREET","A2","OT","ISSUED","10/04/2022","08/25/2023",2022-12-22,40.682968,-73.818526
"1404",2017504,"BRONX","2819","MORRIS AVE","A3","OT","ISSUED","10/04/2022","11/07/2022",2021-11-19,40.870009,-73.8938
"1405",3335182,"BROOKLYN","15","WASHINGTON AVENUE","A3","OT","IN PROCESS","09/30/2022","06/15/2023",2022-10-04,40.701526,-73.967512
"1406",3065463,"BROOKLYN","341","KINGSLAND AVE","A1","","ISSUED","10/03/2022","12/31/2022",2022-10-04,40.728574,-73.942139
"1407",3065463,"BROOKLYN","341","KINGSLAND AVE","A1","","ISSUED","10/03/2022","12/31/2022",2022-10-04,40.728574,-73.942139
"1408",4607880,"QUEENS","122-06","MERRICK BOULEVARD","NB","PL","ISSUED","10/05/2022","10/05/2023",2022-10-05,40.683649,-73.769525
"1409",3255289,"BROOKLYN","2940","WEST 15 STREET","NB","","ISSUED","10/05/2022","10/05/2023",2022-03-14,40.576271,-73.982552
"1410",5082634,"STATEN ISLAND","100","LUTEN AVENUE","A2","PL","ISSUED","01/20/2023","01/20/2024",2022-01-12,40.528092,-74.192032
"1411",1009204,"MANHATTAN","39","EAST 12TH STREET","A2","OT","ISSUED","10/06/2022","09/26/2023",2022-02-10,40.733642,-73.992109
"1412",5043333,"STATEN ISLAND","392","VANDERBILT AVE","A2","OT","ISSUED","10/06/2022","11/15/2022",2022-10-06,40.616072,-74.08342
"1413",4198174,"QUEENS","95-35","113 STREET","A2","OT","ISSUED","10/06/2022","12/11/2022",2022-10-06,40.690693,-73.832028
"1414",1030727,"MANHATTAN","2130","BROADWAY","A2","OT","ISSUED","10/06/2022","04/01/2023",2020-05-19,40.780737,-73.981379
"1415",5027713,"STATEN ISLAND","61","BUSH AVE","A2","OT","ISSUED","10/07/2022","11/15/2022",2022-10-07,40.635228,-74.159013
"1416",5863316,"STATEN ISLAND","114","NORTHFIELD AVENUE","NB","","ISSUED","10/07/2022","06/11/2023",2022-10-18,40.637658,-74.168217
"1417",4020675,"QUEENS","2646","4TH STREET","NB","","ISSUED","10/07/2022","07/31/2023",2020-08-05,40.775472,-73.932996
"1418",4623202,"QUEENS","35-15","19TH AVENUE","A3","EQ","ISSUED","12/20/2023","12/19/2024",2022-06-03,40.780124,-73.902028
"1419",2077589,"BRONX","2923","SCHURZ AVENUE","A2","OT","ISSUED","10/07/2022","04/01/2023",2022-10-07,40.814728,-73.813922
"1420",4623202,"QUEENS","35-15","19TH AVE","A3","EQ","ISSUED","12/20/2023","12/19/2024",2022-06-07,40.780124,-73.902028
"1421",4596249,"QUEENS","1151","BEACH 12 STREET","NB","PL","ISSUED","01/21/2023","01/21/2024",2021-11-30,40.606007,-73.747367
"1422",4618910,"QUEENS","35-32","LEAVITT STREET","NB","","ISSUED","10/10/2022","05/26/2023",2020-09-29,40.764245,-73.828835
"1423",4026513,"QUEENS","73-01","NORTHERN BLVD","DM","EQ","ISSUED","10/11/2022","10/11/2023",2022-10-11,40.754703,-73.893598
"1424",4026513,"QUEENS","73-01","NORTHERN BLVD","DM","","ISSUED","10/11/2022","12/31/2022",2022-10-11,40.754703,-73.893598
"1425",1017224,"MANHATTAN","415","5TH AVENUE","A3","OT","ISSUED","03/19/2024","08/09/2024",2024-03-19,40.750603,-73.982972
"1426",1016921,"MANHATTAN","261","FIFTH AVENUE","A2","SP","ISSUED","10/11/2022","10/11/2023",2020-01-22,40.745131,-73.986957
"1427",5000709,"STATEN ISLAND","73","BROOK STREET","NB","","ISSUED","10/11/2022","09/07/2023",2021-10-28,40.636996,-74.083014
"1428",3336897,"BROOKLYN","67","34 STREET","A2","OT","ISSUED","10/11/2022","05/17/2023",2020-10-29,40.657359,-74.006423
"1429",1077363,"MANHATTAN","712","5TH AVENUE","A1","","ISSUED","10/11/2022","11/01/2023",2021-05-21,40.762495,-73.975193
"1430",3076057,"BROOKLYN","1333","BROADWAY","NB","PL","ISSUED","10/12/2022","10/12/2023",2022-10-12,40.690065,-73.923046
"1431",3000519,"BROOKLYN","285","SCHERMERHORN STREET","A3","EQ","ISSUED","10/12/2022","10/12/2023",2020-11-06,40.687759,-73.982898
"1432",3426233,"BROOKLYN","559","PARK AVENUE","NB","","ISSUED","10/12/2022","03/08/2023",2020-10-27,40.697144,-73.953529
"1433",3426233,"BROOKLYN","559","PARK AVENUE","NB","","ISSUED","10/12/2022","03/08/2023",2020-10-27,40.697144,-73.953529
"1434",3426233,"BROOKLYN","559","PARK AVENUE","NB","","ISSUED","10/12/2022","03/08/2023",2020-10-27,40.697144,-73.953529
"1435",1082906,"MANHATTAN","157","EAST 74TH STREET","A2","OT","ISSUED","10/12/2022","10/20/2023",2021-04-12,40.77154,-73.960749
"1436",3429247,"BROOKLYN","487","FOURTH AVENUE","NB","","ISSUED","06/12/2024","04/30/2025",2023-06-12,40.668453,-73.990289
"1437",4182339,"QUEENS","91-26","85 AVENUE","A2","PL","IN PROCESS","10/12/2022","",2022-10-12,40.696665,-73.85409
"1438",1040539,"MANHATTAN","435","EAST 57TH STREET","A2","OT","ISSUED","10/12/2022","10/20/2023",2021-04-16,40.757946,-73.962034
"1439",4030683,"QUEENS","41-45","73RD ST","A2","OT","ISSUED","10/12/2022","10/01/2023",2022-10-12,40.744125,-73.891807
"1440",4439453,"QUEENS","257-09","UNION TURNPIKE","A2","OT","ISSUED","10/12/2022","06/15/2023",2022-10-12,40.745834,-73.714223
"1441",5174492,"STATEN ISLAND","426","LORETTO STREET","NB","","ISSUED","10/12/2022","03/20/2023",2021-05-11,40.499975,-74.23803
"1442",3004559,"BROOKLYN","407","CLINTON STREET","A1","","ISSUED","10/03/2022","03/26/2023",2020-07-01,40.682444,-73.998107
"1443",3120352,"BROOKLYN","454","EAST 25 STREET","A2","OT","ISSUED","10/04/2022","12/18/2022",2022-10-12,40.639146,-73.953159
"1444",3154979,"BROOKLYN","61","OLIVER ST","A2","OT","ISSUED","10/13/2022","10/20/2023",2020-09-22,40.619711,-74.038409
"1445",1083026,"MANHATTAN","2","PENN PLAZA","A2","EQ","ISSUED","01/23/2023","01/23/2024",2020-02-10,40.750017,-73.991345
"1446",3007199,"BROOKLYN","577","UNION STREET","DM","","ISSUED","10/13/2022","11/20/2022",2022-01-12,40.678683,-73.986278
"1447",3006610,"BROOKLYN","251","DOUGLASS ST","DM","","ISSUED","10/13/2022","11/20/2022",2022-03-07,40.680708,-73.985308
"1448",4619363,"QUEENS","52-09","31 PLACE","A2","SD","ISSUED","03/16/2023","03/15/2024",2021-05-05,40.737237,-73.936668
"1449",1024919,"MANHATTAN","210","CENTRAL PARK SOUTH","A2","OT","ISSUED","10/14/2022","01/14/2023",2021-01-22,40.76709,-73.979617
"1450",2092077,"BRONX","1428","WEBSTER AVENUE","A2","OT","ISSUED","10/16/2022","10/17/2023",2022-01-25,40.836982,-73.906921
"1451",5042446,"STATEN ISLAND","124","TOWNSEND AVENUE","A2","OT","ISSUED","10/17/2022","10/01/2023",2022-10-17,40.618979,-74.07492
"1452",1035721,"MANHATTAN","665","5 AVENUE","DM","","ISSUED","10/17/2022","01/28/2023",2022-06-07,40.760184,-73.975548
"1453",3255289,"BROOKLYN","2940","WEST 15 STREET","NB","","ISSUED","10/17/2022","10/17/2023",2022-03-14,40.576271,-73.982552
"1454",3255289,"BROOKLYN","2940","WEST 15 STREET","NB","","ISSUED","10/17/2022","10/17/2023",2021-10-14,40.576271,-73.982552
"1455",1035721,"MANHATTAN","665","5 AVENUE","DM","EQ","ISSUED","10/17/2022","10/17/2023",2022-06-07,40.760184,-73.975548
"1456",4248251,"QUEENS","133-62","PECONIC STREET","A2","OT","ISSUED","10/17/2022","04/01/2023",2022-10-17,40.675817,-73.83677
"1457",4619363,"QUEENS","52-09","31 PLACE","A2","SP","ISSUED","03/16/2023","03/15/2024",2021-05-05,40.737237,-73.936668
"1458",5010121,"STATEN ISLAND","97","MAINE AVE","A2","OT","ISSUED","10/18/2022","11/15/2022",2022-10-18,40.620745,-74.127085
"1459",3394197,"BROOKLYN","380","SARATOGA AVENUE","A2","OT","ISSUED","10/18/2022","04/21/2023",2022-10-18,40.67273,-73.916844
"1460",4447952,"QUEENS","138-03","LAKEWOOD AVENUE","A1","PL","ISSUED","10/18/2022","10/18/2023",2021-07-29,40.68591,-73.806569
"1461",1000868,"MANHATTAN","111","WALL STREET","A2","OT","ISSUED","10/18/2022","01/01/2023",2021-08-30,40.704553,-74.006636
"1462",1005748,"MANHATTAN","15","AVENUE A","A2","OT","ISSUED","10/18/2022","05/27/2023",2021-05-17,40.722709,-73.985984
"1463",3000370,"BROOKLYN","9","DEKALB AVENUE","A2","EQ","ISSUED","10/18/2022","10/18/2023",2020-10-17,40.689985,-73.98254
"1464",3429214,"BROOKLYN","955","STERLING PLACE","NB","","ISSUED","10/18/2022","10/18/2023",2021-12-23,40.672347,-73.946733
"1465",3421358,"BROOKLYN","2960","BRIGHTON 4 STREET","A3","EQ","ISSUED","10/18/2022","10/24/2023",2020-08-07,40.57952,-73.964141
"1466",3425684,"BROOKLYN","1220","PUTNAM AVENUE","NB","PL","ISSUED","10/19/2022","10/19/2023",2022-10-19,40.691251,-73.915635
"1467",3076057,"BROOKLYN","1333","BROADWAY","A2","SP","ISSUED","10/19/2022","10/19/2023",2022-10-19,40.690065,-73.923046
"1468",4068896,"QUEENS","6346","75TH STREET","A2","OT","ISSUED","10/19/2022","04/21/2023",2022-10-19,40.717749,-73.881129
"1469",2000992,"BRONX","388","CANAL PLACE","A2","OT","ISSUED","10/19/2022","08/10/2023",2022-10-19,40.815329,-73.926062
"1470",1083026,"MANHATTAN","2","PENN PLAZA","A1","","ISSUED","03/16/2023","11/01/2023",2021-01-22,40.750017,-73.991345
"1471",2018494,"BRONX","3328","HULL AVENUE","A2","OT","ISSUED","10/19/2022","04/01/2023",2022-10-19,40.877696,-73.873849
"1472",3429214,"BROOKLYN","955","STERLING PLACE","NB","","ISSUED","01/23/2023","01/23/2024",2022-07-19,40.672347,-73.946733
"1473",3429214,"BROOKLYN","955","STERLING PLACE","NB","","ISSUED","01/23/2023","01/23/2024",2021-12-23,40.672347,-73.946733
"1474",4229789,"QUEENS","90-37","221 PLACE","A2","OT","ISSUED","09/30/2022","04/21/2023",2022-10-19,40.727934,-73.73905
"1475",3076057,"BROOKLYN","1333","BROADWAY","A2","SD","ISSUED","10/14/2022","10/19/2023",2022-10-19,40.690065,-73.923046
"1476",3032611,"BROOKLYN","716","LINCOLN PLACE","A2","SP","ISSUED","10/20/2022","10/20/2023",2021-10-25,40.670851,-73.952488
"1477",3204572,"BROOKLYN","2567","EAST 23 STREET","A3","OT","ISSUED","10/20/2022","07/01/2023",2022-10-20,40.589633,-73.946601
"1478",3035761,"BROOKLYN","1580","DEAN STREET","A2","OT","ISSUED","10/20/2022","10/20/2023",2022-03-04,40.676094,-73.935688
"1479",3035761,"BROOKLYN","1580","DEAN STREET","A2","OT","ISSUED","10/20/2022","10/20/2023",2022-03-04,40.676094,-73.935688
"1480",4278132,"QUEENS","13029","234TH ST","A2","OT","ISSUED","01/23/2023","04/21/2023",2023-01-23,40.679489,-73.733471
"1481",1083026,"MANHATTAN","2","PENN PLAZA","A1","","ISSUED","10/20/2022","11/01/2023",2021-01-22,40.750017,-73.991345
"1482",1083026,"MANHATTAN","2","PENN PLAZA","A2","OT","ISSUED","10/20/2022","11/01/2023",2021-10-18,40.750017,-73.991345
"1483",1083026,"MANHATTAN","2","PENN PLAZA","A2","OT","ISSUED","10/20/2022","11/01/2023",2020-07-21,40.750017,-73.991345
"1484",1083026,"MANHATTAN","2","PENN PLAZA","A2","OT","ISSUED","10/20/2022","11/01/2023",2021-01-22,40.750017,-73.991345
"1485",3179617,"BROOKLYN","1417","AVENUE J","A3","EQ","ISSUED","10/20/2022","10/20/2023",2020-10-26,40.625116,-73.962074
"1486",5126571,"STATEN ISLAND","22","WINSTON STREET","A2","OT","ISSUED","10/14/2022","10/21/2022",2022-10-20,40.563363,-74.181815
"1487",4215701,"QUEENS","106-28","154TH STREET","A2","OT","ISSUED","01/23/2023","04/21/2023",2023-01-23,40.695982,-73.799605
"1488",2129342,"BRONX","1746","ANDREWS AVE SO","NB","","ISSUED","01/23/2023","04/30/2023",2022-03-22,40.85037,-73.917222
"1489",4618112,"QUEENS","112","BEACH 219 ST","DM","","ISSUED","10/21/2022","08/15/2023",2022-10-21,40.554305,-73.926682
"1490",3321259,"BROOKLYN","26","HOPE STREET","A1","","IN PROCESS","10/21/2022","",2022-10-21,40.713605,-73.956991
"1491",4209632,"QUEENS","166-20","90 AVE","NB","","ISSUED","10/21/2022","01/31/2023",2022-04-26,40.70729,-73.794633
"1492",3425955,"BROOKLYN","2286","CROPSEY AVENUE","A3","EQ","ISSUED","10/21/2022","10/21/2023",2020-10-19,40.595843,-73.997001
"1493",1091635,"MANHATTAN","600","WEST 125TH STREET","NB","","ISSUED","03/16/2023","01/01/2024",2021-02-18,40.815974,-73.958569
"1494",5127632,"STATEN ISLAND","40","JARDINE AVENUE","A2","OT","ISSUED","10/21/2022","07/01/2023",2022-10-21,40.610879,-74.161134
"1495",4182339,"QUEENS","91-26","85 AVENUE","A2","PL","ISSUED","10/21/2022","10/21/2023",2022-10-21,40.696665,-73.85409
"1496",1077363,"MANHATTAN","712","FIFTH AVENUE","A2","OT","ISSUED","10/21/2022","11/01/2023",2020-07-16,40.762495,-73.975193
"1497",1077363,"MANHATTAN","712","FIFTH AVENUE","A2","OT","ISSUED","10/21/2022","11/01/2023",2020-09-16,40.762495,-73.975193
"1498",1077363,"MANHATTAN","712","FIFTH AVENUE","A2","OT","ISSUED","10/21/2022","11/01/2023",2021-01-19,40.762495,-73.975193
"1499",5145413,"STATEN ISLAND","99","OTTAVIO PROMENADE","NB","PL","ISSUED","01/22/2021","01/22/2022",2021-01-22,40.50331,-74.228753
"1500",2129342,"BRONX","1746","ANDREWS AVE SO","NB","","ISSUED","01/23/2023","04/30/2023",2022-03-22,40.85037,-73.917222
"1501",3237343,"BROOKLYN","2017","EAST 71 STREET","A2","OT","ISSUED","10/18/2022","01/22/2023",2022-10-21,40.620977,-73.908703
"1502",3153881,"BROOKLYN","650","86TH STREET","NB","PL","ISSUED","10/24/2022","10/24/2023",2022-10-24,40.618851,-74.021875
"1503",2129342,"BRONX","1746","ANDREWS AVE SO","NB","","ISSUED","01/23/2023","04/30/2023",2022-03-25,40.85037,-73.917222
"1504",3170420,"BROOKLYN","312","ELMWOOD AVENUE","DM","","ISSUED","10/24/2022","10/24/2023",2022-10-24,40.627249,-73.974123
"1505",3170420,"BROOKLYN","312","ELMWOOD AVENUE","DM","","ISSUED","10/24/2022","10/24/2023",2022-10-24,40.627249,-73.974123
"1506",4272203,"QUEENS","117-32","204 STREET","A2","OT","ISSUED","10/24/2022","12/18/2022",2022-10-24,40.695157,-73.748133
"1507",4276750,"QUEENS","121-61","233 STREET","A2","OT","ISSUED","10/24/2022","02/11/2023",2022-10-24,40.683588,-73.732813
"1508",4115102,"QUEENS","132-29","POPLE AVENUE","DM","","ISSUED","10/24/2022","05/13/2023",2022-10-24,40.753333,-73.831743
"1509",4224536,"QUEENS","20910","94TH AVE","A2","OT","ISSUED","10/24/2022","04/21/2023",2022-10-24,40.715861,-73.752004
"1510",4137636,"QUEENS","39-14","214 PL","A2","OT","ISSUED","10/24/2022","03/03/2023",2020-08-02,40.76538,-73.769892
"1511",4623202,"QUEENS","35-15","19 AVENUE","NB","","ISSUED","10/24/2022","10/24/2023",2022-01-25,40.780124,-73.902028
"1512",4039603,"QUEENS","94-08","40 DRIVE","A1","","ISSUED","08/01/2022","06/29/2023",2021-12-21,40.747508,-73.871782
"1513",3153881,"BROOKLYN","650","86TH STREET","NB","","ISSUED","10/21/2022","04/01/2023",2022-10-24,40.618851,-74.021875
"1514",3071431,"BROOKLYN","59","MORGAN AVENUE","A2","PL","ISSUED","10/25/2022","10/25/2023",2021-03-05,40.705908,-73.931782
"1515",1079773,"MANHATTAN","2569","ADAM CLAYTON POWELL BLVD","A2","PL","ISSUED","10/25/2022","10/25/2023",2021-10-28,40.823872,-73.937438
"1516",4222245,"QUEENS","88-08","192 STREET","NB","PL","ISSUED","10/25/2022","10/25/2023",2020-07-13,40.715969,-73.769878
"1517",4182654,"QUEENS","85-74","98TH ST","A2","OT","ISSUED","10/25/2022","10/01/2023",2022-10-25,40.695996,-73.848275
"1518",4533505,"QUEENS","34-91","110TH STREET","A2","OT","ISSUED","10/25/2022","04/01/2023",2022-10-25,40.754571,-73.857778
"1519",1082816,"MANHATTAN","390","GREENWICH STREET","A2","FP","ISSUED","06/21/2023","04/25/2024",2023-06-21,40.720862,-74.010058
"1520",4439453,"QUEENS","257-09","UNION TURNPIKE","A2","OT","ISSUED","10/25/2022","06/15/2023",2022-10-25,40.745834,-73.714223
"1521",1010396,"MANHATTAN","39","CLARKSON ST","A1","PL","ISSUED","12/20/2023","12/19/2024",2020-07-09,40.729571,-74.007689
"1522",2130750,"BRONX","1600","GRAND AVENUE","NB","","ISSUED","12/20/2023","01/01/2025",2022-06-28,40.8465,-73.916612
"1523",4284450,"QUEENS","24205","138TH AVE","A2","OT","ISSUED","10/25/2022","10/01/2023",2022-10-25,40.667693,-73.735043
"1524",2019989,"BRONX","182","SOUNDVIEW AVENUE","A2","OT","ISSUED","10/25/2022","07/01/2023",2022-10-25,40.808912,-73.85457
"1525",2092788,"BRONX","1020","SOUNDVIEW AVENUE","A2","OT","ISSUED","10/25/2022","02/25/2023",2022-07-06,40.82563,-73.870573
"1526",2092788,"BRONX","1020","SOUNDVIEW AVENUE","A2","MH","ISSUED","10/25/2022","02/25/2023",2022-07-06,40.82563,-73.870573
"1527",2092788,"BRONX","1020","SOUNDVIEW AVENUE","A2","OT","ISSUED","10/25/2022","02/25/2023",2022-07-06,40.82563,-73.870573
"1528",4139167,"QUEENS","57-16","136 ST","DM","","ISSUED","03/16/2023","09/15/2023",2023-03-16,40.746663,-73.829133
"1529",5109888,"STATEN ISLAND","276","RIDGEWOOD AVENUE","A2","OT","ISSUED","01/23/2023","06/01/2023",2023-01-23,40.554199,-74.164574
"1530",4300733,"QUEENS","25-03","OCEANCREST BOULEVARD","A2","OT","ISSUED","10/26/2022","07/01/2023",2022-10-26,40.601192,-73.762845
"1531",4221224,"QUEENS","190-11","DORMANS ROAD","A2","OT","ISSUED","10/26/2022","03/01/2023",2022-10-26,40.696028,-73.762771
"1532",3429214,"BROOKLYN","955","STERLING PLACE","NB","","RE-ISSUED","10/18/2022","10/26/2023",2021-12-23,40.672347,-73.946733
"1533",3429214,"BROOKLYN","955","STERLING PLACE","NB","","RE-ISSUED","10/18/2022","11/09/2023",2022-07-19,40.672347,-73.946733
"1534",4619363,"QUEENS","52-09","31 PLACE","A3","EQ","ISSUED","10/27/2022","10/27/2023",2020-11-23,40.737237,-73.936668
"1535",2128709,"BRONX","3187","GRAND CONCOURSE","NB","","ISSUED","10/27/2022","11/05/2022",2020-05-08,40.876341,-73.885774
"1536",4624506,"QUEENS","52-35","74TH STREET","NB","","ISSUED","06/30/2020","04/08/2021",2020-06-30,40.73288,-73.888332
"1537",4624506,"QUEENS","52-35","74TH STREET","NB","","ISSUED","06/30/2020","04/08/2021",2020-06-30,40.73288,-73.888332
"1538",4624506,"QUEENS","52-35","74TH STREET","NB","","ISSUED","04/12/2021","04/08/2022",2020-06-30,40.73288,-73.888332
"1539",4624506,"QUEENS","52-35","74TH STREET","NB","","ISSUED","04/13/2021","04/08/2022",2020-06-30,40.73288,-73.888332
"1540",4624506,"QUEENS","52-35","74TH STREET","NB","","ISSUED","04/14/2022","04/08/2023",2020-06-30,40.73288,-73.888332
"1541",4242699,"QUEENS","227-42","114 ROAD","A2","OT","ISSUED","10/14/2022","12/18/2022",2022-10-27,40.700882,-73.729988
"1542",4174620,"QUEENS","81-11","COMMONWEALTH BOULEVARD","A2","OT","ISSUED","10/18/2022","10/21/2023",2022-10-27,40.739728,-73.723963
"1543",3061068,"BROOKLYN","314","RUTLEDGE STREET","DM","EQ","ISSUED","10/28/2022","10/28/2023",2022-10-28,40.705394,-73.951875
"1544",5062522,"STATEN ISLAND","51","GIFFORDS LANE","DM","","ISSUED","10/28/2022","10/28/2023",2022-10-28,40.552346,-74.150791
"1545",3429266,"BROOKLYN","48","CEDAR STREET","A1","","ISSUED","10/28/2022","10/28/2023",2022-10-28,40.697034,-73.927615
"1546",3426055,"BROOKLYN","6313","FORT HAMILTON PARKWAY","NB","PL","ISSUED","10/28/2022","10/28/2023",2022-10-28,40.631511,-74.007901
"1547",3398454,"BROOKLYN","8","GRAND AVENUE","A1","PL","ISSUED","10/28/2022","11/02/2023",2022-11-02,40.697354,-73.964813
"1548",3421419,"BROOKLYN","6319","FORT HAMILTON PARKWAY","NB","PL","ISSUED","10/28/2022","10/28/2023",2022-10-28,40.631489,-74.007933
"1549",4043911,"QUEENS","97-06","37 AVE","A1","","ISSUED","10/28/2022","01/14/2023",2022-04-26,40.751832,-73.869774
"1550",1029936,"MANHATTAN","103","WEST 72ND STREET","A1","","ISSUED","10/28/2022","02/21/2023",2021-10-27,40.777496,-73.978968
"1551",4281639,"QUEENS","221-10","135 AVENUE","A2","OT","ISSUED","10/28/2022","04/03/2023",2022-10-28,40.677004,-73.748702
"1552",2010008,"BRONX","768","E 175 ST","DM","","ISSUED","10/27/2022","08/12/2023",2022-10-28,40.841431,-73.891067
"1553",5175245,"STATEN ISLAND","839","FATHER CAPODANNO BOULEVARD","NB","","ISSUED","10/25/2022","09/16/2023",2021-04-23,40.575512,-74.083478
"1554",3061068,"BROOKLYN","314","RUTLEDGE STREET","DM","","ISSUED","10/31/2022","06/01/2023",2022-10-31,40.705394,-73.951875
"1555",3088719,"BROOKLYN","353","SHEPHERD AVENUE","DM","","ISSUED","10/31/2022","10/31/2023",2022-10-31,40.676039,-73.881268
"1556",4043911,"QUEENS","97-06","37 AVE","A1","EQ","ISSUED","10/31/2022","10/31/2023",2022-04-22,40.751832,-73.869774
"1557",3253166,"BROOKLYN","102","VANDERBILT STREET","DM","","ISSUED","10/31/2022","05/01/2023",2022-10-31,40.651657,-73.980921
"1558",1036505,"MANHATTAN","425","PARK AVENUE","A2","OT","ISSUED","10/31/2022","11/01/2023",2020-01-09,40.760512,-73.971541
"1559",1036505,"MANHATTAN","425","PARK AVENUE","A2","MH","ISSUED","10/31/2022","11/01/2023",2020-01-09,40.760512,-73.971541
"1560",1036505,"MANHATTAN","425","PARK AVENUE","A2","OT","ISSUED","10/31/2022","11/01/2023",2020-01-09,40.760512,-73.971541
"1561",1053247,"MANHATTAN","53","W 119 STREET","A1","","ISSUED","10/31/2022","07/31/2023",2021-08-25,40.803244,-73.946556
"1562",4180064,"QUEENS","85-23","257 STREET","A2","OT","ISSUED","10/31/2022","02/28/2023",2022-10-31,40.733919,-73.709962
"1563",3071418,"BROOKLYN","325","BUSHWICK AVENUE","A2","PL","ISSUED","11/01/2022","11/01/2023",2020-11-13,40.705204,-73.939407
"1564",3429227,"BROOKLYN","65","DUPONT STREET","NB","","ISSUED","11/01/2022","10/01/2023",2022-04-28,40.735668,-73.957396
"1565",3124774,"BROOKLYN","295","EAST 7 STREET","A2","OT","ISSUED","11/01/2022","06/12/2023",2022-11-01,40.644653,-73.972938
"1566",4103651,"QUEENS","10-09","157TH ST","A2","OT","ISSUED","11/01/2022","10/01/2023",2022-11-01,40.792639,-73.804374
"1567",3425684,"BROOKLYN","1220","PUTNAM AVE","A2","EQ","ISSUED","11/01/2022","11/01/2023",2022-11-01,40.691251,-73.915635
"1568",3076043,"BROOKLYN","43","LINDEN STREET","A2","OT","ISSUED","11/01/2022","07/01/2023",2022-11-01,40.690923,-73.921848
"1569",4135975,"QUEENS","214-33","35TH AVENUE","A2","OT","ISSUED","11/01/2022","04/01/2023",2022-01-14,40.769536,-73.771148
"1570",4135975,"QUEENS","214-33","35TH AVENUE","A2","OT","ISSUED","11/01/2022","04/01/2023",2022-01-14,40.769536,-73.771148
"1571",3246888,"BROOKLYN","2971","CONEY ISLAND AVE","A2","PL","ISSUED","11/01/2022","11/01/2023",2021-11-08,40.583965,-73.959991
"1572",3246888,"BROOKLYN","2971","CONEY ISLAND AVE","A2","SP","ISSUED","11/01/2022","11/01/2023",2021-11-08,40.583965,-73.959991
"1573",3429227,"BROOKLYN","65","DUPONT STREET","NB","","ISSUED","11/01/2022","10/01/2023",2022-04-28,40.735668,-73.957396
"1574",3429228,"BROOKLYN","75","DUPONT STREET","NB","","ISSUED","11/01/2022","10/01/2023",2022-05-02,40.735698,-73.957082
"1575",3429228,"BROOKLYN","75","DUPONT STREET","NB","","ISSUED","11/01/2022","10/01/2023",2022-05-02,40.735698,-73.957082
"1576",4619703,"QUEENS","97-24","95 STREET","NB","PL","ISSUED","11/01/2022","11/01/2023",2020-11-16,40.685623,-73.845619
"1577",1084612,"MANHATTAN","59","HENRY STREET","NB","","ISSUED","11/01/2022","06/01/2023",2022-03-30,40.71299,-73.994939
"1578",1010910,"MANHATTAN","246","WEST 11TH STREET","A1","","ISSUED","11/01/2022","11/08/2023",2020-08-12,40.736236,-74.003092
"1579",4027326,"QUEENS","34-17","57 ST","A2","OT","ISSUED","11/01/2022","04/21/2023",2022-11-01,40.751924,-73.904535
"1580",3180681,"BROOKLYN","1609","AVENUE M","A1","","ISSUED","11/01/2022","07/01/2023",2021-09-10,40.618143,-73.958908
"1581",4073505,"QUEENS","62-62","ELLWELL CRESCENT","A1","","ISSUED","10/18/2022","04/16/2023",2021-04-07,40.724414,-73.864842
"1582",4033476,"QUEENS","30-28","90 STREET","A2","OT","ISSUED","10/24/2022","10/21/2023",2022-11-01,40.761171,-73.878817
"1583",4135975,"QUEENS","214-33","35TH AVENUE","A2","OT","ISSUED","10/26/2022","04/01/2023",2022-01-14,40.769536,-73.771148
"1584",3116741,"BROOKLYN","80","LINDEN BOULEVARD","DM","","ISSUED","11/02/2022","09/02/2023",2022-11-02,40.652336,-73.955452
"1585",1091717,"MANHATTAN","155","WEST 29TH STREET","NB","","ISSUED","11/02/2022","11/02/2023",2021-07-13,40.747308,-73.991587
"1586",1028240,"MANHATTAN","17","WEST 67TH STREET","A2","OT","ISSUED","11/02/2022","07/15/2023",2021-06-11,40.773356,-73.979027
"1587",3398454,"BROOKLYN","8","GRAND AVENUE","A1","","ISSUED","10/28/2022","10/07/2023",2022-08-26,40.697354,-73.964813
"1588",3398454,"BROOKLYN","10","GRAND AVENUE","A2","OT","ISSUED","10/28/2022","10/07/2023",2020-02-26,40.697312,-73.964802
"1589",4581376,"QUEENS","143-35 GAR","HOOVER AVE","DM","","RE-ISSUED","11/03/2022","08/25/2023",2022-11-03,40.714247,-73.814838
"1590",3215527,"BROOKLYN","1306","EAST 49TH STREET","A2","OT","ISSUED","11/03/2022","04/21/2023",2022-11-03,40.629277,-73.929003
"1591",3097395,"BROOKLYN","2015","LINDEN BLVD","A2","OT","ISSUED","11/03/2022","04/21/2023",2022-11-03,40.659761,-73.887893
"1592",1046258,"MANHATTAN","537","EAST 71 STREET","A2","SP","ISSUED","11/03/2022","11/03/2023",2021-11-09,40.765809,-73.953377
"1593",1046258,"MANHATTAN","537","EAST 71 STREET","A2","SD","ISSUED","11/03/2022","11/03/2023",2021-11-09,40.765809,-73.953377
"1594",2128709,"BRONX","3187","GRAND CONCOURSE","NB","","ISSUED","11/03/2022","12/10/2022",2020-05-08,40.876341,-73.885774
"1595",4222258,"QUEENS","89-19","191ST ST","A2","OT","ISSUED","11/03/2022","10/01/2023",2022-11-03,40.714509,-73.770114
"1596",4228926,"QUEENS","212-77","WHITEHALL TERRACE","A2","OT","ISSUED","11/03/2022","12/18/2022",2022-11-03,40.726233,-73.753167
"1597",1080352,"MANHATTAN","450","11TH AVENUE","A2","EQ","ISSUED","11/03/2022","11/03/2023",2020-11-10,40.757486,-74.000729
"1598",4311545,"QUEENS","32-08","38TH STREET","DM","EQ","ISSUED","10/28/2022","11/03/2023",2022-11-03,40.758998,-73.920097
"1599",4311545,"QUEENS","32-08","38TH STREET","DM","","ISSUED","10/28/2022","06/24/2023",2022-11-28,40.758998,-73.920097
"1600",4043911,"QUEENS","97-06","37 AVE","A1","","ISSUED","10/31/2022","01/14/2023",2022-04-26,40.751832,-73.869774
"1601",1076225,"MANHATTAN","25","CENTRAL PARK WEST","A2","OT","ISSUED","11/04/2022","09/14/2023",2020-12-10,40.770148,-73.9804
"1602",3091067,"BROOKLYN","61","HEMLOCK STREET,","A2","OT","ISSUED","11/04/2022","12/18/2022",2022-11-04,40.688505,-73.872256
"1603",4289973,"QUEENS","253-16","147TH RD","A2","OT","ISSUED","03/16/2023","04/21/2023",2023-03-16,40.656518,-73.735974
"1604",4099991,"QUEENS","23-30","128 ST","A2","OT","ISSUED","11/04/2022","04/21/2023",2022-11-04,40.778263,-73.840711
"1605",1084081,"MANHATTAN","160","CONVENT AVENUE","A2","OT","ISSUED","11/04/2022","10/20/2023",2021-02-16,40.819196,-73.950221
"1606",1000868,"MANHATTAN","111","WALL STREET","A2","OT","ISSUED","11/04/2022","01/01/2023",2021-08-18,40.704553,-74.006636
"1607",2017504,"BRONX","2819","MORRIS AVE","A3","OT","ISSUED","11/04/2022","05/23/2023",2021-11-19,40.870009,-73.8938
"1608",1079184,"MANHATTAN","261","11 AVENUE","A2","EQ","ISSUED","11/07/2022","11/07/2023",2022-11-07,40.751502,-74.005118
"1609",3001936,"BROOKLYN","40","CLINTON STREET","A2","PL","ISSUED","11/07/2022","11/07/2023",2022-11-07,40.695374,-73.9919
"1610",5002271,"STATEN ISLAND","433","PROSPECT AVE","A2","OT","ISSUED","11/07/2022","11/15/2022",2022-11-07,40.638539,-74.102361
"1611",4623202,"QUEENS","35-15","19 AVENUE","NB","","ISSUED","11/07/2022","11/07/2023",2022-01-25,40.780124,-73.902028
"1612",3157466,"BROOKLYN","7000","21 AVE.","A2","OT","ISSUED","11/07/2022","11/07/2023",2020-06-19,40.612273,-73.986713
"1613",3157466,"BROOKLYN","7000","21 AVENUE","A3","EQ","ISSUED","11/07/2022","11/07/2023",2020-05-27,40.612273,-73.986713
"1614",2007874,"BRONX","1685","MORRIS AVENUE","A3","OT","ISSUED","11/07/2022","11/01/2023",2020-02-25,40.844016,-73.909456
"1615",4151503,"QUEENS","76-21","166 STREET","A2","OT","ISSUED","05/19/2022","03/15/2023",2022-11-21,40.725494,-73.802594
"1616",1060202,"MANHATTAN","253","WEST 137TH STREET","A2","BL","ISSUED","11/08/2022","11/14/2022",2022-01-04,40.81725,-73.944269
"1617",1046258,"MANHATTAN","537","EAST 71 STREET","A1","PL","ISSUED","11/08/2022","11/08/2023",2021-11-17,40.765809,-73.953377
"1618",4017069,"QUEENS","22-50","33 STREET","NB","","ISSUED","11/08/2022","02/10/2023",2020-09-17,40.774507,-73.910684
"1619",1057080,"MANHATTAN","260","RIVERSIDE DRIVE","A2","OT","ISSUED","11/08/2022","10/14/2023",2021-03-10,40.797144,-73.973396
"1620",1091643,"MANHATTAN","304","HUDSON STREET","A2","EQ","ISSUED","11/09/2022","11/09/2023",2022-11-09,40.726009,-74.007519
"1621",4607880,"QUEENS","122-06","MERRICK BOULEVARD","NB","","ISSUED","03/19/2024","11/09/2024",2022-03-22,40.683649,-73.769525
"1622",1079647,"MANHATTAN","83","CANAL STREET","A1","","ISSUED","03/16/2023","03/21/2023",2020-06-17,40.71529,-73.99315
"1623",3131055,"BROOKLYN","1117","EAST 5TH STREET","A1","","ISSUED","11/09/2022","05/06/2023",2021-08-11,40.623702,-73.971772
"1624",1087511,"MANHATTAN","27","WEST 72ND STREET","A2","OT","ISSUED","12/20/2023","12/29/2024",2022-03-31,40.776979,-73.977748
"1625",2010077,"BRONX","813","ELSMERE PLACE","NB","","ISSUED","11/09/2022","08/12/2023",2022-05-26,40.843169,-73.88831
"1626",2092082,"BRONX","3603","THIRD AVENUE","A2","MH","ISSUED","11/09/2022","11/11/2023",2021-07-15,40.83308,-73.904809
"1627",1088749,"MANHATTAN","1","MADISON AVE","A3","EQ","ISSUED","11/10/2022","11/10/2023",2022-11-10,40.740909,-73.987947
"1628",1015733,"MANHATTAN","262","5 AVENUE","A3","EQ","ISSUED","11/10/2022","11/10/2023",2022-11-10,40.745081,-73.987019
"1629",3328167,"BROOKLYN","779","FLATBUSH AVENUE","A1","","ISSUED","11/10/2022","04/27/2023",2021-11-24,40.653853,-73.959495
"1630",3179617,"BROOKLYN","1417","AVENUE J","A2","SP","ISSUED","03/16/2023","03/15/2024",2022-02-07,40.625116,-73.962074
"1631",1079647,"MANHATTAN","83","CANAL STREET","A1","","ISSUED","03/19/2024","10/20/2024",2020-06-17,40.71529,-73.99315
"1632",2022377,"BRONX","2115","VIRGIL PLACE","A2","OT","ISSUED","11/10/2022","07/01/2023",2022-12-01,40.822201,-73.851138
"1633",1000824,"MANHATTAN","25","BROAD STREET","A1","","ISSUED","10/21/2022","11/10/2023",2022-11-10,40.706114,-74.01126
"1634",2130439,"BRONX","784","COURTLANDT AVENUE","NB","","ISSUED","12/20/2023","12/18/2024",2023-11-01,40.822396,-73.916801
"1635",1079184,"MANHATTAN","224","12TH AVENUE","A1","","ISSUED","11/09/2022","03/11/2023",2020-09-28,40.752641,-74.007576
"1636",3332224,"BROOKLYN","748","HENRY STREET","A2","OT","ISSUED","03/17/2021","01/01/2022",2020-06-26,40.675409,-74.003612
"1637",5175245,"STATEN ISLAND","839","FATHER CAPODANNO BOULEVARD","NB","PL","ISSUED","11/11/2022","11/11/2023",2021-11-15,40.575512,-74.083478
"1638",4156124,"QUEENS","186-10","UNION TURNPIKE","A1","","ISSUED","01/24/2023","01/09/2024",2022-09-22,40.728691,-73.782726
"1639",4541930,"QUEENS","187-09","HOLLIS AVENUE","DM","","ISSUED","01/24/2023","11/23/2023",2022-01-12,40.710124,-73.77053
"1640",3039905,"BROOKLYN","1510","BROADWAY","NB","","ISSUED","01/24/2023","01/24/2024",2022-08-17,40.686811,-73.917364
"1641",3039905,"BROOKLYN","1510","BROADWAY","NB","","ISSUED","01/24/2023","01/24/2024",2022-07-12,40.686811,-73.917364
"1642",3039905,"BROOKLYN","1510","BROADWAY","NB","","ISSUED","01/24/2023","01/24/2024",2022-07-12,40.686811,-73.917364
"1643",4590819,"QUEENS","4-79","BEACH 44TH ST","A2","OT","ISSUED","01/24/2023","10/01/2023",2023-01-24,40.59798,-73.776003
"1644",3230163,"BROOKLYN","1177","EAST 98TH STREET","A2","OT","ISSUED","10/26/2022","10/18/2023",2021-04-21,40.643022,-73.898435
"1645",3429285,"BROOKLYN","972","REMSEN AVENUE","A3","OT","ISSUED","01/17/2023","10/24/2023",2021-09-21,40.644677,-73.910933
"1646",2072155,"BRONX","888","CRANFORD AVENUE","A2","OT","ISSUED","12/09/2021","01/25/2024",2023-03-16,40.903468,-73.844553
"1647",4217842,"QUEENS","169-12","104 AVE","DM","","ISSUED","03/03/2023","01/24/2024",2023-03-16,40.702239,-73.788153
"1648",4178704,"QUEENS","8120","266 STREET","A1","","ISSUED","01/25/2023","09/26/2023",2022-04-19,40.743628,-73.704744
"1649",2130763,"BRONX","101","LINCOLN AVENUE","NB","PL","ISSUED","01/25/2023","01/25/2024",2021-03-10,40.807149,-73.929969
"1650",2117503,"BRONX","980","EAST 149 STREET","A2","OT","ISSUED","01/25/2023","08/31/2023",2023-01-25,40.806847,-73.902563
"1651",3257046,"BROOKLYN","85","NAVY WALK","A2","OT","ISSUED","01/25/2023","06/29/2023",2023-01-25,40.695483,-73.980664
"1652",3257046,"BROOKLYN","85","NAVY WALK","A2","OT","ISSUED","01/25/2023","06/29/2023",2023-01-25,40.695483,-73.980664
"1653",1001084,"MANHATTAN","55","LIBERTY STREET","A2","OT","ISSUED","06/21/2023","07/01/2024",2021-03-09,40.708692,-74.009508
"1654",4302173,"QUEENS","515","BEACH 43 STREET","A2","OT","ISSUED","01/25/2023","07/01/2023",2023-01-25,40.599137,-73.775175
"1655",4618772,"QUEENS","26-02","1ST STREET","NB","EQ","ISSUED","09/23/2024","09/23/2025",2022-04-12,40.776821,-73.935533
"1656",1004054,"MANHATTAN","228","E BROADWAY","A1","","ISSUED","01/25/2023","07/01/2023",2022-07-20,40.714359,-73.986707
"1657",3328394,"BROOKLYN","647","LIBERTY AVENUE","DM","","ISSUED","01/25/2023","01/25/2024",2023-01-25,40.675984,-73.885904
"1658",3039270,"BROOKLYN","1694","ST MARKS AVE","NB","","ISSUED","01/19/2023","10/27/2023",2021-11-22,40.673005,-73.910265
"1659",1014251,"MANHATTAN","220","WEST 28TH STREET","A2","FS","ISSUED","01/26/2023","01/01/2024",2023-01-26,40.747582,-73.994197
"1660",1038761,"MANHATTAN","304","EAST 45TH STREET","A2","SP","ISSUED","01/26/2023","01/26/2024",2021-03-05,40.75157,-73.970393
"1661",1038761,"MANHATTAN","304","EAST 45TH STREET","A2","SP","ISSUED","01/26/2023","01/26/2024",2021-03-05,40.75157,-73.970393
"1662",3429098,"BROOKLYN","2141","EAST 16 STREET","NB","","ISSUED","01/26/2023","01/09/2024",2022-01-06,40.598017,-73.955291
"1663",5000794,"STATEN ISLAND","21","SCRIBNER AVENUE","A2","OT","ISSUED","01/26/2023","10/21/2023",2023-01-27,40.638437,-74.082648
"1664",1091728,"MANHATTAN","18","WEST 55 STREET","NB","","ISSUED","03/17/2023","03/16/2024",2023-02-08,40.762023,-73.975782
"1665",1091728,"MANHATTAN","18","WEST 55 STREET","NB","","ISSUED","03/17/2023","03/16/2024",2023-02-08,40.762023,-73.975782
"1666",2097312,"BRONX","2850","GOULDEN AVENUE","A2","SP","ISSUED","01/26/2023","01/26/2024",2023-01-26,40.872898,-73.896175
"1667",1091728,"MANHATTAN","18","WEST 55 STREET","NB","","ISSUED","03/17/2023","03/16/2024",2023-02-08,40.762023,-73.975782
"1668",4007659,"QUEENS","30-38","31ST STREET","A1","PL","ISSUED","01/20/2023","01/26/2024",2023-01-26,40.765993,-73.922132
"1669",2130439,"BRONX","784","COURTLANDT AVENUE","NB","","ISSUED","12/20/2023","12/18/2024",2023-11-01,40.822396,-73.916801
"1670",2130439,"BRONX","784","COURTLANDT AVENUE","NB","","ISSUED","12/20/2023","12/18/2024",2023-11-01,40.822396,-73.916801
"1671",5174977,"STATEN ISLAND","33","WEST TERRACE","NB","","ISSUED","01/27/2023","01/25/2024",2021-01-13,40.533331,-74.193972
"1672",3062371,"BROOKLYN","156","NORTH 4TH STREET","A1","PL","ISSUED","01/27/2023","03/06/2024",2020-07-22,40.715975,-73.959212
"1673",1015242,"MANHATTAN","989","6 AVENUE","DM","EQ","ISSUED","01/27/2023","01/27/2024",2023-01-27,40.751394,-73.986635
"1674",2128709,"BRONX","3187","GRAND CONCOURSE","NB","","ISSUED","01/27/2023","12/06/2023",2020-05-08,40.876341,-73.885774
"1675",2001449,"BRONX","450","EAST 158TH STREET","DM","EQ","ISSUED","01/27/2023","01/27/2024",2023-01-27,40.821712,-73.912933
"1676",2001449,"BRONX","450","EAST 158TH STREET","DM","","ISSUED","01/27/2023","02/24/2023",2023-01-27,40.821712,-73.912933
"1677",3324426,"BROOKLYN","355","53RD ST","NB","","ISSUED","01/27/2023","01/14/2024",2022-03-25,40.645325,-74.015196
"1678",5094099,"STATEN ISLAND","6","WINHAM AVENUE","DM","","ISSUED","01/19/2023","01/27/2024",2023-01-27,40.566765,-74.103378
"1679",5124204,"STATEN ISLAND","95","HIGHLAND ROAD","A2","OT","ISSUED","03/17/2023","10/01/2023",2023-03-28,40.549296,-74.142853
"1680",3330088,"BROOKLYN","50","FRANKLIN STREET","A1","PL","ISSUED","01/29/2023","01/29/2024",2020-11-10,40.726635,-73.957268
"1681",1035464,"MANHATTAN","320","PARK AVE","A1","","ISSUED","01/28/2023","03/05/2024",2023-03-06,40.75745,-73.973798
"1682",3212783,"BROOKLYN","1715","EAST 32 STREET","A2","OT","ISSUED","01/30/2023","10/21/2023",2023-01-30,40.612469,-73.939322
"1683",3115866,"BROOKLYN","601","PARKSIDE AVENUE","A2","PL","ISSUED","01/30/2023","01/30/2024",2020-02-21,40.656046,-73.953742
"1684",2072575,"BRONX","2385","HOLLERS AVE","A2","OT","ISSUED","01/30/2023","03/02/2023",2022-09-19,40.885519,-73.823973
"1685",1047942,"MANHATTAN","1276","LEXINGTON AVENUE","A1","","ISSUED","01/30/2023","05/02/2023",2021-02-03,40.779339,-73.955714
"1686",3023848,"BROOKLYN","100","15 STREET","A1","","ISSUED","01/30/2023","01/01/2024",2022-01-21,40.66746,-73.993248
"1687",3023848,"BROOKLYN","100","15 STREET","A1","EQ","ISSUED","01/30/2023","01/30/2024",2022-01-21,40.66746,-73.993248
"1688",2011872,"BRONX","16","WADE SQUARE","A3","EQ","ISSUED","01/30/2023","01/30/2024",2021-02-05,40.85193,-73.891082
"1689",4148300,"QUEENS","162-06","77 AVENUE","A2","OT","ISSUED","01/30/2023","10/21/2023",2023-01-30,40.724193,-73.806101
"1690",3082389,"BROOKLYN","411","THATFORD AVE.","A2","PL","ISSUED","01/30/2023","01/30/2024",2020-02-24,40.660306,-73.907355
"1691",1001084,"MANHATTAN","55","LIBERTY STREET","A2","OT","ISSUED","01/31/2023","04/15/2023",2020-06-23,40.708692,-74.009508
"1692",2008200,"BRONX","65","CLIFFORD PLACE","A2","OT","ISSUED","01/31/2023","04/21/2023",2023-01-31,40.84609,-73.911954
"1693",1089807,"MANHATTAN","76","11TH AVENUE","A2","EQ","ISSUED","01/31/2023","01/31/2024",2023-01-31,40.745183,-74.008236
"1694",4534152,"QUEENS","14536","FRANKTON ST","A2","OT","IN PROCESS","01/31/2023","",2023-01-31,40.658692,-73.727813
"1695",1007953,"MANHATTAN","152","MERCER STREET","A2","OT","ISSUED","01/31/2023","01/01/2024",2020-07-07,40.725051,-73.998221
"1696",3322599,"BROOKLYN","177","GREENPOINT AVE","DM","","ISSUED","01/31/2023","12/15/2023",2023-01-31,40.730355,-73.952651
"1697",3029214,"BROOKLYN","401","STERLING PL","A1","PL","ISSUED","01/31/2023","01/31/2024",2021-06-30,40.674973,-73.965002
"1698",1088757,"MANHATTAN","100","HAVEN AVENUE","A2","SP","ISSUED","12/20/2022","01/31/2024",2023-01-31,40.844498,-73.942504
"1699",1015242,"MANHATTAN","989","6 AVENUE","DM","","ISSUED","01/27/2023","09/11/2023",2023-01-31,40.751394,-73.986635
"1700",4623141,"QUEENS","53-16","NORTHERN BLVD","A2","SD","ISSUED","02/01/2023","02/01/2024",2023-02-01,40.753192,-73.907839
"1701",4623141,"QUEENS","53-16","NORTHERN BLVD","A2","SP","ISSUED","02/01/2023","02/01/2024",2023-02-01,40.753192,-73.907839
"1702",5104468,"STATEN ISLAND","4855","HYLAN BOULEVARD","A1","","ISSUED","02/01/2023","01/19/2024",2021-11-26,40.526708,-74.167895
"1703",2020361,"BRONX","355","THIERIOT AVENUE","A2","OT","ISSUED","02/01/2023","12/07/2023",2023-02-01,40.812246,-73.859888
"1704",4209632,"QUEENS","166-20","90 AVE","NB","","ISSUED","02/01/2023","02/03/2024",2022-04-26,40.70729,-73.794633
"1705",3335129,"BROOKLYN","63","FLUSHING AVENUE","A2","OT","IN PROCESS","02/01/2023","",2021-07-01,40.69802,-73.974986
"1706",4266876,"QUEENS","140-39","160TH STREET","A2","OT","IN PROCESS","02/01/2023","",2023-02-01,40.669588,-73.775406
"1707",4116436,"QUEENS","46-21","COLDEN STREET","A2","MH","ISSUED","02/01/2023","04/01/2023",2020-11-03,40.749545,-73.822073
"1708",3245840,"BROOKLYN","201","HAMPTON AVENUE","A1","PL","ISSUED","02/01/2023","02/01/2024",2021-01-14,40.579397,-73.952232
"1709",1045234,"MANHATTAN","1504","2 AVE","A2","OT","ISSUED","03/22/2021","09/11/2021",2021-03-25,40.772913,-73.95535
"1710",3335129,"BROOKLYN","63","FLUSHING AVENUE","A2","OT","ISSUED","03/28/2022","01/01/2024",2021-06-18,40.69802,-73.974986
"1711",3023848,"BROOKLYN","100","15 STREET","A1","","ISSUED","02/02/2023","07/05/2023",2022-01-21,40.66746,-73.993248
"1712",4004870,"QUEENS","29-24","40 AVENUE","DM","EQ","ISSUED","02/02/2023","02/02/2024",2023-02-02,40.75217,-73.93534
"1713",4004870,"QUEENS","29-24","40 AVENUE","DM","","ISSUED","02/02/2023","04/26/2023",2023-02-02,40.75217,-73.93534
"1714",2027219,"BRONX","2402","BUTLER PLACE","A2","OT","ISSUED","02/02/2023","07/01/2023",2023-02-02,40.836392,-73.845754
"1715",4253712,"QUEENS","132-11","114TH ST","A2","OT","ISSUED","06/21/2023","10/01/2023",2023-06-21,40.674766,-73.825366
"1716",2060849,"BRONX","1314","GIVAN AVENUE","A2","OT","ISSUED","02/02/2023","10/01/2023",2023-02-02,40.873434,-73.849219
"1717",3082114,"BROOKLYN","166","LIVONIA AVE","NB","","ISSUED","02/02/2023","05/05/2023",2021-12-30,40.662096,-73.91193
"1718",3057705,"BROOKLYN","1084","FULTON STREET","A1","","ISSUED","11/16/2021","11/18/2023",2020-07-07,40.681528,-73.957603
"1719",3045475,"BROOKLYN","746","PUTNAM AVENUE","A2","OT","ISSUED","02/03/2023","09/16/2023",2022-01-08,40.686129,-73.931751
"1720",3009939,"BROOKLYN","200","30TH ST","A2","OT","ISSUED","02/03/2023","09/16/2023",2021-11-12,40.656972,-73.999791
"1721",3045475,"BROOKLYN","746","PUTNAM AVENUE","A2","OT","ISSUED","02/03/2023","09/16/2023",2022-01-08,40.686129,-73.931751
"1722",4299661,"QUEENS","13-25","GIPSON STREET","DM","","ISSUED","02/03/2023","01/12/2024",2023-02-03,40.606706,-73.758543
"1723",4033024,"QUEENS","2625","98TH STREET","A2","OT","ISSUED","02/03/2023","09/16/2023",2021-12-17,40.761588,-73.87121
"1724",2092082,"BRONX","489","EAST 169TH STREET","A2","MH","ISSUED","06/13/2024","10/04/2024",2024-06-13,40.832965,-73.905669
"1725",1021925,"MANHATTAN","333","EAST 38 STREET","A2","EQ","ISSUED","02/03/2023","02/03/2024",2023-02-03,40.746756,-73.972727
"1726",4209632,"QUEENS","166-20","90 AVE","NB","","ISSUED","02/02/2023","02/03/2024",2022-04-26,40.70729,-73.794633
"1727",3157466,"BROOKLYN","7000","21 AVENUE","A3","EQ","IN PROCESS","02/06/2023","",2020-05-27,40.612273,-73.986713
"1728",1090459,"MANHATTAN","255","WEST 34TH STREET","NB","","ISSUED","02/06/2023","08/10/2023",2020-06-05,40.751823,-73.992569
"1729",2092788,"BRONX","1020","SOUNDVIEW AVENUE","A2","OT","ISSUED","02/06/2023","02/25/2024",2022-07-06,40.82563,-73.870573
"1730",2092788,"BRONX","1020","SOUNDVIEW AVENUE","A2","MH","ISSUED","02/06/2023","02/25/2024",2022-07-06,40.82563,-73.870573
"1731",2092788,"BRONX","1020","SOUNDVIEW AVENUE","A2","OT","ISSUED","02/06/2023","02/25/2024",2022-07-06,40.82563,-73.870573
"1732",1091641,"MANHATTAN","443","WEST 54TH STREET","A2","SP","ISSUED","03/17/2023","03/16/2024",2021-04-16,40.766537,-73.988397
"1733",4107652,"QUEENS","17-45","FRANCIS LEWIS BLVD","A1","","ISSUED","02/07/2023","02/07/2024",2023-02-07,40.782452,-73.803999
"1734",4017069,"QUEENS","22-50","33 STREET","NB","","ISSUED","02/07/2023","11/19/2023",2020-09-17,40.774507,-73.910684
"1735",3428897,"BROOKLYN","87","COMMERCIAL STREET","NB","PL","ISSUED","02/07/2023","02/07/2024",2022-02-10,40.737498,-73.956334
"1736",5000064,"STATEN ISLAND","18","RICHMOND TERRACE","A2","OT","ISSUED","02/07/2023","03/04/2023",2022-03-24,40.643004,-74.075772
"1737",1035336,"MANHATTAN","315","MADISON AVENUE","A2","OT","IN PROCESS","02/07/2023","",2023-02-07,40.752661,-73.979376
"1738",3049123,"BROOKLYN","556","WILLOUGHBY AVENUE","A2","OT","ISSUED","03/17/2023","07/31/2023",2020-12-30,40.694086,-73.947271
"1739",3246888,"BROOKLYN","2971","CONEY ISLAND AVENUE","NB","","ISSUED","02/08/2023","03/01/2023",2020-09-02,40.583965,-73.959991
"1740",3400905,"BROOKLYN","1038","JEFFERSON AVENUE","NB","","ISSUED","02/08/2023","12/11/2023",2022-03-08,40.68739,-73.917085
"1741",3325557,"BROOKLYN","21","NOSTRAND AVENUE","A2","OT","ISSUED","02/08/2023","02/09/2024",2022-06-28,40.699394,-73.953355
"1742",1091728,"MANHATTAN","18","WEST 55 STREET","NB","","ISSUED","02/08/2023","02/08/2024",2023-02-08,40.762023,-73.975782
"1743",1091728,"MANHATTAN","18","WEST 55 STREET","NB","","ISSUED","02/08/2023","02/08/2024",2023-02-08,40.762023,-73.975782
"1744",1091728,"MANHATTAN","18","WEST 55 STREET","NB","","ISSUED","02/08/2023","02/08/2024",2023-02-08,40.762023,-73.975782
"1745",3005045,"BROOKLYN","134","SUMMIT STREET","A2","OT","ISSUED","02/08/2023","10/21/2023",2023-02-08,40.681744,-74.001738
"1746",4286510,"QUEENS","146-32","231ST ST","A2","OT","ISSUED","02/09/2023","10/01/2023",2023-02-09,40.658544,-73.749493
"1747",4271570,"QUEENS","117-12","193RD STREET","A1","","ISSUED","02/09/2023","04/28/2023",2023-02-09,40.692354,-73.758406
"1748",4271570,"QUEENS","117-12","193RD STREET","A1","","ISSUED","02/09/2023","04/28/2023",2023-02-09,40.692354,-73.758406
"1749",4271570,"QUEENS","117-12","193RD STREET","A1","","ISSUED","02/09/2023","04/28/2023",2023-03-13,40.692354,-73.758406
"1750",2025904,"BRONX","1947","GLEASON AVENUE","A2","OT","ISSUED","03/17/2023","11/22/2023",2023-03-17,40.830829,-73.859267
"1751",4155261,"QUEENS","75-51","195 STREET","A1","","ISSUED","02/09/2023","04/01/2023",2022-06-22,40.731712,-73.776279
"1752",4232859,"QUEENS","105-17","FARMERS BLVD","A2","OT","ISSUED","02/09/2023","11/15/2023",2023-02-14,40.705022,-73.766962
"1753",3428817,"BROOKLYN","268","BARBEY STREET","NB","","ISSUED","02/09/2023","02/09/2024",2022-06-02,40.676365,-73.888452
"1754",1053233,"MANHATTAN","186","LENOX AVE","DM","EQ","ISSUED","02/09/2023","02/27/2024",2023-02-27,40.804236,-73.948058
"1755",1060040,"MANHATTAN","118","W 139 STREET","A2","PL","ISSUED","03/24/2021","03/24/2022",2020-02-11,40.817195,-73.940298
"1756",2004136,"BRONX","581","AUSTIN PLACE","NB","","ISSUED","02/09/2023","04/08/2023",2023-02-09,40.811268,-73.901513
"1757",3426233,"BROOKLYN","559","PARK AVENUE","A2","SP","ISSUED","06/13/2024","06/13/2025",2023-06-27,40.697144,-73.953529
"1758",3861197,"BROOKLYN","287GAR","23 STREET","DM","","ISSUED","02/07/2023","02/15/2024",2023-02-15,40.659289,-73.993015
"1759",3426233,"BROOKLYN","559","PARK AVENUE","A2","SD","ISSUED","06/13/2024","06/13/2025",2023-06-27,40.697144,-73.953529
"1760",4007659,"QUEENS","30-38","31ST STREET","A1","","ISSUED","02/10/2023","07/21/2023",2022-10-04,40.765993,-73.922132
"1761",1041086,"MANHATTAN","610","PARK AVENUE","A2","OT","ISSUED","02/10/2023","01/10/2024",2020-08-31,40.766497,-73.967199
"1762",2045727,"BRONX","1340","BLONDELL AVENUE","DM","EQ","ISSUED","02/10/2023","02/10/2024",2023-02-10,40.841827,-73.842073
"1763",2045727,"BRONX","1340","BLONDELL AVENUE","DM","","ISSUED","02/10/2023","09/04/2023",2023-02-10,40.841827,-73.842073
"1764",4140184,"QUEENS","142-19","58TH AVE","A2","OT","ISSUED","02/10/2023","04/21/2023",2023-02-10,40.744974,-73.823172
"1765",1079184,"MANHATTAN","224","12TH AVENUE","A1","","ISSUED","02/10/2023","03/11/2023",2020-09-28,40.752641,-74.007576
"1766",4209632,"QUEENS","166-20","90 AVE","NB","","RE-ISSUED","02/03/2023","02/10/2024",2023-02-10,40.70729,-73.794633
"1767",3065463,"BROOKLYN","341","KINGSLAND AVE","A1","","ISSUED","02/10/2023","12/31/2023",2022-10-04,40.728574,-73.942139
"1768",3000370,"BROOKLYN","9","DEKALB AVENUE","A3","EQ","ISSUED","02/13/2023","02/13/2024",2020-03-24,40.689985,-73.98254
"1769",3000370,"BROOKLYN","9","DEKALB AVENUE","A3","EQ","ISSUED","02/13/2023","02/13/2024",2020-03-24,40.689985,-73.98254
"1770",1079184,"MANHATTAN","224","12TH AVENUE","A2","OT","ISSUED","02/13/2023","07/01/2023",2020-09-28,40.752641,-74.007576
"1771",5000064,"STATEN ISLAND","18","RICHMOND TERRACE","A2","OT","ISSUED","02/13/2023","03/04/2024",2022-03-24,40.643004,-74.075772
"1772",1091641,"MANHATTAN","443","WEST 54TH STREET","NB","PL","ISSUED","02/13/2023","02/13/2024",2020-01-17,40.766537,-73.988397
"1773",1091641,"MANHATTAN","443","WEST 54TH STREET","NB","PL","ISSUED","02/13/2023","02/13/2024",2020-01-17,40.766537,-73.988397
"1774",3193844,"BROOKLYN","2255","EAST 2 STREET","A1","PL","ISSUED","02/13/2023","02/13/2024",2020-11-13,40.594189,-73.969016
"1775",1083955,"MANHATTAN","2120","1ST AVENUE","A2","OT","ISSUED","03/08/2023","03/01/2024",2020-02-04,40.791737,-73.938508
"1776",4100033,"QUEENS","23-49","129TH ST","A2","OT","ISSUED","02/14/2023","10/01/2023",2023-02-14,40.777125,-73.839843
"1777",3426233,"BROOKLYN","559","PARK AVENUE","NB","","ISSUED","02/14/2023","07/19/2023",2020-10-27,40.697144,-73.953529
"1778",3426233,"BROOKLYN","559","PARK AVENUE","NB","","ISSUED","02/14/2023","07/19/2023",2020-10-27,40.697144,-73.953529
"1779",3426233,"BROOKLYN","559","PARK AVENUE","NB","","ISSUED","02/14/2023","07/19/2023",2020-10-27,40.697144,-73.953529
"1780",3335129,"BROOKLYN","63","FLUSHING AVENUE","A2","MH","ISSUED","02/01/2023","01/01/2024",2021-06-23,40.69802,-73.974986
"1781",3244213,"BROOKLYN","2251","MILL AVENUE","A1","PL","ISSUED","02/15/2023","02/15/2024",2020-01-07,40.613137,-73.911335
"1782",1091010,"MANHATTAN","270","PARK AVENUE","NB","","ISSUED","02/15/2023","10/01/2023",2021-09-08,40.755641,-73.975109
"1783",1088749,"MANHATTAN","1","MADISON AVE","A3","EQ","ISSUED","09/14/2023","09/13/2024",2022-11-10,40.740909,-73.987947
"1784",1083026,"MANHATTAN","2","PENN PLAZA","A3","OT","ISSUED","02/15/2023","03/01/2023",2023-02-15,40.750017,-73.991345
"1785",3117258,"BROOKLYN","2700","CHURCH AVE","DM","","ISSUED","02/15/2023","09/02/2023",2022-06-03,40.650669,-73.952304
"1786",1064003,"MANHATTAN","605","W 187TH STREET","A1","","IN PROCESS","02/15/2023","",2021-09-07,40.853209,-73.93132
"1787",1046425,"MANHATTAN","555","EAST 78 STREET","A2","OT","ISSUED","02/15/2023","01/01/2024",2023-02-15,40.769922,-73.949049
"1788",4598428,"QUEENS","101-12","158TH AVENUE","A2","OT","ISSUED","02/15/2023","04/01/2023",2023-02-15,40.661937,-73.832641
"1789",4055266,"QUEENS","49-04","66 STREET","A2","OT","ISSUED","02/15/2023","08/31/2023",2023-02-15,40.737577,-73.898941
"1790",1088749,"MANHATTAN","1","MADISON AVENUE","A2","EQ","ISSUED","09/14/2023","09/13/2024",2022-11-23,40.740909,-73.987947
"1791",1088749,"MANHATTAN","1","MADISON AVE","A3","EQ","ISSUED","09/14/2023","09/13/2024",2022-11-29,40.740909,-73.987947
"1792",1088749,"MANHATTAN","1","MADISON AVE","A3","EQ","ISSUED","09/14/2023","09/13/2024",2022-11-30,40.740909,-73.987947
"1793",1088749,"MANHATTAN","1","MADISON AVE","A3","EQ","ISSUED","09/14/2023","09/13/2024",2022-11-30,40.740909,-73.987947
"1794",3335129,"BROOKLYN","63","FLUSHING AVENUE","A2","OT","ISSUED","02/14/2023","01/01/2024",2021-07-01,40.69802,-73.974986
"1795",3076057,"BROOKLYN","1333","BROADWAY","NB","","ISSUED","02/16/2023","02/18/2023",2021-07-01,40.690065,-73.923046
"1796",3426897,"BROOKLYN","318","KENT AVENUE","A2","OT","ISSUED","02/16/2023","02/21/2024",2020-08-19,40.713762,-73.967221
"1797",5104468,"STATEN ISLAND","4855","HYLAN BOULEVARD","A1","","IN PROCESS","02/16/2023","",2021-11-26,40.526708,-74.167895
"1798",1046667,"MANHATTAN","1076","MADISON AVENUE","A2","OT","ISSUED","02/16/2023","03/01/2024",2020-08-12,40.777826,-73.961041
"1799",3429327,"BROOKLYN","625","FULTON STREET","NB","","ISSUED","02/17/2023","02/17/2024",2022-08-16,40.688566,-73.980045
"1800",3245840,"BROOKLYN","201","HAMPTON AVENUE","A1","","ISSUED","02/17/2023","05/06/2023",2020-11-10,40.579397,-73.952232
"1801",4135975,"QUEENS","214-33","35TH AVENUE","A2","OT","ISSUED","02/17/2023","04/01/2023",2021-09-17,40.769536,-73.771148
"1802",4135975,"QUEENS","214-33","35TH AVENUE","A2","OT","ISSUED","02/17/2023","04/01/2023",2021-09-17,40.769536,-73.771148
"1803",4135975,"QUEENS","214-33","35TH AVENUE","A2","MH","ISSUED","02/17/2023","04/01/2023",2021-09-27,40.769536,-73.771148
"1804",4296411,"QUEENS","99-33","163RD DRIVE","A2","OT","ISSUED","02/17/2023","04/01/2023",2023-02-17,40.652343,-73.830574
"1805",5033681,"STATEN ISLAND","43","SANDERS STREET","A1","","ISSUED","02/17/2023","06/11/2023",2020-01-31,40.624171,-74.151843
"1806",4024383,"QUEENS","24-01","96 STREET","A2","OT","ISSUED","02/17/2023","10/21/2023",2023-02-17,40.765986,-73.873848
"1807",3328394,"BROOKLYN","647","LIBERTY AVENUE","DM","","ISSUED","02/17/2023","02/17/2024",2023-01-25,40.675984,-73.885904
"1808",3007298,"BROOKLYN","347","PRESIDENT STREET","A1","","ISSUED","02/17/2023","10/25/2023",2021-09-21,40.680259,-73.992771
"1809",4135975,"QUEENS","214-33","35TH AVENUE","A2","OT","ISSUED","02/17/2023","04/01/2023",2021-09-27,40.769536,-73.771148
"1810",1091643,"MANHATTAN","310","HUDSON STREET","A2","OT","ISSUED","02/18/2023","06/10/2023",2023-02-18,40.726168,-74.007494
"1811",3428821,"BROOKLYN","18","MONITOR","NB","","ISSUED","02/20/2023","02/20/2024",2020-07-20,40.719717,-73.941627
"1812",4436311,"QUEENS","81-03","HAMMELS BLVD","A2","PL","ISSUED","02/21/2023","02/21/2024",2020-01-24,40.589896,-73.807556
"1813",4436311,"QUEENS","81-03","HAMMELS BLVD","A2","PL","ISSUED","02/21/2023","02/21/2024",2020-01-24,40.589896,-73.807556
"1814",4155168,"QUEENS","75-19","192 STREET","A2","OT","ISSUED","02/21/2023","02/28/2023",2023-02-21,40.731435,-73.779177
"1815",4285048,"QUEENS","165-26","145TH AVE","A2","OT","ISSUED","02/21/2023","10/01/2023",2023-02-21,40.663298,-73.776079
"1816",3007299,"BROOKLYN","339","PRESIDENT STREET","A2","OT","ISSUED","03/21/2023","03/28/2024",2020-11-18,40.680344,-73.99298
"1817",4206127,"QUEENS","107-23","130TH STREET","A2","OT","ISSUED","02/21/2023","12/06/2023",2023-02-21,40.686388,-73.813844
"1818",1048101,"MANHATTAN","1095","PARK AVE","A2","OT","ISSUED","02/21/2023","11/20/2023",2021-12-30,40.781925,-73.955915
"1819",3429087,"BROOKLYN","675","EAST 32ND","NB","","ISSUED","02/21/2023","01/05/2024",2021-04-15,40.634848,-73.945934
"1820",3118557,"BROOKLYN","1070","FLATBUSH AVENUE","A1","","ISSUED","02/21/2023","02/21/2024",2022-07-19,40.644512,-73.95798
"1821",1090459,"MANHATTAN","255","WEST 34TH STREET","NB","","ISSUED","02/22/2023","08/10/2023",2020-06-05,40.751823,-73.992569
"1822",2130625,"BRONX","240","DRAKE STREET","A2","OT","ISSUED","02/22/2023","02/17/2024",2022-04-06,40.806362,-73.880504
"1823",1005188,"MANHATTAN","533","EAST 11TH STREET","A1","","ISSUED","02/22/2023","03/01/2024",2021-11-24,40.728085,-73.980907
"1824",3076057,"BROOKLYN","1333","BROADWAY","NB","","ISSUED","02/22/2023","02/18/2024",2021-07-01,40.690065,-73.923046
"1825",3428586,"BROOKLYN","156","BAY 53 STREET","NB","","ISSUED","02/22/2023","01/31/2024",2021-11-09,40.582835,-73.987612
"1826",3428586,"BROOKLYN","156","BAY 53 STREET","NB","","ISSUED","02/22/2023","01/31/2024",2021-11-09,40.582835,-73.987612
"1827",4156512,"QUEENS","81-26","193 STREET","A2","OT","ISSUED","02/22/2023","04/21/2023",2023-02-22,40.727883,-73.776479
"1828",3428586,"BROOKLYN","156","BAY 53 STREET","NB","","ISSUED","02/22/2023","01/31/2024",2021-11-09,40.582835,-73.987612
"1829",1053233,"MANHATTAN","186","LENOX AVE","DM","","ISSUED","02/09/2023","01/24/2024",2023-02-27,40.804236,-73.948058
"1830",2015304,"BRONX","2773","RESERVOIR AVENUE","A2","EQ","ISSUED","03/21/2023","04/24/2024",2023-04-25,40.869969,-73.898638
"1831",1079184,"MANHATTAN","224","12TH AVENUE","A1","","ISSUED","02/23/2023","07/01/2023",2020-09-28,40.752641,-74.007576
"1832",2009125,"BRONX","1875","ANDREWS AVENUE","A2","OT","ISSUED","02/23/2023","12/11/2023",2023-02-23,40.85297,-73.91437
"1833",2006365,"BRONX","908","FAILE STREET","A2","OT","ISSUED","02/23/2023","10/21/2023",2023-02-23,40.819981,-73.887933
"1834",2086919,"BRONX","2059","LACOMBE AVENUE","A2","OT","ISSUED","02/23/2023","12/06/2023",2023-02-23,40.816328,-73.851935
"1835",1091646,"MANHATTAN","212","WEST 124 STREET","NB","","ISSUED","02/23/2023","02/23/2024",2022-12-15,40.808595,-73.949557
"1836",1052384,"MANHATTAN","232","EAST 103RD STREET","A2","OT","ISSUED","02/23/2023","09/06/2023",2022-04-05,40.788952,-73.944538
"1837",5104468,"STATEN ISLAND","4855","HYLAN BOULEVARD","A1","","ISSUED","02/23/2023","05/06/2023",2021-11-26,40.526708,-74.167895
"1838",1031729,"MANHATTAN","12","WEST 96TH STREET","A2","OT","ISSUED","02/23/2023","03/20/2023",2020-10-26,40.79188,-73.965222
"1839",3429327,"BROOKLYN","625","FULTON STREET","NB","","RE-ISSUED","02/22/2023","02/23/2024",2022-08-16,40.688566,-73.980045
"1840",1083184,"MANHATTAN","176","EAST 115TH STREET","A2","OT","ISSUED","02/24/2023","04/01/2023",2023-02-24,40.797577,-73.94128
"1841",1083184,"MANHATTAN","176","EAST 115TH STREET","A2","OT","ISSUED","02/24/2023","04/01/2023",2023-02-24,40.797577,-73.94128
"1842",1083184,"MANHATTAN","176","EAST 115TH STREET","A2","MH","ISSUED","02/24/2023","04/01/2023",2023-02-24,40.797577,-73.94128
"1843",1083184,"MANHATTAN","176","EAST 115TH STREET","A2","PL","ISSUED","02/24/2023","02/24/2024",2023-02-24,40.797577,-73.94128
"1844",4107652,"QUEENS","17-55","FRANCIS LEWIS BLVD","A1","","ISSUED","02/24/2023","02/24/2024",2023-02-24,40.78237,-73.803949
"1845",1002688,"MANHATTAN","126","LAFAYETTE STREET","DM","","ISSUED","02/24/2023","02/19/2024",2023-01-13,40.718727,-74.000274
"1846",3244730,"BROOKLYN","244","OCEAN VIEW AVE","A2","OT","ISSUED","02/24/2023","10/01/2023",2022-08-16,40.578853,-73.965545
"1847",4164521,"QUEENS","80-43","208 ST","A2","OT","ISSUED","02/24/2023","10/01/2023",2022-07-11,40.732126,-73.762274
"1848",2069713,"BRONX","4350","RICHARDSON AVENUE","A2","OT","ISSUED","02/24/2023","04/01/2023",2023-02-24,40.897248,-73.856482
"1849",5084775,"STATEN ISLAND","400","BRADFORD AVENUE","DM","EQ","ISSUED","02/24/2023","02/24/2024",2023-02-24,40.530192,-74.205869
"1850",5084775,"STATEN ISLAND","400","BRADFORD AVENUE","DM","","ISSUED","02/24/2023","02/24/2024",2023-02-24,40.530192,-74.205869
"1851",4295461,"QUEENS","159-32","102 ST","A2","OT","ISSUED","02/24/2023","02/24/2024",2023-02-24,40.659456,-73.831303
"1852",3087570,"BROOKLYN","120","JEROME STREET","A2","OT","ISSUED","03/21/2023","10/21/2023",2023-03-21,40.679335,-73.888296
"1853",1001245,"MANHATTAN","222","BROADWAY","A2","SP","ISSUED","02/24/2023","02/24/2024",2021-03-04,40.711313,-74.008661
"1854",3233439,"BROOKLYN","1560","EAST 91 STREET","A2","OT","ISSUED","09/14/2023","04/21/2024",2023-09-14,40.633016,-73.896631
"1855",2010971,"BRONX","1923","WEST FARMS ROAD","A2","SD","ISSUED","06/12/2020","06/12/2021",2020-06-12,40.83877,-73.880999
"1856",2010971,"BRONX","1923","WEST FARMS ROAD","NB","","ISSUED","12/16/2020","12/16/2021",2020-12-16,40.83877,-73.880999
"1857",2010971,"BRONX","1923","WEST FARMS ROAD","NB","","ISSUED","12/16/2020","12/16/2021",2020-12-16,40.83877,-73.880999
"1858",2010971,"BRONX","1923","WEST FARMS ROAD","NB","PL","ISSUED","12/29/2020","12/29/2021",2020-12-29,40.83877,-73.880999
"1859",2010971,"BRONX","1923","WEST FARMS ROAD","A2","SD","ISSUED","06/08/2021","06/08/2022",2020-06-12,40.83877,-73.880999
"1860",2010971,"BRONX","1923","WEST FARMS ROAD","NB","","ISSUED","08/11/2021","08/11/2022",2020-12-16,40.83877,-73.880999
"1861",2010971,"BRONX","1923","WEST FARMS ROAD","A2","SD","ISSUED","08/17/2021","08/17/2022",2021-08-17,40.83877,-73.880999
"1862",2010971,"BRONX","1923","WEST FARMS ROAD","A2","SP","ISSUED","08/17/2021","08/17/2022",2021-08-17,40.83877,-73.880999
"1863",2010971,"BRONX","1923","WEST FARMS ROAD","NB","","ISSUED","12/27/2021","12/27/2022",2020-12-16,40.83877,-73.880999
"1864",2010971,"BRONX","1923","WEST FARMS ROAD","NB","","IN PROCESS","01/04/2022","01/04/2023",2020-12-16,40.83877,-73.880999
"1865",2010971,"BRONX","1923","WEST FARMS ROAD","NB","","ISSUED","01/04/2022","01/04/2023",2020-12-16,40.83877,-73.880999
"1866",2010971,"BRONX","1923","WEST FARMS ROAD","NB","","ISSUED","02/07/2022","02/07/2023",2020-12-16,40.83877,-73.880999
"1867",2010971,"BRONX","1923","WEST FARMS ROAD","A3","EQ","ISSUED","05/31/2022","05/31/2023",2022-05-31,40.83877,-73.880999
"1868",2010971,"BRONX","1923","WEST FARMS ROAD","A2","SD","ISSUED","08/11/2022","08/11/2023",2021-08-17,40.83877,-73.880999
"1869",2010971,"BRONX","1923","WEST FARMS ROAD","A2","SP","ISSUED","08/11/2022","08/11/2023",2021-08-17,40.83877,-73.880999
"1870",2010971,"BRONX","1923","WEST FARMS ROAD","NB","PL","ISSUED","12/12/2022","12/12/2023",2020-12-29,40.83877,-73.880999
"1871",2010971,"BRONX","1923","WEST FARMS ROAD","NB","","ISSUED","01/10/2023","12/01/2023",2020-12-16,40.83877,-73.880999
"1872",4114142,"QUEENS","40-28","MAIN STREET","A2","OT","ISSUED","03/21/2023","03/01/2024",2020-11-09,40.758861,-73.829802
"1873",5017765,"STATEN ISLAND","139","TILLMAN STREET","A2","OT","ISSUED","03/21/2023","02/22/2024",2020-02-06,40.604675,-74.116178
"1874",1014251,"MANHATTAN","220","WEST 28 STREET","A2","EQ","ISSUED","02/27/2023","02/27/2024",2023-02-27,40.747582,-73.994197
"1875",3054518,"BROOKLYN","130","RYERSON ST","A1","EQ","ISSUED","02/27/2023","02/27/2024",2021-08-23,40.694109,-73.965114
"1876",4252184,"QUEENS","115-32","125 STREET","A2","OT","ISSUED","02/28/2023","04/21/2023",2023-02-28,40.677844,-73.814023
"1877",4618772,"QUEENS","26-02","1ST STREET","NB","","ISSUED","04/08/2022","01/01/2023",2022-04-12,40.776821,-73.935533
"1878",1001005,"MANHATTAN","48","WALL STREET","A2","OT","ISSUED","02/28/2023","11/04/2023",2020-10-21,40.706331,-74.009396
"1879",1015242,"MANHATTAN","989","6 AVENUE","DM","","ISSUED","09/14/2023","09/11/2024",2023-01-31,40.751394,-73.986635
"1880",3429084,"BROOKLYN","624","METROPOLITAN AVENUE","NB","","ISSUED","02/28/2023","04/09/2023",2022-06-01,40.714156,-73.948301
"1881",4618772,"QUEENS","26-02","1ST STREET","NB","","ISSUED","04/08/2022","01/01/2023",2022-04-12,40.776821,-73.935533
"1882",5170925,"STATEN ISLAND","435","TOMPKINS AVENUE","A2","OT","ISSUED","02/28/2023","04/26/2023",2023-02-28,40.614957,-74.073096
"1883",3398454,"BROOKLYN","10","GRAND AVENUE","A2","OT","ISSUED","01/10/2020","02/16/2021",2020-02-26,40.697312,-73.964802
"1884",3398454,"BROOKLYN","10","GRAND AVENUE","A2","OT","ISSUED","06/02/2022","10/07/2022",2020-02-26,40.697312,-73.964802
"1885",4618772,"QUEENS","26-50","1ST STREET","NB","","ISSUED","04/20/2022","01/01/2023",2022-04-22,40.776321,-73.935789
"1886",1026058,"MANHATTAN","347","WEST 57 STREET","A3","OT","ISSUED","03/21/2023","08/03/2023",2023-05-23,40.767297,-73.984231
"1887",4618772,"QUEENS","26-50","1ST STREET","NB","","ISSUED","04/20/2022","01/01/2023",2022-04-22,40.776321,-73.935789
"1888",3246888,"BROOKLYN","2971","CONEY ISLAND AVENUE","NB","","ISSUED","03/01/2023","01/01/2024",2020-08-28,40.583965,-73.959991
"1889",3246888,"BROOKLYN","2971","CONEY ISLAND AVENUE","NB","","ISSUED","03/01/2023","01/01/2024",2020-08-28,40.583965,-73.959991
"1890",3246888,"BROOKLYN","2971","CONEY ISLAND AVENUE","NB","","ISSUED","03/01/2023","01/01/2024",2020-09-02,40.583965,-73.959991
"1891",1011919,"MANHATTAN","90","BANK STREET","A2","OT","ISSUED","03/01/2023","03/06/2024",2021-11-17,40.73651,-74.005943
"1892",3104697,"BROOKLYN","164","EAST 88 STREET","A2","OT","ISSUED","03/02/2023","12/06/2023",2023-03-02,40.649203,-73.918524
"1893",3027483,"BROOKLYN","889","PACIFIC STREET","A2","OT","ISSUED","03/02/2023","06/14/2023",2023-03-02,40.680583,-73.96585
"1894",5142719,"STATEN ISLAND","169GAR","MANOR ROAD","DM","","ISSUED","03/02/2023","03/01/2024",2023-03-03,40.623877,-74.12472
"1895",2013607,"BRONX","203","EAST FORDHAM ROAD","A2","PL","ISSUED","03/02/2023","03/01/2024",2023-03-02,40.862417,-73.896734
"1896",4217842,"QUEENS","169-12","104 AVE","DM","EQ","ISSUED","03/03/2023","03/15/2024",2023-03-16,40.702239,-73.788153
"1897",3425050,"BROOKLYN","350","KENT AVENUE","NB","PL","ISSUED","03/03/2023","03/02/2024",2023-03-03,40.712706,-73.967694
"1898",4031918,"QUEENS","69-27","44 AVE","DM","","ISSUED","03/03/2023","01/21/2024",2023-03-09,40.740964,-73.895284
"1899",4019443,"QUEENS","23-14","DITMARS BOULEVARD","A2","PL","ISSUED","03/03/2023","03/02/2024",2021-12-30,40.779618,-73.915653
"1900",4607880,"QUEENS","122-06","MERRICK BOULEVARD","NB","EQ","ISSUED","03/03/2023","03/02/2024",2022-03-10,40.683649,-73.769525
"1901",4618772,"QUEENS","26-02","1ST STREET","NB","","RE-ISSUED","06/14/2022","01/01/2023",2022-04-12,40.776821,-73.935533
"1902",3076057,"BROOKLYN","1333","BROADWAY","NB","","ISSUED","03/03/2023","12/05/2023",2021-07-29,40.690065,-73.923046
"1903",4618772,"QUEENS","26-02","1ST STREET","NB","","ISSUED","06/14/2022","01/01/2023",2022-04-12,40.776821,-73.935533
"1904",4618772,"QUEENS","26-02","1ST STREET","NB","","ISSUED","06/15/2022","01/01/2023",2022-04-12,40.776821,-73.935533
"1905",4618772,"QUEENS","26-50","1ST STREET","NB","","ISSUED","06/15/2022","01/01/2023",2022-04-22,40.776321,-73.935789
"1906",2016975,"BRONX","3012","BAINBRIDGE AVENUE","A2","OT","ISSUED","01/05/2023","10/21/2023",2023-03-03,40.87184,-73.883059
"1907",4618772,"QUEENS","26-50","1ST STREET","NB","","ISSUED","06/15/2022","01/01/2023",2022-04-22,40.776321,-73.935789
"1908",1089192,"MANHATTAN","375","WEST 207 STREET","NB","","ISSUED","03/06/2023","03/05/2024",2023-03-06,40.864015,-73.917834
"1909",4618772,"QUEENS","26-50","1ST STREET","NB","","ISSUED","10/11/2022","10/11/2023",2022-04-22,40.776321,-73.935789
"1910",4618772,"QUEENS","26-02","1ST STREET","NB","","ISSUED","10/11/2022","10/11/2023",2022-04-12,40.776821,-73.935533
"1911",4618772,"QUEENS","26-02","1ST STREET","NB","","ISSUED","12/13/2022","12/13/2023",2022-12-13,40.776821,-73.935533
"1912",1080352,"MANHATTAN","450","11TH AVENUE","NB","","ISSUED","03/06/2023","06/19/2023",2020-07-14,40.757486,-74.000729
"1913",2046144,"BRONX","3066","ROBERTS AVENUE","A1","","ISSUED","03/06/2023","03/15/2023",2022-02-02,40.84606,-73.829102
"1914",4155168,"QUEENS","75-19","192 STREET","A2","OT","ISSUED","03/06/2023","06/03/2023",2023-02-21,40.731435,-73.779177
"1915",3065463,"BROOKLYN","341","KINGSLAND AVENUE","A2","SP","ISSUED","05/04/2023","09/13/2024",2020-12-16,40.728574,-73.942139
"1916",3426668,"BROOKLYN","960","EAST 23 STREET","A1","","ISSUED","03/06/2023","01/01/2024",2023-03-06,40.627053,-73.953708
"1917",3426668,"BROOKLYN","960","EAST 23 STREET","A1","","ISSUED","03/06/2023","01/01/2024",2023-03-06,40.627053,-73.953708
"1918",3426668,"BROOKLYN","960","EAST 23 STREET","A1","","ISSUED","03/06/2023","01/01/2024",2023-03-06,40.627053,-73.953708
"1919",4618772,"QUEENS","26-02","1ST STREET","NB","","ISSUED","12/15/2022","01/01/2024",2022-04-12,40.776821,-73.935533
"1920",3065463,"BROOKLYN","341","KINGSLAND AVENUE","A2","SD","ISSUED","05/04/2023","09/13/2024",2020-12-21,40.728574,-73.942139
"1921",1033105,"MANHATTAN","215","WEST 84TH STREET","DM","EQ","ISSUED","03/06/2023","03/05/2024",2023-03-06,40.786643,-73.976607
"1922",1033105,"MANHATTAN","215","WEST 84TH STREET","DM","EQ","ISSUED","03/06/2023","03/05/2024",2023-03-06,40.786643,-73.976607
"1923",1033105,"MANHATTAN","215","WEST 84TH STREET","DM","","ISSUED","03/06/2023","04/26/2023",2023-03-06,40.786643,-73.976607
"1924",2072575,"BRONX","2385","HOLLERS AVE","A2","OT","ISSUED","03/06/2023","03/02/2024",2022-09-19,40.885519,-73.823973
"1925",4087416,"QUEENS","63-35","FRESH POND ROAD","A2","OT","ISSUED","03/06/2023","03/02/2024",2023-01-31,40.711388,-73.899907
"1926",4210838,"QUEENS","165-17","85TH AVE","A2","OT","ISSUED","03/07/2023","04/01/2023",2023-03-07,40.713099,-73.800037
"1927",4016852,"QUEENS","20-20","33RD ST","A2","OT","ISSUED","03/07/2023","10/01/2023",2023-03-07,40.778496,-73.905811
"1928",1042490,"MANHATTAN","147","EAST 69TH STREET","A1","","ISSUED","03/07/2023","01/01/2024",2021-04-22,40.76828,-73.963108
"1929",1042490,"MANHATTAN","147","EAST 69TH STREET","A2","OT","ISSUED","03/07/2023","01/01/2024",2021-04-08,40.76828,-73.963108
"1930",2007061,"BRONX","1373","TELLER AVENUE","A2","OT","ISSUED","03/07/2023","10/21/2023",2023-05-19,40.835968,-73.909448
"1931",1042490,"MANHATTAN","147","EAST 69TH STREET","A2","OT","ISSUED","03/07/2023","01/01/2024",2020-07-02,40.76828,-73.963108
"1932",3055377,"BROOKLYN","333","LAFAYETTE AVENUE","A2","OT","ISSUED","03/07/2023","03/08/2024",2021-05-14,40.688657,-73.962027
"1933",3012097,"BROOKLYN","4619","8 AVE","A1","","ISSUED","03/07/2023","03/06/2024",2022-01-31,40.643199,-74.001531
"1934",3232881,"BROOKLYN","1421","EAST 98 STREET","A2","OT","ISSUED","03/07/2023","04/21/2023",2023-03-07,40.638346,-73.893225
"1935",4257656,"QUEENS","129-14","150TH AVE","A2","OT","ISSUED","03/07/2023","10/01/2023",2023-03-07,40.665042,-73.811705
"1936",4275266,"QUEENS","118-16","234 STREET","A2","OT","ISSUED","03/07/2023","06/01/2023",2023-03-07,40.689426,-73.728967
"1937",4619732,"QUEENS","46-11","QUEENS BOULEVARD","NB","","ISSUED","03/07/2023","07/02/2023",2020-05-21,40.74314,-73.918488
"1938",3429595,"BROOKLYN","180","ASHLAND PLACE","NB","","ISSUED","03/23/2022","03/23/2023",2022-03-23,40.689356,-73.978567
"1939",3429595,"BROOKLYN","180","ASHLAND PLACE","NB","","ISSUED","08/11/2022","08/11/2023",2022-08-11,40.689356,-73.978567
"1940",3429595,"BROOKLYN","180","ASHLAND PLACE","NB","","ISSUED","09/29/2022","09/29/2023",2022-08-11,40.689356,-73.978567
"1941",3429595,"BROOKLYN","180","ASHLAND PLACE","NB","","ISSUED","01/31/2023","01/31/2024",2022-08-11,40.689356,-73.978567
"1942",4618772,"QUEENS","26-02","1ST STREET","NB","","ISSUED","02/08/2023","02/08/2024",2022-04-12,40.776821,-73.935533
"1943",5152417,"STATEN ISLAND","46","JUMEL STREET","A2","OT","ISSUED","06/22/2023","10/01/2023",2023-07-05,40.560721,-74.148586
"1944",4623245,"QUEENS","331","BEACH 35 STREET","NB","","RE-ISSUED","03/20/2023","03/21/2024",2023-03-09,40.596108,-73.767699
"1945",4623245,"QUEENS","331","BEACH 35 STREET","NB","","RE-ISSUED","03/20/2023","03/21/2024",2023-03-09,40.596108,-73.767699
"1946",4623245,"QUEENS","331","BEACH 35 STREET","NB","","RE-ISSUED","03/20/2023","03/21/2024",2023-03-09,40.596108,-73.767699
"1947",4214485,"QUEENS","9513","LIVERPOOL STREET","A2","OT","ISSUED","03/22/2023","04/21/2023",2023-03-22,40.697619,-73.808014
"1948",3082389,"BROOKLYN","411","THATFORD AVE.","A2","MH","ISSUED","03/22/2023","04/01/2023",2020-02-24,40.660306,-73.907355
"1949",3082389,"BROOKLYN","411","THATFORD AVE.","A2","OT","ISSUED","03/22/2023","04/01/2023",2020-02-24,40.660306,-73.907355
"1950",3082389,"BROOKLYN","411","THATFORD AVE.","A2","OT","ISSUED","03/22/2023","04/01/2023",2020-02-24,40.660306,-73.907355
"1951",3245804,"BROOKLYN","89","WEST END AVE","NB","PL","ISSUED","03/22/2023","03/21/2024",2023-03-22,40.579694,-73.953413
"1952",4116436,"QUEENS","46-21","COLDEN STREET","A2","OT","ISSUED","03/22/2023","04/01/2023",2020-11-03,40.749545,-73.822073
"1953",5170723,"STATEN ISLAND","4132","VICTORY BOULEVARD","NB","PL","ISSUED","03/22/2023","03/21/2024",2023-03-23,40.591375,-74.191216
"1954",3054370,"BROOKLYN","100","WASHINGTON AVENUE","A2","OT","ISSUED","02/16/2023","01/26/2024",2023-03-22,40.695301,-73.967285
"1955",5150965,"STATEN ISLAND","89A","ANDROS AVENUE","A2","OT","ISSUED","09/15/2023","09/14/2024",2023-09-23,40.63566,-74.162404
"1956",2058740,"BRONX","902","EAST 213 STREET","A2","OT","ISSUED","06/22/2023","07/01/2023",2023-06-22,40.877588,-73.858871
"1957",3006610,"BROOKLYN","251","DOUGLASS ST","DM","","ISSUED","03/23/2023","11/20/2023",2022-03-07,40.680708,-73.985308
"1958",4116436,"QUEENS","46-21","COLDEN STREET","A3","EQ","ISSUED","03/23/2023","03/22/2024",2020-02-18,40.749545,-73.822073
"1959",5067280,"STATEN ISLAND","349","THORNYCROFT AVE","A2","OT","ISSUED","03/23/2023","11/15/2023",2023-03-23,40.5408,-74.158202
"1960",2071271,"BRONX","4425","EDSON AVENUE","A2","OT","ISSUED","03/23/2023","10/01/2023",2023-03-23,40.899805,-73.84726
"1961",4285049,"QUEENS","165-30","145 AVENUE","A1","PL","ISSUED","04/02/2021","04/02/2022",2021-04-02,40.66332,-73.776032
"1962",1088961,"MANHATTAN","20","HUDSON YARDS","A2","OT","ISSUED","03/23/2023","08/28/2023",2023-03-23,40.753045,-74.000282
"1963",1088961,"MANHATTAN","20","HUDSON YARDS","A2","OT","ISSUED","03/23/2023","08/28/2023",2023-03-23,40.753045,-74.000282
"1964",2013297,"BRONX","2075","WEBSTER AVENUE","NB","","ISSUED","03/23/2023","03/22/2024",2022-11-17,40.851741,-73.898493
"1965",4618772,"QUEENS","26-50","1ST STREET","NB","","ISSUED","02/08/2023","02/08/2024",2022-04-22,40.776321,-73.935789
"1966",4618772,"QUEENS","26-02","1ST STREET","NB","","ISSUED","04/13/2023","04/12/2024",2022-12-13,40.776821,-73.935533
"1967",4618772,"QUEENS","26-02","1ST STREET","NB","","ISSUED","07/18/2023","07/17/2024",2022-12-13,40.776821,-73.935533
"1968",4618772,"QUEENS","26-02","1ST STREET","NB","EQ","ISSUED","10/02/2023","10/01/2024",2022-04-12,40.776821,-73.935533
"1969",4618772,"QUEENS","26-02","1ST STREET","NB","","ISSUED","12/06/2023","01/01/2025",2022-04-12,40.776821,-73.935533
"1970",1028138,"MANHATTAN","50","CENTRAL PARK WEST","A3","EQ","ISSUED","12/21/2023","12/20/2024",2020-01-15,40.77169,-73.979273
"1971",2013607,"BRONX","203","EAST FORDHAM ROAD","A2","OT","ISSUED","03/24/2023","12/04/2023",2021-02-18,40.862417,-73.896734
"1972",2013607,"BRONX","203","EAST FORDHAM ROAD","A2","OT","ISSUED","03/24/2023","12/04/2023",2021-02-19,40.862417,-73.896734
"1973",4073667,"QUEENS","62-45","BOELSEN CRESCENT","A2","OT","ISSUED","03/24/2023","10/01/2023",2023-03-24,40.724232,-73.86187
"1974",2001874,"BRONX","333","E 151ST STREET","A2","OT","ISSUED","06/22/2023","06/21/2024",2021-12-28,40.818232,-73.919867
"1975",1001084,"MANHATTAN","55","LIBERTY STREET","A2","OT","ISSUED","03/24/2023","04/15/2024",2020-06-23,40.708692,-74.009508
"1976",3429227,"BROOKLYN","65","DUPONT STREET","NB","","ISSUED","06/22/2023","06/21/2024",2023-06-22,40.735668,-73.957396
"1977",3145870,"BROOKLYN","6902","8TH AVENUE","A1","PL","ISSUED","06/22/2023","06/21/2024",2023-06-22,40.630265,-74.015009
"1978",5102018,"STATEN ISLAND","27","GRASMERE COURT","A2","OT","ISSUED","09/15/2023","12/07/2023",2023-09-15,40.601705,-74.084216
"1979",1086331,"MANHATTAN","111","ANDES ROAD","A1","","ISSUED","06/22/2023","06/21/2024",2021-06-26,40.692552,-74.016281
"1980",1086331,"MANHATTAN","111","ANDES ROAD","A1","","ISSUED","06/22/2023","06/21/2024",2021-06-25,40.692552,-74.016281
"1981",1086331,"MANHATTAN","111","ANDES ROAD","A1","","ISSUED","06/22/2023","06/21/2024",2021-06-25,40.692552,-74.016281
"1982",1087148,"MANHATTAN","353","W 56 ST","A1","","ISSUED","03/27/2023","03/26/2024",2023-03-27,40.766677,-73.984838
"1983",1088894,"MANHATTAN","1","CLARKSON STREET","A2","OT","ISSUED","03/27/2023","04/01/2024",2020-08-27,40.729371,-74.005654
"1984",1088894,"MANHATTAN","1","CLARKSON STREET","A2","OT","ISSUED","03/27/2023","04/01/2024",2020-07-30,40.729371,-74.005654
"1985",2001874,"BRONX","333","EAST 151 STREET","A2","PL","ISSUED","12/21/2023","12/20/2024",2021-01-26,40.818232,-73.919867
"1986",3153881,"BROOKLYN","650","86TH STREET","NB","","ISSUED","03/27/2023","03/26/2024",2022-10-24,40.618851,-74.021875
"1987",3429519,"BROOKLYN","20","VITAL AVENUE","NB","","ISSUED","03/27/2023","04/08/2024",2022-09-08,NA,NA
"1988",4215773,"QUEENS","106-05","159TH STREET","A2","OT","ISSUED","03/27/2023","04/01/2024",2021-10-01,40.698609,-73.796402
"1989",3188672,"BROOKLYN","3731","NAUTILUS AVENUE","A2","OT","ISSUED","03/27/2023","09/16/2023",2022-02-23,40.576094,-74.004093
"1990",2100247,"BRONX","160","HALL OF FAME TERRACE","A2","MH","ISSUED","03/27/2023","04/01/2024",2022-06-10,40.858971,-73.91147
"1991",3109890,"BROOKLYN","921","TROY AVE","A2","PL","ISSUED","03/27/2023","03/26/2024",2023-03-27,40.650535,-73.936065
"1992",2087014,"BRONX","1025","MORRISON AVENUE","A2","MH","ISSUED","03/27/2023","03/15/2024",2022-01-25,40.825403,-73.873666
"1993",2087014,"BRONX","1025","MORRISON AVENUE","A2","OT","ISSUED","03/27/2023","03/15/2024",2022-01-25,40.825403,-73.873666
"1994",2087014,"BRONX","1025","MORRISON AVENUE","A2","OT","ISSUED","03/27/2023","03/15/2024",2022-01-25,40.825403,-73.873666
"1995",2083687,"BRONX","3436","KINGSBRIDGE AVE","NB","PL","ISSUED","03/27/2023","03/26/2024",2020-01-16,40.882783,-73.903645
"1996",1088961,"MANHATTAN","20","HUDSON YARDS","A2","OT","RE-ISSUED","03/23/2023","08/28/2023",2023-03-27,40.753045,-74.000282
"1997",4135975,"QUEENS","214-33","35TH AVENUE","A2","OT","ISSUED","03/28/2023","03/27/2024",2021-09-17,40.769536,-73.771148
"1998",4135975,"QUEENS","214-33","35TH AVENUE","A2","OT","ISSUED","03/28/2023","03/27/2024",2021-09-17,40.769536,-73.771148
"1999",4116436,"QUEENS","46-21","COLDEN STREET","A2","OT","ISSUED","03/28/2023","04/01/2023",2020-11-03,40.749545,-73.822073
"2000",4116436,"QUEENS","46-21","COLDEN STREET","A2","OT","RE-ISSUED","03/28/2023","03/27/2024",2020-11-03,40.749545,-73.822073
"2001",4135975,"QUEENS","214-33","35TH AVENUE","A2","MH","RE-ISSUED","03/28/2023","03/30/2024",2021-09-27,40.769536,-73.771148
"2002",4135975,"QUEENS","214-33","35TH AVENUE","A2","OT","ISSUED","03/28/2023","03/27/2024",2022-01-14,40.769536,-73.771148
"2003",4135975,"QUEENS","214-33","35TH AVENUE","A2","OT","ISSUED","03/28/2023","03/27/2024",2022-01-14,40.769536,-73.771148
"2004",4135975,"QUEENS","214-33","35TH AVENUE","A2","OT","ISSUED","03/28/2023","03/27/2024",2022-01-14,40.769536,-73.771148
"2005",4116436,"QUEENS","46-21","COLDEN STREET","A2","OT","RE-ISSUED","03/22/2023","03/27/2024",2020-11-03,40.749545,-73.822073
"2006",4116436,"QUEENS","46-21","COLDEN STREET","A2","OT","RE-ISSUED","03/22/2023","03/27/2024",2020-11-03,40.749545,-73.822073
"2007",3107741,"BROOKLYN","329","CLARKSON AVE","DM","EQ","ISSUED","06/22/2023","06/21/2024",2023-06-22,40.655503,-73.948826
"2008",5174506,"STATEN ISLAND","48","ERASTINA PLACE","A2","OT","ISSUED","03/29/2023","10/01/2023",2023-04-12,40.635339,-74.156087
"2009",1001405,"MANHATTAN","27","PARK PLACE","A1","PL","ISSUED","03/29/2023","03/28/2024",2020-09-09,40.713116,-74.008931
"2010",2087014,"BRONX","1025","MORRISON AVENUE","A2","MH","ISSUED","03/19/2024","03/15/2025",2022-01-25,40.825403,-73.873666
"2011",2064524,"BRONX","937","EAST 227 STREET","A2","OT","ISSUED","03/29/2023","12/06/2023",2023-03-29,40.887022,-73.852761
"2012",3153881,"BROOKLYN","650","86TH STREET","NB","","ISSUED","03/29/2023","03/28/2024",2022-06-16,40.618851,-74.021875
"2013",2087014,"BRONX","1025","MORRISON AVENUE","A2","OT","ISSUED","03/19/2024","03/15/2025",2022-01-25,40.825403,-73.873666
"2014",3153881,"BROOKLYN","650","86TH STREET","NB","","ISSUED","03/29/2023","03/28/2024",2022-06-16,40.618851,-74.021875
"2015",2087014,"BRONX","1025","MORRISON AVENUE","A2","OT","ISSUED","03/19/2024","03/15/2025",2022-01-25,40.825403,-73.873666
"2016",4116436,"QUEENS","46-21","COLDEN STREET","A2","MH","ISSUED","03/29/2023","03/28/2024",2020-11-03,40.749545,-73.822073
"2017",2004136,"BRONX","581","AUSTIN PLACE","NB","","RE-ISSUED","06/22/2023","04/08/2024",2023-02-09,40.811268,-73.901513
"2018",1001394,"MANHATTAN","1","CENTRE STREET","A2","OT","ISSUED","03/30/2023","04/15/2024",2021-11-22,40.713001,-74.004181
"2019",4623739,"QUEENS","2-21","MALT DRIVE","A3","OT","ISSUED","03/30/2023","02/22/2024",2023-03-30,NA,NA
"2020",4623739,"QUEENS","2-21","MALT DRIVE","A3","OT","ISSUED","03/30/2023","02/22/2024",2023-03-30,NA,NA
"2021",2004136,"BRONX","581","AUSTIN PLACE","NB","","ISSUED","06/22/2023","04/08/2024",2020-06-29,40.811268,-73.901513
"2022",1090883,"MANHATTAN","378","WEST END AVENUE","A2","OT","ISSUED","03/30/2023","04/01/2024",2020-10-06,40.783559,-73.981721
"2023",4623141,"QUEENS","53-16","NORTHERN BOULEVARD","NB","","ISSUED","03/30/2023","03/29/2024",2022-09-27,40.753192,-73.907839
"2024",2004136,"BRONX","581","AUSTIN PLACE","NB","","ISSUED","06/22/2023","04/08/2024",2020-06-29,40.811268,-73.901513
"2025",4623245,"QUEENS","331","BEACH 35 STREET","NB","","ISSUED","03/30/2023","03/29/2024",2023-03-09,40.596108,-73.767699
"2026",4623245,"QUEENS","331","BEACH 35 STREET","NB","","ISSUED","03/30/2023","03/29/2024",2023-03-09,40.596108,-73.767699
"2027",4623245,"QUEENS","331","BEACH 35 STREET","NB","","ISSUED","03/30/2023","03/29/2024",2023-03-09,40.596108,-73.767699
"2028",4135975,"QUEENS","214-33","35TH AVENUE","A2","OT","ISSUED","03/30/2023","03/29/2024",2021-09-27,40.769536,-73.771148
"2029",1044935,"MANHATTAN","330","EAST 75TH STREET","A2","OT","ISSUED","03/30/2023","04/01/2024",2021-02-12,40.770383,-73.956085
"2030",3004559,"BROOKLYN","407","CLINTON STREET","A1","","ISSUED","03/30/2023","03/26/2024",2020-07-01,40.682444,-73.998107
"2031",1091635,"MANHATTAN","600","W125TH STREET","A2","EQ","ISSUED","03/30/2023","03/29/2024",2023-03-30,40.815974,-73.958569
"2032",3245457,"BROOKLYN","2926","BRIGHTON 12 STREET","A2","OT","ISSUED","03/30/2023","07/01/2023",2023-03-30,40.581051,-73.955853
"2033",2001874,"BRONX","333","E 151ST STREET","A2","MH","ISSUED","03/30/2023","03/29/2024",2022-01-05,40.818232,-73.919867
"2034",3017120,"BROOKLYN","273","19 STREET","A1","PL","ISSUED","03/30/2023","03/29/2024",2020-12-02,40.661762,-73.991068
"2035",4623202,"QUEENS","35-15","19 AVENUE","NB","","ISSUED","03/30/2023","04/01/2024",2020-12-04,40.780124,-73.902028
"2036",4623202,"QUEENS","35-15","19 AVENUE","NB","","ISSUED","03/30/2023","04/01/2024",2020-12-04,40.780124,-73.902028
"2037",4260131,"QUEENS","116-32","142ND STREET","A2","OT","ISSUED","03/30/2023","11/15/2023",2023-03-30,40.679673,-73.799892
"2038",4208217,"QUEENS","150-21","87TH AVE","A2","OT","ISSUED","03/30/2023","10/01/2023",2023-03-30,40.708201,-73.806833
"2039",1091632,"MANHATTAN","2924","8 AVENUE","NB","","ISSUED","03/30/2023","04/01/2024",2021-06-10,40.828941,-73.937426
"2040",1001405,"MANHATTAN","27","PARK PLACE","A1","","ISSUED","03/31/2023","04/01/2024",2020-08-19,40.713116,-74.008931
"2041",3428821,"BROOKLYN","18","MONITOR","NB","PL","ISSUED","03/31/2023","03/30/2024",2020-11-30,40.719717,-73.941627
"2042",3082389,"BROOKLYN","411","THATFORD AVE.","A2","MH","ISSUED","03/31/2023","03/30/2024",2020-02-24,40.660306,-73.907355
"2043",3082389,"BROOKLYN","411","THATFORD AVE.","A2","OT","ISSUED","03/31/2023","03/30/2024",2020-02-24,40.660306,-73.907355
"2044",3082389,"BROOKLYN","411","THATFORD AVE.","A2","OT","ISSUED","03/31/2023","03/30/2024",2020-02-24,40.660306,-73.907355
"2045",3082389,"BROOKLYN","411","THATFORD AVE.","A2","OT","ISSUED","03/31/2023","03/30/2024",2020-02-24,40.660306,-73.907355
"2046",1083184,"MANHATTAN","176","EAST 115TH STREET","A2","OT","ISSUED","03/31/2023","03/30/2024",2023-02-24,40.797577,-73.94128
"2047",1083184,"MANHATTAN","176","EAST 115TH STREET","A2","OT","ISSUED","03/31/2023","03/30/2024",2023-02-24,40.797577,-73.94128
"2048",5082634,"STATEN ISLAND","100","LUTEN AVENUE","A2","MH","ISSUED","03/31/2023","03/30/2024",2022-01-12,40.528092,-74.192032
"2049",5082634,"STATEN ISLAND","100","LUTEN AVENUE","A2","OT","ISSUED","03/31/2023","03/30/2024",2022-01-12,40.528092,-74.192032
"2050",5082634,"STATEN ISLAND","100","LUTEN AVENUE","A2","OT","ISSUED","03/31/2023","03/30/2024",2022-01-12,40.528092,-74.192032
"2051",5082634,"STATEN ISLAND","100","LUTEN AVENUE","A2","OT","ISSUED","03/31/2023","03/30/2024",2022-01-12,40.528092,-74.192032
"2052",5082634,"STATEN ISLAND","100","LUTEN AVENUE","A2","OT","ISSUED","03/31/2023","03/30/2024",2022-01-12,40.528092,-74.192032
"2053",1044935,"MANHATTAN","330","E 75TH STREET","A2","OT","ISSUED","12/21/2023","12/09/2024",2021-08-06,40.770383,-73.956085
"2054",3425450,"BROOKLYN","7201","SHORE ROAD","A2","OT","ISSUED","08/18/2022","09/16/2023",2021-10-06,40.635862,-74.037374
"2055",1007729,"MANHATTAN","110","THOMPSON STREET","A2","OT","ISSUED","04/02/2023","01/31/2024",2020-08-25,40.725688,-74.001941
"2056",3065351,"BROOKLYN","123","MESEROLE AVENUE","DM","EQ","ISSUED","04/03/2023","04/02/2024",2023-04-03,40.727264,-73.952217
"2057",3065351,"BROOKLYN","123","MESEROLE AVENUE","DM","","ISSUED","04/03/2023","06/28/2023",2023-04-12,40.727264,-73.952217
"2058",3049020,"BROOKLYN","195","SANFORD STREET","A2","OT","ISSUED","04/03/2023","04/02/2024",2022-08-05,40.693018,-73.953034
"2059",3114934,"BROOKLYN","190","MAPLE STREET","A2","OT","ISSUED","04/03/2023","06/12/2023",2023-04-03,40.660567,-73.954712
"2060",3320627,"BROOKLYN","501","SURF AVE","A1","","ISSUED","04/03/2023","04/01/2024",2020-10-26,40.574897,-73.973978
"2061",3320627,"BROOKLYN","501","SURF AVENUE","A3","OT","ISSUED","04/03/2023","04/01/2024",2020-06-09,40.574897,-73.973978
"2062",2007695,"BRONX","2017","GRAND CONCOURSE","DM","","ISSUED","06/20/2023","05/01/2024",2023-06-22,40.851757,-73.904168
"2063",1030727,"MANHATTAN","2130","BROADWAY","A2","OT","ISSUED","04/03/2023","04/01/2024",2020-05-19,40.780737,-73.981379
"2064",3330085,"BROOKLYN","71","QUAY STREET","DM","EQ","ISSUED","03/19/2024","03/19/2025",2024-03-19,40.726221,-73.958369
"2065",2129656,"BRONX","4720","THIRD AVENUE","NB","","ISSUED","03/22/2023","04/02/2024",2022-07-01,40.859417,-73.891128
"2066",2097312,"BRONX","2850","GOULDEN AVENUE","A2","MH","ISSUED","04/04/2023","04/01/2024",2022-12-13,40.872898,-73.896175
"2067",3329212,"BROOKLYN","1945","MC DONALD AVENUE","A2","PL","ISSUED","04/04/2023","04/03/2024",2023-04-04,40.605169,-73.972313
"2068",3079253,"BROOKLYN","162","COVERT ST","NB","","ISSUED","04/04/2023","03/19/2024",2023-04-19,40.689421,-73.909233
"2069",3115866,"BROOKLYN","601","PARKSIDE AVENUE","A2","OT","ISSUED","04/04/2023","05/13/2023",2021-09-08,40.656046,-73.953742
"2070",3117838,"BROOKLYN","2801","TILDEN AVENUE","NB","","ISSUED","04/04/2023","04/01/2024",2021-06-24,40.646825,-73.950919
"2071",3117838,"BROOKLYN","2801","TILDEN AVENUE","NB","","ISSUED","04/04/2023","04/01/2024",2021-06-24,40.646825,-73.950919
"2072",3117838,"BROOKLYN","2801","TILDEN AVENUE","NB","","ISSUED","04/04/2023","04/01/2024",2021-06-24,40.646825,-73.950919
"2073",4197869,"QUEENS","107-10","97TH AVE","A2","OT","ISSUED","04/04/2023","10/01/2023",2023-04-04,40.688727,-73.83703
"2074",3007920,"BROOKLYN","142","2ND STREET","DM","EQ","ISSUED","04/04/2023","04/03/2024",2023-04-04,40.677217,-73.990699
"2075",2001449,"BRONX","450","EAST 158TH STREET","DM","","ISSUED","04/05/2023","02/24/2024",2023-01-27,40.821712,-73.912933
"2076",2081825,"BRONX","127","HORTON STREET","A2","OT","ISSUED","04/05/2023","10/01/2023",2023-04-05,40.839444,-73.783998
"2077",2001874,"BRONX","333","E 151ST STREET","A2","PL","ISSUED","12/21/2023","12/20/2024",2022-01-05,40.818232,-73.919867
"2078",1005641,"MANHATTAN","327","BROOME STREET","DM","","ISSUED","04/05/2023","02/20/2024",2023-04-05,40.719207,-73.993835
"2079",1083025,"MANHATTAN","125","WEST END AVENUE","A1","","ISSUED","04/05/2023","04/20/2024",2021-02-02,40.775674,-73.987504
"2080",4436311,"QUEENS","81-03","HAMMELS BLVD","A2","OT","ISSUED","04/05/2023","05/01/2024",2020-02-28,40.589896,-73.807556
"2081",4436311,"QUEENS","81-03","HAMMELS BLVD","A2","MH","ISSUED","04/05/2023","05/01/2024",2020-02-28,40.589896,-73.807556
"2082",4436311,"QUEENS","81-03","HAMMELS BLVD","A2","OT","ISSUED","04/05/2023","05/01/2024",2020-02-28,40.589896,-73.807556
"2083",4436311,"QUEENS","81-03","HAMMELS BLVD","A2","MH","ISSUED","04/05/2023","05/01/2024",2020-03-03,40.589896,-73.807556
"2084",4436311,"QUEENS","81-03","HAMMELS BLVD","A2","OT","ISSUED","04/05/2023","05/01/2024",2020-02-28,40.589896,-73.807556
"2085",1083025,"MANHATTAN","125","WEST END AVENUE","A2","OT","ISSUED","04/06/2023","04/20/2024",2021-03-12,40.775674,-73.987504
"2086",3332217,"BROOKLYN","92","CENTRE MALL","A2","MH","ISSUED","04/06/2023","04/01/2024",2021-08-19,40.674833,-74.003558
"2087",3332224,"BROOKLYN","748","HENRY STREET","A2","MH","ISSUED","04/06/2023","04/01/2024",2021-02-26,40.675409,-74.003612
"2088",3332221,"BROOKLYN","465","COLUMBIA STREET","A2","MH","ISSUED","04/06/2023","04/01/2024",2021-08-02,40.676375,-74.006861
"2089",1036505,"MANHATTAN","425","PARK AVENUE","A2","OT","ISSUED","04/06/2023","04/20/2024",2021-02-25,40.760512,-73.971541
"2090",1036505,"MANHATTAN","425","PARK AVENUE","A2","OT","ISSUED","04/06/2023","04/20/2024",2021-02-03,40.760512,-73.971541
"2091",3332217,"BROOKLYN","92","CENTRE MALL","A2","MH","ISSUED","04/06/2023","04/01/2024",2020-06-29,40.674833,-74.003558
"2092",3332224,"BROOKLYN","748","HENRY STREET","A2","MH","ISSUED","04/06/2023","04/01/2024",2020-06-26,40.675409,-74.003612
"2093",3398454,"BROOKLYN","8","GRAND AVENUE","A1","PL","ISSUED","04/06/2023","04/05/2024",2022-11-02,40.697354,-73.964813
"2094",3144156,"BROOKLYN","333","65TH STREET","A2","MH","ISSUED","04/06/2023","09/13/2023",2023-04-06,40.638827,-74.022721
"2095",1079647,"MANHATTAN","83","CANAL STREET","A1","","ISSUED","04/06/2023","03/21/2024",2020-06-17,40.71529,-73.99315
"2096",1076225,"MANHATTAN","25","CPW","A2","OT","ISSUED","03/18/2022","03/20/2024",2020-07-20,40.770148,-73.9804
"2097",2052147,"BRONX","2560","HERING AVENUE","A2","OT","ISSUED","06/23/2023","11/22/2023",2023-06-23,40.863847,-73.853868
"2098",1090748,"MANHATTAN","34","EAST 51ST STREET","A2","OT","ISSUED","04/07/2023","04/20/2024",2022-04-27,40.758303,-73.974722
"2099",4070070,"QUEENS","84-10","PENELOPE AVENUE","A2","OT","ISSUED","04/07/2023","04/21/2023",2023-04-07,40.721796,-73.869512
"2100",4623369,"QUEENS","25-81","31ST STREET","DM","","ISSUED","04/07/2023","05/01/2023",2023-04-07,40.769624,-73.918571
"2101",4623369,"QUEENS","25-81","31ST STREET","DM","EQ","ISSUED","04/07/2023","04/06/2024",2023-04-07,40.769624,-73.918571
"2102",1091010,"MANHATTAN","270","PARK AVENUE","A2","EQ","ISSUED","03/19/2020","06/09/2021",2020-06-09,40.755641,-73.975109
"2103",1091010,"MANHATTAN","270","PARK AVENUE","A2","OT","ISSUED","06/09/2020","01/31/2021",2020-06-09,40.755641,-73.975109
"2104",1091010,"MANHATTAN","270","PARK AVENUE","A2","OT","RE-ISSUED","08/27/2020","07/01/2021",2020-09-04,40.755641,-73.975109
"2105",1091010,"MANHATTAN","270","PARK AVENUE","A2","OT","RE-ISSUED","08/27/2020","07/01/2021",2020-09-04,40.755641,-73.975109
"2106",1091010,"MANHATTAN","270","PARK AVENUE","A2","OT","RE-ISSUED","08/27/2020","07/01/2021",2020-09-04,40.755641,-73.975109
"2107",1091010,"MANHATTAN","270","PARK AVENUE","A2","EQ","ISSUED","06/18/2021","06/18/2022",2020-06-09,40.755641,-73.975109
"2108",1091010,"MANHATTAN","270","PARK AVENUE","A2","OT","ISSUED","07/01/2021","07/01/2022",2020-09-04,40.755641,-73.975109
"2109",1091010,"MANHATTAN","270","PARK AVENUE","A2","OT","ISSUED","07/01/2021","07/01/2022",2020-09-04,40.755641,-73.975109
"2110",1091010,"MANHATTAN","270","PARK AVENUE","A2","OT","ISSUED","07/01/2021","07/01/2022",2020-09-04,40.755641,-73.975109
"2111",1091010,"MANHATTAN","270","PARK AVENUE","NB","","ISSUED","10/01/2021","10/01/2022",2021-09-08,40.755641,-73.975109
"2112",1091010,"MANHATTAN","270","PARK AVENUE","NB","PL","ISSUED","11/30/2021","11/30/2022",2021-11-30,40.755641,-73.975109
"2113",1091010,"MANHATTAN","270","PARK AVENUE","NB","","ISSUED","05/03/2022","10/01/2022",2021-09-08,40.755641,-73.975109
"2114",1091010,"MANHATTAN","270","PARK AVENUE","A2","EQ","ISSUED","06/15/2022","06/15/2023",2020-06-09,40.755641,-73.975109
"2115",1091010,"MANHATTAN","270","PARK AVENUE","A2","OT","ISSUED","06/15/2022","07/01/2022",2020-06-09,40.755641,-73.975109
"2116",1091010,"MANHATTAN","270","PARK AVENUE","A2","OT","ISSUED","06/28/2022","06/28/2023",2020-06-09,40.755641,-73.975109
"2117",1091010,"MANHATTAN","270","PARK AVENUE","A2","OT","RE-ISSUED","06/30/2022","06/30/2023",2022-06-30,40.755641,-73.975109
"2118",1091010,"MANHATTAN","270","PARK AVENUE","A2","OT","RE-ISSUED","06/30/2022","06/30/2023",2022-06-30,40.755641,-73.975109
"2119",1091010,"MANHATTAN","270","PARK AVENUE","A2","OT","RE-ISSUED","06/30/2022","06/30/2023",2022-06-30,40.755641,-73.975109
"2120",1091010,"MANHATTAN","270","PARK AVENUE","A2","OT","RE-ISSUED","06/30/2022","06/30/2023",2022-06-30,40.755641,-73.975109
"2121",1091010,"MANHATTAN","270","PARK AVENUE","A2","OT","RE-ISSUED","06/30/2022","06/30/2023",2022-06-30,40.755641,-73.975109
"2122",1091010,"MANHATTAN","270","PARK AVENUE","A2","OT","RE-ISSUED","06/30/2022","06/30/2023",2022-06-30,40.755641,-73.975109
"2123",1091010,"MANHATTAN","270","PARK AVENUE","NB","","ISSUED","09/19/2022","09/19/2023",2021-09-08,40.755641,-73.975109
"2124",1091010,"MANHATTAN","270","PARK AVENUE","NB","PL","ISSUED","10/25/2022","10/25/2023",2021-11-30,40.755641,-73.975109
"2125",1058188,"MANHATTAN","170","WEST 133 STREET","A1","","ISSUED","04/06/2023","12/31/2023",2023-04-07,40.813744,-73.944041
"2126",2077589,"BRONX","2923","SCHURZ AVENUE","A2","OT","ISSUED","04/09/2023","04/01/2024",2022-10-07,40.814728,-73.813922
"2127",3429084,"BROOKLYN","624","METROPOLITAN AVENUE","NB","","ISSUED","06/23/2023","04/09/2024",2022-06-01,40.714156,-73.948301
"2128",4431248,"QUEENS","24-36","93RD STREET","A2","OT","ISSUED","04/23/2021","04/23/2022",2020-07-01,40.765206,-73.876708
"2129",1083026,"MANHATTAN","2","PENN PLAZA","A2","EQ","ISSUED","04/10/2023","04/09/2024",2021-03-23,40.750017,-73.991345
"2130",4139936,"QUEENS","63-28","138TH ST","A2","OT","ISSUED","04/10/2023","10/01/2023",2023-04-10,40.739607,-73.828299
"2131",4260828,"QUEENS","145-01","119 AVENUE","A2","OT","ISSUED","04/10/2023","01/15/2024",2021-11-29,40.678296,-73.79562
"2132",1022581,"MANHATTAN","1","TIMES SQUARE","A2","OT","ISSUED","04/10/2023","11/01/2023",2022-02-18,40.756628,-73.986287
"2133",1022581,"MANHATTAN","1","TIMES SQUARE","A2","OT","ISSUED","04/10/2023","11/01/2023",2022-05-16,40.756628,-73.986287
"2134",3429084,"BROOKLYN","624","METROPOLITAN AVENUE","NB","","ISSUED","04/10/2023","06/29/2023",2022-06-01,40.714156,-73.948301
"2135",1084612,"MANHATTAN","59","HENRY STREET","NB","PL","ISSUED","04/10/2023","04/09/2024",2022-03-31,40.71299,-73.994939
"2136",2065423,"BRONX","3324","EDSON AVENUE","A2","OT","ISSUED","12/21/2023","12/06/2024",2023-12-21,40.87759,-73.837753
"2137",4197654,"QUEENS","97-32","102ND STREET","A2","OT","ISSUED","04/11/2023","11/15/2023",2023-04-11,40.687163,-73.841473
"2138",4167927,"QUEENS","92-24","242ND STREET","A2","OT","ISSUED","04/11/2023","11/15/2023",2023-04-11,40.725708,-73.726319
"2139",4135975,"QUEENS","214-33","35TH AVENUE","A2","MH","ISSUED","04/11/2023","04/01/2024",2022-01-14,40.769536,-73.771148
"2140",3104931,"BROOKLYN","9219","AVENUE B","A2","OT","ISSUED","04/11/2023","04/01/2024",2021-09-10,40.650619,-73.914644
"2141",3426668,"BROOKLYN","960","EAST 23 STREET","A1","","ISSUED","12/21/2023","07/01/2024",2023-03-06,40.627053,-73.953708
"2142",2004303,"BRONX","610","EAST 169TH STREET","A2","OT","ISSUED","04/12/2023","05/01/2024",2020-01-29,40.831387,-73.90213
"2143",2004303,"BRONX","610","EAST 169TH STREET","A2","MH","ISSUED","04/12/2023","05/01/2024",2020-01-29,40.831387,-73.90213
"2144",5038005,"STATEN ISLAND","23","EVANS STREET","A2","OT","ISSUED","04/12/2023","10/01/2023",2023-04-14,40.587972,-74.149654
"2145",3428561,"BROOKLYN","1215","FULTON STREET","NB","","IN PROCESS","04/12/2023","04/11/2024",2022-03-21,40.680609,-73.952845
"2146",1010647,"MANHATTAN","525","6 AVE","DM","EQ","ISSUED","04/12/2023","04/11/2024",2023-04-12,40.737213,-73.996958
"2147",1010647,"MANHATTAN","525","6 AVE","DM","EQ","ISSUED","04/12/2023","04/11/2024",2023-04-12,40.737213,-73.996958
"2148",1010647,"MANHATTAN","525","6 AVE","DM","","ISSUED","04/12/2023","04/11/2024",2023-04-12,40.737213,-73.996958
"2149",2051571,"BRONX","980","MACE AVE","A2","PL","ISSUED","04/12/2023","04/11/2024",2020-02-13,40.863055,-73.859387
"2150",3428561,"BROOKLYN","1215","FULTON STREET","NB","","ISSUED","04/13/2023","04/12/2024",2022-03-21,40.680609,-73.952845
"2151",1033105,"MANHATTAN","215","WEST 84TH STREET","DM","","ISSUED","04/13/2023","04/12/2024",2023-03-06,40.786643,-73.976607
"2152",4006633,"QUEENS","31-48","CRESCENT ST","DM","EQ","ISSUED","04/13/2023","04/12/2024",2023-04-13,40.764528,-73.927364
"2153",4006633,"QUEENS","31-48","CRESCENT ST","DM","","ISSUED","04/13/2023","05/14/2023",2023-04-13,40.764528,-73.927364
"2154",3214080,"BROOKLYN","953","EAST 42ND STREET","A2","OT","ISSUED","04/13/2023","10/01/2023",2023-04-13,40.631595,-73.935954
"2155",1016077,"MANHATTAN","16","EAST 16TH STREET","DM","EQ","ISSUED","04/13/2023","04/12/2024",2021-09-07,40.737122,-73.99218
"2156",3007920,"BROOKLYN","142","2ND STREET","DM","","ISSUED","04/04/2023","11/23/2023",2023-04-13,40.677217,-73.990699
"2157",1083184,"MANHATTAN","176","EAST 115TH STREET","A2","MH","ISSUED","04/14/2023","04/01/2024",2023-02-24,40.797577,-73.94128
"2158",5106483,"STATEN ISLAND","105","HAMILTON AVENUE","A2","MH","ISSUED","04/14/2023","02/22/2024",2021-07-21,40.644735,-74.081222
"2159",4624506,"QUEENS","52-35","74TH STREET","NB","","RE-ISSUED","04/14/2023","04/08/2024",2020-06-30,40.73288,-73.888332
"2160",4624506,"QUEENS","52-35","74TH STREET","NB","","ISSUED","04/14/2023","04/08/2024",2020-06-30,40.73288,-73.888332
"2161",4620900,"QUEENS","72-01","QUEENS BOULEVARD","NB","","ISSUED","04/14/2023","04/01/2024",2021-11-16,40.739401,-73.891208
"2162",4624506,"QUEENS","52-35","74TH STREET","NB","","ISSUED","03/09/2023","04/08/2024",2023-03-09,40.73288,-73.888332
"2163",4439453,"QUEENS","257-01","UNION TURNPIKE","A1","","ISSUED","04/10/2023","08/09/2023",2023-04-14,40.745809,-73.714266
"2164",2002125,"BRONX","360","EAST 166 STREET","A2","OT","ISSUED","04/05/2023","06/08/2023",2023-04-26,40.829551,-73.912695
"2165",3257046,"BROOKLYN","85","NAVY WALK","A2","OT","ISSUED","06/25/2023","06/29/2024",2023-01-25,40.695483,-73.980664
"2166",3257046,"BROOKLYN","85","NAVY WALK","A2","OT","ISSUED","06/25/2023","06/29/2024",2023-01-25,40.695483,-73.980664
"2167",1083394,"MANHATTAN","17","JACKSON STREET","A2","OT","ISSUED","04/17/2023","04/16/2024",2023-04-17,40.713516,-73.98086
"2168",4618544,"QUEENS","147-25","94TH AVENUE","A2","BL","ISSUED","05/06/2021","05/01/2022",2021-03-23,40.699222,-73.806426
"2169",3428561,"BROOKLYN","1215","FULTON STREET","NB","","ISSUED","04/17/2023","04/16/2024",2023-04-17,40.680609,-73.952845
"2170",1079184,"MANHATTAN","224","12TH AVENUE","A3","OT","ISSUED","04/18/2023","02/13/2024",2023-04-18,40.752641,-74.007576
"2171",4042866,"QUEENS","33-16","112 STREET","A1","PL","ISSUED","04/18/2023","04/17/2024",2020-09-03,40.757658,-73.857469
"2172",2004136,"BRONX","581","AUSTIN PLACE","NB","","ISSUED","04/18/2023","04/08/2024",2020-06-29,40.811268,-73.901513
"2173",2004136,"BRONX","581","AUSTIN PLACE","NB","","RE-ISSUED","04/18/2023","04/08/2024",2020-06-29,40.811268,-73.901513
"2174",2004136,"BRONX","581","AUSTIN PLACE","NB","","ISSUED","04/18/2023","04/08/2024",2023-02-09,40.811268,-73.901513
"2175",3323679,"BROOKLYN","90","PIONEER STREET","A2","OT","ISSUED","04/18/2023","06/12/2023",2023-04-18,40.678208,-74.009983
"2176",3429047,"BROOKLYN","461","FULTON STREET","NB","","ISSUED","04/19/2021","06/20/2021",2021-04-21,40.691254,-73.986817
"2177",4064273,"QUEENS","60-68","74TH STREET","A2","OT","ISSUED","04/18/2023","11/15/2023",2023-04-28,40.7227,-73.886192
"2178",4281386,"QUEENS","221-26","MERRICK BOULEVARD","A2","PL","ISSUED","05/04/2021","05/04/2022",2020-05-27,40.678395,-73.747276
"2179",4209632,"QUEENS","166-20","90 AVE","NB","","ISSUED","04/19/2023","04/18/2024",2023-02-10,40.70729,-73.794633
"2180",3244226,"BROOKLYN","2236","EAST 63RD STREET","A1","","ISSUED","06/26/2023","10/17/2023",2021-04-14,40.61377,-73.910697
"2181",2017194,"BRONX","216","EAST 201 STREET","A2","OT","ISSUED","06/26/2023","07/01/2023",2023-06-26,40.872477,-73.886474
"2182",2046670,"BRONX","3121","WILLOW LANE","A2","OT","ISSUED","04/19/2023","04/18/2024",2023-04-19,40.849481,-73.829469
"2183",3115866,"BROOKLYN","601","PARKSIDE AVENUE","A2","PL","ISSUED","04/19/2023","04/18/2024",2021-09-08,40.656046,-73.953742
"2184",3328167,"BROOKLYN","779","FLATBUSH AVENUE","A1","","ISSUED","04/19/2023","04/27/2024",2021-11-24,40.653853,-73.959495
"2185",3126303,"BROOKLYN","401","EAST 8 STREET","A2","OT","ISSUED","04/19/2023","08/09/2023",2021-03-03,40.640242,-73.971005
"2186",1079184,"MANHATTAN","224","12TH AVENUE","A3","OT","ISSUED","04/20/2023","02/13/2024",2023-04-20,40.752641,-74.007576
"2187",1079184,"MANHATTAN","224","12TH AVENUE","A3","OT","ISSUED","04/20/2023","02/13/2024",2023-04-20,40.752641,-74.007576
"2188",1079184,"MANHATTAN","224","12TH AVENUE","A3","OT","ISSUED","04/20/2023","02/13/2024",2023-04-20,40.752641,-74.007576
"2189",1079184,"MANHATTAN","224","12TH AVENUE","A3","OT","ISSUED","04/20/2023","02/13/2024",2023-04-20,40.752641,-74.007576
"2190",1079184,"MANHATTAN","224","12TH AVENUE","A3","OT","ISSUED","04/20/2023","02/13/2024",2023-04-20,40.752641,-74.007576
"2191",1079184,"MANHATTAN","224","12TH AVENUE","A3","OT","ISSUED","04/20/2023","02/13/2024",2023-04-20,40.752641,-74.007576
"2192",1079184,"MANHATTAN","224","12TH AVENUE","A3","OT","ISSUED","04/20/2023","02/13/2024",2023-04-20,40.752641,-74.007576
"2193",1079184,"MANHATTAN","224","12TH AVENUE","A3","OT","ISSUED","04/20/2023","02/13/2024",2023-04-20,40.752641,-74.007576
"2194",1079184,"MANHATTAN","224","12TH AVENUE","A3","OT","ISSUED","04/20/2023","02/13/2024",2023-04-20,40.752641,-74.007576
"2195",1079184,"MANHATTAN","224","12TH AVENUE","A3","OT","ISSUED","04/20/2023","02/13/2024",2023-04-20,40.752641,-74.007576
"2196",1079184,"MANHATTAN","224","12TH AVENUE","A3","OT","ISSUED","04/20/2023","02/13/2024",2023-04-20,40.752641,-74.007576
"2197",3335129,"BROOKLYN","63","FLUSHING AVENUE","A2","OT","ISSUED","04/20/2023","04/01/2024",2021-03-01,40.69802,-73.974986
"2198",2129342,"BRONX","1746","ANDREWS AVE SO","NB","","ISSUED","04/20/2023","01/01/2024",2022-03-25,40.85037,-73.917222
"2199",2129342,"BRONX","1746","ANDREWS AVE SO","NB","","ISSUED","04/20/2023","01/01/2024",2022-03-22,40.85037,-73.917222
"2200",2129342,"BRONX","1746","ANDREWS AVE SO","NB","","ISSUED","04/20/2023","01/01/2024",2022-03-22,40.85037,-73.917222
"2201",4623835,"QUEENS","36-45","31ST STREET","NB","","ISSUED","04/20/2023","09/02/2023",2021-05-07,40.755831,-73.930348
"2202",1012329,"MANHATTAN","525","WEST 22ND STREET","A2","OT","ISSUED","04/20/2023","05/01/2024",2020-03-11,40.747459,-74.005673
"2203",4619732,"QUEENS","46-11","QUEENS BOULEVARD","NB","","ISSUED","04/19/2023","07/02/2023",2020-05-21,40.74314,-73.918488
"2204",2013297,"BRONX","2075","WEBSTER AVENUE","NB","","ISSUED","04/21/2023","04/01/2024",2023-04-21,40.851741,-73.898493
"2205",2013297,"BRONX","2075","WEBSTER AVENUE","NB","PL","ISSUED","04/21/2023","04/20/2024",2023-04-21,40.851741,-73.898493
"2206",2013297,"BRONX","2075","WEBSTER AVENUE","NB","PL","ISSUED","04/21/2023","04/20/2024",2023-04-21,40.851741,-73.898493
"2207",5170425,"STATEN ISLAND","88","TYRRELL ST","A2","OT","ISSUED","04/21/2023","04/20/2024",2023-04-21,40.513017,-74.249128
"2208",3125328,"BROOKLYN","442","E THIRD ST","A2","OT","ISSUED","04/21/2023","04/20/2024",2023-04-21,40.641163,-73.976993
"2209",1090883,"MANHATTAN","378","WEST END AVENUE","A1","","ISSUED","04/21/2023","07/31/2023",2020-06-02,40.783559,-73.981721
"2210",4200687,"QUEENS","101-29","121ST ST","A2","OT","ISSUED","04/21/2023","04/20/2024",2023-04-21,40.690211,-73.823739
"2211",4073505,"QUEENS","62-62","ELLWELL CRESCENT","A1","","ISSUED","04/23/2023","10/08/2023",2021-04-07,40.724414,-73.864842
"2212",5069403,"STATEN ISLAND","1383","ARDEN AVE","A2","OT","ISSUED","04/24/2023","03/01/2024",2023-04-24,40.53749,-74.167271
"2213",4261232,"QUEENS","120-35","142 STREET","A2","OT","ISSUED","06/17/2021","11/15/2021",2021-06-17,40.675991,-73.799178
"2214",4623369,"QUEENS","25-81","31ST STREET","DM","","ISSUED","04/24/2023","05/01/2023",2023-04-07,40.769624,-73.918571
"2215",3429227,"BROOKLYN","65","DUPONT STREET","NB","PL","ISSUED","06/26/2023","06/25/2024",2023-06-26,40.735668,-73.957396
"2216",4437366,"QUEENS","48-11","48TH STREET","DM","EQ","ISSUED","04/25/2023","04/24/2024",2023-04-25,40.738806,-73.91766
"2217",4437366,"QUEENS","48-11","48TH STREET","DM","","ISSUED","04/25/2023","01/28/2024",2023-04-25,40.738806,-73.91766
"2218",4125614,"QUEENS","47-28","167 STREET","A2","OT","ISSUED","04/25/2023","06/01/2023",2023-04-25,40.749795,-73.800717
"2219",3336666,"BROOKLYN","34","VAN DYKE STREET","A2","OT","IN PROCESS","05/07/2021","",2020-08-07,40.673841,-74.012008
"2220",3054140,"BROOKLYN","275","PARK AVE","A2","OT","ISSUED","04/25/2023","04/02/2024",2020-10-27,40.696012,-73.967562
"2221",1013637,"MANHATTAN","341","WEST 38TH STREET","A1","","ISSUED","04/11/2023","04/24/2024",2021-10-25,40.755237,-73.992864
"2222",1090459,"MANHATTAN","255","WEST 34 STREET","A3","EQ","ISSUED","04/26/2023","04/25/2024",2020-11-12,40.751823,-73.992569
"2223",4598428,"QUEENS","101-12","158TH AVENUE","A2","OT","ISSUED","04/26/2023","04/01/2024",2023-02-15,40.661937,-73.832641
"2224",1047942,"MANHATTAN","1276","LEXINGTON AVENUE","A1","","ISSUED","04/26/2023","03/09/2024",2021-02-03,40.779339,-73.955714
"2225",4000548,"QUEENS","46-01","21 STREET","A2","OT","ISSUED","04/26/2023","05/01/2024",2021-03-18,40.745872,-73.948093
"2226",4000548,"QUEENS","46-01","21 STREET","A2","MH","ISSUED","04/26/2023","05/01/2024",2021-03-18,40.745872,-73.948093
"2227",1030307,"MANHATTAN","537","WEST 59TH ST","DM","","ISSUED","04/26/2023","04/25/2024",2023-03-13,40.77091,-73.988768
"2228",1030307,"MANHATTAN","537","WEST 59TH ST","DM","EQ","ISSUED","04/26/2023","04/25/2024",2023-03-13,40.77091,-73.988768
"2229",4300854,"QUEENS","29-23","OCEAN CREST BLVD.","A2","OT","ISSUED","04/26/2023","10/01/2023",2023-04-26,40.600271,-73.764771
"2230",1007953,"MANHATTAN","152","MERCER STREET","A2","OT","ISSUED","04/26/2023","04/26/2024",2021-06-17,40.725051,-73.998221
"2231",2028402,"BRONX","1181","EAST 178 STREET","A2","OT","ISSUED","04/26/2023","12/11/2023",2023-04-26,40.839266,-73.874963
"2232",4531919,"QUEENS","2538","BEACH CHANNEL DR","A2","OT","ISSUED","04/26/2023","04/21/2024",2023-04-26,40.600442,-73.762383
"2233",1060053,"MANHATTAN","141","WEST 139TH STREET","A2","OT","ISSUED","04/26/2023","04/25/2024",2020-06-22,40.817599,-73.941227
"2234",4226985,"QUEENS","92-18","216 STREET","A2","OT","ISSUED","04/24/2023","11/15/2023",2023-04-26,40.721872,-73.742386
"2235",1091823,"MANHATTAN","3","SAINT MARKS PLACE","NB","PL","ISSUED","04/27/2023","04/26/2024",2023-04-27,40.729379,-73.989475
"2236",2057045,"BRONX","800","EAST GUN HILL ROAD","A2","MH","ISSUED","04/27/2023","04/26/2024",2021-11-22,40.875953,-73.86197
"2237",1052384,"MANHATTAN","232","EAST 103RD STREET","A2","PL","ISSUED","04/27/2023","04/26/2024",2022-04-05,40.788952,-73.944538
"2238",3426347,"BROOKLYN","689","FRANKLIN AVE","NB","PL","ISSUED","09/15/2023","09/14/2024",2022-05-11,40.674915,-73.956422
"2239",4203273,"QUEENS","107-48","111 STREET","A2","OT","ISSUED","04/28/2023","04/21/2024",2023-04-28,40.682074,-73.829836
"2240",4623739,"QUEENS","2-21","MALT DRIVE","A3","EQ","ISSUED","04/28/2023","04/27/2024",2023-04-28,NA,NA
"2241",2057045,"BRONX","800","EAST GUN HILL ROAD","A2","OT","ISSUED","04/28/2023","04/20/2024",2021-11-22,40.875953,-73.86197
"2242",3145672,"BROOKLYN","6901","3 AVENUE","A2","PL","ISSUED","05/01/2023","04/30/2024",2023-05-01,40.635607,-74.026078
"2243",4619732,"QUEENS","46-11","QUEENS BOULEVARD","NB","","ISSUED","05/01/2023","07/02/2023",2020-05-21,40.74314,-73.918488
"2244",4059011,"QUEENS","58-98","54 STREET","NB","PL","ISSUED","05/01/2023","04/30/2024",2020-03-03,40.718048,-73.914904
"2245",5104468,"STATEN ISLAND","4855","HYLAN BOULEVARD","A1","","ISSUED","05/01/2023","01/19/2024",2021-11-26,40.526708,-74.167895
"2246",3117258,"BROOKLYN","2700","CHURCH AVE","DM","","ISSUED","05/01/2023","08/16/2024",2022-06-03,40.650669,-73.952304
"2247",2057045,"BRONX","800","EAST GUN HILL ROAD","A2","OT","ISSUED","05/01/2023","04/20/2024",2021-11-22,40.875953,-73.86197
"2248",2053834,"BRONX","2721","COLDEN AVENUE","NB","","ISSUED","09/15/2023","05/12/2024",2023-09-15,40.866003,-73.859608
"2249",2071870,"BRONX","4750","WHITE PLAINS RD","DM","EQ","ISSUED","05/01/2023","04/30/2024",2023-05-01,40.904834,-73.849625
"2250",3082389,"BROOKLYN","411","THATFORD AVE.","A2","BL","ISSUED","05/01/2023","04/30/2024",2020-02-24,40.660306,-73.907355
"2251",2071870,"BRONX","4750","WHITE PLAINS RD","DM","","ISSUED","05/01/2023","04/27/2024",2023-05-01,40.904834,-73.849625
"2252",2826970,"BRONX","334","EAST 176TH STREET","NB","","ISSUED","05/01/2023","02/22/2024",2022-04-27,40.847527,-73.903028
"2253",2826970,"BRONX","334","EAST 176TH STREET","NB","","ISSUED","05/01/2023","02/22/2024",2022-04-27,40.847527,-73.903028
"2254",2826970,"BRONX","334","EAST 176TH STREET","NB","","ISSUED","05/01/2023","02/22/2024",2022-04-27,40.847527,-73.903028
"2255",2053834,"BRONX","2721","COLDEN AVENUE","NB","","ISSUED","09/15/2023","05/12/2024",2023-09-15,40.866003,-73.859608
"2256",4232069,"QUEENS","9946","BELLAIRE PLACE","A2","OT","ISSUED","05/02/2023","04/21/2024",2023-05-02,40.7123,-73.750257
"2257",3016952,"BROOKLYN","520","17 STREET","NB","PL","ISSUED","05/02/2023","05/01/2024",2020-07-27,40.657783,-73.981482
"2258",3000605,"BROOKLYN","275","ATLANTIC AVENUE","DM","EQ","ISSUED","05/02/2023","05/01/2024",2023-05-02,40.688896,-73.989969
"2259",3000605,"BROOKLYN","275","ATLANTIC AVENUE","DM","","ISSUED","05/02/2023","07/01/2023",2023-05-02,40.688896,-73.989969
"2260",4237202,"QUEENS","114-21","210TH  STREET","A2","OT","ISSUED","05/02/2023","10/01/2023",2023-05-02,40.701929,-73.744746
"2261",2010963,"BRONX","1759","WEST FARMS ROAD","DM","","ISSUED","05/02/2023","05/01/2024",2023-05-02,40.835617,-73.882168
"2262",4079271,"QUEENS","82-77","116 STREET","NB","","ISSUED","05/02/2023","05/08/2024",2021-12-17,40.707094,-73.836484
"2263",3193844,"BROOKLYN","2255","EAST 2 STREET","A1","","ISSUED","05/02/2023","02/06/2024",2020-03-03,40.594189,-73.969016
"2264",4623683,"QUEENS","81-07","KEW GARDENS ROAD","A3","OT","ISSUED","06/27/2023","04/01/2024",2023-06-27,40.712925,-73.829706
"2265",5071159,"STATEN ISLAND","270","BROOKFIELD AVE","A2","OT","ISSUED","05/03/2023","03/01/2024",2023-05-03,40.557875,-74.158379
"2266",3426233,"BROOKLYN","559","PARK AVENUE","A2","SP","ISSUED","06/27/2023","06/26/2024",2023-06-27,40.697144,-73.953529
"2267",3426233,"BROOKLYN","559","PARK AVENUE","A2","SD","ISSUED","06/27/2023","06/26/2024",2023-06-27,40.697144,-73.953529
"2268",3425955,"BROOKLYN","2286","CROPSEY AVENUE","NB","PL","ISSUED","05/03/2023","05/04/2024",2020-12-21,40.595843,-73.997001
"2269",5021572,"STATEN ISLAND","90","HEWITT AVE","A2","OT","ISSUED","05/04/2023","10/01/2023",2023-05-08,40.607836,-74.099678
"2270",3225504,"BROOKLYN","39","PAERDEGAT 4TH STREET","A1","PL","ISSUED","05/04/2023","05/03/2024",2020-12-16,40.631671,-73.910039
"2271",1088749,"MANHATTAN","1","MADISON AVE","A3","EQ","ISSUED","05/04/2023","05/03/2024",2022-05-05,40.740909,-73.987947
"2272",1088749,"MANHATTAN","1","MADISON AVE","A3","EQ","ISSUED","05/04/2023","05/03/2024",2022-05-10,40.740909,-73.987947
"2273",2118546,"BRONX","3420 GAR","GILES PLACE","DM","","ISSUED","05/04/2023","05/03/2024",2023-05-04,40.880469,-73.897563
"2274",4155261,"QUEENS","75-51","195 STREET","A1","","ISSUED","05/04/2023","06/03/2023",2022-06-22,40.731712,-73.776279
"2275",3058228,"BROOKLYN","111","WILLOUGHBY STREET","NB","","ISSUED","05/05/2023","05/04/2024",2022-04-28,40.69214,-73.984628
"2276",3225504,"BROOKLYN","39","PAERDEGAT 4TH STREET","A1","","ISSUED","05/05/2023","09/09/2023",2020-12-08,40.631671,-73.910039
"2277",5059083,"STATEN ISLAND","166","DALTON AVENUE","A2","OT","ISSUED","05/05/2023","10/01/2023",2023-05-15,40.571025,-74.127843
"2278",3082114,"BROOKLYN","166","LIVONIA AVE","NB","","ISSUED","05/07/2023","05/02/2024",2021-12-30,40.662096,-73.91193
"2279",3326746,"BROOKLYN","2700","ATLANTIC AVENUE","NB","","ISSUED","05/08/2023","05/07/2024",2023-05-08,40.675937,-73.894603
"2280",3335882,"BROOKLYN","172","CADMAN PLAZA EAST","A2","OT","ISSUED","05/08/2023","05/14/2024",2020-02-19,40.698511,-73.989906
"2281",3039744,"BROOKLYN","91","RALPH AVENUE","A3","EQ","ISSUED","05/08/2023","05/07/2024",2021-05-06,40.686912,-73.923501
"2282",4129149,"QUEENS","163-64","22ND AVE","A2","OT","ISSUED","05/08/2023","04/27/2024",2023-05-08,40.777325,-73.798894
"2283",4127825,"QUEENS","53-28","190 STREET","A2","OT","ISSUED","05/08/2023","10/01/2023",2023-05-08,40.745851,-73.78704
"2284",4281560,"QUEENS","136-28","220TH ST","A2","OT","ISSUED","05/08/2023","04/21/2024",2023-05-08,40.676232,-73.751236
"2285",2130622,"BRONX","97","WEST 169 STREET","NB","","ISSUED","06/27/2023","04/30/2024",2023-06-27,40.839538,-73.923177
"2286",2130622,"BRONX","97","WEST 169 STREET","NB","","ISSUED","06/27/2023","04/30/2024",2023-06-27,40.839538,-73.923177
"2287",3027721,"BROOKLYN","819","DEAN STREET","A1","","ISSUED","06/26/2023","02/25/2024",2027-08-30,40.679133,-73.962862
"2288",3058228,"BROOKLYN","111","WILLOUGHBY STREET","NB","","ISSUED","05/05/2023","05/08/2024",2022-04-28,40.69214,-73.984628
"2289",3153881,"BROOKLYN","650","86TH STREET","A2","SD","ISSUED","05/10/2023","05/09/2024",2023-05-10,40.618851,-74.021875
"2290",3153881,"BROOKLYN","650","86TH STREET","A2","SP","ISSUED","05/10/2023","05/09/2024",2023-05-10,40.618851,-74.021875
"2291",4079271,"QUEENS","82-77","116TH STREET","A2","OT","ISSUED","05/10/2023","08/31/2023",2023-05-10,40.707094,-73.836484
"2292",4021856,"QUEENS","22-28","75 STREET","A2","OT","ISSUED","05/10/2023","10/21/2023",2023-05-10,40.767862,-73.894245
"2293",1013637,"MANHATTAN","341","WEST 38TH STREET","A1","PL","ISSUED","05/10/2023","05/09/2024",2022-05-12,40.755237,-73.992864
"2294",4623835,"QUEENS","36-45","31ST STREET","NB","","ISSUED","09/15/2023","12/18/2023",2021-05-07,40.755831,-73.930348
"2295",1079184,"MANHATTAN","224","12TH AVENUE","A2","OT","ISSUED","05/10/2023","02/13/2024",2021-02-05,40.752641,-74.007576
"2296",1083464,"MANHATTAN","1809","3 AVENUE","A2","OT","ISSUED","05/11/2023","05/15/2024",2022-11-30,40.787957,-73.947298
"2297",3092104,"BROOKLYN","150","CHESTNUT STREET","DM","","ISSUED","05/11/2023","03/03/2024",2023-05-11,40.684144,-73.875719
"2298",2092082,"BRONX","3603","THIRD AVENUE","A2","OT","ISSUED","05/11/2023","05/15/2024",2021-02-19,40.83308,-73.904809
"2299",2092082,"BRONX","3603","THIRD AVENUE","A2","OT","ISSUED","05/11/2023","05/15/2024",2021-02-19,40.83308,-73.904809
"2300",1044694,"MANHATTAN","337","EAST 64 STREET","A3","EQ","ISSUED","06/28/2023","06/27/2024",2023-06-28,40.763336,-73.961093
"2301",3429047,"BROOKLYN","461","FULTON STREET","NB","","ISSUED","05/11/2023","03/26/2024",2021-04-21,40.691254,-73.986817
"2302",2002729,"BRONX","1057","SHERIDAN AVE","A2","OT","ISSUED","05/12/2023","04/25/2024",2023-05-12,40.830596,-73.918804
"2303",3150481,"BROOKLYN","7805","7 AVENUE","A2","OT","ISSUED","05/12/2023","01/21/2024",2023-05-12,40.624173,-74.018732
"2304",3150481,"BROOKLYN","7805","7 AVENUE","A2","PL","ISSUED","05/12/2023","05/11/2024",2023-05-12,40.624173,-74.018732
"2305",4155064,"QUEENS","75-59","188 STREET","DM","","RE-ISSUED","05/12/2023","11/17/2023",2023-05-12,40.73013,-73.781588
"2306",4220988,"QUEENS","10541","189TH ST","A2","OT","ISSUED","05/12/2023","04/21/2024",2023-05-12,40.704903,-73.767828
"2307",4268133,"QUEENS","170-26","118 AVENUE","A2","OT","ISSUED","05/12/2023","04/21/2024",2023-05-12,40.685706,-73.775712
"2308",1048080,"MANHATTAN","155","EAST 88 STREET","A3","EQ","ISSUED","05/13/2023","05/12/2024",2023-05-13,40.78059,-73.954107
"2309",1000828,"MANHATTAN","63","WALL STREET","A2","PL","ISSUED","05/15/2023","05/14/2024",2020-08-22,40.705843,-74.008516
"2310",1000828,"MANHATTAN","63","WALL STREET","A2","PL","ISSUED","05/16/2023","05/15/2024",2020-08-27,40.705843,-74.008516
"2311",4618910,"QUEENS","35-32","LEAVITT STREET","NB","","ISSUED","05/16/2023","09/01/2023",2020-09-29,40.764245,-73.828835
"2312",2129483,"BRONX","2680","MORRIS AVENUE","NB","","ISSUED","05/16/2023","06/29/2023",2022-06-01,40.867472,-73.895959
"2313",2129483,"BRONX","2680","MORRIS AVENUE","NB","","ISSUED","05/16/2023","06/29/2023",2022-06-01,40.867472,-73.895959
"2314",2129483,"BRONX","2680","MORRIS AVENUE","NB","","ISSUED","05/16/2023","06/29/2023",2022-06-01,40.867472,-73.895959
"2315",3065463,"BROOKLYN","341","KINGSLAND AVE","A1","PL","ISSUED","05/04/2023","05/18/2024",2023-05-19,40.728574,-73.942139
"2316",5855252,"STATEN ISLAND","35","VAN DUZER STREET","NB","","ISSUED","05/18/2021","04/29/2022",2021-05-21,40.637291,-74.077682
"2317",4271570,"QUEENS","117-12","193RD STREET","A1","","ISSUED","05/17/2023","04/30/2024",2023-02-09,40.692354,-73.758406
"2318",4271570,"QUEENS","117-12","193RD STREET","A1","","ISSUED","05/17/2023","04/30/2024",2023-02-09,40.692354,-73.758406
"2319",1080458,"MANHATTAN","936","2ND AVE","DM","EQ","ISSUED","05/17/2023","06/19/2024",2023-06-20,40.754632,-73.968688
"2320",1080458,"MANHATTAN","306","EAST 50 STREET","DM","EQ","ISSUED","05/17/2023","06/19/2024",2023-06-20,40.754676,-73.968071
"2321",1080458,"MANHATTAN","932","2ND AVENUE","DM","EQ","ISSUED","05/17/2023","06/14/2024",2023-06-15,40.754536,-73.968757
"2322",1080458,"MANHATTAN","308","EAST 50 STREET","DM","","ISSUED","05/17/2023","04/26/2024",2023-06-20,40.754662,-73.968039
"2323",2016216,"BRONX","160","VAN CORTLANDT PARK SOUTH","DM","EQ","ISSUED","05/17/2023","05/16/2024",2023-05-17,40.886123,-73.897619
"2324",1080458,"MANHATTAN","306","EAST 50 STREET","DM","","ISSUED","05/17/2023","04/26/2024",2023-06-22,40.754676,-73.968071
"2325",2016216,"BRONX","160","VAN CORTLANDT PARK SOUTH","DM","","ISSUED","05/17/2023","01/28/2024",2023-05-17,40.886123,-73.897619
"2326",1080458,"MANHATTAN","310","EAST 50 STREET","DM","","ISSUED","05/17/2023","04/26/2024",2023-05-26,40.754649,-73.968003
"2327",2110061,"BRONX","171","WEST 239TH STREET","DM","EQ","ISSUED","05/17/2023","05/16/2024",2023-05-17,40.885358,-73.898409
"2328",2110061,"BRONX","171","WEST 239TH STREET","DM","","ISSUED","05/17/2023","01/28/2024",2023-05-17,40.885358,-73.898409
"2329",1089807,"MANHATTAN","76","11TH AVENUE","A3","OT","ISSUED","05/02/2023","08/31/2023",2023-05-17,40.745183,-74.008236
"2330",4271570,"QUEENS","117-12","193RD STREET","A1","","ISSUED","05/16/2023","04/30/2024",2023-03-13,40.692354,-73.758406
"2331",1088888,"MANHATTAN","124","WEST 23 STREET","A1","","ISSUED","05/18/2023","05/17/2024",2023-05-18,40.743287,-73.993724
"2332",4232095,"QUEENS","190-21","103RD AVE","A2","OT","ISSUED","05/18/2023","02/11/2024",2023-05-18,40.707493,-73.766878
"2333",3130812,"BROOKLYN","1650","56 STREET","A2","OT","ISSUED","05/11/2023","08/08/2023",2023-06-07,40.626499,-73.988584
"2334",4623550,"QUEENS","45-43","211 STREET","NB","","ISSUED","05/19/2023","04/24/2024",2021-08-31,40.75851,-73.771258
"2335",3428817,"BROOKLYN","268","BARBEY STREET","A2","SD","ISSUED","05/19/2023","05/18/2024",2022-05-26,40.676365,-73.888452
"2336",4004870,"QUEENS","29-24","40 AVENUE","DM","","ISSUED","05/19/2023","04/26/2024",2023-02-02,40.75217,-73.93534
"2337",3000370,"BROOKLYN","9","DEKALB  AVENUE","A3","EQ","ISSUED","05/19/2023","05/18/2024",2020-06-03,40.689985,-73.98254
"2338",3429327,"BROOKLYN","625","FULTON STREET","NB","","RE-ISSUED","06/28/2023","06/27/2024",2022-08-16,40.688566,-73.980045
"2339",1091775,"MANHATTAN","64","UNIVERSITY PLACE","A3","OT","ISSUED","06/28/2023","03/18/2024",2023-06-28,40.732953,-73.993635
"2340",4066924,"QUEENS","6167","69 LANE","A2","OT","ISSUED","05/20/2023","04/21/2024",2023-05-20,40.719356,-73.887882
"2341",4623739,"QUEENS","2-21","MALT DRIVE","A3","EQ","ISSUED","06/28/2023","06/27/2024",2023-04-28,NA,NA
"2342",4623739,"QUEENS","2-21","MALT DRIVE","A2","EQ","ISSUED","06/28/2023","06/27/2024",2023-05-22,NA,NA
"2343",1081137,"MANHATTAN","14","W 57TH STREET","DM","","ISSUED","06/28/2023","06/26/2024",2023-05-31,40.763282,-73.974742
"2344",1017074,"MANHATTAN","335","5TH AVENUE","DM","EQ","ISSUED","05/22/2023","06/05/2024",2021-05-25,40.74787,-73.984961
"2345",1007729,"MANHATTAN","110","THOMPSON STREET","A2","PL","ISSUED","05/22/2023","05/21/2024",2021-08-30,40.725688,-74.001941
"2346",1007729,"MANHATTAN","110","THOMPSON STREET","A2","BL","ISSUED","05/22/2023","08/01/2023",2021-08-30,40.725688,-74.001941
"2347",3428543,"BROOKLYN","353","20TH STREET","NB","","ISSUED","06/28/2023","06/27/2024",2021-11-05,40.659703,-73.989162
"2348",4623739,"QUEENS","2-21","MALT DRIVE","A2","EQ","ISSUED","05/22/2023","05/21/2024",2023-05-22,NA,NA
"2349",4623739,"QUEENS","2-21","MALT DRIVE","A2","OT","ISSUED","05/22/2023","06/27/2023",2023-05-22,NA,NA
"2350",3429621,"BROOKLYN","875","ERSKINE STREET","NB","","ISSUED","09/26/2022","04/01/2023",2022-09-26,40.656078,-73.86781
"2351",3429621,"BROOKLYN","875","ERSKINE STREET","NB","","ISSUED","09/26/2022","04/01/2023",2022-09-26,40.656078,-73.86781
"2352",3429621,"BROOKLYN","875","ERSKINE STREET","NB","","ISSUED","09/26/2022","04/01/2023",2022-09-26,40.656078,-73.86781
"2353",3429621,"BROOKLYN","875","ERSKINE STREET","NB","","ISSUED","01/26/2023","04/01/2024",2022-09-26,40.656078,-73.86781
"2354",4433860,"QUEENS","104-20","QUEENS BOULEVARD","A2","OT","ISSUED","06/28/2023","07/01/2024",2020-02-19,40.72378,-73.848991
"2355",4433859,"QUEENS","104-60","QUEENS BOULEVARD","A2","OT","ISSUED","06/28/2023","07/01/2024",2020-02-19,40.723485,-73.84849
"2356",4455400,"QUEENS","65-43","PARSONS BLVD","A2","OT","ISSUED","05/23/2023","05/01/2024",2022-06-28,40.735224,-73.810579
"2357",4141809,"QUEENS","136-22","64TH RD","A2","OT","ISSUED","05/23/2023","10/01/2023",2023-05-23,40.73741,-73.829424
"2358",4155261,"QUEENS","75-51","195 STREET","A1","","ISSUED","05/23/2023","06/03/2024",2022-06-22,40.731712,-73.776279
"2359",5855252,"STATEN ISLAND","35","VAN DUZER STREET","NB","","ISSUED","05/23/2023","12/04/2023",2021-05-21,40.637291,-74.077682
"2360",2003157,"BRONX","1182","WOODYCREST AVENUE","A3","EQ","ISSUED","03/18/2024","03/19/2025",2020-09-02,40.836723,-73.924835
"2361",4624278,"QUEENS","130-17","ROCKAWAY BOULEVARD","NB","","ISSUED","05/24/2023","04/01/2024",2023-05-24,40.674977,-73.808245
"2362",4624278,"QUEENS","130-17","ROCKAWAY BOULEVARD","NB","PL","ISSUED","05/24/2023","05/23/2024",2023-05-24,40.674977,-73.808245
"2363",3231550,"BROOKLYN","1393","REMSEN AVE","A2","OT","ISSUED","05/24/2023","10/01/2023",2023-05-24,40.636531,-73.901836
"2364",3429283,"BROOKLYN","763","PARK AVENUE","NB","","ISSUED","05/24/2023","07/23/2023",2021-11-30,40.698136,-73.944805
"2365",1013637,"MANHATTAN","341","WEST 38TH STREET","A1","","ISSUED","05/24/2023","05/23/2024",2021-10-25,40.755237,-73.992864
"2366",4256418,"QUEENS","114-29","149 AVENUE","A2","OT","ISSUED","05/24/2023","10/01/2023",2023-05-24,40.669532,-73.825848
"2367",4451550,"QUEENS","162-5","71ST AVE","A2","OT","ISSUED","05/24/2023","05/01/2024",2022-01-14,40.730433,-73.806956
"2368",2020929,"BRONX","420","BOLTON AVE","A1","","ISSUED","05/24/2023","11/02/2023",2021-10-22,40.81404,-73.857413
"2369",3039905,"BROOKLYN","1510","BROADWAY","NB","","ISSUED","12/22/2023","04/01/2024",2022-08-17,40.686811,-73.917364
"2370",3429283,"BROOKLYN","763","PARK AVENUE","NB","","ISSUED","05/24/2023","07/23/2023",2021-11-30,40.698136,-73.944805
"2371",1083026,"MANHATTAN","2","PENN PLAZA","A1","PL","ISSUED","05/24/2023","05/23/2024",2021-07-02,40.750017,-73.991345
"2372",3429283,"BROOKLYN","763","PARK AVENUE","NB","","ISSUED","05/24/2023","07/23/2023",2021-11-30,40.698136,-73.944805
"2373",2087014,"BRONX","1025","MORRISON AVENUE","A2","PL","ISSUED","12/22/2023","12/21/2024",2022-01-25,40.825403,-73.873666
"2374",1001268,"MANHATTAN","165","WILLIAM STREET","A2","OT","ISSUED","02/07/2023","11/06/2023",2023-07-11,40.710185,-74.005829
"2375",1008832,"MANHATTAN","1","UNIVERSITY PLACE","A2","OT","ISSUED","05/25/2023","06/29/2024",2021-05-21,40.730785,-73.995486
"2376",1004377,"MANHATTAN","270","EAST 2ND STREET","NB","","ISSUED","05/25/2023","11/19/2023",2023-05-25,40.720822,-73.980602
"2377",1004377,"MANHATTAN","270","EAST 2ND STREET","NB","","ISSUED","05/25/2023","11/19/2023",2023-05-25,40.720822,-73.980602
"2378",1084612,"MANHATTAN","59","HENRY STREET","NB","","ISSUED","05/25/2023","06/01/2024",2022-03-30,40.71299,-73.994939
"2379",1017074,"MANHATTAN","335","5TH AVENUE","DM","EQ","ISSUED","05/26/2023","06/19/2024",2021-05-25,40.74787,-73.984961
"2380",3069262,"BROOKLYN","302","GRAHAM AVENUE","NB","","ISSUED","05/26/2023","12/10/2023",2020-02-12,40.712768,-73.944086
"2381",1017074,"MANHATTAN","335","5TH AVENUE","DM","","ISSUED","05/19/2021","04/03/2022",2021-05-25,40.74787,-73.984961
"2382",3007920,"BROOKLYN","142","2ND STREET","DM","","ISSUED","05/26/2023","11/23/2023",2023-04-13,40.677217,-73.990699
"2383",1082792,"MANHATTAN","323","8TH AVENUE","DM","EQ","ISSUED","05/26/2023","05/25/2024",2023-05-26,40.747303,-73.997041
"2384",1082792,"MANHATTAN","323","8TH AVENUE","DM","EQ","ISSUED","05/26/2023","05/25/2024",2023-05-26,40.747303,-73.997041
"2385",1080458,"MANHATTAN","310","EAST 50 STREET","DM","EQ","ISSUED","05/17/2023","05/25/2024",2023-05-26,40.754649,-73.968003
"2386",1080458,"MANHATTAN","310","EAST 50 STREET","DM","EQ","ISSUED","05/17/2023","05/25/2024",2023-05-26,40.754649,-73.968003
"2387",1017074,"MANHATTAN","335","5TH AVENUE","DM","","ISSUED","05/22/2023","04/26/2024",2021-05-25,40.74787,-73.984961
"2388",1080458,"MANHATTAN","932","2ND AVENUE","DM","EQ","ISSUED","05/17/2023","06/14/2024",2023-06-15,40.754536,-73.968757
"2389",3153881,"BROOKLYN","650","86TH STREET","NB","PL","ISSUED","05/30/2023","05/29/2024",2022-10-24,40.618851,-74.021875
"2390",3153881,"BROOKLYN","650","86TH STREET","NB","PL","ISSUED","05/30/2023","05/29/2024",2022-06-16,40.618851,-74.021875
"2391",2053970,"BRONX","2740","LURTING AVENUE","A2","OT","ISSUED","05/30/2023","05/29/2024",2023-05-30,40.86611,-73.856759
"2392",5049760,"STATEN ISLAND","244","EVERGREEN AVENUE","A2","OT","ISSUED","05/30/2023","10/01/2023",2023-06-02,40.59016,-74.085556
"2393",1084051,"MANHATTAN","2518","FREDERICK DOUGLAS BLVD","A2","OT","ISSUED","05/30/2023","04/25/2024",2023-05-30,40.816084,-73.946838
"2394",3016509,"BROOKLYN","511","7TH AVENUE","A2","OT","ISSUED","05/30/2023","05/29/2024",2022-06-28,40.661061,-73.986534
"2395",3016509,"BROOKLYN","511","7TH AVENUE","A2","MH","ISSUED","05/30/2023","05/29/2024",2022-06-28,40.661061,-73.986534
"2396",3117258,"BROOKLYN","2716","CHURCH AVENUE","DM","","ISSUED","02/15/2023","09/02/2023",2023-02-15,40.650671,-73.952181
"2397",1033105,"MANHATTAN","215","WEST 84 STREET","A3","EQ","ISSUED","12/22/2023","12/21/2024",2023-12-22,40.786643,-73.976607
"2398",1091646,"MANHATTAN","212","WEST 124 STREET","NB","","ISSUED","05/31/2023","05/30/2024",2022-12-15,40.808595,-73.949557
"2399",4142453,"QUEENS","135-19","78 ROAD","NB","","ISSUED","05/31/2023","08/11/2023",2022-05-02,40.718783,-73.824681
"2400",2007695,"BRONX","2017","GRAND CONCOURSE","DM","EQ","ISSUED","05/31/2023","06/19/2024",2023-06-20,40.851757,-73.904168
"2401",1081137,"MANHATTAN","14","W 57TH STREET","DM","EQ","ISSUED","05/31/2023","05/30/2024",2023-05-31,40.763282,-73.974742
"2402",1081137,"MANHATTAN","14","W 57TH STREET","DM","","ISSUED","05/31/2023","06/26/2023",2023-05-31,40.763282,-73.974742
"2403",3245130,"BROOKLYN","3161","BRIGHTON 6TH STREET","A2","OT","ISSUED","05/31/2023","07/17/2023",2020-12-15,40.575657,-73.961105
"2404",5070878,"STATEN ISLAND","468","ARTHUR KILL ROAD","A2","OT","ISSUED","06/01/2023","11/15/2023",2023-06-01,40.563054,-74.156566
"2405",1079184,"MANHATTAN","224","12TH AVENUE","A1","","ISSUED","06/01/2023","07/01/2024",2020-09-28,40.752641,-74.007576
"2406",4619737,"QUEENS","137-48","75 ROAD","NB","","ISSUED","06/01/2023","01/01/2024",2020-09-25,40.722757,-73.823011
"2407",1082792,"MANHATTAN","323","8TH AVENUE","DM","","ISSUED","05/26/2023","01/28/2024",2023-06-01,40.747303,-73.997041
"2408",3429356,"BROOKLYN","83","APOLLO STREET","NB","","ISSUED","09/18/2023","12/17/2023",2022-05-23,40.727137,-73.93807
"2409",4624027,"QUEENS","20-50","NAMEOKE AVENUE","NB","","ISSUED","06/02/2023","09/27/2023",2021-12-02,40.607683,-73.75205
"2410",4012201,"QUEENS","25-58","43RD STREET","A1","","ISSUED","06/02/2023","07/16/2023",2021-01-13,40.766414,-73.90964
"2411",3416888,"BROOKLYN","4910","14TH AVENUE","NB","PL","ISSUED","06/02/2023","06/01/2024",2023-06-02,40.633578,-73.990052
"2412",3416888,"BROOKLYN","4910","14TH AVENUE","NB","PL","ISSUED","06/02/2023","06/01/2024",2023-06-02,40.633578,-73.990052
"2413",1091739,"MANHATTAN","40","WEST 137 STREET","NB","","ISSUED","05/31/2023","06/01/2024",2022-12-27,40.814603,-73.938039
"2414",4275059,"QUEENS","118-55","226 STREET","A2","OT","ISSUED","06/03/2023","12/06/2023",2023-06-03,40.691054,-73.736162
"2415",3057705,"BROOKLYN","1084","FULTON STREET","A2","SP","ISSUED","06/29/2023","06/28/2024",2021-05-07,40.681528,-73.957603
"2416",4073667,"QUEENS","6245","BOELSEN CRESCENT","A2","OT","ISSUED","06/29/2023","06/01/2024",2023-06-29,40.724232,-73.86187
"2417",3328167,"BROOKLYN","779","FLATBUSH AVENUE","A1","PL","ISSUED","06/05/2023","06/04/2024",2022-01-17,40.653853,-73.959495
"2418",1028168,"MANHATTAN","36","WEST 66TH STREET","A3","EQ","ISSUED","06/05/2023","06/04/2024",2023-06-05,40.772885,-73.979865
"2419",3115866,"BROOKLYN","601","PARKSIDE AVENUE","A2","OT","ISSUED","06/05/2023","05/13/2024",2021-09-08,40.656046,-73.953742
"2420",1080352,"MANHATTAN","450","11TH AVENUE","NB","","ISSUED","06/05/2023","04/01/2024",2020-07-14,40.757486,-74.000729
"2421",4199876,"QUEENS","9726","125TH STREET","A2","OT","ISSUED","06/05/2023","09/16/2023",2023-06-05,40.692425,-73.821439
"2422",4294507,"QUEENS","164-11","84 STREET","A2","OT","ISSUED","06/05/2023","06/01/2024",2023-06-05,40.649236,-73.846089
"2423",3429356,"BROOKLYN","83","APOLLO STREET","NB","","ISSUED","12/22/2023","02/19/2024",2022-05-23,40.727137,-73.93807
"2424",4290176,"QUEENS","25307","CRAFT AVE","A2","OT","ISSUED","06/29/2023","04/21/2024",2023-06-29,40.649672,-73.736808
"2425",2008836,"BRONX","1750","UNIVERSITY AVENUE","DM","EQ","ISSUED","06/06/2023","06/05/2024",2023-06-06,40.849322,-73.917079
"2426",2003157,"BRONX","1182","WOODYCREST AVENUE","A2","OT","ISSUED","06/06/2023","04/25/2024",2022-11-22,40.836723,-73.924835
"2427",1081114,"MANHATTAN","2130","MADISON AVENUE","A2","OT","ISSUED","06/06/2023","08/03/2024",2020-09-18,40.811232,-73.936648
"2428",2008836,"BRONX","1750","UNIVERSITY AVENUE","DM","","ISSUED","06/06/2023","10/18/2023",2023-06-06,40.849322,-73.917079
"2429",1083026,"MANHATTAN","2","PENN PLAZA","A2","OT","ISSUED","06/06/2023","06/11/2024",2021-03-19,40.750017,-73.991345
"2430",4623202,"QUEENS","35-15","19TH AVENUE","A2","EQ","ISSUED","06/07/2023","06/06/2024",2022-06-15,40.780124,-73.902028
"2431",5106483,"STATEN ISLAND","105","HAMILTON AVENUE","A2","OT","ISSUED","06/07/2023","08/28/2023",2021-07-21,40.644735,-74.081222
"2432",4074378,"QUEENS","85-58","67TH DRIVE","A2","OT","ISSUED","09/18/2023","06/12/2024",2023-09-18,40.716512,-73.859837
"2433",1036505,"MANHATTAN","425","PARK AVENUE","A2","PL","ISSUED","06/29/2023","06/28/2024",2022-07-05,40.760512,-73.971541
"2434",1083026,"MANHATTAN","2","PENN PLAZA","A2","EQ","ISSUED","06/07/2023","06/06/2024",2021-05-06,40.750017,-73.991345
"2435",2021949,"BRONX","2211","CINCINNATUS AVENUE","A2","OT","ISSUED","06/07/2023","12/06/2023",2023-06-07,40.820437,-73.847865
"2436",3246238,"BROOKLYN","250","COLERIDGE STREET","A2","OT","ISSUED","06/07/2023","10/21/2023",2023-06-07,40.575982,-73.949859
"2437",1083026,"MANHATTAN","2","PENN PLAZA","A2","OT","ISSUED","06/07/2023","06/11/2024",2021-05-06,40.750017,-73.991345
"2438",4433918,"QUEENS","2217","HIMROD STREET","A2","OT","ISSUED","06/07/2023","06/06/2024",2023-06-07,40.712111,-73.907716
"2439",2103546,"BRONX","813","EAST 170TH STREET","A2","OT","ISSUED","06/07/2023","09/16/2023",2023-06-07,40.833173,-73.89541
"2440",2119099,"BRONX","700","EXTERIOR STREET","A2","OT","ISSUED","09/18/2023","08/31/2024",2023-09-18,40.823467,-73.931
"2441",2071870,"BRONX","4750","WHITE PLAINS ROAD","NB","","ISSUED","06/07/2023","06/01/2024",2023-06-07,40.904834,-73.849625
"2442",2071870,"BRONX","4750","WHITE PLAINS ROAD","NB","","ISSUED","06/07/2023","06/01/2024",2023-06-07,40.904834,-73.849625
"2443",1036511,"MANHATTAN","660","LEXINGTON AVE","DM","EQ","ISSUED","06/07/2023","06/06/2024",2023-06-07,40.759812,-73.969957
"2444",1036511,"MANHATTAN","660","LEXINGTON AVE","DM","","ISSUED","06/07/2023","04/26/2024",2023-06-07,40.759812,-73.969957
"2445",3428817,"BROOKLYN","268","BARBEY STREET","NB","PL","IN PROCESS","09/18/2023","09/17/2024",2022-04-08,40.676365,-73.888452
"2446",2071870,"BRONX","4750","WHITE PLAINS ROAD","NB","","ISSUED","06/02/2023","06/01/2024",2023-06-07,40.904834,-73.849625
"2447",1052384,"MANHATTAN","232","EAST 103 STREET","A2","PL","ISSUED","06/29/2023","06/28/2024",2020-06-24,40.788952,-73.944538
"2448",3111904,"BROOKLYN","515","EAST 40 STREET","A2","OT","ISSUED","06/08/2023","12/06/2023",2023-06-08,40.642848,-73.93911
"2449",5166607,"STATEN ISLAND","80","SCARBORO AVENUE","NB","PL","ISSUED","06/29/2023","06/28/2024",2021-05-04,40.613706,-74.062592
"2450",3115866,"BROOKLYN","601","PARKSIDE AVENUE","A2","MH","ISSUED","06/08/2023","06/02/2024",2020-02-21,40.656046,-73.953742
"2451",3429327,"BROOKLYN","625","FULTON STREET","NB","","ISSUED","06/08/2023","07/08/2024",2020-11-13,40.688566,-73.980045
"2452",3429327,"BROOKLYN","625","FULTON STREET","NB","","ISSUED","06/08/2023","07/08/2024",2021-03-25,40.688566,-73.980045
"2453",5814491,"STATEN ISLAND","40","PINE STREET","NB","","ISSUED","06/08/2023","01/13/2024",2020-02-03,40.636169,-74.087456
"2454",2009646,"BRONX","1511","FULTON AVENUE","A1","PL","ISSUED","06/29/2023","06/28/2024",2021-05-19,40.836743,-73.900492
"2455",4141155,"QUEENS","15064","58TH AVE","A2","OT","ISSUED","06/09/2023","09/16/2023",2023-06-09,40.742817,-73.816819
"2456",4109043,"QUEENS","3037","150TH STREET","A2","OT","ISSUED","06/09/2023","09/16/2023",2023-06-09,40.771295,-73.815827
"2457",4237169,"QUEENS","114-16","210TH STREET","A2","OT","ISSUED","06/09/2023","04/21/2024",2023-06-09,40.701981,-73.744792
"2458",3202030,"BROOKLYN","1719","AVENUE X","A1","","ISSUED","06/09/2023","06/08/2024",2023-06-09,40.592449,-73.952994
"2459",4286180,"QUEENS","179-02","150TH AVENUE","A2","OT","ISSUED","06/09/2023","04/01/2024",2022-08-01,40.657063,-73.767231
"2460",4166432,"QUEENS","8617","WINCHESTER BOULEVARD","A2","OT","ISSUED","06/10/2023","10/01/2023",2023-06-10,40.732872,-73.735549
"2461",1090459,"MANHATTAN","255","WEST 34 STREET","A3","EQ","ISSUED","06/12/2023","06/11/2024",2020-06-17,40.751823,-73.992569
"2462",4619459,"QUEENS","23-15","44 ROAD","NB","PL","ISSUED","06/12/2023","06/11/2024",2022-08-25,40.748365,-73.944557
"2463",1017074,"MANHATTAN","335","5TH AVENUE","DM","EQ","IN PROCESS","06/12/2023","06/11/2024",2021-05-25,40.74787,-73.984961
"2464",3429247,"BROOKLYN","487","FOURTH AVENUE","NB","","ISSUED","06/09/2023","04/30/2024",2023-06-12,40.668453,-73.990289
"2465",3069960,"BROOKLYN","136","BEADEL STREET","A2","OT","ISSUED","06/13/2023","12/06/2023",2023-06-13,40.722222,-73.935629
"2466",4464276,"QUEENS","300","HILLSIDE AVENUE","NB","","ISSUED","06/13/2023","03/08/2024",2020-10-20,40.56693,-73.891133
"2467",4559238,"QUEENS","25-63","125 STREET","NB","","ISSUED","12/07/2020","12/17/2021",2020-12-17,40.775061,-73.843574
"2468",4559238,"QUEENS","25-63","125 STREET","NB","","ISSUED","12/17/2020","12/17/2021",2020-12-17,40.775061,-73.843574
"2469",4559238,"QUEENS","25-63","125 STREET","NB","PL","ISSUED","09/08/2021","09/08/2022",2021-09-08,40.775061,-73.843574
"2470",4559238,"QUEENS","25-63","125 STREET","NB","","ISSUED","12/05/2021","09/05/2022",2020-12-21,40.775061,-73.843574
"2471",3150481,"BROOKLYN","7805","7 AVENUE","A2","OT","ISSUED","06/14/2023","04/01/2024",2023-06-14,40.624173,-74.018732
"2472",3150481,"BROOKLYN","7805","7 AVENUE","A2","MH","ISSUED","06/14/2023","04/01/2024",2023-06-14,40.624173,-74.018732
"2473",3150481,"BROOKLYN","7805","7 AVENUE","A2","PL","ISSUED","06/14/2023","06/13/2024",2023-06-14,40.624173,-74.018732
"2474",3150481,"BROOKLYN","7805","7 AVENUE","A2","BL","ISSUED","06/14/2023","04/01/2024",2023-06-14,40.624173,-74.018732
"2475",1008003,"MANHATTAN","123","PRINCE STREET","A2","OT","ISSUED","06/14/2021","01/08/2022",2021-02-22,40.725301,-73.999913
"2476",2062163,"BRONX","3032","WICKHAM AVENUE","A2","OT","ISSUED","06/14/2023","07/01/2023",2023-06-14,40.871539,-73.83856
"2477",3157466,"BROOKLYN","7000","21 AVE.","A2","MH","ISSUED","06/14/2023","06/02/2024",2020-06-19,40.612273,-73.986713
"2478",2011872,"BRONX","16","WADE SQUARE","NB","","ISSUED","06/29/2023","09/19/2023",2022-05-31,40.85193,-73.891082
"2479",4211546,"QUEENS","90-44","179 STREET","A1","","ISSUED","06/04/2021","06/11/2022",2020-02-05,40.709432,-73.783016
"2480",5128803,"STATEN ISLAND","119","BILLOP AVENUE","A2","OT","ISSUED","06/15/2023","10/01/2023",2023-06-21,40.499759,-74.240373
"2481",4538599,"QUEENS","10955","209 PL","A2","OT","ISSUED","06/15/2023","04/21/2024",2023-06-15,40.707993,-73.747814
"2482",1091777,"MANHATTAN","740","EIGHTH AVENUE","NB","","ISSUED","06/15/2023","10/01/2023",2022-09-30,40.759546,-73.988095
"2483",3157466,"BROOKLYN","7000","21 AVE.","A2","PL","ISSUED","06/15/2023","06/14/2024",2020-06-19,40.612273,-73.986713
"2484",3079250,"BROOKLYN","107","SCHAEFER ST","DM","","ISSUED","06/15/2023","09/11/2023",2023-06-15,40.68764,-73.909841
"2485",3128762,"BROOKLYN","54","WEBSTER AVE","NB","PL","ISSUED","05/09/2023","06/13/2024",2022-04-26,40.62958,-73.977588
"2486",2009646,"BRONX","1511","FULTON AVENUE","A2","SD","ISSUED","06/29/2023","06/28/2024",2021-06-11,40.836743,-73.900492
"2487",1083026,"MANHATTAN","2","PENN PLAZA","A2","EQ","ISSUED","06/03/2021","06/03/2022",2021-05-06,40.750017,-73.991345
"2488",5159208,"STATEN ISLAND","67","HANOVER AVENUE","A2","OT","ISSUED","06/16/2023","10/01/2023",2023-06-28,40.519408,-74.199456
"2489",3229873,"BROOKLYN","1253","REMSEN AVENUE","A2","OT","ISSUED","09/18/2023","07/01/2024",2023-09-18,40.639149,-73.90475
"2490",1083026,"MANHATTAN","2","PENN PLAZA","A2","OT","ISSUED","06/03/2021","06/11/2022",2021-03-19,40.750017,-73.991345
"2491",4135975,"QUEENS","214-33","35TH AVENUE","A2","PL","ISSUED","09/18/2023","09/17/2024",2021-09-27,40.769536,-73.771148
"2492",3168794,"BROOKLYN","8768","20 AVENUE","A2","OT","ISSUED","06/16/2023","10/21/2023",2023-06-16,40.601143,-74.001865
"2493",2084722,"BRONX","5449","SYLVAN AVENUE","A1","","ISSUED","10/24/2023","12/21/2024",2023-12-22,40.902765,-73.898462
"2494",1088749,"MANHATTAN","1","MADISON AVENUE","A1","","ISSUED","09/18/2023","10/01/2024",2021-01-26,40.740909,-73.987947
"2495",4236272,"QUEENS","191-21","114 DRIVE","A2","OT","ISSUED","06/16/2023","04/21/2024",2023-06-16,40.696733,-73.761455
"2496",5084453,"STATEN ISLAND","878","SHELDON AVENUE","A1","","ISSUED","06/16/2023","06/15/2024",2023-06-16,40.538865,-74.204655
"2497",2011872,"BRONX","16","WADE SQUARE","NB","","ISSUED","09/18/2023","07/01/2024",2022-05-31,40.85193,-73.891082
"2498",4040253,"QUEENS","40-43","97TH STREET","A1","PL","ISSUED","06/16/2023","06/15/2024",2020-02-25,40.748231,-73.867843
"2499",1088749,"MANHATTAN","1","MADISON AVENUE","A3","OT","ISSUED","09/18/2023","10/01/2024",2021-12-03,40.740909,-73.987947
"2500",4276203,"QUEENS","120-04","229 STREET","A2","OT","ISSUED","06/16/2023","12/11/2023",2023-06-16,40.687543,-73.734993
"2501",1080458,"MANHATTAN","932","2ND AVENUE","DM","","ISSUED","05/17/2023","04/26/2024",2023-06-16,40.754536,-73.968757
"2502",1088749,"MANHATTAN","308","PARK AVENUE SOUTH","A3","OT","ISSUED","09/18/2023","10/01/2024",2021-11-29,40.740091,-73.986446
"2503",2009646,"BRONX","1511","FULTON AVENUE","A2","SP","ISSUED","06/29/2023","06/28/2024",2021-06-11,40.836743,-73.900492
"2504",1079184,"MANHATTAN","224","12TH AVENUE","A2","OT","ISSUED","06/30/2023","07/01/2024",2020-09-28,40.752641,-74.007576
"2505",1079184,"MANHATTAN","224","12TH AVENUE","A2","OT","ISSUED","06/30/2023","07/01/2024",2021-01-13,40.752641,-74.007576
"2506",4291913,"QUEENS","241-22","148 DRIVE","A2","OT","ISSUED","09/14/2023","01/22/2024",2023-09-18,40.653272,-73.742474
"2507",3429228,"BROOKLYN","75","DUPONT STREET","NB","PL","ISSUED","12/26/2023","12/25/2024",2023-01-03,40.735698,-73.957082
"2508",2014506,"BRONX","2212","AQUEDUCT AVENUE","DM","EQ","ISSUED","07/03/2023","07/02/2024",2023-07-03,40.858539,-73.907574
"2509",1009531,"MANHATTAN","26","WEST 11TH STREET","A2","OT","ISSUED","07/03/2023","07/01/2024",2022-09-30,40.734468,-73.996103
"2510",1085816,"MANHATTAN","26","BEAVER ST","A2","OT","ISSUED","07/03/2023","07/01/2024",2021-09-20,40.704959,-74.011902
"2511",4042866,"QUEENS","33-16","112 STREET","A1","","ISSUED","07/03/2023","06/23/2024",2020-08-12,40.757658,-73.857469
"2512",5112043,"STATEN ISLAND","165","ADA DRIVE","A2","OT","ISSUED","07/05/2023","10/01/2023",2023-07-08,40.620764,-74.159991
"2513",4253745,"QUEENS","132-45","114 PLACE","A2","OT","ISSUED","07/05/2023","10/01/2023",2023-07-05,40.674158,-73.824592
"2514",4060553,"QUEENS","61-12","56 ROAD","NB","PL","ISSUED","07/05/2023","07/04/2024",2021-04-27,40.724355,-73.903976
"2515",4116436,"QUEENS","46-21","COLDEN STREET","A2","OT","ISSUED","07/05/2023","07/04/2024",2020-03-02,40.749545,-73.822073
"2516",4116436,"QUEENS","46-21","COLDEN STREET","A2","OT","ISSUED","07/05/2023","07/04/2024",2020-11-03,40.749545,-73.822073
"2517",2064138,"BRONX","819","E 230TH ST","A2","OT","ISSUED","07/05/2023","04/21/2024",2023-07-05,40.890173,-73.854834
"2518",1090655,"MANHATTAN","401","WEST STREET","A2","SP","ISSUED","07/05/2023","07/04/2024",2022-07-08,40.733488,-74.01024
"2519",3244226,"BROOKLYN","2236","EAST 63RD STREET","A1","","ISSUED","07/05/2023","04/11/2024",2021-04-14,40.61377,-73.910697
"2520",1090655,"MANHATTAN","401","WEST STREET","A2","SD","ISSUED","07/05/2023","07/04/2024",2022-07-08,40.733488,-74.01024
"2521",3208170,"BROOKLYN","1148","EAST 35 STREET","A2","OT","ISSUED","07/05/2023","12/06/2023",2023-07-12,40.626115,-73.941936
"2522",1028714,"MANHATTAN","145","CENTRAL PARK WEST","A2","OT","ISSUED","06/27/2023","01/12/2024",2023-07-18,40.777819,-73.974801
"2523",3428817,"BROOKLYN","268","BARBEY STREET","NB","PL","ISSUED","09/19/2023","09/18/2024",2022-04-08,40.676365,-73.888452
"2524",5010931,"STATEN ISLAND","110","MARGARETTA COURT","A2","OT","ISSUED","07/06/2023","10/01/2023",2023-07-08,40.617687,-74.129471
"2525",1085735,"MANHATTAN","200","PARK AVENUE","A1","","ISSUED","06/14/2024","06/14/2025",2024-06-14,40.754162,-73.976557
"2526",1043220,"MANHATTAN","106","EAST 78 STREET","A1","","ISSUED","07/06/2023","07/01/2024",2020-10-06,40.774743,-73.960534
"2527",1009242,"MANHATTAN","17","EAST 9TH STREET","A1","PL","ISSUED","07/06/2023","07/05/2024",2022-03-31,40.732434,-73.994916
"2528",5085657,"STATEN ISLAND","41","MARISA CIRCLE","A2","OT","ISSUED","07/06/2023","08/03/2023",2023-07-06,40.538041,-74.216917
"2529",4256979,"QUEENS","149-38","121 ST","A2","OT","ISSUED","07/06/2023","07/01/2024",2023-07-06,40.667629,-73.819833
"2530",4143304,"QUEENS","141-34","71 AVENUE","A2","OT","ISSUED","07/06/2023","03/20/2024",2023-07-06,40.727587,-73.823781
"2531",2129483,"BRONX","2680","MORRIS AVENUE","NB","","ISSUED","07/06/2023","06/29/2024",2022-06-01,40.867472,-73.895959
"2532",2129483,"BRONX","2680","MORRIS AVENUE","NB","","ISSUED","07/06/2023","06/29/2024",2022-06-01,40.867472,-73.895959
"2533",2129483,"BRONX","2680","MORRIS AVENUE","NB","","ISSUED","07/06/2023","06/29/2024",2022-06-01,40.867472,-73.895959
"2534",4135975,"QUEENS","214-33","35TH AVENUE","A2","PL","ISSUED","12/26/2023","12/25/2024",2022-01-14,40.769536,-73.771148
"2535",1091646,"MANHATTAN","212","WEST 124 STREET","NB","","ISSUED","07/06/2023","07/05/2024",2022-12-15,40.808595,-73.949557
"2536",1001405,"MANHATTAN","27","PARK PLACE","A2","OT","ISSUED","07/06/2023","09/21/2023",2023-07-06,40.713116,-74.008931
"2537",1089807,"MANHATTAN","76","11TH AVENUE","A2","MH","ISSUED","06/22/2023","08/31/2023",2023-07-06,40.745183,-74.008236
"2538",2014506,"BRONX","2212","AQUEDUCT AVENUE","DM","","ISSUED","07/05/2023","06/16/2024",2023-07-06,40.858539,-73.907574
"2539",3061859,"BROOKLYN","525","UNION AVE","A3","OT","ISSUED","07/05/2023","02/06/2024",2020-09-21,40.716233,-73.951986
"2540",1011884,"MANHATTAN","557","HUDSON STREET","A1","","ISSUED","07/07/2023","07/19/2024",2021-05-28,40.735429,-74.006037
"2541",4617668,"QUEENS","148-18","HILLSIDE AVE","A2","OT","ISSUED","07/07/2023","07/06/2024",2022-06-02,40.706166,-73.808184
"2542",4617668,"QUEENS","148-18","HILLSIDE AVE","NB","EQ","ISSUED","07/07/2023","07/06/2024",2022-06-07,40.706166,-73.808184
"2543",4617668,"QUEENS","148-18","HILLSIDE AVE","NB","","ISSUED","07/07/2023","07/06/2024",2022-06-10,40.706166,-73.808184
"2544",4617668,"QUEENS","148-18","HILLSIDE AVE","A2","OT","ISSUED","07/07/2023","07/06/2024",2022-06-02,40.706166,-73.808184
"2545",3073331,"BROOKLYN","1061","HART STREET","A2","OT","ISSUED","07/07/2023","06/12/2024",2023-07-07,40.706613,-73.918086
"2546",3428543,"BROOKLYN","353","20TH STREET","A2","SP","ISSUED","07/07/2023","01/07/2025",2024-01-08,40.659703,-73.989162
"2547",4623739,"QUEENS","2-21","MALT DRIVE","A2","OT","ISSUED","07/07/2023","06/27/2024",2023-05-22,NA,NA
"2548",1067116,"MANHATTAN","421","HUDSON STREET","A2","OT","ISSUED","07/07/2023","03/22/2024",2020-11-10,40.730063,-74.006891
"2549",3000605,"BROOKLYN","275","ATLANTIC AVENUE","DM","","ISSUED","07/07/2023","07/01/2024",2023-05-02,40.688896,-73.989969
"2550",1057080,"MANHATTAN","260","RIVERSIDE DRIVE","A2","OT","ISSUED","07/07/2023","02/10/2024",2021-03-10,40.797144,-73.973396
"2551",3016509,"BROOKLYN","511","7TH AVENUE","A2","PL","ISSUED","07/07/2023","07/06/2024",2022-06-28,40.661061,-73.986534
"2552",3255289,"BROOKLYN","2940","WEST 15 STREET","NB","","ISSUED","07/07/2023","04/06/2024",2021-10-14,40.576271,-73.982552
"2553",2091984,"BRONX","1115","PROSPECT AVE","A1","","ISSUED","09/19/2023","09/18/2024",2023-09-19,40.826252,-73.898893
"2554",1080074,"MANHATTAN","40","EAST 4 STREET","A3","OT","ISSUED","07/10/2023","10/20/2023",2023-07-10,40.727337,-73.992073
"2555",1091635,"MANHATTAN","600","WEST 125TH STREET","NB","","ISSUED","12/26/2023","12/25/2024",2020-10-06,40.815974,-73.958569
"2556",3115866,"BROOKLYN","601","PARKSIDE AVENUE","A2","MH","ISSUED","07/10/2023","10/25/2023",2021-10-25,40.656046,-73.953742
"2557",4087481,"QUEENS","63-15","TRAFFIC AVENUE","A2","OT","ISSUED","07/10/2023","02/28/2024",2023-07-10,40.71112,-73.89836
"2558",1058188,"MANHATTAN","170","WEST 133 STREET","A1","","ISSUED","07/10/2023","12/31/2023",2023-04-07,40.813744,-73.944041
"2559",3115866,"BROOKLYN","601","PARKSIDE AVENUE","A2","OT","ISSUED","07/10/2023","10/25/2023",2021-10-25,40.656046,-73.953742
"2560",1091635,"MANHATTAN","600","WEST 125TH STREET","NB","","ISSUED","12/26/2023","12/25/2024",2020-10-06,40.815974,-73.958569
"2561",3378290,"BROOKLYN","2015","BATH AVENUE","A1","PL","ISSUED","07/10/2023","07/09/2024",2020-02-20,40.60116,-74.001116
"2562",3378290,"BROOKLYN","2015","BATH AVENUE","A1","","ISSUED","07/10/2023","04/26/2024",2020-02-20,40.60116,-74.001116
"2563",5863316,"STATEN ISLAND","114","NORTHFIELD AVENUE","NB","","ISSUED","07/10/2023","01/13/2024",2022-10-18,40.637658,-74.168217
"2564",5863316,"STATEN ISLAND","114","NORTHFIELD AVENUE","NB","","ISSUED","07/10/2023","01/13/2024",2022-05-19,40.637658,-74.168217
"2565",2006622,"BRONX","660","CASANOVA STREET","DM","","ISSUED","07/10/2023","05/01/2024",2022-11-17,40.812945,-73.889896
"2566",3201629,"BROOKLYN","3117","AVENUE W","A2","OT","ISSUED","07/10/2023","06/30/2024",2021-11-17,40.596757,-73.933499
"2567",1091635,"MANHATTAN","600","WEST 125TH STREET","NB","","ISSUED","12/26/2023","12/25/2024",2021-02-18,40.815974,-73.958569
"2568",2052250,"BRONX","2411","BOUCK AVENUE","A2","OT","ISSUED","06/20/2023","04/13/2024",2023-07-10,40.861441,-73.850207
"2569",4269398,"QUEENS","176-21","120 AVENUE","A2","OT","ISSUED","06/22/2023","04/13/2024",2023-07-10,40.684542,-73.768793
"2570",3400905,"BROOKLYN","1038","JEFFERSON AVENUE","NB","","ISSUED","09/19/2023","04/25/2024",2022-03-08,40.68739,-73.917085
"2571",3400905,"BROOKLYN","1038","JEFFERSON AVENUE","NB","","ISSUED","09/19/2023","04/25/2024",2022-03-08,40.68739,-73.917085
"2572",3400905,"BROOKLYN","1038","JEFFERSON AVENUE","NB","","ISSUED","09/19/2023","04/25/2024",2022-03-08,40.68739,-73.917085
"2573",4071046,"QUEENS","6546","80TH STREET","A2","OT","ISSUED","07/11/2023","04/21/2024",2023-07-11,40.716949,-73.872256
"2574",3107741,"BROOKLYN","329","CLARKSON AVE","DM","","ISSUED","07/11/2023","05/01/2024",2023-07-11,40.655503,-73.948826
"2575",5052861,"STATEN ISLAND","355","NEW DORP LANE","A2","PL","ISSUED","07/11/2023","07/10/2024",2021-04-23,40.570999,-74.110727
"2576",3429784,"BROOKLYN","1042","ATLANTIC AVENUE","DM","EQ","ISSUED","07/11/2023","07/10/2024",2023-07-11,40.680027,-73.959274
"2577",3429283,"BROOKLYN","763","PARK AVENUE","NB","","ISSUED","07/11/2023","11/18/2023",2021-11-30,40.698136,-73.944805
"2578",4619732,"QUEENS","46-11","QUEENS BOULEVARD","NB","","ISSUED","07/11/2023","08/25/2023",2020-05-21,40.74314,-73.918488
"2579",4244176,"QUEENS","115-67","231ST STREET","A2","OT","ISSUED","07/11/2023","07/01/2024",2023-07-11,40.695154,-73.72898
"2580",1080352,"MANHATTAN","450","11TH AVENUE","A2","EQ","ISSUED","07/11/2023","07/10/2024",2023-07-11,40.757486,-74.000729
"2581",3190662,"BROOKLYN","2296","CONEY ISLAND AVENUE","A1","","ISSUED","06/22/2023","07/10/2024",2104-10-31,40.601087,-73.961414
"2582",4617668,"QUEENS","148-18","HILLSIDE AVE","NB","","ISSUED","07/12/2023","07/11/2024",2022-06-10,40.706166,-73.808184
"2583",3214887,"BROOKLYN","5718","AVENUE H","A2","OT","ISSUED","07/12/2023","04/21/2024",2023-07-12,40.63328,-73.921418
"2584",3144156,"BROOKLYN","333","65TH STREET","A2","BL","ISSUED","07/12/2023","10/28/2023",2023-07-12,40.638827,-74.022721
"2585",1007561,"MANHATTAN","536","BROADWAY","A3","OT","ISSUED","06/09/2021","06/13/2022",2021-01-06,40.723341,-73.998528
"2586",3157466,"BROOKLYN","7000","21 AVE.","A2","OT","ISSUED","07/12/2023","11/15/2023",2020-06-19,40.612273,-73.986713
"2587",5090125,"STATEN ISLAND","50","BENJAMIN PLACE","A2","OT","ISSUED","09/20/2023","09/19/2024",2023-09-28,40.637411,-74.170209
"2588",1028168,"MANHATTAN","36","WEST 66TH STREET","A2","EQ","ISSUED","09/20/2023","09/19/2024",2022-09-20,40.772885,-73.979865
"2589",3039905,"BROOKLYN","1510","BROADWAY","NB","","ISSUED","03/20/2024","06/10/2024",2022-08-17,40.686811,-73.917364
"2590",4007320,"QUEENS","34-22","29TH STREET","A2","OT","ISSUED","07/13/2023","08/31/2023",2023-07-13,40.759953,-73.929243
"2591",4595289,"QUEENS","42-32","149 PLACE","A2","OT","ISSUED","07/13/2023","11/15/2023",2023-07-13,40.759659,-73.813542
"2592",4174576,"QUEENS","8045","252 STREET","A2","OT","ISSUED","07/13/2023","11/15/2023",2023-07-13,40.742396,-73.718081
"2593",4053346,"QUEENS","50-04","48 STREET","A1","","ISSUED","07/13/2023","08/03/2023",2020-06-12,40.737077,-73.918027
"2594",4559238,"QUEENS","25-63GAR","125 STREET","NB","PL","ISSUED","07/13/2023","07/12/2024",2021-09-08,40.775061,-73.843574
"2595",4623202,"QUEENS","35-15","19 AVENUE","NB","","RE-ISSUED","07/13/2023","07/30/2024",2022-01-25,40.780124,-73.902028
"2596",4100478,"QUEENS","25-63","125 STREET","NB","PL","ISSUED","07/13/2023","07/12/2024",2020-12-28,40.775061,-73.843574
"2597",2831766,"BRONX","1163","GARRISON AVENUE","NB","","ISSUED","07/13/2023","09/28/2023",2022-03-29,40.820261,-73.888493
"2598",1031798,"MANHATTAN","101","WEST 79TH STREET","A2","OT","ISSUED","09/17/2019","03/01/2024",2023-07-31,40.782139,-73.975904
"2599",2017421,"BRONX","2702","CRESTON AVENUE","NB","","ISSUED","07/10/2023","07/12/2024",2023-07-13,40.867778,-73.894581
"2600",2128756,"BRONX","2880","EXTERIOR STREET","A2","OT","ISSUED","07/14/2023","05/01/2024",2023-07-14,40.875638,-73.906176
"2601",3335129,"BROOKLYN","63","FLUSHING AVENUE","DM","","ISSUED","09/06/2022","12/31/2023",2023-09-01,40.69802,-73.974986
"2602",3131584,"BROOKLYN","2066","58TH STREET","DM","","ISSUED","07/17/2023","05/10/2024",2023-07-17,40.619521,-73.980048
"2603",3060114,"BROOKLYN","575","BEDFORD AVE","A1","","ISSUED","07/18/2023","01/12/2024",2022-08-25,40.703877,-73.960824
"2604",4623141,"QUEENS","53-16","NORTHERN BOULEVARD","A2","FS","ISSUED","07/18/2023","05/01/2024",2023-07-18,40.753192,-73.907839
"2605",3053387,"BROOKLYN","121","MACDONOUGH ST","A1","","ISSUED","12/26/2023","12/23/2024",2022-05-19,40.681263,-73.941646
"2606",1004377,"MANHATTAN","270","EAST 2ND STREET","NB","","ISSUED","07/18/2023","11/19/2023",2023-05-25,40.720822,-73.980602
"2607",1004377,"MANHATTAN","270","EAST 2ND STREET","NB","","ISSUED","07/18/2023","11/19/2023",2023-05-25,40.720822,-73.980602
"2608",3426233,"BROOKLYN","559","PARK AVENUE","NB","","ISSUED","07/18/2023","07/19/2024",2020-10-27,40.697144,-73.953529
"2609",3426233,"BROOKLYN","559","PARK AVENUE","NB","","ISSUED","07/18/2023","07/19/2024",2020-10-27,40.697144,-73.953529
"2610",3426233,"BROOKLYN","559","PARK AVENUE","NB","","ISSUED","07/18/2023","07/19/2024",2020-10-27,40.697144,-73.953529
"2611",4007659,"QUEENS","30-38","31ST STREET","A1","","ISSUED","07/18/2023","07/21/2024",2022-10-04,40.765993,-73.922132
"2612",3038668,"BROOKLYN","2435","PACIFIC STREET","DM","EQ","ISSUED","07/19/2023","07/18/2024",2023-07-19,40.675235,-73.904872
"2613",4268087,"QUEENS","168-22","119TH AVE","A2","OT","ISSUED","09/20/2023","09/19/2024",2023-09-20,40.683409,-73.776055
"2614",2130622,"BRONX","97","WEST 169 STREET","NB","","ISSUED","07/19/2023","04/30/2024",2023-07-19,40.839538,-73.923177
"2615",1007174,"MANHATTAN","178","MOTT STREET","A1","","ISSUED","07/19/2023","12/08/2023",2020-12-09,40.720429,-73.995923
"2616",3429214,"BROOKLYN","955","STERLING PLACE","NB","PL","ISSUED","07/19/2023","07/18/2024",2022-07-20,40.672347,-73.946733
"2617",3429227,"BROOKLYN","65","DUPONT STREET","NB","PL","ISSUED","06/14/2024","06/14/2025",2023-06-26,40.735668,-73.957396
"2618",2130506,"BRONX","1223","SPOFFORD AVE","NB","","ISSUED","09/20/2023","09/19/2024",2023-08-15,40.813898,-73.890537
"2619",2130506,"BRONX","1223","SPOFFORD AVE","NB","","ISSUED","09/20/2023","09/19/2024",2023-08-15,40.813898,-73.890537
"2620",5032708,"STATEN ISLAND","136","ADA DRIVE","A2","OT","ISSUED","07/20/2023","10/01/2023",2022-05-11,40.620541,-74.15861
"2621",1013637,"MANHATTAN","341","WEST 38TH STREET","A1","","ISSUED","07/20/2023","07/14/2024",2021-10-25,40.755237,-73.992864
"2622",2068344,"BRONX","4160","DIGNEY AVENUE","A2","OT","ISSUED","07/20/2023","12/06/2023",2023-07-20,40.892523,-73.851143
"2623",3391368,"BROOKLYN","2310","PITKIN AVENUE","A2","OT","ISSUED","07/20/2023","04/21/2024",2023-07-20,40.67318,-73.887142
"2624",2058768,"BRONX","951","EAST 213 STREET","A2","OT","ISSUED","06/15/2023","06/15/2024",2023-07-20,40.877329,-73.858008
"2625",3247765,"BROOKLYN","3085","EMMONS AVENUE","DM","","ISSUED","06/12/2023","02/20/2024",2023-07-26,40.584003,-73.936057
"2626",1001289,"MANHATTAN","100","GOLD STREET","A2","OT","ISSUED","06/29/2023","06/29/2024",2021-09-02,40.710353,-74.004007
"2627",1046252,"MANHATTAN","510","EAST 62ND STREET","A1","","ISSUED","09/20/2023","09/19/2024",2023-09-20,40.760459,-73.958196
"2628",3000352,"BROOKLYN","589","FULTON STREET","A2","EQ","ISSUED","07/21/2023","07/20/2024",2023-07-21,40.689027,-73.981217
"2629",3038668,"BROOKLYN","2435","PACIFIC STREET","DM","","ISSUED","07/21/2023","09/11/2023",2023-07-21,40.675235,-73.904872
"2630",5170723,"STATEN ISLAND","4132","VICTORY BOULEVARD","NB","","ISSUED","07/21/2023","03/05/2024",2022-07-28,40.591375,-74.191216
"2631",3023696,"BROOKLYN","270","14 STREET","DM","","ISSUED","07/21/2023","01/14/2024",2023-07-21,40.665854,-73.988173
"2632",3079253,"BROOKLYN","162","COVERT ST","NB","","ISSUED","03/20/2024","03/19/2025",2023-04-19,40.689421,-73.909233
"2633",4257428,"QUEENS","149-51","123RD ST","A2","OT","ISSUED","07/24/2023","10/01/2023",2023-07-24,40.666983,-73.817121
"2634",3073018,"BROOKLYN","1390","WILLOUGHBY AVE","A2","OT","ISSUED","09/20/2023","11/17/2023",2021-07-14,40.707229,-73.919805
"2635",4039603,"QUEENS","94-08","40 DRIVE","A1","PL","ISSUED","07/24/2023","07/23/2024",2022-07-13,40.747508,-73.871782
"2636",4301488,"QUEENS","327","BEACH 31 STREET","A2","OT","ISSUED","07/24/2023","10/21/2023",2023-07-24,40.596366,-73.763956
"2637",4433936,"QUEENS","2214","HIMROD STREET","A2","OT","ISSUED","07/24/2023","10/21/2023",2023-07-24,40.712086,-73.907716
"2638",1036505,"MANHATTAN","425","PARK AVENUE","A2","EQ","ISSUED","07/10/2020","07/10/2021",2020-07-10,40.760512,-73.971541
"2639",2128965,"BRONX","1001","WHITLOCK AVE","NB","EQ","ISSUED","07/05/2023","07/04/2024",2023-07-05,40.823427,-73.887057
"2640",2128965,"BRONX","1001","WHITLOCK AVE","NB","","ISSUED","07/05/2023","07/04/2024",2023-07-05,40.823427,-73.887057
"2641",4133980,"QUEENS","198-23","32 AVENUE","A2","OT","ISSUED","07/25/2023","10/21/2023",2023-07-25,40.769113,-73.791341
"2642",1090459,"MANHATTAN","255","WEST 34TH STREET","NB","","ISSUED","07/25/2023","08/07/2024",2020-06-05,40.751823,-73.992569
"2643",5003649,"STATEN ISLAND","33","ST AUSTINS PL","A2","OT","ISSUED","06/08/2021","09/30/2021",2021-06-09,40.636152,-74.108007
"2644",1086331,"MANHATTAN","111","ANDES ROAD","A1","PL","ISSUED","07/26/2023","07/25/2024",2021-08-02,40.692552,-74.016281
"2645",4301363,"QUEENS","25-33","FAR ROCKAWAY BLVD","A2","OT","ISSUED","07/26/2023","12/06/2023",2023-07-26,40.599832,-73.761917
"2646",4060553,"QUEENS","61-12","56 ROAD","NB","","ISSUED","07/26/2023","07/23/2024",2020-11-12,40.724355,-73.903976
"2647",4060553,"QUEENS","61-12","56 ROAD","NB","","ISSUED","07/26/2023","07/23/2024",2020-12-04,40.724355,-73.903976
"2648",1036505,"MANHATTAN","425","PARK AVENUE","A2","OT","ISSUED","12/27/2023","01/01/2025",2021-05-10,40.760512,-73.971541
"2649",4051200,"QUEENS","64-35","102ND STREET","A2","OT","ISSUED","07/27/2023","04/29/2024",2022-01-11,40.730941,-73.853164
"2650",4051200,"QUEENS","64-35","102ND STREET","A2","OT","ISSUED","07/27/2023","04/29/2024",2022-06-23,40.730941,-73.853164
"2651",1083026,"MANHATTAN","2","PENN PLAZA","A3","EQ","ISSUED","07/27/2023","07/26/2024",2021-08-11,40.750017,-73.991345
"2652",4179328,"QUEENS","83-24","258 STREET","A2","OT","ISSUED","07/27/2023","10/01/2023",2023-07-27,40.738169,-73.710589
"2653",4090684,"QUEENS","78-26","62 STREET","A2","OT","ISSUED","07/27/2023","12/11/2023",2023-07-27,40.696688,-73.892511
"2654",3107458,"BROOKLYN","417","WINTHROP STREET","A2","OT","ISSUED","07/27/2023","12/06/2023",2023-07-27,40.657361,-73.946277
"2655",3031636,"BROOKLYN","207","BROOKLYN AVENUE","A2","PL","ISSUED","07/27/2023","07/26/2024",2022-01-18,40.672725,-73.944653
"2656",4619459,"QUEENS","23-15","44TH ROAD","A2","EQ","ISSUED","07/27/2023","07/26/2024",2023-07-27,40.748365,-73.944557
"2657",4210042,"QUEENS","88-15","163 STREET","A2","OT","ISSUED","07/27/2023","05/11/2024",2023-07-27,40.708281,-73.799034
"2658",2026744,"BRONX","2238","POWELL AVENUE","A2","OT","ISSUED","07/27/2023","04/21/2024",2023-07-27,40.831402,-73.84939
"2659",1089807,"MANHATTAN","76","11TH AVENUE","A2","FS","ISSUED","07/27/2023","11/04/2023",2023-08-29,40.745183,-74.008236
"2660",1001405,"MANHATTAN","27","PARK PLACE","A2","OT","ISSUED","12/27/2023","12/29/2024",2023-07-06,40.713116,-74.008931
"2661",4109794,"QUEENS","154-16","BAYSIDE AVE","A2","OT","ISSUED","07/28/2023","04/27/2024",2023-07-28,40.77159,-73.809349
"2662",3231016,"BROOKLYN","1243","E 98TH ST","A2","OT","ISSUED","07/28/2023","04/21/2024",2023-07-31,40.641835,-73.897111
"2663",1048273,"MANHATTAN","150","EAST 91 STREET","A3","OT","ISSUED","07/31/2023","12/09/2023",2023-07-31,40.782533,-73.952924
"2664",3078953,"BROOKLYN","1637","BROADWAY","A2","OT","ISSUED","07/31/2023","01/13/2024",2020-03-13,40.684945,-73.914031
"2665",3244226,"BROOKLYN","2236","EAST 63RD STREET","A1","","ISSUED","07/31/2023","04/11/2024",2021-04-14,40.61377,-73.910697
"2666",1004054,"MANHATTAN","228","E BROADWAY","A1","","ISSUED","07/31/2023","01/05/2024",2022-07-20,40.714359,-73.986707
"2667",1090883,"MANHATTAN","378","WEST END AVENUE","A1","","ISSUED","07/31/2023","01/23/2024",2020-06-02,40.783559,-73.981721
"2668",3220453,"BROOKLYN","1369","EAST 58TH STREET","A2","OT","ISSUED","07/31/2023","12/06/2023",2023-07-31,40.620924,-73.919347
"2669",1028240,"MANHATTAN","17","WEST 67 ST","A2","OT","ISSUED","07/14/2020","10/10/2020",2020-07-14,40.773356,-73.979027
"2670",3259295,"BROOKLYN","399","16TH STREET","A2","OT","ISSUED","08/01/2023","06/12/2024",2023-08-01,40.661744,-73.983135
"2671",2025586,"BRONX","1280","ROSEDALE AVENUE","A2","OT","ISSUED","08/01/2023","04/21/2024",2023-08-08,40.831953,-73.869271
"2672",1019603,"MANHATTAN","245","EAST 19TH STREET","A2","OT","RE-ISSUED","07/20/2023","07/14/2024",2023-08-01,40.735828,-73.983614
"2673",4177052,"QUEENS","248-48","89 AVENUE","A2","OT","ISSUED","08/02/2023","04/03/2024",2023-08-02,40.727056,-73.717337
"2674",2001029,"BRONX","120","EAST 144 STREET","DM","EQ","ISSUED","08/02/2023","08/01/2024",2023-08-02,40.816951,-73.929876
"2675",1022581,"MANHATTAN","1","TIMES SQUARE","A3","EQ","ISSUED","08/02/2023","08/01/2024",2020-08-28,40.756628,-73.986287
"2676",1076193,"MANHATTAN","1585","BROADWAY","A3","OT","ISSUED","08/02/2023","09/30/2023",2023-08-02,40.760216,-73.985334
"2677",2001029,"BRONX","120","EAST 144 STREET","DM","","ISSUED","08/02/2023","07/10/2024",2023-08-02,40.816951,-73.929876
"2678",1007729,"MANHATTAN","110","THOMPSON STREET","A2","BL","ISSUED","08/02/2023","08/01/2024",2021-08-30,40.725688,-74.001941
"2679",3429519,"BROOKLYN","20","VITAL AVENUE","NB","","ISSUED","03/15/2023","03/14/2024",2022-09-08,NA,NA
"2680",3336897,"BROOKLYN","90","33RD STREET","A1","","ISSUED","08/04/2023","08/03/2024",2022-04-21,40.65754,-74.005251
"2681",3427365,"BROOKLYN","1607","PACIFIC STREET","NB","","ISSUED","12/27/2023","02/18/2024",2022-12-08,40.676984,-73.937334
"2682",1046258,"MANHATTAN","537","EAST 71 STREET","A1","PL","ISSUED","08/04/2023","08/03/2024",2021-11-17,40.765809,-73.953377
"2683",1079647,"MANHATTAN","83","CANAL STREET","A1","PL","ISSUED","08/04/2023","08/03/2024",2020-08-06,40.71529,-73.99315
"2684",5149694,"STATEN ISLAND","85","DELAFIELD PLACE","A2","OT","ISSUED","08/04/2023","07/01/2024",2023-08-04,40.643882,-74.110149
"2685",4193311,"QUEENS","8469","129TH ST","A2","OT","ISSUED","07/29/2023","04/03/2024",2023-08-04,40.706326,-73.82392
"2686",5174428,"STATEN ISLAND","117","FINGERBOARD RD","NB","","ISSUED","08/07/2023","01/30/2024",2020-11-09,40.607424,-74.066191
"2687",5171142,"STATEN ISLAND","109","FINGERBOARD RD","NB","","ISSUED","08/07/2023","01/30/2024",2020-11-09,40.607501,-74.066004
"2688",1088749,"MANHATTAN","1","MADISON AVE","A3","EQ","ISSUED","08/07/2023","08/06/2024",2022-09-23,40.740909,-73.987947
"2689",1088749,"MANHATTAN","1","MADISON AVE","A3","EQ","ISSUED","08/07/2023","08/06/2024",2022-09-20,40.740909,-73.987947
"2690",4305577,"QUEENS","424","B 133 ST","A2","OT","ISSUED","08/07/2023","10/01/2023",2023-08-07,40.577317,-73.852717
"2691",3115866,"BROOKLYN","601","PARKSIDE AVENUE","A2","OT","ISSUED","08/07/2023","06/24/2024",2021-08-31,40.656046,-73.953742
"2692",5080160,"STATEN ISLAND","614","DRUMGOOLE RD E","DM","","ISSUED","08/07/2023","08/06/2024",2023-08-10,40.54633,-74.180599
"2693",3119067,"BROOKLYN","245","EAST 25 STREET","A2","OT","ISSUED","08/07/2023","04/21/2024",2023-08-07,40.643794,-73.953635
"2694",3235251,"BROOKLYN","9411","SKIDMORE AVENUE","A2","OT","ISSUED","08/07/2023","06/01/2024",2023-08-07,40.631552,-73.890044
"2695",3254244,"BROOKLYN","4529","BEDFORD AVENUE","A2","OT","ISSUED","08/08/2023","06/12/2024",2023-08-08,40.591479,-73.945023
"2696",1046425,"MANHATTAN","555","EAST 78 STREET","A2","OT","ISSUED","12/27/2023","01/01/2025",2023-02-15,40.769922,-73.949049
"2697",3426078,"BROOKLYN","85","GATEWAY DRIVE","NB","","ISSUED","08/08/2023","08/07/2024",2022-12-20,40.654231,-73.877789
"2698",3425949,"BROOKLYN","414","VANDALIA AVENUE","NB","","ISSUED","08/08/2023","08/07/2024",2022-12-20,40.654526,-73.876642
"2699",3426078,"BROOKLYN","85","GATEWAY DRIVE","NB","","ISSUED","08/08/2023","08/07/2024",2022-12-20,40.654231,-73.877789
"2700",3425949,"BROOKLYN","414","VANDALIA AVENUE","NB","","ISSUED","08/08/2023","08/07/2024",2022-12-20,40.654526,-73.876642
"2701",3426078,"BROOKLYN","85","GATEWAY DRIVE","NB","","ISSUED","08/08/2023","08/07/2024",2022-12-20,40.654231,-73.877789
"2702",3425949,"BROOKLYN","414","VANDALIA AVENUE","NB","","ISSUED","08/08/2023","08/07/2024",2022-12-20,40.654526,-73.876642
"2703",3426079,"BROOKLYN","83","GATEWAY DRIVE","NB","","ISSUED","08/08/2023","08/07/2024",2022-12-21,40.65425,-73.877789
"2704",3426079,"BROOKLYN","83","GATEWAY DRIVE","NB","","ISSUED","08/08/2023","08/07/2024",2022-12-21,40.65425,-73.877789
"2705",3426079,"BROOKLYN","83","GATEWAY DRIVE","NB","","ISSUED","08/08/2023","08/07/2024",2022-12-21,40.65425,-73.877789
"2706",4215113,"QUEENS","107-30","139TH STREET","A2","OT","ISSUED","08/08/2023","04/21/2024",2023-08-08,40.688422,-73.807178
"2707",1016876,"MANHATTAN","11","EAST 26 STREET","A3","OT","ISSUED","12/27/2023","11/05/2024",2023-12-27,40.743188,-73.98755
"2708",1091571,"MANHATTAN","172","EAST 122 STREET","NB","","ISSUED","08/09/2023","07/27/2024",2022-06-14,40.802109,-73.938058
"2709",4149327,"QUEENS","6515","172ND ST","A2","OT","ISSUED","08/09/2023","11/29/2023",2023-08-09,40.7362,-73.797427
"2710",3126303,"BROOKLYN","401","EAST 8 STREET","A2","OT","ISSUED","08/09/2023","08/09/2024",2021-03-03,40.640242,-73.971005
"2711",4283871,"QUEENS","13517","234 ST","A2","OT","ISSUED","08/09/2023","04/21/2024",2023-08-09,40.672474,-73.737378
"2712",3060114,"BROOKLYN","575","BEDFORD AVENUE","A2","OT","ISSUED","08/09/2023","01/12/2024",2021-02-08,40.703877,-73.960824
"2713",1001394,"MANHATTAN","1","CENTRE STREET","A2","OT","ISSUED","08/09/2023","06/29/2024",2023-08-09,40.713001,-74.004181
"2714",1079184,"MANHATTAN","224","12TH AVENUE","A1","","ISSUED","08/09/2023","07/27/2024",2020-09-28,40.752641,-74.007576
"2715",3429247,"BROOKLYN","487","FOURTH AVENUE","NB","","ISSUED","08/10/2023","04/30/2024",2023-06-12,40.668453,-73.990289
"2716",3332217,"BROOKLYN","92","CENTRE MALL","A2","OT","ISSUED","12/27/2023","01/01/2025",2020-06-29,40.674833,-74.003558
"2717",2053834,"BRONX","2721","COLDEN AVENUE","NB","","ISSUED","08/10/2023","05/12/2024",2023-08-10,40.866003,-73.859608
"2718",3332217,"BROOKLYN","92","CENTRE MALL","A2","OT","ISSUED","12/27/2023","01/01/2025",2020-06-29,40.674833,-74.003558
"2719",3332217,"BROOKLYN","92","CENTRE MALL","A2","OT","ISSUED","12/27/2023","01/01/2025",2020-06-29,40.674833,-74.003558
"2720",3332224,"BROOKLYN","748","HENRY STREET","A2","OT","ISSUED","12/27/2023","01/01/2025",2020-06-26,40.675409,-74.003612
"2721",3332224,"BROOKLYN","748","HENRY STREET","A2","OT","ISSUED","12/27/2023","01/01/2025",2020-06-26,40.675409,-74.003612
"2722",4142453,"QUEENS","135-19","78 ROAD","NB","","ISSUED","08/08/2023","01/20/2024",2022-05-02,40.718783,-73.824681
"2723",2119284,"BRONX","1748","EAST TREMONT AVENUE","A2","PL","ISSUED","09/21/2023","09/20/2024",2023-09-21,40.839383,-73.869668
"2724",5032825,"STATEN ISLAND","281","ADA DRIVE","A2","OT","ISSUED","08/11/2023","10/01/2023",2023-08-17,40.621486,-74.164268
"2725",4464668,"QUEENS","36","REID AVE","NB","","ISSUED","08/11/2023","09/12/2023",2022-04-14,40.563083,-73.911377
"2726",3332224,"BROOKLYN","748","HENRY STREET","A2","OT","ISSUED","12/27/2023","01/01/2025",2020-06-26,40.675409,-74.003612
"2727",4128474,"QUEENS","58-17","186TH ST","A2","OT","ISSUED","09/21/2023","09/20/2024",2023-09-21,40.741719,-73.789121
"2728",4156029,"QUEENS","184-45","ABERDEEN ROAD","DM","","ISSUED","08/14/2023","01/25/2024",2023-08-14,40.72414,-73.783762
"2729",4234844,"QUEENS","111-52","205 STREET","A2","OT","ISSUED","08/14/2023","06/12/2024",2023-08-14,40.704269,-73.751629
"2730",1087309,"MANHATTAN","325","5 AVENUE","A2","OT","ISSUED","07/17/2020","09/05/2020",2020-07-17,40.747428,-73.985282
"2731",4623002,"QUEENS","149-56","SANFORD AVENUE","NB","PL","ISSUED","07/17/2020","07/17/2021",2020-07-17,40.760927,-73.813
"2732",5093059,"STATEN ISLAND","30","NANCY LANE","A2","OT","ISSUED","08/14/2023","10/01/2023",2023-08-21,40.507606,-74.237816
"2733",1046667,"MANHATTAN","1076","MADISON AVENUE","A1","","ISSUED","08/14/2023","08/13/2024",2021-06-01,40.777826,-73.961041
"2734",2051466,"BRONX","2429","MATTHEWS AVENUE","A2","OT","ISSUED","09/21/2023","04/21/2024",2023-09-21,40.861912,-73.862704
"2735",4137632,"QUEENS","39-01","CORPORAL STONE STREET","NB","","ISSUED","08/15/2023","08/12/2024",2021-10-25,40.765344,-73.770823
"2736",3428817,"BROOKLYN","268","BARBEY STREET","A3","OT","ISSUED","08/15/2023","05/26/2024",2023-08-15,40.676365,-73.888452
"2737",4228083,"QUEENS","89-19","216 STREET","A2","OT","ISSUED","08/15/2023","10/01/2023",2023-08-15,40.726109,-73.746861
"2738",1014251,"MANHATTAN","220","WEST 28TH STREET","A1","PL","ISSUED","08/15/2023","08/14/2024",2022-08-22,40.747582,-73.994197
"2739",3019597,"BROOKLYN","180","6TH AVENUE","A2","BL","ISSUED","08/15/2023","08/14/2024",2021-12-13,40.67634,-73.977367
"2740",3019597,"BROOKLYN","180","6TH AVENUE","A2","FB","ISSUED","08/15/2023","08/14/2024",2021-12-13,40.67634,-73.977367
"2741",3019597,"BROOKLYN","180","6TH AVENUE","A2","OT","ISSUED","08/15/2023","08/14/2024",2021-12-13,40.67634,-73.977367
"2742",3019597,"BROOKLYN","180","6TH AVENUE","A2","MH","ISSUED","08/15/2023","08/14/2024",2021-12-13,40.67634,-73.977367
"2743",3019597,"BROOKLYN","180","6TH AVENUE","A2","OT","ISSUED","08/15/2023","08/14/2024",2021-12-13,40.67634,-73.977367
"2744",3019597,"BROOKLYN","180","6TH AVENUE","A2","PL","ISSUED","08/15/2023","08/14/2024",2021-12-13,40.67634,-73.977367
"2745",3019597,"BROOKLYN","180","6TH AVENUE","A2","OT","ISSUED","08/15/2023","08/14/2024",2021-12-13,40.67634,-73.977367
"2746",2130506,"BRONX","1223","SPOFFORD AVE","NB","","ISSUED","08/15/2023","08/14/2024",2023-08-15,40.813898,-73.890537
"2747",1051383,"MANHATTAN","610","EAST 83RD STREET","A1","","ISSUED","08/15/2023","11/01/2023",2023-08-15,40.772879,-73.945963
"2748",2130506,"BRONX","1223","SPOFFORD AVE","NB","","ISSUED","08/10/2023","08/14/2024",2023-08-15,40.813898,-73.890537
"2749",1030525,"MANHATTAN","250","W 73RD STREET","A1","","ISSUED","12/27/2023","12/28/2024",2021-06-14,40.780076,-73.983022
"2750",1088749,"MANHATTAN","1","MADISON AVENUE","A3","EQ","ISSUED","08/16/2023","08/15/2024",2020-09-02,40.740909,-73.987947
"2751",4173149,"QUEENS","66-30","246 STREET","A2","OT","ISSUED","08/16/2023","01/22/2024",2023-08-16,40.752059,-73.728059
"2752",4098922,"QUEENS","18-17","125 STREET","A2","OT","ISSUED","08/16/2023","04/21/2024",2023-08-16,40.782979,-73.84313
"2753",5000709,"STATEN ISLAND","73","BROOK STREET","A2","OT","ISSUED","08/17/2023","10/01/2023",2023-08-25,40.636996,-74.083014
"2754",3233977,"BROOKLYN","1381","EAST 103 STREET","A2","OT","ISSUED","08/17/2023","12/06/2023",2023-08-17,40.638848,-73.887549
"2755",2004136,"BRONX","581","AUSTIN PLACE","NB","","ISSUED","08/17/2023","04/08/2024",2020-06-29,40.811268,-73.901513
"2756",2004136,"BRONX","581","AUSTIN PLACE","NB","","ISSUED","08/17/2023","04/08/2024",2020-06-29,40.811268,-73.901513
"2757",2004136,"BRONX","581","AUSTIN PLACE","NB","","ISSUED","08/17/2023","04/08/2024",2023-02-09,40.811268,-73.901513
"2758",2070376,"BRONX","4378","EDSON AVENUE","A2","OT","ISSUED","08/17/2023","10/21/2023",2023-08-17,40.898583,-73.846778
"2759",1083955,"MANHATTAN","2120","1ST AVENUE","A2","PL","IN PROCESS","08/17/2023","",2020-09-11,40.791737,-73.938508
"2760",1009585,"MANHATTAN","21","WEST 11TH STREET","A2","OT","ISSUED","07/15/2020","06/13/2021",2020-07-20,40.734438,-73.995988
"2761",4056377,"QUEENS","50-42","69TH PLACE","NB","","ISSUED","08/11/2023","01/11/2024",2023-08-17,40.736122,-73.895082
"2762",3428817,"BROOKLYN","268","BARBEY STREET","NB","PL","ISSUED","09/22/2023","07/23/2025",2022-04-08,40.676365,-73.888452
"2763",3430047,"BROOKLYN","156","BAY 29 STREET","NB","","ISSUED","08/18/2023","02/09/2024",2020-10-21,40.59945,-73.997674
"2764",4052133,"QUEENS","65-01","110 STREET","A2","OT","ISSUED","08/18/2023","03/20/2024",2023-08-18,40.732187,-73.846605
"2765",4042070,"QUEENS","104-12","32 AVENUE","A2","OT","ISSUED","08/18/2023","12/06/2023",2023-08-18,40.759602,-73.864749
"2766",1088961,"MANHATTAN","20","HUDSON YARDS","A2","OT","ISSUED","08/18/2023","02/28/2024",2023-03-23,40.753045,-74.000282
"2767",1088961,"MANHATTAN","20","HUDSON YARDS","A2","OT","ISSUED","08/18/2023","02/28/2024",2023-03-27,40.753045,-74.000282
"2768",1088961,"MANHATTAN","20","HUDSON YARDS","A2","OT","ISSUED","08/18/2023","02/28/2024",2023-03-23,40.753045,-74.000282
"2769",3005094,"BROOKLYN","24","1ST PLACE","A1","","ISSUED","08/14/2023","10/07/2023",2023-08-21,40.681129,-73.999838
"2770",3255289,"BROOKLYN","2940","WEST 15 STREET","NB","","ISSUED","08/16/2023","08/17/2024",2022-03-14,40.576271,-73.982552
"2771",4156623,"QUEENS","204-04","45TH ROAD","A2","OT","ISSUED","08/21/2023","10/01/2023",2023-08-21,40.75699,-73.778771
"2772",4531216,"QUEENS","174-27","129TH AVENUE","A2","OT","ISSUED","08/21/2023","04/21/2024",2023-08-21,40.679869,-73.768049
"2773",1079184,"MANHATTAN","261","11 AVENUE","A3","OT","ISSUED","08/21/2023","08/07/2024",2021-05-18,40.751502,-74.005118
"2774",3107206,"BROOKLYN","625","NEW YORK AVENUE","DM","EQ","ISSUED","08/21/2023","08/20/2024",2023-08-21,40.659121,-73.94754
"2775",1091775,"MANHATTAN","64","UNIVERSITY PLACE","A2","OT","ISSUED","03/11/2020","10/30/2020",2020-03-11,40.732953,-73.993635
"2776",4623202,"QUEENS","35-15","19TH AVENUE","DM","EQ","ISSUED","07/21/2020","07/21/2021",2020-07-21,40.780124,-73.902028
"2777",2826970,"BRONX","334","EAST 176TH STREET","NB","","ISSUED","08/22/2023","08/21/2024",2022-04-27,40.847527,-73.903028
"2778",2826970,"BRONX","334","EAST 176TH STREET","NB","","ISSUED","08/22/2023","08/21/2024",2022-04-27,40.847527,-73.903028
"2779",3429094,"BROOKLYN","170","FREEMAN STREET","NB","","ISSUED","08/22/2023","08/21/2024",2022-05-18,40.734481,-73.954532
"2780",3429094,"BROOKLYN","170","FREEMAN STREET","NB","","ISSUED","08/22/2023","08/21/2024",2022-05-18,40.734481,-73.954532
"2781",4178947,"QUEENS","82-24","259 STREET","A2","OT","ISSUED","08/22/2023","11/15/2023",2023-08-22,40.740337,-73.710417
"2782",2101529,"BRONX","278","ROBINSON AVENUE","A2","OT","ISSUED","08/22/2023","06/01/2024",2023-08-22,40.814816,-73.826288
"2783",3144156,"BROOKLYN","333","65TH STREET","A2","MH","ISSUED","08/22/2023","05/01/2024",2023-04-06,40.638827,-74.022721
"2784",1091777,"MANHATTAN","740","EIGHTH AVENUE","NB","","RE-ISSUED","01/07/2022","10/01/2022",2022-01-07,40.759546,-73.988095
"2785",1091777,"MANHATTAN","740","EIGHTH AVENUE","NB","","ISSUED","09/23/2022","10/01/2022",2022-01-07,40.759546,-73.988095
"2786",1091777,"MANHATTAN","740","EIGHTH AVENUE","NB","","RE-ISSUED","09/29/2022","09/30/2023",2022-09-30,40.759546,-73.988095
"2787",1091777,"MANHATTAN","740","EIGHTH AVENUE","NB","","ISSUED","05/08/2023","10/01/2023",2023-06-06,40.759546,-73.988095
"2788",2826970,"BRONX","334","EAST 176TH STREET","NB","","ISSUED","08/15/2023","08/21/2024",2022-04-27,40.847527,-73.903028
"2789",3107206,"BROOKLYN","625","NEW YORK AVENUE","DM","","ISSUED","08/21/2023","11/06/2023",2023-08-22,40.659121,-73.94754
"2790",4204942,"QUEENS","135-14","LIBERTY AVE","A1","","ISSUED","08/23/2023","04/24/2024",2020-08-03,40.69168,-73.81164
"2791",1091777,"MANHATTAN","740","EIGHTH AVENUE","NB","","ISSUED","08/23/2023","10/01/2023",2022-09-30,40.759546,-73.988095
"2792",2130506,"BRONX","1223","SPOFFORD AVE","NB","","ISSUED","08/23/2023","08/22/2024",2023-08-15,40.813898,-73.890537
"2793",2130506,"BRONX","1223","SPOFFORD AVE","NB","","ISSUED","08/23/2023","08/22/2024",2023-08-15,40.813898,-73.890537
"2794",1000821,"MANHATTAN","55","BROAD STREET","A2","OT","ISSUED","07/22/2020","10/01/2020",2020-07-22,40.705189,-74.011505
"2795",3184245,"BROOKLYN","2219","AVENUE S","A2","OT","ISSUED","08/24/2023","11/22/2023",2023-08-24,40.604278,-73.950068
"2796",3391931,"BROOKLYN","7311","AVENUE T","A2","OT","IN PROCESS","08/24/2023","",2023-08-24,40.622455,-73.907364
"2797",4559238,"QUEENS","25-63GAR","125 STREET","NB","","ISSUED","09/22/2023","10/26/2023",2020-12-21,40.775061,-73.843574
"2798",4146113,"QUEENS","162-07","59 AVE","A2","OT","ISSUED","08/24/2023","04/21/2024",2023-08-24,40.740456,-73.806281
"2799",4151503,"QUEENS","76-21","166 STREET","A2","PL","ISSUED","08/24/2023","09/06/2024",2023-09-07,40.725494,-73.802594
"2800",4193055,"QUEENS","84-25","124 STREET","A2","OT","ISSUED","08/24/2023","06/14/2024",2023-08-24,40.70474,-73.82801
"2801",3245983,"BROOKLYN","101","ORIENTAL BOULEVARD","DM","","ISSUED","08/21/2023","01/14/2024",2023-08-24,40.576919,-73.952623
"2802",3429214,"BROOKLYN","955","STERLING PLACE","NB","","ISSUED","09/22/2023","09/21/2024",2021-12-23,40.672347,-73.946733
"2803",5026933,"STATEN ISLAND","213","SIMONSON AVENUE","A2","OT","ISSUED","08/25/2023","10/01/2023",2023-08-31,40.631301,-74.152281
"2804",3332217,"BROOKLYN","92","CENTRE MALL","A2","OT","ISSUED","08/25/2023","04/10/2024",2020-06-29,40.674833,-74.003558
"2805",3332217,"BROOKLYN","92","CENTRE MALL","A2","OT","ISSUED","08/25/2023","04/10/2024",2020-06-29,40.674833,-74.003558
"2806",3332217,"BROOKLYN","92","CENTRE MALL","A2","OT","ISSUED","08/25/2023","04/10/2024",2020-06-29,40.674833,-74.003558
"2807",3017120,"BROOKLYN","273","19 STREET","A1","","ISSUED","08/25/2023","08/04/2024",2020-09-23,40.661762,-73.991068
"2808",1015733,"MANHATTAN","262","FIFTH AVENUE","NB","","ISSUED","08/25/2023","03/17/2024",2022-06-16,40.745081,-73.987019
"2809",1015733,"MANHATTAN","262","FIFTH AVENUE","NB","EQ","ISSUED","08/25/2023","08/24/2024",2021-09-29,40.745081,-73.987019
"2810",3003887,"BROOKLYN","33","STRONG PLACE","A1","","ISSUED","08/23/2023","08/24/2024",2023-08-25,40.685515,-73.997692
"2811",3332224,"BROOKLYN","748","HENRY STREET","A2","OT","ISSUED","08/28/2023","01/01/2024",2020-06-26,40.675409,-74.003612
"2812",3332224,"BROOKLYN","748","HENRY STREET","A2","OT","ISSUED","08/28/2023","01/01/2024",2020-06-26,40.675409,-74.003612
"2813",3018012,"BROOKLYN","521","41ST STREET","A2","OT","ISSUED","08/28/2023","06/12/2024",2023-08-28,40.649764,-74.004422
"2814",4234063,"QUEENS","19606","110TH AVENUE","A2","OT","ISSUED","08/11/2021","04/21/2022",2021-08-11,40.704644,-73.760558
"2815",4271277,"QUEENS","171-26","144TH AVE","A2","OT","ISSUED","08/28/2023","07/01/2024",2023-08-28,40.668806,-73.76901
"2816",4618910,"QUEENS","35-32","LEAVITT STREET","NB","","ISSUED","08/28/2023","05/26/2024",2020-09-29,40.764245,-73.828835
"2817",3004559,"BROOKLYN","407","CLINTON STREET","A1","","ISSUED","08/21/2023","03/26/2024",2020-07-01,40.682444,-73.998107
"2818",4590169,"QUEENS","107-34","156 STREET","A1","","ISSUED","08/24/2023","08/27/2024",2023-08-28,40.695377,-73.797036
"2819",4024899,"QUEENS","30-17","74 STREET","A2","OT","ISSUED","08/29/2023","04/21/2024",2023-08-29,40.759912,-73.893727
"2820",2117503,"BRONX","980","EAST 149 STREET","A2","OT","ISSUED","08/29/2023","08/31/2024",2023-01-25,40.806847,-73.902563
"2821",4235726,"QUEENS","194-17","113TH ROAD","A2","OT","ISSUED","08/29/2023","04/01/2024",2023-08-29,40.699273,-73.76044
"2822",1009430,"MANHATTAN","16","FIFTH AVENUE","NB","","ISSUED","08/29/2023","03/17/2024",2022-09-27,40.732624,-73.996092
"2823",1009430,"MANHATTAN","16","FIFTH AVENUE","NB","","ISSUED","08/29/2023","03/17/2024",2022-09-23,40.732624,-73.996092
"2824",1009430,"MANHATTAN","16","FIFTH AVENUE","NB","","ISSUED","08/29/2023","03/17/2024",2022-09-23,40.732624,-73.996092
"2825",3400905,"BROOKLYN","1038","JEFFERSON AVENUE","NB","","IN PROCESS","08/29/2023","",2022-03-08,40.68739,-73.917085
"2826",5008453,"STATEN ISLAND","57","ALLEN COURT","A2","OT","ISSUED","08/30/2023","10/01/2023",2023-09-05,40.628071,-74.118935
"2827",4618910,"QUEENS","35-32","LEAVITT STREET","NB","PL","ISSUED","08/30/2023","08/29/2024",2021-09-16,40.764245,-73.828835
"2828",3324426,"BROOKLYN","355","53RD ST","NB","PL","ISSUED","08/30/2023","08/29/2024",2022-08-26,40.645325,-74.015196
"2829",2097312,"BRONX","2850","GOULDEN AVENUE","A2","OT","ISSUED","08/30/2023","06/29/2024",2022-09-07,40.872898,-73.896175
"2830",2097312,"BRONX","2850","GOULDEN AVENUE","A2","OT","ISSUED","08/30/2023","06/29/2024",2022-09-19,40.872898,-73.896175
"2831",2097312,"BRONX","2850","GOULDEN AVENUE","A2","MH","ISSUED","08/30/2023","06/29/2024",2022-12-13,40.872898,-73.896175
"2832",1091777,"MANHATTAN","740","EIGHTH AVENUE","NB","","ISSUED","08/30/2023","10/01/2023",2022-09-30,40.759546,-73.988095
"2833",3073018,"BROOKLYN","1390","WILLOUGHBY AVE","A2","PL","ISSUED","09/22/2023","09/21/2024",2021-07-20,40.707229,-73.919805
"2834",1089807,"MANHATTAN","76","11TH AVENUE","A3","OT","ISSUED","08/31/2023","08/31/2024",2023-05-17,40.745183,-74.008236
"2835",3137285,"BROOKLYN","4720","15 AVENUE","NB","","ISSUED","08/31/2023","08/30/2024",2021-11-03,40.633328,-73.986727
"2836",3245283,"BROOKLYN","2","BRIGHTON 10TH LANE","A1","","ISSUED","08/31/2023","09/01/2024",2020-01-15,40.580484,-73.959619
"2837",3245283,"BROOKLYN","2","BRIGHTON 10TH LANE","A1","","ISSUED","08/31/2023","09/01/2024",2020-01-15,40.580484,-73.959619
"2838",3245283,"BROOKLYN","2","BRIGHTON 10TH LANE","A1","","ISSUED","08/31/2023","09/01/2024",2020-01-15,40.580484,-73.959619
"2839",2004136,"BRONX","581","AUSTIN PLACE","NB","","ISSUED","06/14/2024","10/03/2024",2020-06-29,40.811268,-73.901513
"2840",4252949,"QUEENS","116-28","135TH ST","A2","OT","ISSUED","09/01/2023","10/01/2023",2023-09-01,40.678431,-73.805131
"2841",2001965,"BRONX","943","TELLER AVENUE","A2","MH","ISSUED","09/01/2023","09/04/2024",2021-07-21,40.826292,-73.915467
"2842",2001965,"BRONX","943","TELLER AVENUE","A2","OT","ISSUED","09/01/2023","09/04/2024",2021-07-19,40.826292,-73.915467
"2843",1035460,"MANHATTAN","18","EAST 50 STREET","A2","OT","ISSUED","08/18/2023","04/19/2024",2020-06-22,40.758136,-73.97627
"2844",1091887,"MANHATTAN","520","FIFTH AVENUE","NB","","ISSUED","09/05/2023","08/31/2024",2022-09-02,40.754421,-73.980213
"2845",4073505,"QUEENS","62-62","ELLWELL CRESCENT","A1","","ISSUED","09/06/2023","02/28/2024",2021-04-07,40.724414,-73.864842
"2846",4116436,"QUEENS","46-21","COLDEN STREET","A2","PL","ISSUED","09/06/2023","09/05/2024",2020-11-03,40.749545,-73.822073
"2847",4116436,"QUEENS","46-21","COLDEN STREET","A2","SP","ISSUED","09/06/2023","09/05/2024",2020-11-03,40.749545,-73.822073
"2848",3207000,"BROOKLYN","2919","AVENUE J","A2","OT","ISSUED","09/06/2023","10/21/2023",2023-09-06,40.626705,-73.947595
"2849",4277792,"QUEENS","130-70","227TH ST","A2","OT","ISSUED","09/06/2023","04/21/2024",2023-09-06,40.681191,-73.740744
"2850",3429247,"BROOKLYN","487","FOURTH AVENUE","NB","","ISSUED","09/06/2023","04/30/2024",2023-06-12,40.668453,-73.990289
"2851",1011884,"MANHATTAN","557","HUDSON STREET","A1","","ISSUED","09/05/2023","10/28/2023",2021-05-28,40.735429,-74.006037
"2852",1014251,"MANHATTAN","227","WEST 27 STREET","A2","EQ","ISSUED","09/07/2023","09/06/2024",2022-09-08,40.747127,-73.994991
"2853",3112733,"BROOKLYN","609","E 40TH ST","A2","OT","ISSUED","09/07/2023","09/06/2024",2023-09-07,40.640583,-73.938867
"2854",4070746,"QUEENS","75-30","FURMANVILLE AVENUE","A2","OT","ISSUED","09/07/2023","11/15/2023",2023-09-07,40.717076,-73.87832
"2855",2073709,"BRONX","1375","MAYFLOWER AVENUE","A2","OT","ISSUED","09/07/2023","09/06/2024",2023-09-07,40.838592,-73.833038
"2856",3017338,"BROOKLYN","599","20 STREET","A2","OT","ISSUED","09/08/2023","06/12/2024",2023-09-08,40.654487,-73.980524
"2857",2043367,"BRONX","867","KINSELLA STREET","A2","OT","ISSUED","09/08/2023","04/01/2024",2023-09-08,40.845696,-73.860117
"2858",4254145,"QUEENS","130-21","122ND PL","A2","OT","ISSUED","09/08/2023","04/03/2024",2023-09-08,40.673225,-73.816141
"2859",3113160,"BROOKLYN","3709","FARRAGUT ROAD","A2","OT","ISSUED","09/08/2023","12/06/2023",2023-09-08,40.636706,-73.941094
"2860",2129082,"BRONX","2486","HOFFMAN STREET","NB","","ISSUED","09/09/2023","09/13/2024",2021-08-18,40.857955,-73.886745
"2861",1811452,"MANHATTAN","20","RANDALLS ISLAND","A2","OT","ISSUED","12/28/2023","01/01/2025",2022-05-05,NA,NA
"2862",1811452,"MANHATTAN","20","RANDALLS ISLAND","A2","OT","ISSUED","12/28/2023","01/01/2025",2022-05-11,NA,NA
"2863",2130518,"BRONX","3019","CORLEAR AVENUE","NB","EQ","ISSUED","09/11/2023","09/10/2024",2020-07-16,40.879381,-73.908648
"2864",2130518,"BRONX","3019","CORLEAR AVENUE","NB","","ISSUED","09/11/2023","06/29/2024",2020-07-16,40.879381,-73.908648
"2865",4127825,"QUEENS","53-28","190TH ST","A2","OT","ISSUED","09/11/2023","09/10/2024",2023-09-11,40.745851,-73.78704
"2866",4135975,"QUEENS","214-33","35TH AVENUE","A2","PL","ISSUED","09/11/2023","09/10/2024",2021-09-17,40.769536,-73.771148
"2867",1811452,"MANHATTAN","20","RANDALLS ISLAND","A2","OT","ISSUED","12/28/2023","01/01/2025",2022-05-05,NA,NA
"2868",1028168,"MANHATTAN","36","WEST 66TH STREET","A3","EQ","ISSUED","09/12/2023","09/11/2024",2023-09-12,40.772885,-73.979865
"2869",4100478,"QUEENS","25-63","125 STREET","NB","","ISSUED","09/12/2023","10/26/2023",2020-07-08,40.775061,-73.843574
"2870",4291272,"QUEENS","147-35","226TH STREET","A2","OT","ISSUED","09/12/2023","04/21/2024",2023-09-12,40.658273,-73.755988
"2871",4048427,"QUEENS","110-72","CORONA AVE","NB","","IN PROCESS","09/12/2023","",2022-09-15,40.740912,-73.850807
"2872",5175245,"STATEN ISLAND","839","FATHER CAPODANNO BOULEVARD","NB","","ISSUED","09/12/2023","07/10/2024",2021-04-23,40.575512,-74.083478
"2873",4623971,"QUEENS","31-29","CRESCENT STREET","NB","","ISSUED","09/12/2023","01/01/2024",2022-06-17,40.764934,-73.926923
"2874",1014167,"MANHATTAN","280","8 AVE","DM","EQ","ISSUED","09/12/2023","09/11/2024",2023-09-12,40.746043,-73.997928
"2875",1014167,"MANHATTAN","280","8 AVE","DM","","ISSUED","09/12/2023","12/31/2023",2023-09-12,40.746043,-73.997928
"2876",2044269,"BRONX","1541","WILLIAMSBRIDGE ROAD","A2","PL","ISSUED","09/12/2023","09/11/2024",2020-11-12,40.845856,-73.847756
"2877",2044269,"BRONX","1541","WILLIAMSBRIDGE ROAD","A2","PL","ISSUED","09/12/2023","09/11/2024",2020-11-12,40.845856,-73.847756
"2878",4048427,"QUEENS","110-72","CORONA AVE","NB","","ISSUED","09/06/2023","09/01/2024",2022-09-15,40.740912,-73.850807
"2879",4226377,"QUEENS","94-40","218 STREET","A2","PL","ISSUED","09/25/2023","10/31/2024",2023-11-01,40.71951,-73.738051
"2880",4288726,"QUEENS","249-29","MAYDA RD","A2","OT","ISSUED","09/25/2023","07/01/2024",2023-09-25,40.658052,-73.737889
"2881",1017122,"MANHATTAN","200","MADISON AVENUE","A3","EQ","ISSUED","09/25/2023","09/24/2024",2022-09-30,40.748528,-73.982413
"2882",1046258,"MANHATTAN","537","EAST 71 STREET","A1","","ISSUED","09/25/2023","10/01/2024",2021-11-16,40.765809,-73.953377
"2883",1046258,"MANHATTAN","537","EAST 71 STREET","A1","","ISSUED","09/25/2023","10/01/2024",2021-10-07,40.765809,-73.953377
"2884",2009646,"BRONX","1511","FULTON AVENUE","A1","","ISSUED","09/26/2023","10/01/2024",2020-12-15,40.836743,-73.900492
"2885",3398454,"BROOKLYN","8","GRAND AVENUE","A1","","ISSUED","09/26/2023","10/07/2024",2022-08-26,40.697354,-73.964813
"2886",3398454,"BROOKLYN","10","GRAND AVENUE","A2","OT","ISSUED","09/26/2023","10/07/2024",2020-02-26,40.697312,-73.964802
"2887",3429084,"BROOKLYN","624","METROPOLITAN AVENUE","NB","","ISSUED","12/28/2023","12/10/2024",2022-06-01,40.714156,-73.948301
"2888",3225504,"BROOKLYN","39","PAERDEGAT 4TH STREET","A1","","ISSUED","09/26/2023","08/02/2024",2020-12-08,40.631671,-73.910039
"2889",1089192,"MANHATTAN","375","WEST 207 STREET","NB","","RE-ISSUED","08/31/2023","09/26/2024",2023-09-27,40.864015,-73.917834
"2890",3335129,"BROOKLYN","63","FLUSHING AVENUE","DM","EQ","ISSUED","09/07/2023","09/26/2024",2022-04-12,40.69802,-73.974986
"2891",4277925,"QUEENS","130-19","229 STREET","A2","OT","ISSUED","09/27/2023","04/21/2024",2023-09-27,40.681378,-73.738576
"2892",4204080,"QUEENS","104-20","117TH ST","A2","OT","ISSUED","09/27/2023","09/26/2024",2023-09-27,40.685617,-73.825795
"2893",3400905,"BROOKLYN","1038","JEFFERSON AVENUE","NB","","IN PROCESS","09/27/2023","04/25/2024",2022-03-08,40.68739,-73.917085
"2894",3320627,"BROOKLYN","501","SURF AVE","A1","","ISSUED","03/20/2024","04/01/2025",2020-10-26,40.574897,-73.973978
"2895",1091777,"MANHATTAN","740","EIGHTH AVENUE","NB","","ISSUED","09/27/2023","09/26/2024",2022-09-30,40.759546,-73.988095
"2896",1091777,"MANHATTAN","740","EIGHTH AVENUE","NB","","ISSUED","09/27/2023","09/26/2024",2022-09-30,40.759546,-73.988095
"2897",5000064,"STATEN ISLAND","18","RICHMOND TERRACE","A2","OT","ISSUED","09/27/2023","03/04/2024",2022-03-24,40.643004,-74.075772
"2898",4114658,"QUEENS","143-09","BARCLAY AVE","A2","OT","ISSUED","09/25/2023","04/25/2024",2023-09-27,40.759183,-73.823065
"2899",1091010,"MANHATTAN","270","PARK AVENUE","NB","","ISSUED","09/26/2023","09/27/2024",2021-09-08,40.755641,-73.975109
"2900",5129743,"STATEN ISLAND","56","BAYVIEW LANE","A2","OT","ISSUED","09/28/2023","07/01/2024",2023-09-28,40.516546,-74.203716
"2901",2010093,"BRONX","857","CROTONA PARK NORTH","A2","OT","ISSUED","09/28/2023","08/31/2024",2023-09-28,40.839618,-73.889729
"2902",2010092,"BRONX","861","CROTONA PARK NORTH","A2","OT","ISSUED","09/28/2023","08/31/2024",2023-09-28,40.839569,-73.889646
"2903",4205770,"QUEENS","107-16","125TH ST","A2","OT","ISSUED","09/28/2023","09/27/2024",2023-09-28,40.685437,-73.818029
"2904",4620316,"QUEENS","82-53","164 STREET","A1","","ISSUED","06/15/2024","10/04/2024",2022-08-25,40.71759,-73.803505
"2905",4618112,"QUEENS","112","BEACH 219TH STREET","A2","OT","ISSUED","09/28/2023","05/04/2024",2023-09-28,40.554305,-73.926682
"2906",3400905,"BROOKLYN","1038","JEFFERSON AVENUE","NB","","ISSUED","09/28/2023","04/25/2024",2022-03-08,40.68739,-73.917085
"2907",1079184,"MANHATTAN","224","12TH AVENUE","A1","PL","ISSUED","09/28/2023","09/27/2024",2021-01-28,40.752641,-74.007576
"2908",2831766,"BRONX","1163","GARRISON AVENUE","NB","","ISSUED","09/28/2023","02/01/2024",2022-03-29,40.820261,-73.888493
"2909",1000868,"MANHATTAN","111","WALL STREET","A2","OT","ISSUED","09/28/2023","09/25/2024",2021-08-03,40.704553,-74.006636
"2910",3329047,"BROOKLYN","7819","16 AVE","A1","","ISSUED","09/25/2023","11/05/2024",2023-11-06,40.614434,-74.00277
"2911",2045727,"BRONX","1340","BLONDELL AVENUE","NB","","ISSUED","09/27/2023","10/03/2024",2023-10-04,40.841827,-73.842073
"2912",3256921,"BROOKLYN","10502","AVENUE D","A2","OT","RE-ISSUED","09/29/2023","09/27/2024",2022-12-01,40.653831,-73.901511
"2913",4177534,"QUEENS","79-22","257 ST","A2","OT","ISSUED","09/29/2023","11/15/2023",2023-09-29,40.745254,-73.7142
"2914",4624033,"QUEENS","23-10","42 ROAD","A3","OT","ISSUED","09/29/2023","09/03/2024",2023-09-29,40.750555,-73.942664
"2915",1064452,"MANHATTAN","100","OVERLOOK TERRACE","A2","OT","ISSUED","09/29/2023","04/25/2024",2023-09-29,40.855967,-73.935412
"2916",3054016,"BROOKLYN","302","HERKIMER STREET","A2","OT","ISSUED","12/29/2023","06/12/2024",2023-12-29,40.679295,-73.943461
"2917",3428908,"BROOKLYN","4622","FORT HAMILTON PARKWAY","NB","","ISSUED","12/29/2023","10/10/2024",2022-06-07,40.639669,-73.995737
"2918",4623739,"QUEENS","2-21","MALT DRIVE","NB","","ISSUED","10/02/2023","02/22/2024",2022-03-03,NA,NA
"2919",4265877,"QUEENS","160-68","122 AVENUE","DM","","ISSUED","06/27/2023","01/28/2024",2023-10-02,40.67851,-73.78228
"2920",3428561,"BROOKLYN","12","HALSEY STREET","NB","","ISSUED","10/03/2023","10/09/2024",2023-04-17,40.681446,-73.952902
"2921",3000519,"BROOKLYN","285","SCHERMERHORN STREET","A3","EQ","ISSUED","10/03/2023","10/02/2024",2020-11-06,40.687759,-73.982898
"2922",3428561,"BROOKLYN","12","HALSEY STREET","NB","","ISSUED","10/03/2023","10/02/2024",2022-03-21,40.681446,-73.952902
"2923",1079773,"MANHATTAN","2569","ADAM CLAYTON POWELL BLVD","A2","PL","ISSUED","10/03/2023","10/15/2024",2021-10-28,40.823872,-73.937438
"2924",3842240,"BROOKLYN","15","HUDSON AVE","DM","EQ","ISSUED","10/03/2023","10/02/2024",2023-10-03,40.704645,-73.980975
"2925",3842240,"BROOKLYN","15","HUDSON AVE","DM","","ISSUED","10/03/2023","06/11/2024",2023-10-03,40.704645,-73.980975
"2926",3076057,"BROOKLYN","1333","BROADWAY","NB","PL","ISSUED","10/03/2023","10/02/2024",2022-10-12,40.690065,-73.923046
"2927",3115866,"BROOKLYN","601","PARKSIDE AVENUE","A3","EQ","ISSUED","12/29/2023","12/28/2024",2020-01-14,40.656046,-73.953742
"2928",5038304,"STATEN ISLAND","419","TRAVIS AVENUE","A2","OT","ISSUED","10/04/2023","10/01/2024",2023-10-11,40.589394,-74.155829
"2929",4263288,"QUEENS","109-45","156TH STREET","A2","OT","ISSUED","10/04/2023","10/01/2024",2023-10-04,40.692095,-73.794615
"2930",3115866,"BROOKLYN","601","PARKSIDE AVENUE","A2","OT","ISSUED","12/29/2023","12/28/2024",2020-02-21,40.656046,-73.953742
"2931",3115866,"BROOKLYN","601","PARKSIDE AVENUE","A2","OT","ISSUED","12/29/2023","12/28/2024",2020-02-21,40.656046,-73.953742
"2932",3076057,"BROOKLYN","1333","BROADWAY","A2","SD","ISSUED","10/05/2023","10/04/2024",2022-10-19,40.690065,-73.923046
"2933",3076057,"BROOKLYN","1333","BROADWAY","A2","SP","ISSUED","10/05/2023","10/04/2024",2022-10-19,40.690065,-73.923046
"2934",3080756,"BROOKLYN","326","ROCKAWAY AVENUE","NB","","IN PROCESS","10/05/2023","10/04/2024",2023-08-08,40.671905,-73.911308
"2935",4268075,"QUEENS","168-19","119 AVENUE","A2","OT","ISSUED","10/05/2023","10/01/2024",2023-10-05,40.68342,-73.776073
"2936",3369431,"BROOKLYN","1443 GAR","EAST 12 STREET","DM","","ISSUED","10/04/2023","10/04/2024",2023-10-05,40.614117,-73.962127
"2937",2080452,"BRONX","458","REVERE AVENUE","A2","OT","ISSUED","10/06/2023","12/06/2023",2023-10-06,40.821203,-73.819634
"2938",2130506,"BRONX","1223","SPOFFORD AVE","NB","","ISSUED","10/06/2023","10/22/2024",2023-08-15,40.813898,-73.890537
"2939",3000370,"BROOKLYN","9","DEKALB AVENUE","A2","EQ","ISSUED","10/06/2023","10/05/2024",2020-10-17,40.689985,-73.98254
"2940",2097312,"BRONX","2850","GOULDEN AVENUE","A2","PL","ISSUED","10/04/2023","10/05/2024",2023-10-06,40.872898,-73.896175
"2941",5156513,"STATEN ISLAND","140","LANDER AVENUE","A2","OT","IN PROCESS","12/22/2023","01/31/2024",2023-12-08,40.613788,-74.163291
"2942",3004546,"BROOKLYN","207","PRESIDENT STREET","A1","","ISSUED","10/09/2023","01/01/2024",2020-12-21,40.682482,-73.998861
"2943",3428561,"BROOKLYN","12","HALSEY STREET","NB","","ISSUED","10/10/2023","10/09/2024",2022-03-21,40.681446,-73.952902
"2944",3247659,"BROOKLYN","2819","HARING ST","A2","OT","ISSUED","10/10/2023","04/13/2024",2023-10-10,40.584976,-73.937799
"2945",3004546,"BROOKLYN","207","PRESIDENT STREET","A2","MH","ISSUED","10/10/2023","05/02/2024",2023-10-10,40.682482,-73.998861
"2946",1014251,"MANHATTAN","220","WEST 28TH STREET","A2","FS","ISSUED","10/11/2023","05/01/2024",2023-01-26,40.747582,-73.994197
"2947",3238517,"BROOKLYN","6419","STRICKLAND AVENUE","A2","OT","ISSUED","10/11/2023","10/21/2023",2023-10-11,40.614915,-73.910411
"2948",2007580,"BRONX","1840","ANTHONY AVENUE","A1","","ISSUED","10/11/2023","10/16/2024",2021-12-16,40.847574,-73.903653
"2949",5156513,"STATEN ISLAND","140","LANDER AVENUE","A2","OT","IN PROCESS","01/02/2024","01/31/2024",2023-12-08,40.613788,-74.163291
"2950",4087416,"QUEENS","63-35","FRESH POND ROAD","A2","OT","ISSUED","01/02/2024","03/02/2024",2023-01-31,40.711388,-73.899907
"2951",3233235,"BROOKLYN","10553","FLATLANDS 5TH ST","A2","OT","ISSUED","10/12/2023","04/21/2024",2023-10-12,40.642779,-73.887481
"2952",3428817,"BROOKLYN","268","BARBEY STREET","A2","SD","ISSUED","10/12/2023","10/11/2024",2023-10-12,40.676365,-73.888452
"2953",3428817,"BROOKLYN","268","BARBEY STREET","A2","SP","ISSUED","10/12/2023","10/11/2024",2023-10-12,40.676365,-73.888452
"2954",4306899,"QUEENS","146-16","ROCKAWAY BEACH BOULEVARD","A2","OT","ISSUED","10/12/2023","02/28/2024",2023-10-12,40.570294,-73.861835
"2955",5045648,"STATEN ISLAND","155","SAND LANE","A2","OT","ISSUED","10/12/2023","04/21/2024",2023-10-12,40.595852,-74.06995
"2956",4106591,"QUEENS","150-36","22ND AVE","A2","OT","ISSUED","10/13/2023","10/01/2024",2023-10-13,40.77881,-73.81364
"2957",1083026,"MANHATTAN","2","PENN PLAZA","A1","","ISSUED","10/13/2023","11/01/2023",2021-01-22,40.750017,-73.991345
"2958",1083026,"MANHATTAN","2","PENN PLAZA","A2","OT","ISSUED","10/13/2023","11/01/2023",2021-10-18,40.750017,-73.991345
"2959",1083026,"MANHATTAN","2","PENN PLAZA","A2","OT","ISSUED","10/13/2023","11/01/2023",2020-07-21,40.750017,-73.991345
"2960",1083026,"MANHATTAN","2","PENN PLAZA","A2","OT","ISSUED","10/13/2023","11/01/2023",2021-01-22,40.750017,-73.991345
"2961",2129483,"BRONX","2680","MORRIS AVENUE","NB","","ISSUED","10/16/2023","06/29/2024",2022-06-01,40.867472,-73.895959
"2962",2129483,"BRONX","2680","MORRIS AVENUE","NB","","ISSUED","10/16/2023","06/29/2024",2022-06-01,40.867472,-73.895959
"2963",2129483,"BRONX","2680","MORRIS AVENUE","NB","","ISSUED","10/16/2023","06/29/2024",2022-06-01,40.867472,-73.895959
"2964",4015932,"QUEENS","21-51","38TH ST","A2","OT","ISSUED","10/16/2023","04/27/2024",2023-10-16,40.774064,-73.905926
"2965",1091010,"MANHATTAN","270","PARK AVE","A2","EQ","ISSUED","01/02/2024","01/01/2025",2022-12-21,40.755641,-73.975109
"2966",3323702,"BROOKLYN","100","DWIGHT STREET","NB","PL","ISSUED","10/16/2023","10/15/2024",2020-05-27,40.675752,-74.009377
"2967",2027746,"BRONX","1346","NOBLE AVE","A2","OT","ISSUED","10/16/2023","04/21/2024",2023-10-16,40.833478,-73.870615
"2968",3250019,"BROOKLYN","34","FANE CT","A2","OT","ISSUED","10/16/2023","07/01/2024",2023-10-16,40.592038,-73.928211
"2969",4623357,"QUEENS","5119","BEACH CHANNEL DRIVE","NB","","ISSUED","07/18/2023","10/17/2024",2023-10-18,40.595241,-73.782119
"2970",1091010,"MANHATTAN","270","PARK AVENUE","NB","PL","ISSUED","10/13/2023","10/23/2024",2021-11-30,40.755641,-73.975109
"2971",5006037,"STATEN ISLAND","421","CLOVE ROAD","A2","OT","ISSUED","10/17/2023","10/01/2024",2023-10-21,40.630196,-74.123842
"2972",4619855,"QUEENS","121-67","133 STREET","A2","OT","ISSUED","10/17/2023","04/21/2024",2023-10-17,40.674325,-73.805388
"2973",3429595,"BROOKLYN","180","ASHLAND PLACE","NB","","ISSUED","01/02/2024","01/01/2025",2022-08-11,40.689356,-73.978567
"2974",2129656,"BRONX","4720","THIRD AVENUE","NB","","ISSUED","10/17/2023","01/01/2024",2022-07-01,40.859417,-73.891128
"2975",2128965,"BRONX","1001","WHITLOCK AVE","NB","PL","ISSUED","10/17/2023","10/16/2024",2023-10-17,40.823427,-73.887057
"2976",4156295,"QUEENS","186-28","AVON ROAD","A1","","ISSUED","10/17/2023","06/24/2024",2020-11-13,40.722633,-73.779791
"2977",1091010,"MANHATTAN","270","PARK AVENUE","A2","SD","ISSUED","01/02/2024","01/01/2025",2021-06-09,40.755641,-73.975109
"2978",3425060,"BROOKLYN","1020","ROGERS AVE","NB","","ISSUED","10/18/2023","02/21/2024",2022-06-09,40.645445,-73.951918
"2979",2130726,"BRONX","1525","BRYANT AVENUE","NB","","ISSUED","10/18/2023","10/01/2024",2020-01-27,40.833484,-73.88691
"2980",5104468,"STATEN ISLAND","4855","HYLAN BOULEVARD","A1","","ISSUED","12/29/2023","05/06/2024",2021-11-26,40.526708,-74.167895
"2981",2065806,"BRONX","1205","EAST 224 STREET","A2","OT","ISSUED","10/18/2023","12/06/2023",2023-10-18,40.882078,-73.846244
"2982",4623357,"QUEENS","5119","BEACH CHANNEL DRIVE","NB","","ISSUED","10/16/2023","10/17/2024",2023-10-18,40.595241,-73.782119
"2983",1004054,"MANHATTAN","228","E BROADWAY","A1","","ISSUED","01/03/2024","07/01/2024",2022-07-20,40.714359,-73.986707
"2984",2001874,"BRONX","333","EAST 151 STREET","A2","SP","ISSUED","10/19/2023","10/18/2024",2021-06-16,40.818232,-73.919867
"2985",1046927,"MANHATTAN","60","EAST 88TH STREET","A2","OT","ISSUED","10/19/2023","09/28/2024",2020-06-24,40.78187,-73.957197
"2986",3035761,"BROOKLYN","1580","DEAN STREET","A2","OT","ISSUED","10/19/2023","10/18/2024",2022-03-04,40.676094,-73.935688
"2987",1028138,"MANHATTAN","50","CENTRAL PARK WEST","A2","OT","ISSUED","10/19/2023","04/14/2024",2020-03-19,40.77169,-73.979273
"2988",1028138,"MANHATTAN","50","CENTRAL PARK WEST","A2","OT","ISSUED","10/19/2023","04/14/2024",2020-03-19,40.77169,-73.979273
"2989",5132415,"STATEN ISLAND","118","COVINGTON CIRCLE","A2","OT","ISSUED","10/19/2023","10/01/2024",2022-12-29,40.545163,-74.202584
"2990",1053247,"MANHATTAN","53","W 119 STREET","A1","","RE-ISSUED","03/06/2023","08/05/2024",2023-10-19,40.803244,-73.946556
"2991",1053247,"MANHATTAN","53","W 119 STREET","A1","","RE-ISSUED","03/06/2023","08/05/2024",2023-10-19,40.803244,-73.946556
"2992",1053247,"MANHATTAN","53","W 119 STREET","A1","","RE-ISSUED","03/06/2023","08/05/2024",2023-10-19,40.803244,-73.946556
"2993",4623357,"QUEENS","5119","BEACH CHANNEL DRIVE","NB","","ISSUED","07/18/2023","10/18/2024",2023-10-19,40.595241,-73.782119
"2994",3109498,"BROOKLYN","3515","SNYDER AVENUE","A2","OT","ISSUED","10/20/2023","06/12/2024",2023-10-20,40.649241,-73.944337
"2995",4258650,"QUEENS","111-49","144 STREET","A2","OT","ISSUED","10/20/2023","04/21/2024",2023-10-20,40.685155,-73.800117
"2996",3035761,"BROOKLYN","1580","DEAN STREET","A2","OT","ISSUED","10/20/2023","10/19/2024",2022-03-04,40.676094,-73.935688
"2997",4564701,"QUEENS","38-42 REAR","216TH STREET","DM","EQ","ISSUED","10/20/2023","10/19/2024",2023-10-20,40.766808,-73.767421
"2998",1022581,"MANHATTAN","1","TIMES SQUARE","A2","OT","ISSUED","10/20/2023","11/01/2024",2022-05-16,40.756628,-73.986287
"2999",4564701,"QUEENS","38-42 REAR","216TH STREET","DM","","ISSUED","10/20/2023","05/01/2024",2023-11-14,40.766808,-73.767421
"3000",1022581,"MANHATTAN","1","TIMES SQUARE","A2","OT","ISSUED","10/20/2023","11/01/2024",2022-02-18,40.756628,-73.986287
"3001",3007924,"BROOKLYN","131","3RD STREET","DM","EQ","ISSUED","10/20/2023","10/19/2024",2023-10-20,40.676732,-73.991409
"3002",4619732,"QUEENS","46-11","QUEENS BOULEVARD","NB","","ISSUED","10/20/2023","03/04/2024",2020-05-21,40.74314,-73.918488
"3003",3000605,"BROOKLYN","275","ATLANTIC AVENUE","DM","EQ","ISSUED","10/20/2023","10/19/2024",2023-05-02,40.688896,-73.989969
"3004",1080074,"MANHATTAN","40","EAST 4 STREET","A3","OT","ISSUED","10/20/2023","10/20/2024",2023-07-10,40.727337,-73.992073
"3005",4619459,"QUEENS","23-15","44 ROAD","NB","PL","ISSUED","01/03/2024","01/02/2025",2022-08-25,40.748365,-73.944557
"3006",3087577,"BROOKLYN","109","JEROME STREET","A2","OT","ISSUED","10/23/2023","04/21/2024",2023-10-23,40.679516,-73.888321
"3007",3091145,"BROOKLYN","82","LINCOLN AVENUE","A2","OT","ISSUED","10/23/2023","04/21/2024",2023-10-23,40.688552,-73.870496
"3008",1091036,"MANHATTAN","355","WEST 39TH STREET","NB","","ISSUED","10/24/2023","02/17/2024",2022-10-31,40.755978,-73.992694
"3009",3429205,"BROOKLYN","1538","BROOKLYN AVENUE","NB","","ISSUED","10/24/2023","03/19/2024",2021-05-25,40.635598,-73.942154
"3010",4228063,"QUEENS","89-46","217TH STREET","A2","OT","ISSUED","10/24/2023","11/22/2023",2023-10-24,40.726159,-73.745685
"3011",3429621,"BROOKLYN","875","ERSKINE ST","A2","OT","ISSUED","10/24/2023","10/22/2024",2023-10-24,40.656078,-73.86781
"3012",3023848,"BROOKLYN","100","15 STREET","A1","","ISSUED","10/25/2023","01/01/2024",2022-01-21,40.66746,-73.993248
"3013",4175103,"QUEENS","252-11","82 DRIVE","A2","OT","ISSUED","10/25/2023","08/31/2024",2023-10-25,40.738335,-73.716261
"3014",4046048,"QUEENS","9328","CORONA AVE","A2","OT","ISSUED","10/25/2023","11/29/2023",2023-10-25,40.742366,-73.870543
"3015",3421358,"BROOKLYN","2960","BRIGHTON 4 STREET","A3","EQ","ISSUED","10/25/2023","10/24/2024",2020-08-07,40.57952,-73.964141
"3016",2130882,"BRONX","168","FORDHAM ST","A1","","ISSUED","10/25/2023","10/24/2024",2023-10-25,40.847467,-73.785482
"3017",4252165,"QUEENS","115-17","123RD STREET","A2","OT","ISSUED","10/26/2023","04/01/2024",2023-10-26,40.677457,-73.815816
"3018",4146113,"QUEENS","162-07","59 AVENUE","A2","OT","ISSUED","10/26/2023","04/21/2024",2023-10-26,40.740456,-73.806281
"3019",3007924,"BROOKLYN","131","3RD STREET","DM","","IN PROCESS","10/26/2023","",2023-10-26,40.676732,-73.991409
"3020",4166327,"QUEENS","231-14","87TH AVE","A2","OT","ISSUED","10/26/2023","10/01/2024",2023-10-26,40.73142,-73.738048
"3021",1091010,"MANHATTAN","270","PARK AVENUE","A2","OT","ISSUED","01/17/2020","01/31/2021",2020-01-17,40.755641,-73.975109
"3022",1091010,"MANHATTAN","270","PARK AVENUE","A2","EQ","ISSUED","01/17/2020","01/16/2021",2020-01-17,40.755641,-73.975109
"3023",1091010,"MANHATTAN","270","PARK AVENUE","A2","PL","ISSUED","01/22/2020","01/21/2021",2020-01-22,40.755641,-73.975109
"3024",1091010,"MANHATTAN","270","PARK AVENUE","A3","EQ","ISSUED","06/04/2020","06/04/2021",2020-06-04,40.755641,-73.975109
"3025",1091010,"MANHATTAN","270","PARK AVENUE","A2","OT","ISSUED","06/08/2020","12/01/2020",2020-06-25,40.755641,-73.975109
"3026",1091010,"MANHATTAN","270","PARK AVE","A3","EQ","ISSUED","06/11/2020","06/26/2021",2020-06-26,40.755641,-73.975109
"3027",1091010,"MANHATTAN","270","PARK AVENUE","A3","EQ","ISSUED","07/30/2020","07/30/2021",2020-07-30,40.755641,-73.975109
"3028",1091010,"MANHATTAN","270","PARK AVENUE","A2","EQ","ISSUED","07/30/2020","07/30/2021",2020-07-30,40.755641,-73.975109
"3029",1091010,"MANHATTAN","270","PARK AVE","A3","EQ","ISSUED","08/14/2020","08/14/2021",2020-08-14,40.755641,-73.975109
"3030",1091010,"MANHATTAN","270","PARK AVENUE","A3","EQ","ISSUED","09/25/2020","09/25/2021",2020-09-25,40.755641,-73.975109
"3031",1091010,"MANHATTAN","270","PARK AVENUE","A2","OT","ISSUED","11/06/2020","10/01/2021",2020-11-13,40.755641,-73.975109
"3032",1091010,"MANHATTAN","270","PARK AVENUE","A3","EQ","ISSUED","11/18/2020","11/18/2021",2020-11-18,40.755641,-73.975109
"3033",1091010,"MANHATTAN","270","PARK AVE","A3","EQ","ISSUED","11/19/2020","11/19/2021",2020-11-19,40.755641,-73.975109
"3034",1091010,"MANHATTAN","270","PARK AVENUE","A2","OT","ISSUED","11/25/2020","12/01/2021",2020-06-25,40.755641,-73.975109
"3035",1091010,"MANHATTAN","270","PARK AVENUE","A2","OT","RE-ISSUED","03/03/2021","07/01/2021",2021-03-04,40.755641,-73.975109
"3036",1091010,"MANHATTAN","270","PARK AVENUE","A2","PL","ISSUED","03/25/2021","03/25/2022",2020-01-22,40.755641,-73.975109
"3037",1091010,"MANHATTAN","270","PARK AVENUE","A2","SD","ISSUED","06/09/2021","06/09/2022",2021-06-09,40.755641,-73.975109
"3038",1091010,"MANHATTAN","270","PARK AVE","A3","EQ","ISSUED","06/21/2021","06/21/2022",2020-06-26,40.755641,-73.975109
"3039",1091010,"MANHATTAN","270","PARK AVENUE","A2","OT","ISSUED","07/01/2021","07/01/2022",2021-03-04,40.755641,-73.975109
"3040",1091010,"MANHATTAN","270","PARK AVENUE","A2","OT","ISSUED","03/03/2021","07/01/2021",2021-03-04,40.755641,-73.975109
"3041",3429693,"BROOKLYN","585","WARWICK STREET","NB","EQ","ISSUED","07/06/2021","07/06/2022",2021-07-06,40.668868,-73.884676
"3042",3429693,"BROOKLYN","585","WARWICK STREET","NB","","ISSUED","07/06/2021","08/09/2021",2021-07-06,40.668868,-73.884676
"3043",3429693,"BROOKLYN","585","WARWICK STREET","NB","","ISSUED","07/06/2021","08/09/2021",2021-07-06,40.668868,-73.884676
"3044",3429693,"BROOKLYN","585","WARWICK STREET","NB","","ISSUED","08/03/2021","08/02/2022",2021-07-06,40.668868,-73.884676
"3045",3429693,"BROOKLYN","585","WARWICK STREET","NB","","ISSUED","08/03/2021","08/02/2022",2021-07-06,40.668868,-73.884676
"3046",3429693,"BROOKLYN","585","WARWICK STREET","NB","","ISSUED","08/03/2021","08/02/2022",2021-07-07,40.668868,-73.884676
"3047",1091010,"MANHATTAN","270","PARK AVE","A3","EQ","ISSUED","08/19/2021","08/19/2022",2020-08-14,40.755641,-73.975109
"3048",1091781,"MANHATTAN","32","WEST 48TH STREET","NB","","ISSUED","10/06/2021","10/01/2022",2021-10-06,40.757978,-73.979783
"3049",1091010,"MANHATTAN","270","PARK AVENUE","A3","EQ","ISSUED","10/26/2021","10/26/2022",2020-07-30,40.755641,-73.975109
"3050",1091010,"MANHATTAN","270","PARK AVENUE","A2","OT","ISSUED","11/22/2021","12/01/2022",2020-06-25,40.755641,-73.975109
"3051",1091010,"MANHATTAN","270","PARK AVENUE","A2","OT","ISSUED","12/08/2021","10/01/2022",2020-11-13,40.755641,-73.975109
"3052",1091010,"MANHATTAN","270","PARK AVENUE","A2","SD","ISSUED","12/10/2021","12/10/2022",2021-06-09,40.755641,-73.975109
"3053",3429693,"BROOKLYN","585","WARWICK STREET","NB","PL","ISSUED","03/29/2022","03/29/2023",2022-03-29,40.668868,-73.884676
"3054",1091010,"MANHATTAN","270","PARK AVE","A3","EQ","ISSUED","06/07/2022","06/07/2023",2020-06-26,40.755641,-73.975109
"3055",1091010,"MANHATTAN","270","PARK AVENUE","A2","OT","RE-ISSUED","06/30/2022","06/30/2023",2022-06-30,40.755641,-73.975109
"3056",1091010,"MANHATTAN","270","PARK AVENUE","A2","OT","RE-ISSUED","06/30/2022","06/30/2023",2022-06-30,40.755641,-73.975109
"3057",1091781,"MANHATTAN","32","WEST 48TH STREET","NB","","ISSUED","07/15/2022","10/01/2022",2021-10-06,40.757978,-73.979783
"3058",1091781,"MANHATTAN","32","WEST 48TH STREET","NB","","ISSUED","07/15/2022","10/01/2022",2021-10-06,40.757978,-73.979783
"3059",1091010,"MANHATTAN","270","PARK AVE","A2","EQ","ISSUED","08/16/2022","08/16/2023",2021-08-17,40.755641,-73.975109
"3060",1091010,"MANHATTAN","270","PARK AVE","A3","EQ","ISSUED","08/16/2022","08/16/2023",2020-08-14,40.755641,-73.975109
"3061",1091781,"MANHATTAN","32","WEST 48TH STREET","NB","","ISSUED","09/15/2022","10/01/2023",2021-10-06,40.757978,-73.979783
"3062",1091781,"MANHATTAN","32","WEST 48TH STREET","NB","","ISSUED","09/15/2022","10/01/2023",2021-10-06,40.757978,-73.979783
"3063",1091010,"MANHATTAN","270","PARK AVENUE","A2","OT","ISSUED","09/28/2022","09/28/2023",2020-11-13,40.755641,-73.975109
"3064",1091010,"MANHATTAN","270","PARK AVENUE","A3","EQ","ISSUED","10/25/2022","10/25/2023",2020-07-30,40.755641,-73.975109
"3065",1091010,"MANHATTAN","270","PARK AVENUE","A2","OT","ISSUED","11/23/2022","12/01/2023",2020-06-25,40.755641,-73.975109
"3066",1091010,"MANHATTAN","270","PARK AVENUE","A2","SD","ISSUED","12/13/2022","12/13/2023",2021-06-09,40.755641,-73.975109
"3067",1091781,"MANHATTAN","32","WEST 48TH STREET","NB","","ISSUED","12/16/2022","12/28/2023",2022-12-28,40.757978,-73.979783
"3068",1091010,"MANHATTAN","270","PARK AVE","A2","EQ","ISSUED","12/21/2022","12/21/2023",2022-12-21,40.755641,-73.975109
"3069",1091781,"MANHATTAN","32","WEST 48TH STREET","NB","","ISSUED","02/02/2023","02/02/2024",2022-12-28,40.757978,-73.979783
"3070",1091010,"MANHATTAN","270","PARK AVE","A3","EQ","ISSUED","06/09/2023","06/08/2024",2020-06-26,40.755641,-73.975109
"3071",1091010,"MANHATTAN","270","PARK AVE","A3","EQ","ISSUED","08/09/2023","08/08/2024",2020-08-14,40.755641,-73.975109
"3072",1091010,"MANHATTAN","270","PARK AVE","A2","EQ","ISSUED","08/09/2023","08/08/2024",2021-08-17,40.755641,-73.975109
"3073",1091781,"MANHATTAN","32","WEST 48TH STREET","NB","","ISSUED","09/21/2023","10/01/2024",2021-10-06,40.757978,-73.979783
"3074",1091781,"MANHATTAN","32","WEST 48TH STREET","NB","","ISSUED","09/21/2023","10/01/2024",2021-10-06,40.757978,-73.979783
"3075",1091781,"MANHATTAN","32","WEST 48TH STREET","NB","","ISSUED","09/21/2023","10/01/2024",2022-12-28,40.757978,-73.979783
"3076",3076057,"BROOKLYN","1333","BROADWAY","NB","","ISSUED","10/11/2023","12/05/2023",2022-01-13,40.690065,-73.923046
"3077",4170636,"QUEENS","248-02","NORTHERN BOULEVARD","DM","","ISSUED","09/22/2023","01/31/2024",2024-01-03,40.766973,-73.739208
"3078",4211022,"QUEENS","8318","164TH PLACE","A2","OT","ISSUED","10/27/2023","11/15/2023",2023-10-27,40.715751,-73.801721
"3079",3000605,"BROOKLYN","275","ATLANTIC AVENUE","DM","","ISSUED","10/27/2023","07/01/2024",2023-05-02,40.688896,-73.989969
"3080",3071418,"BROOKLYN","325","BUSHWICK AVENUE","A2","PL","ISSUED","10/27/2023","10/26/2024",2020-11-13,40.705204,-73.939407
"3081",3245190,"BROOKLYN","59 A","IDE COURT","A2","OT","ISSUED","10/27/2023","11/22/2023",2023-10-27,40.581645,-73.95789
"3082",2057045,"BRONX","800","EAST GUN HILL ROAD","A2","PL","ISSUED","11/05/2024","11/05/2025",2021-11-22,40.875953,-73.86197
"3083",4624066,"QUEENS","23-30","BORDEN AVENUE","NB","","ISSUED","10/27/2023","07/01/2024",2021-12-09,40.739918,-73.947213
"3084",4174576,"QUEENS","80-45","252 STREET","A2","OT","ISSUED","10/27/2023","11/15/2023",2023-10-27,40.742396,-73.718081
"3085",2072463,"BRONX","3410","DE REIMER AVENUE","A2","OT","ISSUED","10/27/2023","02/14/2024",2023-10-27,40.879631,-73.836703
"3086",1015733,"MANHATTAN","262","5 AVENUE","A3","EQ","ISSUED","11/10/2022","10/26/2024",2022-11-10,40.745081,-73.987019
"3087",3429697,"BROOKLYN","450","UNION STREET","DM","","ISSUED","04/10/2023","02/20/2024",2023-04-12,40.679877,-73.989407
"3088",3429697,"BROOKLYN","450","UNION STREET","DM","EQ","ISSUED","04/12/2023","04/11/2024",2023-04-12,40.679877,-73.989407
"3089",1087511,"MANHATTAN","27","WEST 72ND STREET","A2","OT","ISSUED","01/04/2024","12/29/2024",2022-03-31,40.776979,-73.977748
"3090",1087511,"MANHATTAN","27","WEST 72ND STREET","A2","PL","ISSUED","01/04/2024","01/03/2025",2022-04-09,40.776979,-73.977748
"3091",1046258,"MANHATTAN","537","EAST 71 STREET","A2","SP","ISSUED","10/30/2023","10/29/2024",2021-11-09,40.765809,-73.953377
"3092",1046258,"MANHATTAN","537","EAST 71 STREET","A2","SD","ISSUED","10/30/2023","10/29/2024",2021-11-09,40.765809,-73.953377
"3093",1018895,"MANHATTAN","123","EAST 35 STREET","A2","MH","ISSUED","10/30/2023","06/30/2024",2023-10-30,40.747345,-73.979869
"3094",3429214,"BROOKLYN","955","STERLING PLACE","NB","","ISSUED","01/04/2024","03/31/2024",2021-12-23,40.672347,-73.946733
"3095",1077363,"MANHATTAN","712","5TH AVENUE","A1","","ISSUED","10/30/2023","11/01/2024",2021-05-21,40.762495,-73.975193
"3096",1036505,"MANHATTAN","425","PARK AVENUE","A2","OT","ISSUED","10/30/2023","11/01/2024",2020-01-09,40.760512,-73.971541
"3097",1036505,"MANHATTAN","425","PARK AVENUE","A2","MH","ISSUED","10/30/2023","11/01/2024",2020-01-09,40.760512,-73.971541
"3098",1083026,"MANHATTAN","2","PENN PLAZA","A1","","ISSUED","10/27/2023","10/29/2024",2021-01-22,40.750017,-73.991345
"3099",3225258,"BROOKLYN","951","E 88TH ST","A2","OT","ISSUED","10/31/2023","04/21/2024",2023-10-31,40.638366,-73.906423
"3100",1083026,"MANHATTAN","2","PENN PLAZA","A2","OT","ISSUED","10/31/2023","11/01/2024",2021-10-18,40.750017,-73.991345
"3101",1083026,"MANHATTAN","2","PENN PLAZA","A2","OT","ISSUED","10/31/2023","11/01/2024",2020-07-21,40.750017,-73.991345
"3102",1083026,"MANHATTAN","2","PENN PLAZA","A2","OT","ISSUED","10/31/2023","11/01/2024",2021-01-22,40.750017,-73.991345
"3103",3243666,"BROOKLYN","2440","EAST 66 STREET","A2","OT","ISSUED","10/31/2023","04/21/2024",2023-10-31,40.610726,-73.906772
"3104",3079253,"BROOKLYN","162","COVERT ST","NB","","ISSUED","10/31/2023","03/19/2024",2023-04-19,40.689421,-73.909233
"3105",3428543,"BROOKLYN","353","20TH STREET","NB","PL","ISSUED","10/31/2023","10/30/2024",2021-02-02,40.659703,-73.989162
"3106",3192734,"BROOKLYN","364","AVENUE U","DM","","ISSUED","10/31/2023","09/05/2024",2023-11-15,40.597237,-73.970815
"3107",3192734,"BROOKLYN","364","AVENUE U","DM","EQ","ISSUED","10/31/2023","11/16/2024",2023-11-17,40.597237,-73.970815
"3108",3192735,"BROOKLYN","2110","EAST 1 STREET","DM","","ISSUED","10/31/2023","09/05/2024",2023-11-20,40.59697,-73.970509
"3109",3109498,"BROOKLYN","3515","SNYDER AVENUE","A2","OT","ISSUED","11/05/2024","05/01/2025",2023-10-20,40.649241,-73.944337
"3110",1005679,"MANHATTAN","197","BOWERY","A2","OT","ISSUED","11/01/2023","01/31/2024",2023-11-01,40.721095,-73.993723
"3111",1051383,"MANHATTAN","610","EAST 83RD STREET","A1","","ISSUED","11/01/2023","11/01/2024",2023-08-15,40.772879,-73.945963
"3112",2130439,"BRONX","784","COURTLANDT AVENUE","NB","","ISSUED","11/01/2023","04/08/2024",2023-11-01,40.822396,-73.916801
"3113",2130439,"BRONX","784","COURTLANDT AVENUE","NB","","ISSUED","11/01/2023","04/08/2024",2023-11-01,40.822396,-73.916801
"3114",2130439,"BRONX","784","COURTLANDT AVENUE","NB","","ISSUED","11/01/2023","04/08/2024",2023-11-01,40.822396,-73.916801
"3115",2045727,"BRONX","1340","BLONDELL AVENUE","NB","","ISSUED","11/01/2023","10/31/2024",2023-10-04,40.841827,-73.842073
"3116",2007874,"BRONX","1685","MORRIS AVENUE","A3","OT","ISSUED","11/01/2023","11/01/2024",2020-02-25,40.844016,-73.909456
"3117",4192720,"QUEENS","86-20","116 STREET","A2","OT","IN PROCESS","11/01/2023","",2021-12-01,40.699695,-73.833541
"3118",1067116,"MANHATTAN","421","HUDSON STREET","A2","OT","RE-ISSUED","05/16/2022","09/14/2024",2023-11-01,40.730063,-74.006891
"3119",4192720,"QUEENS","86-20","116TH STREET","A1","","","05/18/2022","12/05/2022",2021-11-17,40.699695,-73.833541
"3120",3425060,"BROOKLYN","1020","ROGERS AVE","NB","","","06/02/2022","06/02/2023",2022-06-09,40.645445,-73.951918
"3121",3425060,"BROOKLYN","1020","ROGERS AVE","NB","","","08/30/2022","06/02/2023",2022-06-09,40.645445,-73.951918
"3122",3425060,"BROOKLYN","1020","ROGERS AVE","NB","","","07/06/2023","10/05/2023",2022-06-09,40.645445,-73.951918
"3123",2130573,"BRONX","1940","TURNBULL AVENUE","NB","","ISSUED","06/05/2023","12/30/2024",2022-07-29,40.822911,-73.857365
"3124",3332224,"BROOKLYN","748","HENRY STREET","A2","PL","ISSUED","11/02/2023","11/01/2024",2020-06-26,40.675409,-74.003612
"3125",4607880,"QUEENS","122-06","MERRICK BOULEVARD","NB","","ISSUED","11/02/2023","01/01/2024",2022-03-22,40.683649,-73.769525
"3126",4269324,"QUEENS","119-64","178TH STREET","A2","OT","ISSUED","11/02/2023","04/21/2024",2023-11-02,40.685835,-73.766395
"3127",1001268,"MANHATTAN","165","WILLIAM STREET","A2","OT","ISSUED","11/02/2023","11/06/2024",2023-07-11,40.710185,-74.005829
"3128",3429214,"BROOKLYN","955","STERLING PLACE","NB","","ISSUED","01/02/2024","03/31/2024",2022-07-19,40.672347,-73.946733
"3129",1007411,"MANHATTAN","9","SPRING STREET","A2","OT","ISSUED","11/03/2023","08/31/2024",2022-09-26,40.721216,-73.994452
"3130",3114203,"BROOKLYN","3611","GLENWOOD RD","A2","OT","ISSUED","11/03/2023","12/06/2023",2023-11-03,40.634376,-73.941799
"3131",3425060,"BROOKLYN","1020","ROGERS AVE","NB","EQ","ISSUED","11/03/2023","11/02/2024",2024-11-03,40.645445,-73.951918
"3132",3332217,"BROOKLYN","92","CENTRE MALL","A2","PL","ISSUED","11/03/2023","11/02/2024",2021-08-27,40.674833,-74.003558
"3133",3332221,"BROOKLYN","465","COLUMBIA STREET","A2","PL","ISSUED","11/03/2023","11/02/2024",2021-08-27,40.676375,-74.006861
"3134",1004377,"MANHATTAN","270","EAST 2ND STREET","NB","","ISSUED","11/06/2023","11/19/2023",2023-05-25,40.720822,-73.980602
"3135",1078053,"MANHATTAN","725","FDR DRIVE","A2","OT","ISSUED","11/06/2023","05/15/2024",2020-07-08,40.721318,-73.974812
"3136",1078053,"MANHATTAN","725","FDR DRIVE","A2","OT","ISSUED","11/06/2023","05/15/2024",2020-07-08,40.721318,-73.974812
"3137",1078053,"MANHATTAN","725","FDR DRIVE","A2","OT","ISSUED","11/06/2023","05/15/2024",2020-07-08,40.721318,-73.974812
"3138",1078053,"MANHATTAN","725","FDR DRIVE","A2","OT","ISSUED","11/06/2023","05/15/2024",2020-07-08,40.721318,-73.974812
"3139",5130512,"STATEN ISLAND","25","AUGUSTA AVENUE","A2","OT","ISSUED","01/05/2024","12/31/2024",2020-03-04,40.551882,-74.168869
"3140",5130512,"STATEN ISLAND","25","AUGUSTA AVENUE","A2","OT","ISSUED","01/05/2024","12/31/2024",2020-02-05,40.551882,-74.168869
"3141",1054420,"MANHATTAN","120","EAST 123RD STREET","A2","OT","ISSUED","11/07/2023","12/01/2024",2022-02-04,40.8034,-73.939173
"3142",1063346,"MANHATTAN","99","FORT WASHINGTON AVENUE","A2","OT","ISSUED","11/07/2023","12/01/2024",2021-01-28,40.83851,-73.943738
"3143",1063346,"MANHATTAN","99","FORT WASHINGTON AVENUE","A2","OT","ISSUED","11/07/2023","12/01/2024",2021-02-08,40.83851,-73.943738
"3144",5046954,"STATEN ISLAND","36","WILSON ST","A2","OT","ISSUED","11/08/2023","07/01/2024",2023-11-08,40.597449,-74.090804
"3145",2057045,"BRONX","800","EAST GUN HILL ROAD","A2","PL","ISSUED","11/08/2023","11/07/2024",2021-11-22,40.875953,-73.86197
"3146",3004087,"BROOKLYN","142","DEGRAW STREET","A2","OT","ISSUED","11/08/2023","06/12/2024",2023-11-08,40.685463,-74.001428
"3147",2127043,"BRONX","4643","CARPENTER AVENUE","A2","OT","ISSUED","11/08/2023","12/06/2023",2023-11-08,40.903831,-73.853556
"3148",2075362,"BRONX","3296","POLO PLACE","A2","OT","ISSUED","11/08/2023","01/22/2024",2023-11-08,40.840069,-73.818734
"3149",1054420,"MANHATTAN","120","EAST 123RD STREET","A2","OT","ISSUED","11/08/2023","07/01/2024",2023-11-08,40.8034,-73.939173
"3150",2092082,"BRONX","3603","THIRD AVENUE","A2","MH","ISSUED","11/08/2023","11/11/2024",2021-07-15,40.83308,-73.904809
"3151",3007924,"BROOKLYN","131","3RD STREET","DM","EQ","IN PROCESS","11/08/2023","",2023-10-20,40.676732,-73.991409
"3152",2025875,"BRONX","1968","ELLIS AVE","A2","OT","ISSUED","11/01/2023","04/03/2024",2023-11-08,40.831614,-73.858814
"3153",1091739,"MANHATTAN","40","WEST 137 STREET","NB","","ISSUED","11/03/2023","10/07/2024",2022-12-27,40.814603,-73.938039
"3154",4273788,"QUEENS","190-02","122ND AVE","A2","OT","ISSUED","11/09/2023","04/21/2024",2023-11-09,40.684807,-73.756497
"3155",2130763,"BRONX","101","LINCOLN AVENUE","A3","OT","ISSUED","11/09/2023","09/30/2024",2023-11-09,40.807149,-73.929969
"3156",4060553,"QUEENS","61-12","56 ROAD","NB","","ISSUED","11/09/2023","07/01/2024",2020-11-12,40.724355,-73.903976
"3157",2013297,"BRONX","2075","WEBSTER AVENUE","NB","PL","ISSUED","11/09/2023","11/08/2024",2022-11-17,40.851741,-73.898493
"3158",1031114,"MANHATTAN","321","WEST 78TH STREET","A2","OT","ISSUED","11/09/2023","05/15/2024",2023-11-09,40.783828,-73.982035
"3159",2010965,"BRONX","1900","LONGFELLOW AVENUE","A1","","ISSUED","11/02/2023","09/04/2024",2023-11-09,40.838969,-73.882285
"3160",2001965,"BRONX","943","TELLER AVENUE","A2","PL","ISSUED","11/10/2023","11/09/2024",2022-01-07,40.826292,-73.915467
"3161",5175245,"STATEN ISLAND","839","FATHER CAPODANNO BOULEVARD","NB","PL","ISSUED","11/10/2023","11/09/2024",2021-11-15,40.575512,-74.083478
"3162",5082928,"STATEN ISLAND","2","JOHANNA LANE","A2","OT","ISSUED","11/13/2023","10/01/2024",2023-11-24,40.522545,-74.199458
"3163",3063807,"BROOKLYN","54","DUPONT STREET","A1","PL","ISSUED","11/13/2023","11/12/2024",2022-06-07,40.73561,-73.957825
"3164",1051383,"MANHATTAN","610","EAST 83RD STREET","A1","","ISSUED","11/13/2023","11/01/2024",2023-08-15,40.772879,-73.945963
"3165",3127173,"BROOKLYN","717","EAST 4 STREET","A2","OT","ISSUED","11/13/2023","06/01/2024",2023-11-13,40.634597,-73.97478
"3166",1079184,"MANHATTAN","261","11 AVENUE","A2","EQ","ISSUED","11/13/2023","11/12/2024",2022-11-07,40.751502,-74.005118
"3167",2097312,"BRONX","2850","GOULDEN AVENUE","A2","SP","ISSUED","11/13/2023","11/12/2024",2023-01-26,40.872898,-73.896175
"3168",5045300,"STATEN ISLAND","44","LYMAN AVENUE","A3","OT","ISSUED","11/14/2023","08/20/2024",2023-11-14,40.607195,-74.063094
"3169",3047654,"BROOKLYN","486","DECATUR STREET","A2","OT","ISSUED","11/14/2023","06/12/2024",2023-11-14,40.682572,-73.923542
"3170",3088951,"BROOKLYN","439","LINWOOD STREET","A2","OT","ISSUED","11/14/2023","12/06/2023",2023-11-14,40.674671,-73.882777
"3171",1091036,"MANHATTAN","355","WEST 39 STREET","A3","EQ","ISSUED","08/25/2020","08/25/2021",2020-08-25,40.755978,-73.992694
"3172",1091036,"MANHATTAN","355","WEST 39 STREET","A3","EQ","ISSUED","09/17/2020","09/17/2021",2020-09-17,40.755978,-73.992694
"3173",1091036,"MANHATTAN","355","WEST 39TH STREET","NB","","ISSUED","05/25/2022","05/25/2023",2022-05-25,40.755978,-73.992694
"3174",1091036,"MANHATTAN","355","WEST 39TH STREET","NB","","ISSUED","05/25/2022","05/25/2023",2022-05-25,40.755978,-73.992694
"3175",1091036,"MANHATTAN","355","WEST 39TH STREET","NB","","ISSUED","09/29/2022","10/31/2023",2022-10-31,40.755978,-73.992694
"3176",1091036,"MANHATTAN","355","WEST 39TH STREET","NB","PL","ISSUED","09/29/2022","09/29/2023",2022-09-29,40.755978,-73.992694
"3177",1091036,"MANHATTAN","355","WEST 39TH STREET","NB","","ISSUED","06/13/2023","02/17/2024",2022-05-25,40.755978,-73.992694
"3178",3007924,"BROOKLYN","131","3RD STREET","DM","","ISSUED","10/31/2023","08/16/2024",2023-11-17,40.676732,-73.991409
"3179",4532158,"QUEENS","133-42","37 AVE","A1","","ISSUED","01/03/2024","01/04/2025",2024-01-05,40.760667,-73.833483
"3180",1091643,"MANHATTAN","310","HUDSON STREET","NB","","ISSUED","11/15/2023","10/14/2024",2021-01-21,40.726168,-74.007494
"3181",3429228,"BROOKLYN","75","DUPONT STREET","NB","","IN PROCESS","11/15/2023","",2022-05-02,40.735698,-73.957082
"3182",3157466,"BROOKLYN","7000","21 AVE.","A2","OT","ISSUED","11/15/2023","11/14/2024",2020-06-19,40.612273,-73.986713
"3183",1091643,"MANHATTAN","304","HUDSON STREET","A2","EQ","ISSUED","11/15/2023","11/14/2024",2022-11-09,40.726009,-74.007519
"3184",5027495,"STATEN ISLAND","59","UNION AVENUE","A2","OT","ISSUED","11/15/2023","10/21/2024",2023-11-22,40.635202,-74.158018
"3185",1004377,"MANHATTAN","270","EAST 2ND STREET","NB","","ISSUED","11/16/2023","11/19/2023",2023-05-25,40.720822,-73.980602
"3186",1004377,"MANHATTAN","270","EAST 2ND STREET","NB","","ISSUED","11/16/2023","11/19/2023",2023-05-25,40.720822,-73.980602
"3187",1004377,"MANHATTAN","270","EAST 2ND STREET","NB","","ISSUED","11/16/2023","11/19/2024",2023-11-16,40.720822,-73.980602
"3188",1004377,"MANHATTAN","270","EAST 2ND STREET","NB","","ISSUED","11/16/2023","11/19/2024",2023-05-25,40.720822,-73.980602
"3189",1004377,"MANHATTAN","270","EAST 2ND STREET","NB","","ISSUED","11/16/2023","11/19/2024",2023-05-25,40.720822,-73.980602
"3190",4104050,"QUEENS","160-21","12TH AVE","A2","OT","ISSUED","11/16/2023","04/21/2024",2023-11-16,40.791138,-73.801547
"3191",3428579,"BROOKLYN","609","OSBORNE STREET","NB","","ISSUED","11/16/2023","11/15/2024",2023-11-16,40.656983,-73.90555
"3192",3428579,"BROOKLYN","609","OSBORNE STREET","NB","","ISSUED","11/16/2023","11/15/2024",2023-11-16,40.656983,-73.90555
"3193",5015913,"STATEN ISLAND","34","CEDARCLIFF ROAD","A1","","ISSUED","11/15/2023","11/15/2024",2023-11-16,40.617136,-74.088771
"3194",1004377,"MANHATTAN","270","EAST 2ND STREET","NB","","ISSUED","11/15/2023","11/19/2023",2023-11-16,40.720822,-73.980602
"3195",3255289,"BROOKLYN","2940","WEST 15 STREET","NB","","ISSUED","01/08/2024","08/19/2024",2022-03-14,40.576271,-73.982552
"3196",5076807,"STATEN ISLAND","53","SUNFIELD AVENUE","A2","OT","ISSUED","11/17/2023","11/15/2024",2023-11-17,40.559389,-74.177787
"3197",2093464,"BRONX","660","ARNOW AVENUE","A2","OT","ISSUED","11/17/2023","08/31/2024",2023-11-17,40.867916,-73.869015
"3198",1012540,"MANHATTAN","436","WEST 15TH ST","A1","","ISSUED","11/17/2023","12/10/2024",2021-02-05,40.742285,-74.006416
"3199",4623141,"QUEENS","53-16","NORTHERN BOULEVARD","NB","PL","ISSUED","01/08/2024","01/07/2025",2022-02-08,40.753192,-73.907839
"3200",2101738,"BRONX","680","ADEE AVENUE","A2","OT","ISSUED","11/20/2023","08/31/2024",2023-11-20,40.86968,-73.867812
"3201",3057705,"BROOKLYN","1084","FULTON STREET","A2","SP","IN PROCESS","11/20/2023","",2021-05-07,40.681528,-73.957603
"3202",3429228,"BROOKLYN","75","DUPONT STREET","NB","","IN PROCESS","11/20/2023","",2022-05-02,40.735698,-73.957082
"3203",4290064,"QUEENS","253-68","148TH ROAD","A2","OT","ISSUED","11/20/2023","04/21/2024",2023-11-20,40.654438,-73.736285
"3204",3039905,"BROOKLYN","1510","BROADWAY","NB","PL","ISSUED","11/20/2023","11/19/2024",2022-11-21,40.686811,-73.917364
"3205",3054191,"BROOKLYN","67","TAAFFE PLACE","DM","","ISSUED","11/20/2023","06/01/2024",2023-11-20,40.69691,-73.960735
"3206",3330085,"BROOKLYN","71","QUAY STREET","DM","","ISSUED","11/20/2023","09/05/2024",2023-11-20,40.726221,-73.958369
"3207",4051200,"QUEENS","64-35","102ND STREET","A2","OT","ISSUED","11/20/2023","05/01/2024",2023-12-13,40.730941,-73.853164
"3208",3428817,"BROOKLYN","268","BARBEY STREET","NB","","ISSUED","11/21/2023","11/20/2024",2022-06-02,40.676365,-73.888452
"3209",3057705,"BROOKLYN","1084","FULTON STREET","A2","MH","ISSUED","11/21/2023","12/18/2023",2023-11-21,40.681528,-73.957603
"3210",3328501,"BROOKLYN","2058","CROPSEY AVE","A2","OT","ISSUED","11/21/2023","04/25/2024",2023-11-21,40.599126,-74.001268
"3211",3342298,"BROOKLYN","1098","GATES AVENUE","A2","OT","ISSUED","11/21/2023","07/01/2024",2023-11-21,40.690102,-73.921456
"3212",1007174,"MANHATTAN","178","MOTT STREET","A1","","ISSUED","11/21/2023","01/01/2025",2020-12-09,40.720429,-73.995923
"3213",1091036,"MANHATTAN","355","WEST 39TH STREET","NB","PL","ISSUED","11/21/2023","11/20/2024",2022-09-29,40.755978,-73.992694
"3214",2130750,"BRONX","1600","GRAND AVE","A2","OT","ISSUED","01/08/2024","04/25/2024",2024-01-08,40.8465,-73.916612
"3215",3057705,"BROOKLYN","1084","FULTON STREET","A2","PL","ISSUED","11/22/2023","11/21/2024",2022-09-13,40.681528,-73.957603
"3216",1046667,"MANHATTAN","1076","MADISON AVENUE","A1","","ISSUED","11/22/2023","08/15/2024",2021-06-01,40.777826,-73.961041
"3217",4619191,"QUEENS","97-45","63RD DRIVE","A1","","ISSUED","11/24/2023","11/23/2024",2023-11-24,40.730683,-73.859796
"3218",4266097,"QUEENS","129-31","157 STREET","A2","OT","ISSUED","11/24/2023","04/21/2024",2023-11-24,40.674497,-73.782008
"3219",1088961,"MANHATTAN","20","HUDSON YARDS","A2","OT","ISSUED","06/17/2024","01/29/2025",2023-03-23,40.753045,-74.000282
"3220",2056516,"BRONX","931","BURKE AVENUE","A2","OT","ISSUED","11/24/2023","04/13/2024",2023-11-24,40.871323,-73.860136
"3221",1088961,"MANHATTAN","20","HUDSON YARDS","A2","OT","ISSUED","06/17/2024","01/29/2025",2023-03-27,40.753045,-74.000282
"3222",3429464,"BROOKLYN","2440","FULTON STREET","NB","","ISSUED","11/27/2023","12/31/2023",2022-07-11,40.677869,-73.903473
"3223",3429464,"BROOKLYN","2440","FULTON STREET","NB","","ISSUED","11/27/2023","12/31/2023",2022-07-11,40.677869,-73.903473
"3224",3429464,"BROOKLYN","2440","FULTON STREET","NB","","ISSUED","11/27/2023","12/31/2023",2022-07-11,40.677869,-73.903473
"3225",4268075,"QUEENS","168-19","119TH AVE","A2","OT","ISSUED","11/27/2023","07/01/2024",2023-11-27,40.68342,-73.776073
"3226",2071870,"BRONX","4750","WHITE PLAINS ROAD","NB","","ISSUED","11/27/2023","06/01/2024",2023-06-07,40.904834,-73.849625
"3227",2071870,"BRONX","4750","WHITE PLAINS ROAD","NB","","ISSUED","11/27/2023","06/01/2024",2023-06-07,40.904834,-73.849625
"3228",3424544,"BROOKLYN","280","MOTHER GASTON BLVD","A2","OT","ISSUED","11/27/2023","08/31/2024",2023-11-27,40.672537,-73.907612
"3229",2071870,"BRONX","4750","WHITE PLAINS ROAD","NB","","ISSUED","11/24/2023","06/01/2024",2023-06-07,40.904834,-73.849625
"3230",3429716,"BROOKLYN","29","WHARF PLAZA","NB","EQ","ISSUED","05/16/2023","05/15/2024",2022-05-26,NA,NA
"3231",3429716,"BROOKLYN","29","WHARF PLAZA","NB","","ISSUED","08/23/2023","11/27/2023",2022-05-26,NA,NA
"3232",5108496,"STATEN ISLAND","151","JERSEY STREET","A2","OT","ISSUED","11/28/2023","08/31/2024",2023-12-08,40.644047,-74.086727
"3233",3393582,"BROOKLYN","364","MILFORD STREET","A2","OT","ISSUED","11/28/2023","04/21/2024",2023-11-28,40.67016,-73.876008
"3234",2051283,"BRONX","2500","BARKER AVENUE","NB","","ISSUED","11/28/2023","09/21/2024",2020-09-30,40.863569,-73.86936
"3235",2071870,"BRONX","4750","WHITE PLAINS ROAD","NB","","ISSUED","11/28/2023","06/01/2024",2023-06-07,40.904834,-73.849625
"3236",3429716,"BROOKLYN","29","WHARF PLAZA","NB","","ISSUED","05/26/2022","05/26/2023",2022-05-26,NA,NA
"3237",3429716,"BROOKLYN","29","WHARF PLAZA","NB","EQ","ISSUED","05/26/2022","05/26/2023",2022-05-26,NA,NA
"3238",3429716,"BROOKLYN","29","WHARF PLAZA","NB","","ISSUED","11/15/2022","08/27/2023",2022-05-26,NA,NA
"3239",3429084,"BROOKLYN","624","METROPOLITAN AVENUE","NB","","ISSUED","11/29/2023","12/10/2023",2022-06-01,40.714156,-73.948301
"3240",4271735,"QUEENS","196-11","118 AVENUE","A2","OT","ISSUED","11/29/2023","12/06/2023",2023-11-29,40.692561,-73.754972
"3241",3429228,"BROOKLYN","75","DUPONT STREET","NB","","ISSUED","11/29/2023","11/28/2024",2022-12-14,40.735698,-73.957082
"3242",3060114,"BROOKLYN","575","BEDFORD AVE","A1","","ISSUED","11/29/2023","01/12/2025",2022-08-25,40.703877,-73.960824
"3243",4077096,"QUEENS","91-18","70 AVENUE","A1","PL","ISSUED","11/29/2023","12/13/2024",2021-08-02,40.711702,-73.852798
"3244",3427365,"BROOKLYN","1607","PACIFIC STREET","NB","","ISSUED","12/01/2022","01/21/2023",2022-12-08,40.676984,-73.937334
"3245",3427365,"BROOKLYN","1607","PACIFIC STREET","NB","","ISSUED","01/19/2023","01/05/2024",2022-12-08,40.676984,-73.937334
"3246",2051283,"BRONX","2500","BARKER AVENUE","NB","","ISSUED","11/28/2023","09/21/2024",2020-09-30,40.863569,-73.86936
"3247",1004377,"MANHATTAN","270","EAST 2ND STREET","NB","","ISSUED","01/02/2024","11/19/2024",2023-11-16,40.720822,-73.980602
"3248",4433860,"QUEENS","104-20","QUEENS BOULEVARD","A2","OT","ISSUED","12/01/2023","12/06/2024",2020-01-07,40.72378,-73.848991
"3249",3076057,"BROOKLYN","1333","BROADWAY","NB","","ISSUED","12/01/2023","02/18/2024",2021-07-29,40.690065,-73.923046
"3250",4031086,"QUEENS","41-34","57 STREET","A2","OT","ISSUED","12/01/2023","07/01/2024",2023-12-07,40.744955,-73.907724
"3251",3323702,"BROOKLYN","100","DWIGHT STREET","NB","","ISSUED","01/09/2024","03/20/2024",2020-05-06,40.675752,-74.009377
"3252",1050618,"MANHATTAN","421","EAST 88 STREET","A2","OT","ISSUED","12/04/2023","11/30/2024",2021-04-06,40.777911,-73.947757
"3253",1050618,"MANHATTAN","421","EAST 88 STREET","A2","OT","ISSUED","12/04/2023","11/30/2024",2021-04-06,40.777911,-73.947757
"3254",1060298,"MANHATTAN","206","WEST 139TH STREET","A2","OT","ISSUED","12/04/2023","06/12/2024",2023-12-04,40.818025,-73.942285
"3255",4226762,"QUEENS","93-24","218 STREET","A2","OT","ISSUED","12/04/2023","04/21/2024",2023-12-04,40.72097,-73.73907
"3256",1090459,"MANHATTAN","255","WEST 34TH STREET","NB","","ISSUED","12/04/2023","12/03/2024",2020-06-05,40.751823,-73.992569
"3257",2129342,"BRONX","1746","ANDREWS AVE SO","NB","","ISSUED","12/04/2023","04/30/2024",2022-03-25,40.85037,-73.917222
"3258",3429227,"BROOKLYN","65","DUPONT STREET","NB","","ISSUED","11/14/2023","12/03/2024",2022-04-28,40.735668,-73.957396
"3259",3429227,"BROOKLYN","65","DUPONT STREET","NB","","ISSUED","11/14/2023","12/03/2024",2022-04-28,40.735668,-73.957396
"3260",3076057,"BROOKLYN","1333","BROADWAY","NB","","ISSUED","12/01/2023","02/18/2024",2022-01-13,40.690065,-73.923046
"3261",3009549,"BROOKLYN","218","23 STREET","DM","","ISSUED","12/01/2023","06/17/2024",2023-12-04,40.660664,-73.995329
"3262",3429227,"BROOKLYN","65","DUPONT STREET","NB","","ISSUED","11/14/2023","12/21/2024",2023-06-22,40.735668,-73.957396
"3263",3144156,"BROOKLYN","333","65TH STREET","A2","BL","ISSUED","12/05/2023","10/28/2024",2023-07-12,40.638827,-74.022721
"3264",5105252,"STATEN ISLAND","401","ANNADALE ROAD","A3","OT","ISSUED","12/05/2023","12/04/2024",2023-12-05,40.552926,-74.175554
"3265",1091819,"MANHATTAN","3800","10 AVENUE","NB","","ISSUED","12/05/2023","07/02/2024",2023-12-05,40.86204,-73.920707
"3266",2017263,"BRONX","261","E 202 ST","A2","OT","ISSUED","12/05/2023","04/25/2024",2023-12-05,40.872791,-73.884688
"3267",3245804,"BROOKLYN","89","WEST END AVE","NB","","ISSUED","11/30/2023","05/17/2024",2021-04-16,40.579694,-73.953413
"3268",3115866,"BROOKLYN","601","PARKSIDE AVENUE","A2","MH","ISSUED","12/06/2023","10/25/2024",2021-10-25,40.656046,-73.953742
"3269",3115866,"BROOKLYN","601","PARKSIDE AVENUE","A2","OT","ISSUED","12/06/2023","10/25/2024",2021-10-25,40.656046,-73.953742
"3270",1080352,"MANHATTAN","450","11 AVENUE","A3","EQ","ISSUED","12/06/2023","12/05/2024",2020-06-19,40.757486,-74.000729
"3271",5855252,"STATEN ISLAND","35","VAN DUZER STREET","NB","","ISSUED","12/06/2023","12/04/2024",2021-05-21,40.637291,-74.077682
"3272",2005129,"BRONX","907","AVENUE ST JOHN","A1","","ISSUED","12/04/2023","12/06/2024",2023-12-07,40.815899,-73.902933
"3273",1014251,"MANHATTAN","220","WEST 28TH STREET","A1","","ISSUED","12/07/2023","01/01/2025",2021-12-29,40.747582,-73.994197
"3274",3098533,"BROOKLYN","699","LOGAN STREET","A2","OT","ISSUED","12/07/2023","12/06/2024",2023-12-07,40.668728,-73.874439
"3275",2017263,"BRONX","261","E 202 ST","NB","","ISSUED","12/07/2023","03/19/2024",2020-12-04,40.872791,-73.884688
"3276",2017263,"BRONX","261","E 202 ST","NB","","ISSUED","12/07/2023","01/01/2025",2020-12-04,40.872791,-73.884688
"3277",2017263,"BRONX","261","E 202 ST","NB","","ISSUED","12/07/2023","01/01/2025",2020-12-04,40.872791,-73.884688
"3278",2130922,"BRONX","3893","WALDO AVENUE","NB","","ISSUED","01/19/2021","02/19/2021",2021-01-19,40.888815,-73.903026
"3279",2130922,"BRONX","3893","WALDO AVENUE","NB","","ISSUED","02/16/2021","07/02/2022",2021-07-02,40.888815,-73.903026
"3280",2130922,"BRONX","3893","WALDO AVENUE","NB","","ISSUED","07/13/2021","07/13/2022",2021-07-13,40.888815,-73.903026
"3281",2130922,"BRONX","3893","WALDO AVENUE","NB","","ISSUED","07/14/2021","02/03/2022",2021-01-19,40.888815,-73.903026
"3282",2130922,"BRONX","3893","WALDO AVENUE","NB","","ISSUED","02/04/2022","02/03/2023",2021-01-19,40.888815,-73.903026
"3283",2130922,"BRONX","3893","WALDO AVENUE","NB","PL","ISSUED","05/31/2022","05/31/2023",2022-05-31,40.888815,-73.903026
"3284",2130922,"BRONX","3893","WALDO AVENUE","NB","","ISSUED","06/06/2022","06/06/2023",2021-01-19,40.888815,-73.903026
"3285",2130922,"BRONX","3893","WALDO AVENUE","NB","","ISSUED","06/06/2022","06/06/2023",2021-07-02,40.888815,-73.903026
"3286",2130922,"BRONX","3893","WALDO AVENUE","NB","","ISSUED","06/06/2022","06/06/2023",2021-07-13,40.888815,-73.903026
"3287",2130922,"BRONX","39","DASH PLACE","A3","OT","ISSUED","05/05/2023","02/19/2024",2023-05-05,40.889557,-73.903896
"3288",2130922,"BRONX","3893","WALDO AVENUE","NB","","ISSUED","05/24/2023","06/01/2024",2021-01-19,40.888815,-73.903026
"3289",2130922,"BRONX","3893","WALDO AVENUE","NB","","ISSUED","05/24/2023","06/01/2024",2021-07-02,40.888815,-73.903026
"3290",2130922,"BRONX","3893","WALDO AVENUE","NB","","ISSUED","05/24/2023","02/19/2024",2021-07-13,40.888815,-73.903026
"3291",2130922,"BRONX","3893","WALDO AVENUE","NB","PL","ISSUED","05/30/2023","05/29/2024",2022-05-31,40.888815,-73.903026
"3292",2051283,"BRONX","2500","BARKER AVENUE","NB","","ISSUED","11/28/2023","09/21/2024",2020-09-30,40.863569,-73.86936
"3293",3029556,"BROOKLYN","820","CLASSON AVENUE","A1","","ISSUED","12/08/2023","07/12/2024",2020-01-22,40.672622,-73.960904
"3294",3332217,"BROOKLYN","92","CENTRE MALL","A2","PL","ISSUED","12/08/2023","12/07/2024",2020-07-06,40.674833,-74.003558
"3295",3332224,"BROOKLYN","748","HENRY STREET","A2","PL","ISSUED","12/08/2023","12/07/2024",2020-06-26,40.675409,-74.003612
"3296",3332224,"BROOKLYN","748","HENRY STREET","A2","PL","ISSUED","12/08/2023","12/07/2024",2021-08-27,40.675409,-74.003612
"3297",4623141,"QUEENS","53-16","NORTHERN BOULEVARD","A2","OT","ISSUED","12/08/2023","11/01/2024",2023-12-08,40.753192,-73.907839
"3298",1048273,"MANHATTAN","150","EAST 91 STREET","A3","OT","ISSUED","12/08/2023","04/01/2024",2023-07-31,40.782533,-73.952924
"3299",5156513,"STATEN ISLAND","140","LANDER AVENUE","A2","OT","ISSUED","09/21/2023","01/31/2024",2023-12-08,40.613788,-74.163291
"3300",3109443,"BROOKLYN","3421","SNYDER AVE","A2","SP","ISSUED","12/11/2023","12/10/2024",2020-06-04,40.649186,-73.945238
"3301",5043194,"STATEN ISLAND","54","FAIRWAY AVENUE","A2","OT","ISSUED","12/11/2023","07/01/2024",2023-12-11,40.617764,-74.078376
"3302",4623739,"QUEENS","2-21","MALT DRIVE","A2","OT","ISSUED","12/12/2023","04/22/2025",2022-12-14,NA,NA
"3303",4272459,"QUEENS","188-23","119 RD","A2","OT","ISSUED","12/12/2023","04/21/2024",2023-12-12,40.687504,-73.761164
"3304",3426233,"BROOKLYN","559","PARK AVENUE","NB","PL","ISSUED","12/12/2023","12/11/2024",2021-09-20,40.697144,-73.953529
"3305",3429227,"BROOKLYN","65","DUPONT STREET","NB","","IN PROCESS","12/11/2023","12/11/2024",2022-04-28,40.735668,-73.957396
"3306",5055052,"STATEN ISLAND","541","GREELEY AVE.","NB","PL","ISSUED","12/13/2023","12/12/2024",2020-07-17,40.571176,-74.096236
"3307",3069262,"BROOKLYN","302","GRAHAM AVENUE","NB","","ISSUED","12/13/2023","05/26/2024",2020-02-12,40.712768,-73.944086
"3308",4623739,"QUEENS","2-21","MALT DRIVE","NB","","ISSUED","12/14/2023","04/22/2025",2022-03-03,NA,NA
"3309",1080352,"MANHATTAN","450","11TH AVENUE","NB","PL","ISSUED","12/14/2023","12/13/2024",2021-06-08,40.757486,-74.000729
"3310",4156124,"QUEENS","186-10","UNION TURNPIKE","A1","","ISSUED","01/02/2024","01/08/2025",2022-09-22,40.728691,-73.782726
"3311",1028168,"MANHATTAN","36","WEST 66 STREET","A2","EQ","ISSUED","12/14/2023","12/13/2024",2022-12-15,40.772885,-73.979865
"3312",3063483,"BROOKLYN","337","SOUTH 5TH STREET","A1","","ISSUED","12/13/2023","10/07/2024",2023-12-14,40.708379,-73.955422
"3313",4184844,"QUEENS","9037","76 STREET","A2","OT","IN PROCESS","12/15/2023","",2023-12-15,40.687014,-73.864572
"3314",3058228,"BROOKLYN","111","WILLOUGHBY STREET","NB","","ISSUED","12/15/2023","04/01/2024",2022-05-25,40.69214,-73.984628
"3315",3056243,"BROOKLYN","141","GATES AVENUE","A2","OT","ISSUED","12/15/2023","06/12/2024",2023-12-15,40.684864,-73.962422
"3316",4623141,"QUEENS","53-16","NORTHERN BOULEVARD","NB","PL","ISSUED","12/15/2023","12/14/2024",2022-09-27,40.753192,-73.907839
"3317",1042490,"MANHATTAN","147","EAST 69TH STREET","A1","","ISSUED","12/15/2023","01/01/2025",2021-04-22,40.76828,-73.963108
"3318",1042490,"MANHATTAN","147","EAST 69TH STREET","A2","OT","ISSUED","12/15/2023","01/01/2025",2021-04-08,40.76828,-73.963108
"3319",1042490,"MANHATTAN","147","EAST 69TH STREET","A2","OT","ISSUED","12/15/2023","01/01/2025",2020-07-02,40.76828,-73.963108
"3320",4624942,"QUEENS","25-16","37 AVE","NB","PL","ISSUED","06/28/2023","06/27/2024",2023-06-28,40.756874,-73.93453
"3321",1059460,"MANHATTAN","6","EDGECOMBE AVENUE","A2","PL","ISSUED","01/10/2024","01/09/2025",2023-01-06,40.817372,-73.947712
"3322",3023848,"BROOKLYN","100","15 STREET","A1","","ISSUED","01/11/2024","01/01/2025",2022-01-21,40.66746,-73.993248
"3323",3023848,"BROOKLYN","100","15 STREET","A1","EQ","ISSUED","01/11/2024","01/10/2025",2022-01-21,40.66746,-73.993248
"3324",5814491,"STATEN ISLAND","40","PINE STREET","NB","","ISSUED","01/12/2024","06/11/2024",2020-02-03,40.636169,-74.087456
"3325",3429519,"BROOKLYN","20","VITAL AVENUE","NB","","ISSUED","01/12/2024","04/08/2024",2022-09-08,NA,NA
"3326",4035802,"QUEENS","34-20","JUNCTION BLVD","DM","","RE-ISSUED","03/25/2024","01/28/2025",2024-02-14,40.754464,-73.872404
"3327",1038761,"MANHATTAN","304","EAST 45TH STREET","A2","SP","ISSUED","01/15/2024","01/14/2025",2021-03-05,40.75157,-73.970393
"3328",1038761,"MANHATTAN","304","EAST 45TH STREET","A2","SP","ISSUED","01/15/2024","01/14/2025",2021-03-05,40.75157,-73.970393
"3329",5130512,"STATEN ISLAND","25","AUGUSTA AVENUE","A2","PL","ISSUED","03/25/2024","03/25/2025",2020-03-02,40.551882,-74.168869
"3330",4114142,"QUEENS","40-28","MAIN STREET","A2","OT","ISSUED","01/16/2024","03/01/2024",2020-11-09,40.758861,-73.829802
"3331",3073525,"BROOKLYN","704","HART STREET","DM","EQ","ISSUED","01/17/2024","01/16/2025",2024-01-17,40.69936,-73.925246
"3332",3073525,"BROOKLYN","704","HART STREET","DM","","ISSUED","01/17/2024","01/16/2025",2024-01-17,40.69936,-73.925246
"3333",3429356,"BROOKLYN","83","APOLLO STREET","NB","","ISSUED","01/17/2024","09/03/2024",2022-05-23,40.727137,-73.93807
"3334",2071870,"BRONX","4750","WHITE PLAINS ROAD","NB","","ISSUED","01/17/2024","06/01/2024",2023-06-07,40.904834,-73.849625
"3335",2071870,"BRONX","4750","WHITE PLAINS ROAD","NB","","ISSUED","01/17/2024","06/01/2024",2023-06-07,40.904834,-73.849625
"3336",2071870,"BRONX","4750","WHITE PLAINS ROAD","NB","","RE-ISSUED","01/04/2024","06/01/2024",2023-06-07,40.904834,-73.849625
"3337",4624278,"QUEENS","130-17","ROCKAWAY BOULEVARD","NB","","ISSUED","01/18/2024","01/17/2025",2024-01-18,40.674977,-73.808245
"3338",4624278,"QUEENS","130-17","ROCKAWAY BOULEVARD","NB","PL","ISSUED","01/18/2024","01/17/2025",2024-01-18,40.674977,-73.808245
"3339",1080776,"MANHATTAN","22","EAST 29TH STREET","A2","SD","ISSUED","01/18/2024","01/17/2025",2020-03-09,40.744722,-73.985489
"3340",2020929,"BRONX","420","BOLTON AVE","A1","","ISSUED","11/06/2023","11/02/2024",2021-10-22,40.81404,-73.857413
"3341",2130818,"BRONX","1298","INWOOD AVENUE","DM","EQ","ISSUED","01/19/2024","01/18/2025",2024-01-19,40.838458,-73.920338
"3342",3193844,"BROOKLYN","2255","EAST 2 STREET","A1","","ISSUED","01/19/2024","05/06/2024",2020-03-03,40.594189,-73.969016
"3343",2130818,"BRONX","1298","INWOOD AVENUE","DM","","ISSUED","01/19/2024","04/27/2024",2024-01-19,40.838458,-73.920338
"3344",1058188,"MANHATTAN","170","WEST 133 STREET","A1","","ISSUED","01/19/2024","01/15/2025",2023-04-07,40.813744,-73.944041
"3345",4156029,"QUEENS","184-45","ABERDEEN ROAD","NB","","ISSUED","01/18/2024","04/20/2024",2024-01-19,40.72414,-73.783762
"3346",1089807,"MANHATTAN","76","11TH AVENUE","A2","FS","IN PROCESS","11/17/2023","",2023-08-29,40.745183,-74.008236
"3347",4156029,"QUEENS","184-45","ABERDEEN ROAD","NB","","ISSUED","01/18/2024","04/20/2024",2024-01-19,40.72414,-73.783762
"3348",3429227,"BROOKLYN","65","DUPONT STREET","NB","","ISSUED","01/22/2024","01/21/2025",2022-04-28,40.735668,-73.957396
"3349",3429227,"BROOKLYN","65","DUPONT STREET","NB","","ISSUED","01/22/2024","01/21/2025",2023-06-22,40.735668,-73.957396
"3350",5855252,"STATEN ISLAND","35","VAN DUZER STREET","NB","","ISSUED","01/22/2024","08/12/2024",2021-05-21,40.637291,-74.077682
"3351",4617668,"QUEENS","148-18","HILLSIDE AVE","NB","PL","ISSUED","01/22/2024","01/21/2025",2024-01-22,40.706166,-73.808184
"3352",4156029,"QUEENS","184-45","ABERDEEN ROAD","NB","","ISSUED","01/22/2024","04/20/2024",2024-01-22,40.72414,-73.783762
"3353",1091036,"MANHATTAN","355","WEST 39TH STREET","NB","","ISSUED","01/22/2024","11/03/2024",2022-10-31,40.755978,-73.992694
"3354",4056377,"QUEENS","50-42","69TH PLACE","NB","","ISSUED","01/22/2024","07/01/2024",2023-08-17,40.736122,-73.895082
"3355",1083026,"MANHATTAN","2","PENN PLAZA","A2","EQ","ISSUED","01/22/2024","01/21/2025",2020-02-10,40.750017,-73.991345
"3356",1009242,"MANHATTAN","17","EAST 9TH STREET","A1","","ISSUED","01/22/2024","01/17/2025",2021-05-24,40.732434,-73.994916
"3357",3059089,"BROOKLYN","294","CLERMONT AVENUE","A2","OT","ISSUED","01/23/2024","11/08/2024",2021-11-12,40.688948,-73.970032
"3358",4297683,"QUEENS","833","CENTRAL AVE","A2","PL","ISSUED","01/23/2024","01/22/2025",2024-01-23,40.609907,-73.745025
"3359",4618772,"QUEENS","26-50","1ST STREET","NB","","ISSUED","01/23/2024","01/01/2025",2022-04-22,40.776321,-73.935789
"3360",1091677,"MANHATTAN","58","WEST 39TH STREET","A3","EQ","ISSUED","03/25/2024","03/25/2025",2020-01-15,40.75233,-73.984076
"3361",3332217,"BROOKLYN","92","CENTRE MALL","A2","OT","ISSUED","01/24/2024","01/01/2025",2021-08-19,40.674833,-74.003558
"3362",1004377,"MANHATTAN","270","EAST 2ND STREET","NB","","ISSUED","01/24/2024","11/19/2024",2023-11-16,40.720822,-73.980602
"3363",1077417,"MANHATTAN","23","SAINT JAMES PLACE","A2","OT","ISSUED","01/24/2024","08/17/2024",2024-01-24,40.711618,-73.999852
"3364",1077417,"MANHATTAN","23","SAINT JAMES PLACE","A2","PL","ISSUED","01/24/2024","01/23/2025",2024-01-24,40.711618,-73.999852
"3365",1077417,"MANHATTAN","23","SAINT JAMES PLACE","A2","OT","ISSUED","01/24/2024","08/17/2024",2024-01-24,40.711618,-73.999852
"3366",1077417,"MANHATTAN","23","SAINT JAMES PLACE","A2","PL","ISSUED","01/24/2024","01/23/2025",2024-01-24,40.711618,-73.999852
"3367",4116436,"QUEENS","46-21","COLDEN STREET","A2","MH","ISSUED","01/24/2024","04/01/2024",2020-11-03,40.749545,-73.822073
"3368",3332221,"BROOKLYN","465","COLUMBIA STREET","A2","OT","ISSUED","01/24/2024","01/01/2025",2021-08-02,40.676375,-74.006861
"3369",3332221,"BROOKLYN","465","COLUMBIA STREET","A2","OT","ISSUED","01/24/2024","01/01/2025",2021-08-02,40.676375,-74.006861
"3370",3332221,"BROOKLYN","465","COLUMBIA STREET","A2","OT","ISSUED","01/24/2024","01/01/2025",2021-08-02,40.676375,-74.006861
"3371",3332224,"BROOKLYN","748","HENRY STREET","A2","OT","ISSUED","01/24/2024","01/01/2025",2020-12-17,40.675409,-74.003612
"3372",3332224,"BROOKLYN","748","HENRY STREET","A2","OT","ISSUED","01/24/2024","01/01/2025",2020-12-17,40.675409,-74.003612
"3373",3332224,"BROOKLYN","748","HENRY STREET","A2","OT","ISSUED","01/24/2024","01/01/2025",2020-12-17,40.675409,-74.003612
"3374",1004377,"MANHATTAN","270","EAST 2ND STREET","NB","","ISSUED","01/25/2024","11/19/2024",2023-11-16,40.720822,-73.980602
"3375",4619363,"QUEENS","52-09","31 PLACE","A2","SD","ISSUED","01/26/2024","01/25/2025",2021-05-05,40.737237,-73.936668
"3376",4619363,"QUEENS","52-09","31 PLACE","A2","SP","ISSUED","01/26/2024","01/25/2025",2021-05-05,40.737237,-73.936668
"3377",3082389,"BROOKLYN","411","THATFORD AVE.","A2","PL","ISSUED","01/26/2024","01/25/2025",2020-02-24,40.660306,-73.907355
"3378",3115866,"BROOKLYN","601","PARKSIDE AVENUE","A2","PL","ISSUED","01/25/2024","01/25/2025",2020-02-21,40.656046,-73.953742
"3379",3150481,"BROOKLYN","7805","7 AVENUE","A2","BL","ISSUED","03/26/2024","04/01/2024",2023-06-14,40.624173,-74.018732
"3380",3058228,"BROOKLYN","111","WILLOUGHBY STREET","NB","","ISSUED","03/26/2024","04/01/2025",2022-05-25,40.69214,-73.984628
"3381",3058228,"BROOKLYN","111","WILLOUGHBY STREET","NB","","ISSUED","03/26/2024","04/01/2025",2022-04-28,40.69214,-73.984628
"3382",3058228,"BROOKLYN","111","WILLOUGHBY STREET","NB","","ISSUED","03/26/2024","04/01/2025",2022-04-28,40.69214,-73.984628
"3383",1044935,"MANHATTAN","330","EAST 75TH STREET","A2","OT","ISSUED","03/26/2024","04/01/2025",2021-02-12,40.770383,-73.956085
"3384",1088961,"MANHATTAN","20","HUDSON YARDS","A2","OT","ISSUED","01/30/2024","07/01/2024",2023-03-23,40.753045,-74.000282
"3385",1088961,"MANHATTAN","20","HUDSON YARDS","A2","OT","ISSUED","01/30/2024","07/01/2024",2023-03-27,40.753045,-74.000282
"3386",1091777,"MANHATTAN","740","EIGHTH AVENUE","NB","","ISSUED","01/30/2024","01/29/2025",2022-09-30,40.759546,-73.988095
"3387",1091777,"MANHATTAN","740","EIGHTH AVENUE","NB","","ISSUED","01/30/2024","01/29/2025",2022-09-30,40.759546,-73.988095
"3388",5863316,"STATEN ISLAND","114","NORTHFIELD AVENUE","NB","","ISSUED","01/30/2024","06/11/2024",2022-10-18,40.637658,-74.168217
"3389",5863316,"STATEN ISLAND","114","NORTHFIELD AVENUE","NB","","ISSUED","01/30/2024","06/11/2024",2022-05-19,40.637658,-74.168217
"3390",1083026,"MANHATTAN","2","PENN PLAZA","A2","OT","ISSUED","01/30/2024","11/01/2024",2021-10-18,40.750017,-73.991345
"3391",1083026,"MANHATTAN","2","PENN PLAZA","A1","","ISSUED","01/31/2024","11/01/2024",2021-01-22,40.750017,-73.991345
"3392",3079253,"BROOKLYN","162","COVERT ST","NB","","ISSUED","02/01/2024","03/19/2024",2023-04-19,40.689421,-73.909233
"3393",3117258,"BROOKLYN","2716","CHURCH AVENUE","DM","","ISSUED","02/01/2024","08/16/2024",2023-02-15,40.650671,-73.952181
"3394",2130763,"BRONX","101","LINCOLN AVENUE","NB","PL","ISSUED","02/01/2024","01/31/2025",2021-03-10,40.807149,-73.929969
"3395",4623835,"QUEENS","36-45","31ST STREET","NB","","ISSUED","02/01/2024","07/27/2024",2021-05-07,40.755831,-73.930348
"3396",4619737,"QUEENS","137-48","75 ROAD","NB","","ISSUED","02/01/2024","12/29/2024",2020-09-25,40.722757,-73.823011
"3397",4436311,"QUEENS","81-03","HAMMELS BLVD","A2","PL","ISSUED","02/02/2024","02/01/2025",2020-01-24,40.589896,-73.807556
"3398",4436311,"QUEENS","81-03","HAMMELS BLVD","A2","PL","ISSUED","02/02/2024","02/01/2025",2020-01-24,40.589896,-73.807556
"3399",4623739,"QUEENS","2-21","MALT DRIVE","A3","OT","ISSUED","02/02/2024","02/07/2025",2023-03-30,NA,NA
"3400",2130726,"BRONX","1525","BRYANT AVENUE","NB","PL","ISSUED","02/05/2024","02/04/2025",2024-02-05,40.833484,-73.88691
"3401",3227438,"BROOKLYN","1358","E 87 ST","A2","OT","ISSUED","02/05/2024","04/13/2024",2024-02-05,40.631254,-73.899768
"3402",3150481,"BROOKLYN","7805","7 AVENUE","A2","OT","ISSUED","02/05/2024","11/21/2024",2023-05-12,40.624173,-74.018732
"3403",2130596,"BRONX","6201","BROADWAY","NB","","IN PROCESS","02/05/2024","",2024-02-05,40.896116,-73.896761
"3404",1088590,"MANHATTAN","261","EAST 78 STREET","A1","","ISSUED","02/05/2024","02/04/2025",2024-02-05,40.773062,-73.956491
"3405",2129656,"BRONX","4720","THIRD AVENUE","NB","PL","ISSUED","02/05/2024","02/04/2025",2023-02-08,40.859417,-73.891128
"3406",2004303,"BRONX","610","EAST 169TH STREET","A2","OT","ISSUED","02/05/2024","05/01/2024",2020-01-29,40.831387,-73.90213
"3407",4290856,"QUEENS","259-07","147TH RD","A1","","ISSUED","02/06/2024","02/05/2025",2024-02-06,40.65636,-73.729192
"3408",4624981,"QUEENS","144-02","135TH AVENUE","A1","","ISSUED","02/06/2024","12/29/2024",2024-02-06,40.668289,-73.79599
"3409",2044269,"BRONX","1551","WILLIAMSBRIDGE ROAD","A2","PL","ISSUED","02/06/2024","02/05/2025",2020-11-12,40.845916,-73.847821
"3410",3185382,"BROOKLYN","2501","86 ST","DM","","ISSUED","02/05/2024","02/05/2025",2024-02-06,40.597865,-73.987076
"3411",4623141,"QUEENS","53-16","NORTHERN BLVD","A2","SP","ISSUED","02/07/2024","02/06/2025",2023-02-01,40.753192,-73.907839
"3412",4623141,"QUEENS","53-16","NORTHERN BLVD","A2","SD","ISSUED","02/07/2024","02/06/2025",2023-02-01,40.753192,-73.907839
"3413",2051283,"BRONX","2500","BARKER AVENUE","NB","PL","ISSUED","12/29/2023","02/06/2025",2021-02-11,40.863569,-73.86936
"3414",4618910,"QUEENS","35-32","LEAVITT STREET","NB","","ISSUED","03/26/2024","05/26/2024",2020-09-29,40.764245,-73.828835
"3415",3004559,"BROOKLYN","407","CLINTON STREET","A1","","ISSUED","03/26/2024","03/24/2025",2020-07-01,40.682444,-73.998107
"3416",3157466,"BROOKLYN","7000","21 AVE.","A2","PL","ISSUED","06/20/2024","06/20/2025",2020-06-19,40.612273,-73.986713
"3417",4623245,"QUEENS","331","BEACH 35 STREET","NB","","ISSUED","02/08/2024","04/01/2025",2023-03-09,40.596108,-73.767699
"3418",4623245,"QUEENS","331","BEACH 35 STREET","NB","","ISSUED","02/08/2024","04/01/2025",2023-03-09,40.596108,-73.767699
"3419",4623245,"QUEENS","331","BEACH 35 STREET","NB","","ISSUED","02/08/2024","04/01/2025",2023-03-09,40.596108,-73.767699
"3420",4623739,"QUEENS","2-21","MALT DRIVE","A3","OT","ISSUED","02/02/2024","02/07/2025",2023-03-30,NA,NA
"3421",4260828,"QUEENS","145-01","119 AVENUE","A2","OT","ISSUED","02/09/2024","01/15/2025",2021-11-29,40.678296,-73.79562
"3422",1091635,"MANHATTAN","600","W125TH STREET","A2","EQ","ISSUED","03/27/2024","03/27/2025",2023-03-30,40.815974,-73.958569
"3423",2097312,"BRONX","2850","GOULDEN AVENUE","A2","OT","ISSUED","06/20/2024","12/01/2024",2022-09-07,40.872898,-73.896175
"3424",1083184,"MANHATTAN","176","EAST 115TH STREET","A2","OT","ISSUED","03/27/2024","04/01/2024",2023-02-24,40.797577,-73.94128
"3425",2097312,"BRONX","2850","GOULDEN AVENUE","A2","OT","ISSUED","06/20/2024","12/01/2024",2022-09-19,40.872898,-73.896175
"3426",3429621,"BROOKLYN","875","ERSKINE STREET","NB","","ISSUED","02/12/2024","04/01/2025",2022-09-26,40.656078,-73.86781
"3427",2097312,"BRONX","2850","GOULDEN AVENUE","A2","MH","ISSUED","06/20/2024","12/01/2024",2022-12-13,40.872898,-73.896175
"3428",1088961,"MANHATTAN","20","HUDSON YARDS","A2","OT","ISSUED","02/12/2024","05/01/2024",2023-03-23,40.753045,-74.000282
"3429",3425050,"BROOKLYN","350","KENT AVENUE","NB","PL","ISSUED","02/12/2024","02/11/2025",2023-03-03,40.712706,-73.967694
"3430",4623357,"QUEENS","5119","BEACH CHANNEL DRIVE","NB","","ISSUED","02/12/2024","02/11/2025",2023-10-19,40.595241,-73.782119
"3431",4623357,"QUEENS","5119","BEACH CHANNEL DRIVE","NB","","ISSUED","02/12/2024","02/11/2025",2023-10-18,40.595241,-73.782119
"3432",4623357,"QUEENS","5119","BEACH CHANNEL DRIVE","NB","","ISSUED","02/12/2024","02/11/2025",2023-10-18,40.595241,-73.782119
"3433",3426897,"BROOKLYN","318","KENT AVENUE","A2","OT","ISSUED","02/12/2024","02/21/2025",2020-08-19,40.713762,-73.967221
"3434",4620900,"QUEENS","72-01","QUEENS BOULEVARD","A2","OT","ISSUED","04/13/2021","04/01/2022",2021-05-07,40.739401,-73.891208
"3435",4620900,"QUEENS","72-01","QUEENS BOULEVARD","A2","OT","ISSUED","07/22/2021","04/01/2022",2021-05-07,40.739401,-73.891208
"3436",4620900,"QUEENS","72-01","QUEENS BOULEVARD","NB","","ISSUED","10/06/2021","10/13/2022",2021-10-13,40.739401,-73.891208
"3437",4620900,"QUEENS","72-01","QUEENS BOULEVARD","NB","","ISSUED","10/06/2021","11/16/2022",2021-11-16,40.739401,-73.891208
"3438",4620900,"QUEENS","72-01","QUEENS BOULEVARD","NB","","ISSUED","11/12/2021","11/16/2022",2021-11-16,40.739401,-73.891208
"3439",4620900,"QUEENS","72-01","QUEENS BOULEVARD","NB","","ISSUED","01/21/2022","02/24/2023",2021-11-16,40.739401,-73.891208
"3440",4620900,"QUEENS","72-01","QUEENS BOULEVARD","NB","","ISSUED","02/24/2022","02/24/2023",2021-11-16,40.739401,-73.891208
"3441",4620900,"QUEENS","72-01","QUEENS BOULEVARD","A2","OT","ISSUED","03/11/2022","04/01/2023",2021-05-07,40.739401,-73.891208
"3442",4620900,"QUEENS","72-01","QUEENS BOULEVARD","NB","","ISSUED","04/19/2022","04/19/2023",2021-11-16,40.739401,-73.891208
"3443",4620900,"QUEENS","72-01","QUEENS BOULEVARD","NB","","ISSUED","06/07/2022","06/07/2023",2021-11-16,40.739401,-73.891208
"3444",4620900,"QUEENS","72-01","QUEENS BOULEVARD","NB","","ISSUED","06/07/2022","06/07/2023",2021-11-16,40.739401,-73.891208
"3445",4620900,"QUEENS","72-01","QUEENS BOULEVARD","NB","","ISSUED","01/04/2023","04/01/2023",2021-10-13,40.739401,-73.891208
"3446",4620900,"QUEENS","72-01","QUEENS BOULEVARD","NB","","ISSUED","03/14/2023","04/01/2023",2021-11-16,40.739401,-73.891208
"3447",4620900,"QUEENS","72-01","QUEENS BOULEVARD","NB","","ISSUED","04/14/2023","04/01/2024",2021-10-13,40.739401,-73.891208
"3448",4620900,"QUEENS","72-01","QUEENS BOULEVARD","A2","OT","ISSUED","04/14/2023","04/01/2024",2021-05-07,40.739401,-73.891208
"3449",4620900,"QUEENS","72-01","QUEENS BOULEVARD","NB","","ISSUED","05/23/2023","04/01/2024",2021-11-16,40.739401,-73.891208
"3450",1083184,"MANHATTAN","176","EAST 115TH STREET","A2","PL","ISSUED","02/13/2024","02/12/2025",2023-02-24,40.797577,-73.94128
"3451",3076057,"BROOKLYN","1333","BROADWAY","NB","","ISSUED","02/13/2024","01/01/2025",2022-01-13,40.690065,-73.923046
"3452",3076057,"BROOKLYN","1333","BROADWAY","NB","","ISSUED","02/13/2024","02/07/2025",2021-07-01,40.690065,-73.923046
"3453",3076057,"BROOKLYN","1333","BROADWAY","NB","","ISSUED","02/13/2024","02/07/2025",2021-07-29,40.690065,-73.923046
"3454",1005679,"MANHATTAN","197","BOWERY","A2","OT","ISSUED","02/13/2024","06/04/2024",2023-11-01,40.721095,-73.993723
"3455",4045629,"QUEENS","48-01","90TH STREET","A2","OT","ISSUED","02/14/2024","11/16/2024",2020-05-27,40.741122,-73.874721
"3456",2130506,"BRONX","1223","SPOFFORD AVE","NB","","ISSUED","02/14/2024","02/13/2025",2023-08-15,40.813898,-73.890537
"3457",2130506,"BRONX","1223","SPOFFORD AVE","NB","","IN PROCESS","02/14/2024","",2023-08-15,40.813898,-73.890537
"3458",4035802,"QUEENS","34-20","JUNCTION BLVD","DM","EQ","ISSUED","02/14/2024","02/13/2025",2024-02-14,40.754464,-73.872404
"3459",4035802,"QUEENS","34-20","JUNCTION BLVD","DM","","ISSUED","02/14/2024","01/28/2025",2024-02-14,40.754464,-73.872404
"3460",2831766,"BRONX","1163","GARRISON AVENUE","NB","","ISSUED","02/14/2024","12/13/2024",2022-03-29,40.820261,-73.888493
"3461",2130940,"BRONX","390","EAST MOSHOLU PARKWAY SOUTH","NB","","ISSUED","06/30/2022","07/08/2023",2022-07-08,40.869129,-73.881635
"3462",2130940,"BRONX","390","EAST MOSHOLU PARKWAY SOUTH","NB","","ISSUED","03/31/2023","06/25/2024",2022-07-08,40.869129,-73.881635
"3463",2130506,"BRONX","1223","SPOFFORD AVE","NB","","ISSUED","10/06/2023","02/13/2025",2023-08-15,40.813898,-73.890537
"3464",1007174,"MANHATTAN","178","MOTT STREET","A1","","ISSUED","01/24/2024","02/13/2025",2020-12-09,40.720429,-73.995923
"3465",2015709,"BRONX","2731","KINGSBRIDGE TERRACE","DM","","ISSUED","02/05/2024","08/14/2024",2021-12-28,40.871757,-73.903506
"3466",4619732,"QUEENS","46-11","QUEENS BOULEVARD","NB","","ISSUED","02/15/2024","02/14/2025",2020-05-21,40.74314,-73.918488
"3467",2100247,"BRONX","160","HALL OF FAME TERRACE","A2","MH","ISSUED","03/27/2024","04/01/2025",2022-06-10,40.858971,-73.91147
"3468",1086331,"MANHATTAN","111","ANDES ROAD","A1","","ISSUED","06/20/2024","06/20/2025",2021-06-26,40.692552,-74.016281
"3469",5171142,"STATEN ISLAND","109","FINGERBOARD RD","NB","","ISSUED","02/16/2024","01/30/2025",2020-11-09,40.607501,-74.066004
"3470",5174428,"STATEN ISLAND","117","FINGERBOARD RD","NB","","ISSUED","02/16/2024","01/30/2025",2020-11-09,40.607424,-74.066191
"3471",4155261,"QUEENS","75-51","195 STREET","A1","","ISSUED","06/20/2024","05/23/2025",2022-06-22,40.731712,-73.776279
"3472",2130625,"BRONX","240","DRAKE STREET","A2","OT","ISSUED","02/19/2024","02/17/2025",2022-04-06,40.806362,-73.880504
"3473",3425060,"BROOKLYN","1020","ROGERS AVE","NB","","ISSUED","02/20/2024","11/27/2024",2022-06-09,40.645445,-73.951918
"3474",5082634,"STATEN ISLAND","100","LUTEN AVENUE","A2","PL","ISSUED","02/21/2024","02/20/2025",2022-01-12,40.528092,-74.192032
"3475",4436311,"QUEENS","81-03","HAMMELS BLVD","A2","OT","ISSUED","02/21/2024","12/21/2024",2020-02-28,40.589896,-73.807556
"3476",4436311,"QUEENS","81-03","HAMMELS BLVD","A2","OT","ISSUED","02/21/2024","12/21/2024",2020-02-28,40.589896,-73.807556
"3477",4436311,"QUEENS","81-03","HAMMELS BLVD","A2","OT","ISSUED","02/21/2024","12/21/2024",2020-02-28,40.589896,-73.807556
"3478",4436311,"QUEENS","81-03","HAMMELS BLVD","A2","OT","ISSUED","02/21/2024","12/21/2024",2020-03-03,40.589896,-73.807556
"3479",1004377,"MANHATTAN","270","EAST 2ND STREET","NB","","ISSUED","03/27/2024","11/19/2024",2023-05-25,40.720822,-73.980602
"3480",3428561,"BROOKLYN","12","HALSEY STREET","NB","","ISSUED","02/22/2024","02/21/2025",2022-03-21,40.681446,-73.952902
"3481",1091781,"MANHATTAN","32","WEST 48TH STREET","NB","","ISSUED","02/22/2024","10/01/2024",2021-10-06,40.757978,-73.979783
"3482",4200980,"QUEENS","101-50","130 STREET","A2","OT","ISSUED","02/26/2024","04/21/2024",2024-02-26,40.691391,-73.816527
"3483",5170723,"STATEN ISLAND","4132","VICTORY BOULEVARD","NB","","ISSUED","02/26/2024","03/05/2025",2022-07-28,40.591375,-74.191216
"3484",3054565,"BROOKLYN","507","MYRTLE AVENUE","A1","","ISSUED","02/27/2024","10/17/2024",2020-07-22,40.693571,-73.964602
"3485",3418384,"BROOKLYN","1360","36 STREET","NB","","IN PROCESS","02/27/2024","08/27/2024",2020-02-28,40.641441,-73.983324
"3486",1091781,"MANHATTAN","32","WEST 48TH STREET","NB","","ISSUED","02/27/2024","11/24/2024",2021-10-06,40.757978,-73.979783
"3487",2017263,"BRONX","261","E 202 ST","NB","","ISSUED","02/27/2024","01/01/2025",2020-12-04,40.872791,-73.884688
"3488",1080352,"MANHATTAN","450","11TH AVENUE","NB","","ISSUED","02/27/2024","06/19/2024",2020-07-14,40.757486,-74.000729
"3489",4209632,"QUEENS","166-20","90 AVE","NB","","ISSUED","03/27/2024","01/31/2025",2023-02-10,40.70729,-73.794633
"3490",4142453,"QUEENS","135-19","78 ROAD","NB","","ISSUED","02/28/2024","08/11/2024",2022-05-02,40.718783,-73.824681
"3491",1091728,"MANHATTAN","18","WEST 55 STREET","NB","","ISSUED","02/29/2024","09/19/2024",2023-02-08,40.762023,-73.975782
"3492",1091728,"MANHATTAN","18","WEST 55 STREET","NB","","ISSUED","02/29/2024","03/01/2025",2023-02-08,40.762023,-73.975782
"3493",1091728,"MANHATTAN","18","WEST 55 STREET","NB","","ISSUED","02/29/2024","03/01/2025",2023-02-08,40.762023,-73.975782
"3494",1057080,"MANHATTAN","260","RIVERSIDE DRIVE","A2","OT","ISSUED","02/29/2024","10/01/2024",2021-03-10,40.797144,-73.973396
"3495",3429084,"BROOKLYN","624","METROPOLITAN AVENUE","NB","","ISSUED","02/29/2024","12/10/2024",2022-06-01,40.714156,-73.948301
"3496",1017224,"MANHATTAN","415","5TH AVENUE","A3","OT","ISSUED","02/29/2024","08/09/2024",2024-02-29,40.750603,-73.982972
"3497",5106483,"STATEN ISLAND","105","HAMILTON AVENUE","A2","OT","ISSUED","02/29/2024","08/24/2024",2021-07-21,40.644735,-74.081222
"3498",1089192,"MANHATTAN","375","WEST 207 STREET","NB","PL","ISSUED","02/29/2024","02/28/2025",2023-03-09,40.864015,-73.917834
"3499",1079184,"MANHATTAN","224","12TH AVENUE","A2","OT","ISSUED","02/29/2024","02/13/2025",2021-02-05,40.752641,-74.007576
"3500",2130831,"BRONX","1017","OLMSTEAD AVENUE","NB","","IN PROCESS","02/29/2024","",2024-03-07,40.827586,-73.853196
"3501",1079184,"MANHATTAN","261","11 AVENUE","A3","EQ","ISSUED","03/01/2024","03/01/2025",2021-03-23,40.751502,-74.005118
"3502",1079184,"MANHATTAN","261","11 AVENUE","A3","EQ","ISSUED","03/01/2024","03/01/2025",2021-03-24,40.751502,-74.005118
"3503",1014251,"MANHATTAN","220","WEST 28TH STREET","A2","SP","ISSUED","03/01/2024","03/01/2025",2022-11-22,40.747582,-73.994197
"3504",1014251,"MANHATTAN","220","WEST 28TH STREET","A2","SD","ISSUED","03/01/2024","03/01/2025",2022-11-22,40.747582,-73.994197
"3505",4114142,"QUEENS","40-28","MAIN STREET","A2","OT","ISSUED","03/01/2024","03/01/2025",2020-11-09,40.758861,-73.829802
"3506",3193844,"BROOKLYN","2255","EAST 2 STREET","A1","PL","ISSUED","03/01/2024","03/01/2025",2020-11-13,40.594189,-73.969016
"3507",4623130,"QUEENS","139-20","LAKEWOOD AVENUE","NB","","ISSUED","03/01/2024","05/15/2024",2022-08-01,40.686727,-73.805986
"3508",1009430,"MANHATTAN","16","FIFTH AVENUE","NB","","ISSUED","03/01/2024","03/17/2025",2022-09-27,40.732624,-73.996092
"3509",1091781,"MANHATTAN","32","WEST 48TH STREET","NB","","ISSUED","02/27/2024","11/24/2024",2022-12-28,40.757978,-73.979783
"3510",4116436,"QUEENS","46-21","COLDEN STREET","A3","EQ","ISSUED","03/04/2024","03/04/2025",2020-02-18,40.749545,-73.822073
"3511",4623835,"QUEENS","36-45","31ST STREET","NB","","ISSUED","03/04/2024","07/27/2024",2021-05-07,40.755831,-73.930348
"3512",4607880,"QUEENS","122-06","MERRICK BOULEVARD","NB","EQ","ISSUED","03/04/2024","03/04/2025",2022-03-10,40.683649,-73.769525
"3513",1014251,"MANHATTAN","220","WEST 28TH STREET","A1","","IN PROCESS","03/04/2024","",2021-12-29,40.747582,-73.994197
"3514",1015733,"MANHATTAN","262","FIFTH AVENUE","NB","","ISSUED","03/04/2024","03/17/2025",2022-06-16,40.745081,-73.987019
"3515",3416888,"BROOKLYN","4910","14TH AVENUE","NB","","ISSUED","03/04/2024","03/07/2025",2021-10-08,40.633578,-73.990052
"3516",4112161,"QUEENS","35-18","LEAVITT STREET","DM","","ISSUED","02/21/2024","07/01/2024",2024-03-04,40.764525,-73.82891
"3517",4135975,"QUEENS","214-33","35TH AVENUE","A2","MH","ISSUED","03/28/2024","03/28/2025",2021-09-27,40.769536,-73.771148
"3518",3055377,"BROOKLYN","333","LAFAYETTE AVENUE","A2","OT","ISSUED","03/05/2024","03/08/2025",2021-05-14,40.688657,-73.962027
"3519",4116436,"QUEENS","46-21","COLDEN STREET","A2","OT","ISSUED","03/05/2024","03/05/2025",2020-11-03,40.749545,-73.822073
"3520",4116436,"QUEENS","46-21","COLDEN STREET","A2","OT","ISSUED","03/05/2024","03/05/2025",2020-11-03,40.749545,-73.822073
"3521",4116436,"QUEENS","46-21","COLDEN STREET","A2","OT","ISSUED","03/05/2024","03/05/2025",2020-11-03,40.749545,-73.822073
"3522",4135975,"QUEENS","214-33","35TH AVENUE","A2","MH","ISSUED","03/28/2024","03/28/2025",2022-01-14,40.769536,-73.771148
"3523",4617668,"QUEENS","148-18","HILLSIDE AVE","NB","","ISSUED","03/05/2024","03/05/2025",2022-06-10,40.706166,-73.808184
"3524",2072463,"BRONX","3410","DE REIMER AVENUE","A2","OT","ISSUED","03/05/2024","06/01/2024",2023-10-27,40.879631,-73.836703
"3525",4624066,"QUEENS","23-30","BORDEN AVENUE","NB","","ISSUED","06/20/2024","01/01/2025",2021-12-09,40.739918,-73.947213
"3526",4116436,"QUEENS","46-21","COLDEN STREET","A3","EQ","ISSUED","03/05/2024","03/05/2025",2020-01-14,40.749545,-73.822073
"3527",1090814,"MANHATTAN","215","WEST 28TH STREET","A3","OT","ISSUED","03/06/2024","01/05/2025",2024-03-27,40.747544,-73.994063
"3528",1090814,"MANHATTAN","215","WEST 28TH STREET","A3","OT","ISSUED","03/06/2024","01/05/2025",2024-04-08,40.747544,-73.994063
"3529",5166607,"STATEN ISLAND","80","SCARBORO AVENUE","NB","PL","ISSUED","03/06/2024","03/06/2025",2021-05-04,40.613706,-74.062592
"3530",3040477,"BROOKLYN","741","DECATUR STREET","A2","OT","ISSUED","03/07/2024","10/07/2024",2020-07-28,40.683751,-73.913434
"3531",2087014,"BRONX","1025","MORRISON AVENUE","A2","MH","ISSUED","03/07/2024","03/15/2024",2022-01-25,40.825403,-73.873666
"3532",2087014,"BRONX","1025","MORRISON AVENUE","A2","OT","ISSUED","03/07/2024","03/15/2024",2022-01-25,40.825403,-73.873666
"3533",2087014,"BRONX","1025","MORRISON AVENUE","A2","OT","ISSUED","03/07/2024","03/15/2024",2022-01-25,40.825403,-73.873666
"3534",3226266,"BROOKLYN","1144","EAST 86 STREET","A2","OT","ISSUED","06/15/2021","10/21/2021",2021-06-16,40.634285,-73.904368
"3535",3429098,"BROOKLYN","2141","EAST 16 STREET","NB","","ISSUED","03/07/2024","08/15/2024",2022-01-06,40.598017,-73.955291
"3536",2129656,"BRONX","4720","THIRD AVENUE","A2","SD","ISSUED","06/11/2020","06/11/2021",2020-06-11,40.859417,-73.891128
"3537",2129656,"BRONX","4720","THIRD AVENUE","A2","SD","ISSUED","08/20/2021","08/20/2022",2020-06-11,40.859417,-73.891128
"3538",2129656,"BRONX","4720","THIRD AVENUE","NB","","ISSUED","12/02/2021","12/09/2022",2021-12-09,40.859417,-73.891128
"3539",2129656,"BRONX","4720","THIRD AVENUE","NB","","ISSUED","12/09/2021","12/09/2022",2021-12-09,40.859417,-73.891128
"3540",2129656,"BRONX","4720","THIRD AVENUE","NB","","ISSUED","05/26/2022","05/26/2023",2021-12-09,40.859417,-73.891128
"3541",2129656,"BRONX","4720","THIRD AVENUE","NB","","ISSUED","07/01/2022","07/01/2023",2022-07-01,40.859417,-73.891128
"3542",2129656,"BRONX","4720","THIRD AVENUE","A2","SD","ISSUED","08/16/2022","08/16/2023",2020-06-11,40.859417,-73.891128
"3543",2129656,"BRONX","4720","THIRD AVENUE","NB","PL","ISSUED","02/06/2023","02/08/2024",2023-02-08,40.859417,-73.891128
"3544",2129656,"BRONX","4720","THIRD AVENUE","NB","","ISSUED","04/19/2023","06/20/2024",2021-12-09,40.859417,-73.891128
"3545",2129656,"BRONX","4720","THIRD AVENUE","NB","","ISSUED","05/19/2023","10/28/2023",2022-07-01,40.859417,-73.891128
"3546",2129656,"BRONX","4720","THIRD AVENUE","A2","SD","ISSUED","08/15/2023","08/14/2024",2020-06-11,40.859417,-73.891128
"3547",2129656,"BRONX","4720","THIRD AVENUE","NB","","ISSUED","12/06/2023","10/28/2024",2022-07-01,40.859417,-73.891128
"3548",1083616,"MANHATTAN","321","WEST 38 STREET","A1","","ISSUED","03/08/2024","03/08/2025",2024-03-08,40.755067,-73.992456
"3549",1050618,"MANHATTAN","421","EAST 88 STREET","A2","PL","ISSUED","03/08/2024","03/08/2025",2021-04-06,40.777911,-73.947757
"3550",3071418,"BROOKLYN","325","BUSHWICK AVENUE","A2","PL","ISSUED","03/08/2024","03/08/2025",2020-02-13,40.705204,-73.939407
"3551",2130596,"BRONX","6201","BROADWAY","NB","","ISSUED","11/13/2024","06/01/2025",2024-03-21,40.896116,-73.896761
"3552",1030727,"MANHATTAN","2130","BROADWAY","A2","OT","ISSUED","03/28/2024","04/01/2025",2020-05-19,40.780737,-73.981379
"3553",1076225,"MANHATTAN","25","CPW","A2","OT","ISSUED","03/08/2024","03/20/2025",2020-07-20,40.770148,-73.9804
"3554",3153881,"BROOKLYN","650","86TH STREET","NB","","ISSUED","03/08/2024","03/11/2025",2022-10-24,40.618851,-74.021875
"3555",3153881,"BROOKLYN","650","86TH STREET","NB","","ISSUED","03/12/2024","03/12/2025",2022-10-24,40.618851,-74.021875
"3556",2046144,"BRONX","3066","ROBERTS AVENUE","A1","","ISSUED","03/12/2024","03/15/2025",2022-02-02,40.84606,-73.829102
"3557",4135975,"QUEENS","214-33","35TH AVENUE","A2","OT","ISSUED","03/12/2024","03/12/2025",2021-09-17,40.769536,-73.771148
"3558",4135975,"QUEENS","214-33","35TH AVENUE","A2","OT","ISSUED","03/12/2024","03/12/2025",2021-09-17,40.769536,-73.771148
"3559",4135975,"QUEENS","214-33","35TH AVENUE","A2","OT","ISSUED","03/12/2024","03/12/2025",2021-09-27,40.769536,-73.771148
"3560",4135975,"QUEENS","214-33","35TH AVENUE","A2","OT","ISSUED","03/12/2024","04/01/2024",2022-01-14,40.769536,-73.771148
"3561",4135975,"QUEENS","214-33","35TH AVENUE","A2","OT","ISSUED","03/12/2024","04/01/2024",2022-01-14,40.769536,-73.771148
"3562",4135975,"QUEENS","214-33","35TH AVENUE","A2","OT","ISSUED","03/12/2024","04/01/2024",2022-01-14,40.769536,-73.771148
"3563",1013637,"MANHATTAN","341","WEST 38TH STREET","A1","","ISSUED","03/12/2024","07/01/2024",2021-10-25,40.755237,-73.992864
"3564",2092082,"BRONX","3603","THIRD AVENUE","A2","PL","ISSUED","03/12/2024","03/12/2025",2021-03-01,40.83308,-73.904809
"3565",1083026,"MANHATTAN","2","PENN PLAZA","A1","PL","ISSUED","03/12/2024","03/12/2025",2021-07-02,40.750017,-73.991345
"3566",3068046,"BROOKLYN","29","FROST STREET","A1","PL","ISSUED","03/12/2024","03/12/2025",2021-12-30,40.717511,-73.950889
"3567",1091641,"MANHATTAN","443","WEST 54TH STREET","A2","SP","ISSUED","03/12/2024","03/12/2025",2021-04-16,40.766537,-73.988397
"3568",4623141,"QUEENS","53-16","NORTHERN BOULEVARD","NB","","ISSUED","03/12/2024","03/12/2025",2022-09-27,40.753192,-73.907839
"3569",3061859,"BROOKLYN","525","UNION AVE","A3","OT","ISSUED","03/12/2024","02/22/2025",2020-09-21,40.716233,-73.951986
"3570",2045727,"BRONX","1340","BLONDELL AVENUE","NB","","IN PROCESS","06/21/2024","06/21/2025",2023-10-04,40.841827,-73.842073
"3571",2130506,"BRONX","1223","SPOFFORD AVE","NB","","ISSUED","08/16/2023","03/13/2025",2024-03-13,40.813898,-73.890537
"3572",3418384,"BROOKLYN","1360","36 STREET","NB","","ISSUED","10/28/2022","08/27/2023",2021-03-17,40.641441,-73.983324
"3573",1007953,"MANHATTAN","152","MERCER STREET","A2","OT","ISSUED","06/21/2024","04/26/2025",2021-06-17,40.725051,-73.998221
"3574",1083026,"MANHATTAN","2","PENN PLAZA","A2","EQ","ISSUED","03/14/2024","03/14/2025",2021-03-23,40.750017,-73.991345
"3575",4003841,"QUEENS","9-03","35 AVENUE","A1","","ISSUED","12/22/2023","06/03/2024",2021-05-05,40.763382,-73.940397
"3576",3150481,"BROOKLYN","7805","7 AVENUE","A2","BL","ISSUED","03/28/2024","04/01/2024",2023-06-14,40.624173,-74.018732
"3577",3063244,"BROOKLYN","61","SOUTH 4TH STREET","A1","PL","IN PROCESS","06/21/2024","",2024-07-09,40.71281,-73.965581
"3578",1059752,"MANHATTAN","527","WEST 134TH STREET","A2","OT","ISSUED","03/15/2024","03/29/2025",2022-01-04,40.818895,-73.954272
"3579",1091643,"MANHATTAN","310","HUDSON STREET","NB","","ISSUED","03/15/2024","10/14/2024",2021-01-21,40.726168,-74.007494
"3580",1033691,"MANHATTAN","720","WEST END AVENUE","A1","","ISSUED","03/13/2024","03/15/2025",2022-07-08,40.794723,-73.973581
"3581",4116436,"QUEENS","46-21","COLDEN STREET","A2","MH","ISSUED","03/28/2024","03/28/2025",2020-11-03,40.749545,-73.822073
"3582",4617668,"QUEENS","148-18","HILLSIDE AVE","A2","OT","IN PROCESS","03/28/2024","03/15/2025",2022-06-02,40.706166,-73.808184
"3583",4623202,"QUEENS","35-15","19 AVENUE","NB","","ISSUED","03/28/2024","04/01/2025",2022-01-25,40.780124,-73.902028
"3584",4618910,"QUEENS","35-32","LEAVITT STREET","NB","","ISSUED","03/28/2024","09/01/2024",2020-09-29,40.764245,-73.828835
"3585",3027721,"BROOKLYN","819","DEAN STREET","A1","","ISSUED","03/28/2024","05/22/2024",2027-08-30,40.679133,-73.962862
"3586",3257046,"BROOKLYN","85","NAVY WALK","A2","OT","ISSUED","06/21/2024","06/29/2025",2023-01-25,40.695483,-73.980664
"3587",3150481,"BROOKLYN","7805","7 AVENUE","A2","BL","ISSUED","03/29/2024","03/29/2025",2023-06-14,40.624173,-74.018732
"3588",3082389,"BROOKLYN","411","THATFORD AVE.","A2","MH","ISSUED","03/29/2024","03/29/2025",2020-02-24,40.660306,-73.907355
"3589",3082389,"BROOKLYN","411","THATFORD AVE.","A2","OT","ISSUED","03/29/2024","03/29/2025",2020-02-24,40.660306,-73.907355
"3590",3082389,"BROOKLYN","411","THATFORD AVE.","A2","OT","ISSUED","03/29/2024","03/29/2025",2020-02-24,40.660306,-73.907355
"3591",3082389,"BROOKLYN","411","THATFORD AVE.","A2","OT","ISSUED","03/29/2024","03/29/2025",2020-02-24,40.660306,-73.907355
"3592",3257046,"BROOKLYN","85","NAVY WALK","A2","OT","ISSUED","06/21/2024","06/29/2025",2023-01-25,40.695483,-73.980664
"3593",3257046,"BROOKLYN","85","NAVY WALK","A2","OT","ISSUED","06/21/2024","06/29/2025",2023-01-25,40.695483,-73.980664
"3594",3257046,"BROOKLYN","85","NAVY WALK","A2","OT","ISSUED","06/21/2024","06/29/2025",2023-01-25,40.695483,-73.980664
"3595",2129483,"BRONX","2680","MORRIS AVENUE","NB","","ISSUED","06/22/2024","06/29/2025",2022-06-01,40.867472,-73.895959
"3596",2129483,"BRONX","2680","MORRIS AVENUE","NB","","ISSUED","06/22/2024","06/29/2025",2022-06-01,40.867472,-73.895959
"3597",2129483,"BRONX","2680","MORRIS AVENUE","NB","","ISSUED","06/22/2024","06/29/2025",2022-06-01,40.867472,-73.895959
"3598",5175245,"STATEN ISLAND","839","FATHER CAPODANNO BOULEVARD","NB","","ISSUED","04/01/2024","09/16/2024",2021-04-23,40.575512,-74.083478
"3599",5082634,"STATEN ISLAND","100","LUTEN AVENUE","A2","MH","ISSUED","04/01/2024","04/01/2025",2022-01-12,40.528092,-74.192032
"3600",5082634,"STATEN ISLAND","100","LUTEN AVENUE","A2","OT","ISSUED","04/01/2024","04/01/2025",2022-01-12,40.528092,-74.192032
"3601",5082634,"STATEN ISLAND","100","LUTEN AVENUE","A2","OT","ISSUED","04/01/2024","04/01/2025",2022-01-12,40.528092,-74.192032
"3602",5082634,"STATEN ISLAND","100","LUTEN AVENUE","A2","OT","ISSUED","04/01/2024","04/01/2025",2022-01-12,40.528092,-74.192032
"3603",5082634,"STATEN ISLAND","100","LUTEN AVENUE","A2","OT","ISSUED","04/01/2024","04/01/2025",2022-01-12,40.528092,-74.192032
"3604",1001405,"MANHATTAN","27","PARK PLACE","A1","","ISSUED","04/01/2024","04/01/2025",2020-08-19,40.713116,-74.008931
"3605",3153881,"BROOKLYN","650","86TH STREET","NB","","ISSUED","04/02/2024","04/02/2025",2022-06-16,40.618851,-74.021875
"3606",3153881,"BROOKLYN","650","86TH STREET","NB","","ISSUED","04/02/2024","04/02/2025",2022-06-16,40.618851,-74.021875
"3607",3150481,"BROOKLYN","7805","7 AVENUE","A2","MH","ISSUED","04/02/2024","04/02/2025",2023-06-14,40.624173,-74.018732
"3608",1048273,"MANHATTAN","150","EAST 91 STREET","A3","OT","ISSUED","04/02/2024","04/01/2025",2023-07-31,40.782533,-73.952924
"3609",3193844,"BROOKLYN","2255","EAST 2 STREET","A1","PL","ISSUED","04/02/2024","04/02/2025",2020-11-13,40.594189,-73.969016
"3610",2013297,"BRONX","2075","WEBSTER AVENUE","NB","PL","ISSUED","04/02/2024","04/02/2025",2023-04-21,40.851741,-73.898493
"3611",2013297,"BRONX","2075","WEBSTER AVENUE","NB","PL","ISSUED","04/02/2024","04/02/2025",2023-04-21,40.851741,-73.898493
"3612",1088394,"MANHATTAN","125","WHITE STREET","DM","","ISSUED","03/29/2024","06/26/2024",2024-04-02,40.716715,-74.000346
"3613",1083184,"MANHATTAN","176","EAST 115TH STREET","A2","OT","ISSUED","04/03/2024","04/03/2025",2023-02-24,40.797577,-73.94128
"3614",3335129,"BROOKLYN","63","FLUSHING AVENUE","A2","OT","ISSUED","04/03/2024","04/01/2025",2021-03-01,40.69802,-73.974986
"3615",1083184,"MANHATTAN","176","EAST 115TH STREET","A2","OT","ISSUED","04/03/2024","04/03/2025",2023-02-24,40.797577,-73.94128
"3616",3429327,"BROOKLYN","625","FULTON STREET","NB","PL","ISSUED","04/03/2024","04/03/2025",2023-03-16,40.688566,-73.980045
"3617",5106483,"STATEN ISLAND","105","HAMILTON AVENUE","A2","MH","ISSUED","04/04/2024","02/22/2025",2021-07-21,40.644735,-74.081222
"3618",2073086,"BRONX","1255","MAYFLOWER AVENUE","A1","PL","ISSUED","04/04/2024","04/04/2025",2024-04-04,40.836265,-73.831393
"3619",5045176,"STATEN ISLAND","18","SHORE ACRES ROAD","A1","","ISSUED","04/04/2024","07/10/2024",2024-04-04,40.608878,-74.061316
"3620",1091010,"MANHATTAN","270","PARK AVENUE","A2","OT","ISSUED","04/05/2024","12/01/2024",2020-06-25,40.755641,-73.975109
"3621",1088894,"MANHATTAN","1","CLARKSON STREET","A2","OT","ISSUED","04/05/2024","04/01/2025",2020-08-27,40.729371,-74.005654
"3622",1088894,"MANHATTAN","1","CLARKSON STREET","A2","OT","ISSUED","04/05/2024","04/01/2025",2020-07-30,40.729371,-74.005654
"3623",3065463,"BROOKLYN","341","KINGSLAND AVE","A1","","ISSUED","12/27/2023","12/31/2024",2022-10-04,40.728574,-73.942139
"3624",1001084,"MANHATTAN","55","LIBERTY STREET","A2","OT","ISSUED","04/08/2024","04/15/2025",2020-06-23,40.708692,-74.009508
"3625",3150481,"BROOKLYN","7805","7 AVENUE","A2","OT","ISSUED","04/08/2024","04/08/2025",2023-06-14,40.624173,-74.018732
"3626",1090814,"MANHATTAN","215","WEST 28TH STREET","A3","OT","ISSUED","03/06/2024","01/05/2025",2024-04-08,40.747544,-73.994063
"3627",1090814,"MANHATTAN","215","WEST 28TH STREET","A3","OT","ISSUED","03/06/2024","01/05/2025",2024-04-08,40.747544,-73.994063
"3628",2001965,"BRONX","943","TELLER AVENUE","A2","BL","ISSUED","04/09/2024","10/01/2024",2024-04-09,40.826292,-73.915467
"3629",4623245,"QUEENS","331","BEACH 35 STREET","NB","","ISSUED","04/09/2024","04/01/2025",2023-03-09,40.596108,-73.767699
"3630",3115866,"BROOKLYN","601","PARKSIDE AVENUE","A2","MH","ISSUED","04/09/2024","06/02/2024",2020-02-21,40.656046,-73.953742
"3631",4253712,"QUEENS","132-11","114TH ST","A2","OT","ISSUED","04/09/2024","10/01/2024",2023-06-21,40.674766,-73.825366
"3632",1083184,"MANHATTAN","176","EAST 115TH STREET","A2","MH","ISSUED","04/10/2024","04/10/2025",2023-02-24,40.797577,-73.94128
"3633",1030544,"MANHATTAN","2109","BROADWAY","A2","OT","ISSUED","04/10/2024","06/30/2024",2024-04-10,40.780408,-73.982076
"3634",3418384,"BROOKLYN","1360","36 STREET","NB","","ISSUED","02/28/2020","02/27/2021",2020-02-28,40.641441,-73.983324
"3635",3418384,"BROOKLYN","1360","36 STREET","NB","","ISSUED","12/23/2020","12/31/2021",2020-02-28,40.641441,-73.983324
"3636",3418384,"BROOKLYN","1360","36 STREET","NB","","ISSUED","02/08/2021","02/08/2022",2021-02-08,40.641441,-73.983324
"3637",3418384,"BROOKLYN","1360","36 STREET","NB","","ISSUED","03/17/2021","03/17/2022",2021-03-17,40.641441,-73.983324
"3638",3418384,"BROOKLYN","1360","36 STREET","NB","","ISSUED","12/23/2021","12/31/2022",2020-02-28,40.641441,-73.983324
"3639",3418384,"BROOKLYN","1360","36 STREET","NB","","ISSUED","01/04/2022","01/04/2023",2020-02-28,40.641441,-73.983324
"3640",3418384,"BROOKLYN","1360","36 STREET","NB","","RE-ISSUED","01/04/2022","01/07/2023",2021-02-08,40.641441,-73.983324
"3641",3418384,"BROOKLYN","1360","36 STREET","NB","","RE-ISSUED","01/04/2022","01/07/2023",2021-03-17,40.641441,-73.983324
"3642",3418384,"BROOKLYN","1360","36 STREET","NB","","ISSUED","11/30/2022","08/27/2023",2021-03-17,40.641441,-73.983324
"3643",3418384,"BROOKLYN","1360","36 STREET","NB","","ISSUED","12/27/2022","12/31/2023",2020-02-28,40.641441,-73.983324
"3644",3418384,"BROOKLYN","1360","36 STREET","NB","","RE-ISSUED","09/06/2023","02/27/2024",2021-03-17,40.641441,-73.983324
"3645",3418384,"BROOKLYN","1360","36 STREET","NB","","ISSUED","02/27/2024","08/27/2024",2021-03-17,40.641441,-73.983324
"3646",2011872,"BRONX","16","WADE SQUARE","NB","","ISSUED","04/11/2024","04/13/2024",2022-05-31,40.85193,-73.891082
"3647",1009242,"MANHATTAN","17","EAST 9TH STREET","A2","SP","ISSUED","04/11/2024","04/11/2025",2023-01-17,40.732434,-73.994916
"3648",3429784,"BROOKLYN","1042","ATLANTIC AVENUE","DM","","ISSUED","05/09/2023","04/26/2024",2023-05-09,40.680027,-73.959274
"3649",3429784,"BROOKLYN","1042","ATLANTIC AVENUE","DM","","ISSUED","10/27/2023","11/10/2024",2023-05-09,40.680027,-73.959274
"3650",3429784,"BROOKLYN","1042","ATLANTIC AVENUE","DM","EQ","ISSUED","11/08/2023","11/07/2024",2023-07-11,40.680027,-73.959274
"3651",1005641,"MANHATTAN","327","BROOME STREET","DM","","ISSUED","04/12/2024","02/20/2025",2023-04-05,40.719207,-73.993835
"3652",1036505,"MANHATTAN","425","PARK AVENUE","A2","OT","ISSUED","04/15/2024","04/20/2025",2021-02-25,40.760512,-73.971541
"3653",1036505,"MANHATTAN","425","PARK AVENUE","A2","OT","ISSUED","04/15/2024","04/20/2025",2021-02-03,40.760512,-73.971541
"3654",4173747,"QUEENS","261-38","72 ROAD","A2","OT","ISSUED","04/15/2024","01/23/2025",2020-11-05,40.753858,-73.718306
"3655",1090748,"MANHATTAN","34","EAST 51ST STREET","A2","OT","ISSUED","04/15/2024","04/20/2025",2022-04-27,40.758303,-73.974722
"3656",5172178,"STATEN ISLAND","221","CANAL STREET","A2","PL","ISSUED","07/14/2020","07/14/2021",2020-07-14,40.624726,-74.079764
"3657",1089807,"MANHATTAN","76","11TH AVENUE","A2","FS","ISSUED","04/16/2024","11/04/2024",2023-08-29,40.745183,-74.008236
"3658",5051088,"STATEN ISLAND","112","HULL AVENUE","A3","OT","IN PROCESS","04/17/2024","",2024-04-17,40.583168,-74.102662
"3659",4624278,"QUEENS","130-17","ROCKAWAY BOULEVARD","NB","","ISSUED","04/18/2024","04/18/2025",2023-05-24,40.674977,-73.808245
"3660",1088961,"MANHATTAN","20","HUDSON YARDS","A2","OT","ISSUED","04/18/2024","01/29/2025",2023-03-23,40.753045,-74.000282
"3661",1015733,"MANHATTAN","262","FIFTH AVENUE","NB","PL","ISSUED","04/18/2024","04/18/2025",2024-04-18,40.745081,-73.987019
"3662",1033838,"MANHATTAN","125","RIVERSIDE DRIVE","A3","EQ","ISSUED","04/19/2024","04/19/2025",2024-04-19,40.789018,-73.980958
"3663",3049020,"BROOKLYN","195","SANFORD STREET","A2","OT","ISSUED","04/19/2024","04/19/2025",2022-08-05,40.693018,-73.953034
"3664",4623202,"QUEENS","35-15","19TH AVENUE","A2","OT","ISSUED","04/19/2024","04/20/2025",2024-03-21,40.780124,-73.902028
"3665",1090459,"MANHATTAN","255","WEST 34 STREET","A3","EQ","ISSUED","04/19/2024","04/19/2025",2020-11-12,40.751823,-73.992569
"3666",2057045,"BRONX","800","EAST GUN HILL ROAD","A2","OT","ISSUED","04/19/2024","04/19/2025",2021-11-22,40.875953,-73.86197
"3667",5051088,"STATEN ISLAND","112","HULL AVENUE","A3","OT","ISSUED","04/19/2024","04/19/2025",2024-04-19,40.583168,-74.102662
"3668",2057045,"BRONX","800","EAST GUN HILL ROAD","A2","OT","ISSUED","04/22/2024","04/20/2025",2021-11-22,40.875953,-73.86197
"3669",2011872,"BRONX","16","WADE SQUARE","NB","","ISSUED","04/22/2024","01/13/2025",2022-05-31,40.85193,-73.891082
"3670",2003321,"BRONX","1305","SHAKESPEARE AVE","A1","","ISSUED","01/20/2023","01/13/2025",2020-12-24,40.839955,-73.922468
"3671",4098406,"QUEENS","124-06","14TH AVENUE","A2","MH","ISSUED","04/23/2024","07/01/2024",2020-02-05,40.785327,-73.843749
"3672",4098406,"QUEENS","124-06","14TH AVENUE","A2","OT","ISSUED","04/23/2024","07/01/2024",2020-02-05,40.785327,-73.843749
"3673",4098406,"QUEENS","124-06","14TH AVENUE","A2","PL","ISSUED","04/23/2024","04/23/2025",2020-10-22,40.785327,-73.843749
"3674",2071870,"BRONX","4750","WHITE PLAINS ROAD","NB","","RE-ISSUED","04/23/2024","06/01/2024",2023-06-07,40.904834,-73.849625
"3675",4623202,"QUEENS","35-15","19 AVENUE","A2","OT","ISSUED","04/23/2024","04/01/2025",2024-04-23,40.780124,-73.902028
"3676",3338507,"BROOKLYN","1388","BUSHWICK AVENUE","A1","","ISSUED","04/23/2024","03/13/2025",2022-05-11,40.684868,-73.910025
"3677",2071870,"BRONX","4750","WHITE PLAINS ROAD","NB","","ISSUED","04/23/2024","05/30/2025",2023-06-07,40.904834,-73.849625
"3678",4833056,"QUEENS","116-13","SUTPHIN BOULEVARD","NB","PL","ISSUED","04/24/2024","04/24/2025",2024-04-24,40.682186,-73.792558
"3679",1063265,"MANHATTAN","638","WEST 158TH STREET","DM","EQ","ISSUED","04/24/2024","04/24/2025",2024-04-24,40.835618,-73.946678
"3680",1063265,"MANHATTAN","638","WEST 158TH STREET","DM","EQ","ISSUED","04/24/2024","04/24/2025",2024-04-24,40.835618,-73.946678
"3681",1064452,"MANHATTAN","100","OVERLOOK TERRACE","A2","OT","ISSUED","04/24/2024","04/25/2025",2023-09-29,40.855967,-73.935412
"3682",2003157,"BRONX","1182","WOODYCREST AVENUE","A2","OT","ISSUED","04/24/2024","04/25/2025",2022-11-22,40.836723,-73.924835
"3683",2130750,"BRONX","1600","GRAND AVE","A2","OT","ISSUED","04/24/2024","04/25/2025",2024-01-08,40.8465,-73.916612
"3684",2017263,"BRONX","261","E 202 ST","A2","OT","ISSUED","04/24/2024","04/25/2025",2023-12-05,40.872791,-73.884688
"3685",1063265,"MANHATTAN","638","WEST 158TH STREET","DM","","RE-ISSUED","04/24/2024","04/25/2025",2024-04-25,40.835618,-73.946678
"3686",1091887,"MANHATTAN","520","FIFTH AVENUE","NB","","ISSUED","04/22/2024","05/14/2025",2022-09-02,40.754421,-73.980213
"3687",1088749,"MANHATTAN","1","MADISON AVE","A3","EQ","ISSUED","04/26/2024","04/26/2025",2022-05-05,40.740909,-73.987947
"3688",1088749,"MANHATTAN","1","MADISON AVE","A3","EQ","ISSUED","04/26/2024","04/26/2025",2022-05-10,40.740909,-73.987947
"3689",2129342,"BRONX","1746","ANDREWS AVE SO","NB","","ISSUED","04/26/2024","01/01/2025",2022-03-25,40.85037,-73.917222
"3690",2129342,"BRONX","1746","ANDREWS AVE SO","NB","","ISSUED","04/26/2024","01/01/2025",2022-03-22,40.85037,-73.917222
"3691",2129342,"BRONX","1746","ANDREWS AVE SO","NB","","ISSUED","04/26/2024","01/01/2025",2022-03-22,40.85037,-73.917222
"3692",4156029,"QUEENS","184-45","ABERDEEN ROAD","NB","","ISSUED","04/26/2024","04/21/2025",2024-01-19,40.72414,-73.783762
"3693",4156029,"QUEENS","184-45","ABERDEEN ROAD","NB","","ISSUED","04/26/2024","04/21/2025",2024-01-19,40.72414,-73.783762
"3694",4156029,"QUEENS","184-45","ABERDEEN ROAD","NB","","ISSUED","04/26/2024","04/05/2025",2024-01-22,40.72414,-73.783762
"3695",3082389,"BROOKLYN","411","THATFORD AVE.","A2","BL","ISSUED","04/29/2024","04/29/2025",2020-02-24,40.660306,-73.907355
"3696",4617668,"QUEENS","148-18","HILLSIDE AVE","A2","OT","ISSUED","04/29/2024","03/15/2025",2022-06-02,40.706166,-73.808184
"3697",1057619,"MANHATTAN","135","WEST 120TH STREET","A1","","ISSUED","04/26/2024","05/08/2025",2024-05-08,40.805065,-73.948924
"3698",2130622,"BRONX","97","WEST 169 STREET","NB","","ISSUED","04/30/2024","04/30/2025",2023-07-19,40.839538,-73.923177
"3699",1001405,"MANHATTAN","27","PARK PLACE","A1","PL","ISSUED","04/30/2024","04/30/2025",2020-09-09,40.713116,-74.008931
"3700",2130622,"BRONX","97","WEST 169 STREET","NB","","ISSUED","04/29/2024","04/30/2025",2023-06-27,40.839538,-73.923177
"3701",2130622,"BRONX","97","WEST 169 STREET","NB","","ISSUED","04/29/2024","04/30/2025",2023-06-27,40.839538,-73.923177
"3702",1028168,"MANHATTAN","36","WEST 66TH STREET","A3","EQ","ISSUED","05/01/2024","05/01/2025",2024-05-01,40.772885,-73.979865
"3703",4059011,"QUEENS","58-98","54 STREET","NB","PL","ISSUED","05/01/2024","05/01/2025",2020-03-03,40.718048,-73.914904
"3704",3144156,"BROOKLYN","333","65TH STREET","A2","MH","ISSUED","05/01/2024","05/01/2025",2023-04-06,40.638827,-74.022721
"3705",2004303,"BRONX","610","EAST 169TH STREET","A2","OT","ISSUED","05/01/2024","05/01/2025",2020-01-29,40.831387,-73.90213
"3706",2004303,"BRONX","610","EAST 169TH STREET","A2","MH","ISSUED","05/01/2024","05/01/2025",2020-01-29,40.831387,-73.90213
"3707",2004303,"BRONX","610","EAST 169TH STREET","A2","OT","ISSUED","05/01/2024","05/01/2025",2020-01-29,40.831387,-73.90213
"3708",4000548,"QUEENS","46-01","21 STREET","A2","OT","ISSUED","05/01/2024","05/01/2025",2021-03-18,40.745872,-73.948093
"3709",4000548,"QUEENS","46-01","21 STREET","A2","MH","ISSUED","05/01/2024","05/01/2025",2021-03-18,40.745872,-73.948093
"3710",4619732,"QUEENS","46-11","QUEENS BOULEVARD","NB","","ISSUED","05/01/2024","05/01/2025",2020-05-21,40.74314,-73.918488
"3711",4623141,"QUEENS","53-16","NORTHERN BOULEVARD","A2","FS","ISSUED","05/01/2024","05/01/2025",2023-07-18,40.753192,-73.907839
"3712",3326746,"BROOKLYN","2700","ATLANTIC AVENUE","NB","","ISSUED","05/01/2024","01/06/2025",2023-05-08,40.675937,-73.894603
"3713",1014251,"MANHATTAN","220","WEST 28TH STREET","A2","FS","ISSUED","05/01/2024","05/01/2025",2023-01-26,40.747582,-73.994197
"3714",3429464,"BROOKLYN","2440","FULTON STREET","NB","","ISSUED","05/01/2024","12/31/2024",2022-07-11,40.677869,-73.903473
"3715",2130818,"BRONX","1298","INWOOD AVENUE","DM","","ISSUED","05/01/2024","04/27/2025",2024-01-19,40.838458,-73.920338
"3716",5104468,"STATEN ISLAND","4855","HYLAN BOULEVARD","A1","","ISSUED","05/01/2024","01/19/2025",2021-11-26,40.526708,-74.167895
"3717",4607880,"QUEENS","122-06","MERRICK BOULEVARD","NB","PL","ISSUED","05/01/2024","05/01/2025",2022-10-05,40.683649,-73.769525
"3718",5170723,"STATEN ISLAND","4132","VICTORY BOULEVARD","NB","PL","ISSUED","05/02/2024","05/02/2025",2023-03-23,40.591375,-74.191216
"3719",3145672,"BROOKLYN","6901","3 AVENUE","A2","PL","ISSUED","05/02/2024","05/02/2025",2023-05-01,40.635607,-74.026078
"3720",2057045,"BRONX","800","EAST GUN HILL ROAD","A2","MH","ISSUED","05/02/2024","05/01/2025",2021-11-22,40.875953,-73.86197
"3721",3429247,"BROOKLYN","487","FOURTH AVENUE","NB","","ISSUED","05/01/2024","04/30/2025",2023-06-12,40.668453,-73.990289
"3722",2051571,"BRONX","980","MACE AVE","A2","OT","ISSUED","05/03/2024","04/21/2025",2020-02-13,40.863055,-73.859387
"3723",3115866,"BROOKLYN","601","PARKSIDE AVENUE","A2","OT","ISSUED","05/03/2024","10/25/2024",2021-10-25,40.656046,-73.953742
"3724",3328501,"BROOKLYN","2058","CROPSEY AVE","A2","OT","ISSUED","05/03/2024","04/25/2025",2023-11-21,40.599126,-74.001268
"3725",3335882,"BROOKLYN","172","CADMAN PLAZA EAST","A2","OT","ISSUED","05/03/2024","05/14/2025",2020-02-19,40.698511,-73.989906
"3726",1004377,"MANHATTAN","270","EAST 2ND STREET","NB","","ISSUED","03/27/2024","11/19/2024",2023-05-25,40.720822,-73.980602
"3727",1004377,"MANHATTAN","270","EAST 2ND STREET","NB","","ISSUED","05/01/2024","11/19/2024",2023-11-16,40.720822,-73.980602
"3728",1091704,"MANHATTAN","162","EAST 36 STREET","NB","","ISSUED","04/19/2024","05/03/2025",2024-05-03,40.747185,-73.977628
"3729",3193844,"BROOKLYN","2255","EAST 2 STREET","A1","","ISSUED","05/06/2024","05/06/2025",2020-03-03,40.594189,-73.969016
"3730",1013637,"MANHATTAN","341","WEST 38TH STREET","A1","","ISSUED","05/06/2024","07/14/2024",2021-10-25,40.755237,-73.992864
"3731",1091704,"MANHATTAN","162","EAST 36 STREET","NB","","ISSUED","04/19/2024","05/06/2025",2024-05-06,40.747185,-73.977628
"3732",3153881,"BROOKLYN","650","86TH STREET","A2","SD","ISSUED","05/07/2024","05/07/2025",2023-05-10,40.618851,-74.021875
"3733",3153881,"BROOKLYN","650","86TH STREET","A2","SP","ISSUED","05/07/2024","05/07/2025",2023-05-10,40.618851,-74.021875
"3734",4048427,"QUEENS","110-72","CORONA AVENUE","A2","SP","ISSUED","05/07/2024","05/07/2025",2024-05-07,40.740912,-73.850807
"3735",3009549,"BROOKLYN","218","23 STREET","NB","","ISSUED","05/07/2024","09/26/2024",2024-05-07,40.660664,-73.995329
"3736",3009549,"BROOKLYN","218","23 STREET","NB","","ISSUED","05/07/2024","09/26/2024",2024-05-07,40.660664,-73.995329
"3737",3009549,"BROOKLYN","218","23 STREET","NB","","ISSUED","05/07/2024","09/26/2024",2024-05-07,40.660664,-73.995329
"3738",3205691,"BROOKLYN","2670","COYLE STREET","A2","OT","ISSUED","05/08/2024","10/22/2024",2022-07-20,40.588353,-73.934778
"3739",3205691,"BROOKLYN","2670","COYLE STREET","A2","OT","ISSUED","05/08/2024","10/22/2024",2022-05-24,40.588353,-73.934778
"3740",3322167,"BROOKLYN","127","AVENUE X","A2","OT","ISSUED","05/08/2024","05/31/2024",2024-05-08,40.589589,-73.978991
"3741",4087416,"QUEENS","63-35","FRESH POND ROAD","A2","OT","ISSUED","05/08/2024","03/03/2025",2023-01-31,40.711388,-73.899907
"3742",2072575,"BRONX","2385","HOLLERS AVE","A2","OT","ISSUED","05/08/2024","03/03/2025",2022-09-19,40.885519,-73.823973
"3743",3029556,"BROOKLYN","820","CLASSON AVENUE","A1","PL","ISSUED","05/09/2024","05/09/2025",2020-01-27,40.672622,-73.960904
"3744",2011872,"BRONX","16","WADE SQUARE","NB","","ISSUED","05/09/2024","01/13/2025",2021-10-25,40.85193,-73.891082
"3745",2011872,"BRONX","16","WADE SQUARE","NB","","ISSUED","05/09/2024","01/13/2025",2021-10-25,40.85193,-73.891082
"3746",4436311,"QUEENS","81-03","HAMMELS BLVD","A2","OT","ISSUED","05/09/2024","05/01/2025",2020-02-28,40.589896,-73.807556
"3747",4436311,"QUEENS","81-03","HAMMELS BLVD","A2","MH","ISSUED","05/09/2024","05/01/2025",2020-02-28,40.589896,-73.807556
"3748",4436311,"QUEENS","81-03","HAMMELS BLVD","A2","OT","ISSUED","05/09/2024","05/01/2025",2020-02-28,40.589896,-73.807556
"3749",4436311,"QUEENS","81-03","HAMMELS BLVD","A2","MH","ISSUED","05/09/2024","05/01/2025",2020-03-03,40.589896,-73.807556
"3750",4436311,"QUEENS","81-03","HAMMELS BLVD","A2","OT","ISSUED","05/09/2024","05/01/2025",2020-02-28,40.589896,-73.807556
"3751",3150481,"BROOKLYN","7805","7 AVENUE","A2","PL","ISSUED","05/09/2024","05/09/2025",2023-05-12,40.624173,-74.018732
"3752",1013637,"MANHATTAN","341","WEST 38TH STREET","A1","PL","ISSUED","05/09/2024","05/09/2025",2022-05-12,40.755237,-73.992864
"3753",2053834,"BRONX","2721","COLDEN AVENUE","NB","","ISSUED","05/09/2024","10/16/2024",2023-09-15,40.866003,-73.859608
"3754",4295842,"QUEENS","162-44","98TH STREET","A2","OT","ISSUED","05/14/2024","07/01/2024",2024-05-14,40.654047,-73.833778
"3755",2092082,"BRONX","3603","THIRD AVENUE","A2","OT","ISSUED","05/14/2024","04/01/2025",2021-02-19,40.83308,-73.904809
"3756",1009430,"MANHATTAN","16","FIFTH AVENUE","NB","","ISSUED","05/14/2024","05/14/2025",2022-09-23,40.732624,-73.996092
"3757",1009430,"MANHATTAN","16","FIFTH AVENUE","NB","","ISSUED","05/14/2024","05/14/2025",2022-09-27,40.732624,-73.996092
"3758",1081137,"MANHATTAN","14","W 57TH STREET","DM","EQ","ISSUED","05/14/2024","05/14/2025",2023-05-31,40.763282,-73.974742
"3759",3018646,"BROOKLYN","85","4TH AVENUE","DM","","ISSUED","05/14/2024","04/26/2025",2024-05-15,40.681608,-73.980192
"3760",1091704,"MANHATTAN","162","EAST 36 STREET","NB","","ISSUED","04/19/2024","11/07/2025",2024-11-07,40.747185,-73.977628
"3761",3423079,"BROOKLYN","2408 GAR","CORTELYOU ROAD","DM","","ISSUED","05/16/2024","05/16/2025",2024-05-16,40.644203,-73.954341
"3762",3119041,"BROOKLYN","2406","CORTELYOU ROAD","DM","","ISSUED","05/16/2024","05/16/2025",2024-05-16,40.6442,-73.954395
"3763",4617668,"QUEENS","148-18","HILLSIDE AVE","A2","OT","IN PROCESS","05/16/2024","03/15/2025",2022-06-02,40.706166,-73.808184
"3764",1007174,"MANHATTAN","178","MOTT STREET","A1","PL","ISSUED","05/02/2024","05/16/2025",2021-05-27,40.720429,-73.995923
"3765",3255289,"BROOKLYN","2940","WEST 15 STREET","NB","","ISSUED","10/05/2022","10/05/2023",2021-10-14,40.576271,-73.982552
"3766",3255289,"BROOKLYN","2940","WEST 15 STREET","NB","","ISSUED","10/25/2022","04/06/2023",2021-10-14,40.576271,-73.982552
"3767",3255289,"BROOKLYN","2940","WEST 15 STREET","NB","","ISSUED","08/18/2023","08/17/2024",2021-10-14,40.576271,-73.982552
"3768",3255289,"BROOKLYN","2940","WEST 15 STREET","NB","","ISSUED","01/08/2024","08/19/2024",2021-10-14,40.576271,-73.982552
"3769",3255289,"BROOKLYN","2940","WEST 15 STREET","NB","","ISSUED","08/16/2023","08/19/2024",2021-10-14,40.576271,-73.982552
"3770",3153881,"BROOKLYN","650","86TH STREET","NB","PL","ISSUED","05/21/2024","05/21/2025",2022-10-24,40.618851,-74.021875
"3771",3153881,"BROOKLYN","650","86TH STREET","NB","PL","ISSUED","05/21/2024","05/21/2025",2022-06-16,40.618851,-74.021875
"3772",3338507,"BROOKLYN","1388","BUSHWICK AVENUE","A1","","ISSUED","04/23/2024","03/13/2025",2022-05-11,40.684868,-73.910025
"3773",1053247,"MANHATTAN","53","W 119 STREET","A1","PL","ISSUED","02/29/2024","05/23/2025",2024-05-23,40.803244,-73.946556
"3774",1058151,"MANHATTAN","135","WEST 132ND STREET","A1","","ISSUED","05/22/2024","01/01/2025",2020-08-07,40.812676,-73.94337
"3775",1079184,"MANHATTAN","224","12TH AVENUE","A2","OT","ISSUED","05/22/2024","02/13/2025",2021-02-05,40.752641,-74.007576
"3776",3425955,"BROOKLYN","2286","CROPSEY AVENUE","NB","PL","ISSUED","05/22/2024","05/22/2025",2020-12-21,40.595843,-73.997001
"3777",3322167,"BROOKLYN","127","AVENUE X","A2","OT","ISSUED","05/23/2024","05/31/2025",2024-05-08,40.589589,-73.978991
"3778",3039905,"BROOKLYN","1510","BROADWAY","NB","","ISSUED","05/24/2024","04/01/2025",2022-08-17,40.686811,-73.917364
"3779",3039905,"BROOKLYN","1510","BROADWAY","NB","","ISSUED","05/24/2024","04/01/2025",2022-08-17,40.686811,-73.917364
"3780",3039905,"BROOKLYN","1510","BROADWAY","NB","","ISSUED","05/24/2024","04/01/2025",2022-07-12,40.686811,-73.917364
"3781",3039905,"BROOKLYN","1510","BROADWAY","NB","","ISSUED","05/24/2024","04/01/2025",2022-08-17,40.686811,-73.917364
"3782",2003155,"BRONX","1139","ANDERSON AVENUE","A2","EQ","ISSUED","05/24/2024","05/24/2025",2024-05-24,40.83554,-73.924681
"3783",3416888,"BROOKLYN","4910","14TH AVENUE","NB","PL","ISSUED","05/28/2024","05/28/2025",2023-06-02,40.633578,-73.990052
"3784",4624278,"QUEENS","130-17","ROCKAWAY BOULEVARD","NB","PL","ISSUED","05/28/2024","05/28/2025",2023-05-24,40.674977,-73.808245
"3785",1008832,"MANHATTAN","1","UNIVERSITY PLACE","A2","OT","ISSUED","05/29/2024","06/29/2025",2021-05-21,40.730785,-73.995486
"3786",3255289,"BROOKLYN","1515","SURF AVENUE","A2","OT","ISSUED","09/15/2020","07/01/2021",2020-09-15,40.57547,-73.982995
"3787",3255289,"BROOKLYN","1515","SURF AVENUE","A2","OT","ISSUED","09/09/2021","12/03/2021",2020-09-15,40.57547,-73.982995
"3788",3255289,"BROOKLYN","2940","WEST 15 STREET","NB","","ISSUED","10/05/2021","10/14/2022",2021-10-14,40.576271,-73.982552
"3789",3255289,"BROOKLYN","2940","WEST 15 STREET","NB","","ISSUED","10/05/2021","10/14/2022",2021-10-14,40.576271,-73.982552
"3790",3255289,"BROOKLYN","2940","WEST 15 STREET","NB","","ISSUED","11/10/2021","11/10/2022",2021-10-14,40.576271,-73.982552
"3791",3255289,"BROOKLYN","2940","WEST 15 STREET","NB","","RE-ISSUED","09/19/2022","09/20/2023",2021-10-14,40.576271,-73.982552
"3792",3255289,"BROOKLYN","2940","WEST 15 STREET","NB","","RE-ISSUED","09/19/2022","09/20/2023",2022-03-14,40.576271,-73.982552
"3793",2128965,"BRONX","1001","WHITLOCK AVE","NB","","ISSUED","05/30/2024","05/23/2025",2023-07-05,40.823427,-73.887057
"3794",2130596,"BRONX","6201","BROADWAY","NB","","ISSUED","05/30/2024","05/30/2025",2024-03-21,40.896116,-73.896761
"3795",3004559,"BROOKLYN","407","CLINTON STREET","A1","PL","ISSUED","05/30/2024","05/30/2025",2020-10-26,40.682444,-73.998107
"3796",2071870,"BRONX","4750","WHITE PLAINS ROAD","NB","","ISSUED","05/30/2024","05/30/2025",2023-06-07,40.904834,-73.849625
"3797",2071870,"BRONX","4750","WHITE PLAINS ROAD","NB","","ISSUED","05/30/2024","05/30/2025",2023-06-07,40.904834,-73.849625
"3798",1091054,"MANHATTAN","144","WEST 125 STREET","A2","SP","ISSUED","05/30/2024","05/30/2025",2023-06-06,40.808523,-73.947278
"3799",4264486,"QUEENS","114-22","158 STREET","A1","","ISSUED","05/30/2024","05/02/2025",2023-11-30,40.687452,-73.788929
"3800",1084612,"MANHATTAN","59","HENRY STREET","NB","","ISSUED","05/31/2024","06/01/2025",2022-03-30,40.71299,-73.994939
"3801",1080352,"MANHATTAN","450","11TH AVENUE","NB","","ISSUED","06/03/2024","06/03/2025",2020-07-14,40.757486,-74.000729
"3802",1084174,"MANHATTAN","1867","AMSTERDAM AVENUE","DM","EQ","ISSUED","06/03/2024","06/03/2025",2024-06-03,40.829974,-73.944132
"3803",1030544,"MANHATTAN","2109","BROADWAY","A2","OT","ISSUED","06/03/2024","10/18/2025",2024-04-10,40.780408,-73.982076
"3804",1084174,"MANHATTAN","1867","AMSTERDAM AVENUE","DM","","ISSUED","06/04/2024","04/26/2025",2024-06-04,40.829974,-73.944132
"3805",1007953,"MANHATTAN","152","MERCER STREET","A2","OT","ISSUED","06/05/2024","01/01/2025",2020-07-07,40.725051,-73.998221
"3806",3426668,"BROOKLYN","960","EAST 23 STREET","A1","","ISSUED","06/06/2024","07/01/2025",2023-03-06,40.627053,-73.953708
"3807",3429585,"BROOKLYN","420","CARROLL STREET","A3","EQ","IN PROCESS","06/12/2020","",2020-06-16,40.677928,-73.988514
"3808",3150481,"BROOKLYN","7805","7 AVENUE","A2","PL","ISSUED","06/07/2024","06/07/2025",2023-06-14,40.624173,-74.018732
"3809",3338507,"BROOKLYN","1388","BUSHWICK AVENUE","A1","","ISSUED","04/23/2024","03/15/2025",2022-05-12,40.684868,-73.910025
"3810",4624506,"QUEENS","52-35","74TH STREET","NB","","ISSUED","05/29/2024","11/22/2024",2020-06-30,40.73288,-73.888332
"3811",4624506,"QUEENS","52-35","74TH STREET","NB","","ISSUED","05/29/2024","11/22/2024",2020-06-30,40.73288,-73.888332
"3812",4624506,"QUEENS","52-35","74TH STREET","NB","","ISSUED","05/29/2024","11/22/2024",2023-03-09,40.73288,-73.888332
"3813",2010965,"BRONX","1900","LONGFELLOW AVENUE","A1","","ISSUED","06/03/2024","06/10/2025",2023-11-09,40.838969,-73.882285
"3814",3062371,"BROOKLYN","156","NORTH 4TH STREET","A1","PL","ISSUED","06/24/2024","06/24/2025",2020-07-22,40.715975,-73.959212
"3815",2045727,"BRONX","1340","BLONDELL AVENUE","NB","","ISSUED","06/24/2024","10/23/2025",2023-10-04,40.841827,-73.842073
"3816",4447952,"QUEENS","138-03","LAKEWOOD AVENUE","A1","PL","ISSUED","06/25/2024","06/25/2025",2021-07-29,40.68591,-73.806569
"3817",4436311,"QUEENS","81-03","HAMMELS BLVD","A2","OT","ISSUED","06/25/2024","05/01/2025",2020-02-28,40.589896,-73.807556
"3818",1017224,"MANHATTAN","415","5TH AVENUE","A3","OT","ISSUED","06/25/2024","08/09/2024",2024-06-25,40.750603,-73.982972
"3819",3079192,"BROOKLYN","1321","BUSHWICK AVENUE","A1","PL","ISSUED","06/04/2024","06/25/2025",2024-06-25,40.686113,-73.912172
"3820",1088394,"MANHATTAN","125","WHITE STREET","DM","","ISSUED","06/26/2024","06/26/2025",2024-04-02,40.716715,-74.000346
"3821",4623739,"QUEENS","2-21","MALT DRIVE","A3","EQ","ISSUED","06/26/2024","06/26/2025",2023-04-28,NA,NA
"3822",4623739,"QUEENS","2-21","MALT DRIVE","A2","OT","ISSUED","06/26/2024","12/27/2024",2023-05-22,NA,NA
"3823",4623739,"QUEENS","2-21","MALT DRIVE","A2","EQ","ISSUED","06/26/2024","06/26/2025",2023-05-22,NA,NA
"3824",3429094,"BROOKLYN","170","FREEMAN STREET","NB","","ISSUED","05/30/2024","06/26/2025",2024-06-26,40.734481,-73.954532
"3825",3184245,"BROOKLYN","2219","AVENUE S","A2","OT","ISSUED","06/27/2024","05/01/2025",2023-08-24,40.604278,-73.950068
"3826",1079184,"MANHATTAN","224","12TH AVENUE","A2","OT","ISSUED","06/27/2024","07/01/2025",2020-09-28,40.752641,-74.007576
"3827",1079184,"MANHATTAN","224","12TH AVENUE","A2","OT","ISSUED","06/27/2024","07/01/2025",2021-01-13,40.752641,-74.007576
"3828",1079184,"MANHATTAN","224","12TH AVENUE","A1","","ISSUED","06/28/2024","07/01/2025",2020-09-28,40.752641,-74.007576
"3829",1081137,"MANHATTAN","14","W 57TH STREET","DM","","ISSUED","06/28/2024","06/26/2025",2023-05-31,40.763282,-73.974742
"3830",3005415,"BROOKLYN","100","3RD PLACE","A1","PL","ISSUED","06/28/2024","06/28/2025",2020-09-22,40.678774,-73.998032
"3831",3428543,"BROOKLYN","353","20TH STREET","NB","","ISSUED","06/28/2024","07/27/2024",2021-11-05,40.659703,-73.989162
"3832",3009549,"BROOKLYN","218","23 STREET","DM","","ISSUED","06/28/2024","09/26/2024",2023-12-04,40.660664,-73.995329
"3833",1079184,"MANHATTAN","224","12TH AVENUE","A3","OT","ISSUED","06/28/2024","07/01/2025",2023-04-20,40.752641,-74.007576
"3834",1079184,"MANHATTAN","224","12TH AVENUE","A3","OT","ISSUED","06/28/2024","07/01/2025",2023-04-20,40.752641,-74.007576
"3835",1079184,"MANHATTAN","224","12TH AVENUE","A3","OT","ISSUED","06/28/2024","07/01/2025",2023-04-20,40.752641,-74.007576
"3836",1079184,"MANHATTAN","224","12TH AVENUE","A3","OT","ISSUED","06/28/2024","07/01/2025",2023-04-20,40.752641,-74.007576
"3837",1079184,"MANHATTAN","224","12TH AVENUE","A3","OT","ISSUED","06/28/2024","07/01/2025",2023-04-20,40.752641,-74.007576
"3838",1079184,"MANHATTAN","224","12TH AVENUE","A3","OT","ISSUED","06/28/2024","07/01/2025",2023-04-20,40.752641,-74.007576
"3839",1079184,"MANHATTAN","224","12TH AVENUE","A3","OT","ISSUED","06/28/2024","07/01/2025",2023-04-20,40.752641,-74.007576
"3840",1079184,"MANHATTAN","224","12TH AVENUE","A3","OT","ISSUED","06/28/2024","07/01/2025",2023-04-20,40.752641,-74.007576
"3841",1079184,"MANHATTAN","224","12TH AVENUE","A3","OT","ISSUED","06/28/2024","07/01/2025",2023-04-20,40.752641,-74.007576
"3842",1079184,"MANHATTAN","224","12TH AVENUE","A3","OT","ISSUED","06/28/2024","07/01/2025",2023-04-20,40.752641,-74.007576
"3843",1079184,"MANHATTAN","224","12TH AVENUE","A3","OT","ISSUED","06/28/2024","07/01/2025",2023-04-20,40.752641,-74.007576
"3844",1079184,"MANHATTAN","224","12TH AVENUE","A3","OT","ISSUED","06/28/2024","07/01/2025",2023-04-18,40.752641,-74.007576
"3845",4433859,"QUEENS","104-60","QUEENS BOULEVARD","A2","OT","ISSUED","06/30/2024","07/01/2025",2020-02-19,40.723485,-73.84849
"3846",4433860,"QUEENS","104-20","QUEENS BOULEVARD","A2","OT","ISSUED","06/30/2024","07/01/2025",2020-02-19,40.72378,-73.848991
"3847",1009531,"MANHATTAN","26","WEST 11TH STREET","A2","OT","ISSUED","07/01/2024","07/01/2025",2022-09-30,40.734468,-73.996103
"3848",3429094,"BROOKLYN","170","FREEMAN STREET","NB","","ISSUED","07/01/2024","07/01/2025",2022-05-18,40.734481,-73.954532
"3849",2004136,"BRONX","581","AUSTIN PLACE","NB","","ISSUED","07/01/2024","10/30/2024",2023-02-09,40.811268,-73.901513
"3850",4116436,"QUEENS","46-21","COLDEN STREET","A2","OT","ISSUED","07/01/2024","08/03/2024",2020-03-02,40.749545,-73.822073
"3851",4116436,"QUEENS","46-21","COLDEN STREET","A2","OT","ISSUED","07/01/2024","08/03/2024",2020-11-03,40.749545,-73.822073
"3852",3427433,"BROOKLYN","210","NORTH 12TH STREET","A3","OT","ISSUED","06/22/2020","01/31/2021",2020-06-22,40.719977,-73.953773
"3853",3131065,"BROOKLYN","1036","OCEAN PARKWAY","A2","BL","ISSUED","02/14/2023","05/01/2023",2022-03-17,40.62329,-73.970317
"3854",2004136,"BRONX","581","AUSTIN PLACE","NB","","ISSUED","06/14/2024","10/30/2024",2020-06-29,40.811268,-73.901513
"3855",3429595,"BROOKLYN","180","ASHLAND PLACE","NB","","ISSUED","07/02/2024","07/02/2025",2022-08-11,40.689356,-73.978567
"3856",2130506,"BRONX","1223","SPOFFORD AVE","NB","","ISSUED","07/02/2024","07/02/2025",2024-03-13,40.813898,-73.890537
"3857",2017421,"BRONX","2702","CRESTON AVENUE","NB","","ISSUED","07/02/2024","09/09/2024",2023-07-13,40.867778,-73.894581
"3858",1022563,"MANHATTAN","1440","BROADWAY","A1","","ISSUED","07/02/2024","02/12/2025",2020-09-29,40.754611,-73.986761
"3859",2017421,"BRONX","2702","CRESTON AVENUE","NB","","ISSUED","07/02/2024","03/10/2025",2023-07-13,40.867778,-73.894581
"3860",3343253,"BROOKLYN","790","ELDERT LANE","A2","OT","ISSUED","01/04/2022","01/04/2023",2022-01-04,40.670554,-73.863105
"3861",3343253,"BROOKLYN","790","ELDERT LANE","A2","OT","ISSUED","01/17/2023","01/10/2024",2022-01-04,40.670554,-73.863105
"3862",1004054,"MANHATTAN","228","E BROADWAY","A1","","ISSUED","06/28/2024","02/12/2025",2022-07-20,40.714359,-73.986707
"3863",1091819,"MANHATTAN","3800","10 AVENUE","NB","","ISSUED","03/21/2024","07/02/2024",2023-12-05,40.86204,-73.920707
"3864",3016509,"BROOKLYN","511","7TH AVENUE","A2","OT","ISSUED","07/03/2024","05/31/2025",2022-06-28,40.661061,-73.986534
"3865",4430171,"QUEENS","50-25","BARNETT AVENUE","NB","","ISSUED","07/03/2024","07/03/2025",2024-07-03,40.750171,-73.913174
"3866",4436573,"QUEENS","2-33","50TH AVE","DM","EQ","ISSUED","05/10/2022","05/10/2023",2022-05-10,40.743499,-73.95808
"3867",4436573,"QUEENS","2-33","50TH AVE","DM","","ISSUED","05/10/2022","05/01/2023",2022-05-10,40.743499,-73.95808
"3868",1067116,"MANHATTAN","421","HUDSON STREET","A2","OT","ISSUED","04/05/2024","09/14/2024",2020-11-10,40.730063,-74.006891
"3869",1091819,"MANHATTAN","3800","10 AVENUE","NB","","ISSUED","06/28/2024","04/01/2025",2023-12-05,40.86204,-73.920707
"3870",3177479,"BROOKLYN","1727","OCEAN PARKWAY","A2","SP","ISSUED","07/05/2024","07/05/2025",2020-06-29,40.606488,-73.967112
"3871",1091704,"MANHATTAN","162","EAST 36 STREET","NB","","IN PROCESS","11/14/2024","",2024-05-06,40.747185,-73.977628
"3872",1080352,"MANHATTAN","450","11TH AVENUE","A2","EQ","ISSUED","07/08/2024","07/08/2025",2023-07-11,40.757486,-74.000729
"3873",3429205,"BROOKLYN","1538","BROOKLYN AVENUE","NB","","ISSUED","07/08/2024","08/22/2024",2021-05-25,40.635598,-73.942154
"3874",1028168,"MANHATTAN","36","WEST 66TH STREET","A3","EQ","ISSUED","07/08/2024","07/08/2025",2023-06-05,40.772885,-73.979865
"3875",3023848,"BROOKLYN","100","15 STREET","A1","","ISSUED","07/08/2024","01/01/2025",2022-01-21,40.66746,-73.993248
"3876",3023848,"BROOKLYN","100","15 STREET","A1","EQ","ISSUED","07/08/2024","07/08/2025",2022-01-21,40.66746,-73.993248
"3877",1048080,"MANHATTAN","155","EAST 88 STREET","A3","EQ","ISSUED","07/09/2024","07/09/2025",2023-05-13,40.78059,-73.954107
"3878",1091823,"MANHATTAN","3","SAINT MARKS PLACE","NB","","RE-ISSUED","02/25/2020","02/25/2021",2020-02-26,40.729379,-73.989475
"3879",1091823,"MANHATTAN","3","SAINT MARKS PLACE","NB","","ISSUED","02/25/2020","02/25/2021",2020-02-26,40.729379,-73.989475
"3880",1091823,"MANHATTAN","3","SAINT MARKS PLACE","NB","","ISSUED","02/25/2020","02/25/2021",2020-02-26,40.729379,-73.989475
"3881",1091823,"MANHATTAN","3","SAINT MARKS PLACE","NB","","ISSUED","06/22/2020","05/26/2022",2020-02-26,40.729379,-73.989475
"3882",1091823,"MANHATTAN","3","SAINT MARKS PLACE","NB","","ISSUED","06/22/2020","05/26/2022",2020-02-26,40.729379,-73.989475
"3883",1091823,"MANHATTAN","3","SAINT MARKS PLACE","NB","","ISSUED","06/22/2020","05/26/2022",2020-02-26,40.729379,-73.989475
"3884",1091823,"MANHATTAN","3","SAINT MARKS PLACE","NB","","ISSUED","06/09/2022","02/03/2023",2020-02-26,40.729379,-73.989475
"3885",1091823,"MANHATTAN","3","SAINT MARKS PLACE","NB","","ISSUED","06/09/2022","02/03/2023",2020-02-26,40.729379,-73.989475
"3886",1091823,"MANHATTAN","3","SAINT MARKS PLACE","NB","","ISSUED","06/09/2022","02/03/2023",2020-02-26,40.729379,-73.989475
"3887",1091823,"MANHATTAN","3","SAINT MARKS PLACE","NB","","ISSUED","09/28/2022","02/03/2023",2020-02-26,40.729379,-73.989475
"3888",1091823,"MANHATTAN","3","SAINT MARKS PLACE","NB","","ISSUED","09/28/2022","02/03/2023",2020-02-26,40.729379,-73.989475
"3889",1091823,"MANHATTAN","3","SAINT MARKS PLACE","NB","","ISSUED","09/28/2022","02/03/2023",2020-02-26,40.729379,-73.989475
"3890",1091823,"MANHATTAN","3","SAINT MARKS PLACE","NB","","ISSUED","10/24/2022","02/03/2023",2020-02-26,40.729379,-73.989475
"3891",1091823,"MANHATTAN","3","SAINT MARKS PLACE","NB","","ISSUED","10/24/2022","02/03/2023",2020-02-26,40.729379,-73.989475
"3892",1091823,"MANHATTAN","3","SAINT MARKS PLACE","NB","","ISSUED","10/24/2022","02/03/2023",2020-02-26,40.729379,-73.989475
"3893",1091823,"MANHATTAN","3","SAINT MARKS PLACE","NB","","ISSUED","01/13/2023","01/13/2024",2020-02-26,40.729379,-73.989475
"3894",1091823,"MANHATTAN","3","SAINT MARKS PLACE","NB","","ISSUED","01/13/2023","01/13/2024",2020-02-26,40.729379,-73.989475
"3895",1091823,"MANHATTAN","3","SAINT MARKS PLACE","NB","","ISSUED","01/13/2023","01/13/2024",2020-02-26,40.729379,-73.989475
"3896",1091823,"MANHATTAN","3","SAINT MARKS PLACE","A2","SD","ISSUED","08/17/2023","08/16/2024",2023-08-17,40.729379,-73.989475
"3897",1091823,"MANHATTAN","3","SAINT MARKS PLACE","NB","","ISSUED","12/11/2023","05/12/2024",2020-02-26,40.729379,-73.989475
"3898",1091823,"MANHATTAN","3","SAINT MARKS PLACE","NB","PL","ISSUED","02/15/2024","02/14/2025",2023-04-27,40.729379,-73.989475
"3899",1091823,"MANHATTAN","3","SAINT MARKS PLACE","NB","","ISSUED","05/10/2024","08/12/2024",2020-02-26,40.729379,-73.989475
"3900",4618772,"QUEENS","26-02","1ST STREET","NB","","ISSUED","07/10/2024","01/01/2025",2022-12-13,40.776821,-73.935533
"3901",3245804,"BROOKLYN","89","WEST END AVE","NB","","ISSUED","07/10/2024","05/17/2025",2021-04-16,40.579694,-73.953413
"3902",1001289,"MANHATTAN","100","GOLD STREET","A2","OT","ISSUED","07/10/2024","06/29/2025",2021-09-02,40.710353,-74.004007
"3903",1013637,"MANHATTAN","341","WEST 38TH STREET","A1","","ISSUED","07/10/2024","07/01/2025",2021-10-25,40.755237,-73.992864
"3904",3063244,"BROOKLYN","61","SOUTH 4TH STREET","A1","PL","ISSUED","07/15/2024","07/15/2025",2024-07-15,40.71281,-73.965581
"3905",1019603,"MANHATTAN","245","EAST 19TH STREET","A2","OT","ISSUED","07/15/2024","11/01/2024",2023-08-01,40.735828,-73.983614
"3906",1044935,"MANHATTAN","330","EAST 75TH STREET","A2","OT","ISSUED","07/15/2024","09/01/2024",2021-02-12,40.770383,-73.956085
"3907",4018478,"QUEENS","2038","27TH STREET","A2","OT","ISSUED","01/05/2020","03/01/2020",2020-01-13,40.780662,-73.909589
"3908",3335736,"BROOKLYN","87","RIVER STREET","A2","OT","ISSUED","01/24/2020","11/30/2020",2020-01-24,40.717338,-73.965661
"3909",3161588,"BROOKLYN","2034","77 ST","A2","OT","ISSUED","02/05/2020","03/29/2020",2020-02-05,40.609155,-73.99212
"3910",3023848,"BROOKLYN","100","15TH STREET","A2","OT","ISSUED","02/19/2020","01/31/2021",2020-02-24,40.66746,-73.993248
"3911",1090786,"MANHATTAN","1241","BROADWAY","A2","EQ","ISSUED","07/31/2020","07/31/2021",2020-07-31,40.747192,-73.988383
"3912",3058228,"BROOKLYN","111","WILLOUGHBY STREET","A2","OT","ISSUED","07/30/2020","10/30/2020",2020-07-30,40.69214,-73.984628
"3913",4246023,"QUEENS","138-19","LAFAYETTE ST.","A2","OT","ISSUED","08/14/2020","10/08/2020",2020-08-14,40.671245,-73.845116
"3914",4042866,"QUEENS","33-16","112 STREET","A1","","ISSUED","08/12/2020","05/28/2021",2020-08-12,40.757658,-73.857469
"3915",2129168,"BRONX","980","WESTCHESTER AVENUE","A3","EQ","ISSUED","08/12/2020","08/12/2021",2020-08-12,40.823204,-73.894731
"3916",3006277,"BROOKLYN","58","ST MARKS PLACE","A3","EQ","ISSUED","08/14/2020","08/14/2021",2020-08-14,40.682113,-73.980718
"3917",1015587,"MANHATTAN","40","WEST 24 STREET","A2","OT","ISSUED","08/14/2020","12/18/2020",2020-08-14,40.742743,-73.990401
"3918",4618858,"QUEENS","43-16","166 ST","NB","","ISSUED","08/14/2020","05/13/2021",2020-08-14,40.758079,-73.800534
"3919",4208570,"QUEENS","84-14","150 STREET","A2","OT","ISSUED","08/24/2020","06/15/2021",2020-08-24,40.713122,-73.809993
"3920",1001027,"MANHATTAN","140","BROADWAY","A2","OT","ISSUED","08/24/2020","04/20/2021",2020-08-24,40.709043,-74.010626
"3921",1022678,"MANHATTAN","1211","AVENUE OF THE AMERICAS","A2","OT","ISSUED","08/31/2020","09/30/2021",2020-07-07,40.758393,-73.981537
"3922",3129033,"BROOKLYN","1607","49 STREET","A2","OT","ISSUED","09/01/2020","08/31/2021",2020-06-11,40.630759,-73.985031
"3923",3029382,"BROOKLYN","396","STERLING PLACE","A2","OT","ISSUED","09/03/2020","01/25/2021",2020-09-03,40.674954,-73.964987
"3924",3009549,"BROOKLYN","218","23 STREET","NB","","ISSUED","11/14/2024","09/26/2025",2024-05-07,40.660664,-73.995329
"3925",1083719,"MANHATTAN","1345","6TH AVENUE","A2","OT","ISSUED","09/15/2020","05/07/2021",2020-09-18,40.762605,-73.97846
"3926",1081114,"MANHATTAN","2130","MADISON AVENUE","A2","OT","ISSUED","09/18/2020","08/03/2021",2020-09-18,40.811232,-73.936648
"3927",3228043,"BROOKLYN","14","PAERDEGAT 15 STREET","A2","OT","ISSUED","09/21/2020","10/21/2020",2020-09-21,40.627116,-73.901302
"3928",3106519,"BROOKLYN","460","EAST NEW YORK AVENUE","A1","","ISSUED","09/21/2020","01/27/2021",2020-07-31,40.661769,-73.947307
"3929",1080258,"MANHATTAN","52","GANSEVOORT STREET","A2","OT","ISSUED","09/23/2020","12/08/2020",2020-09-29,40.739389,-74.006928
"3930",4433860,"QUEENS","104-20","QUEENS BOULEVARD","A2","OT","ISSUED","10/02/2020","12/06/2020",2020-02-19,40.72378,-73.848991
"3931",1090972,"MANHATTAN","42","TRINITY PLACE","A2","PL","ISSUED","11/17/2021","11/17/2022",2020-11-23,40.707437,-74.013194
"3932",3000603,"BROOKLYN","100","FLATBUSH AVENUE","NB","","ISSUED","06/22/2021","06/22/2022",2021-06-22,40.685511,-73.978525
"3933",3119596,"BROOKLYN","1148","FLATBUSH AVE","A3","OT","ISSUED","11/12/2020","06/24/2021",2020-11-12,40.642307,-73.957412
"3934",1088749,"MANHATTAN","1","MADISON AVENUE","A3","EQ","ISSUED","10/15/2020","10/15/2021",2020-10-15,40.740909,-73.987947
"3935",1076746,"MANHATTAN","177","FT WASHINGTON AVENUE","A2","OT","ISSUED","10/13/2020","11/01/2020",2020-10-13,40.841153,-73.942691
"3936",4105078,"QUEENS","23-19","PARSONS BLVD","NB","","ISSUED","10/20/2020","12/08/2020",2020-10-20,40.778178,-73.823874
"3937",4209674,"QUEENS","89-14","168 PLACE","A2","OT","ISSUED","10/26/2020","12/18/2020",2020-10-26,40.708703,-73.792941
"3938",1090786,"MANHATTAN","1241","BROADWAY","A2","EQ","ISSUED","10/23/2020","10/23/2021",2020-10-23,40.747192,-73.988383
"3939",3428850,"BROOKLYN","1120","SAINT JOHNS PLACE","NB","","ISSUED","02/24/2020","02/23/2021",2020-02-24,40.671134,-73.941251
"3940",1033691,"MANHATTAN","720","WEST END AVENUE","A2","OT","ISSUED","06/24/2021","07/01/2022",2020-01-08,40.794723,-73.973581
"3941",3122559,"BROOKLYN","168","PROSPECT PARK SOUTHWEST","A2","OT","IN PROCESS","10/28/2020","01/16/2021",2020-10-28,40.654227,-73.973154
"3942",1091733,"MANHATTAN","331","EAST 82 STREET","NB","PL","ISSUED","11/03/2020","11/03/2021",2020-11-03,40.774935,-73.95276
"3943",3000519,"BROOKLYN","285","SCHERMERHORN STREET","A3","EQ","ISSUED","11/06/2020","11/06/2021",2020-11-06,40.687759,-73.982898
"3944",2128709,"BRONX","3187","GRAND CONCOURSE","NB","","RE-ISSUED","11/10/2020","11/12/2021",2020-05-08,40.876341,-73.885774
"3945",3193844,"BROOKLYN","2255","EAST 2 STREET","A1","PL","ISSUED","11/13/2020","11/13/2021",2020-11-13,40.594189,-73.969016
"3946",1086331,"MANHATTAN","111","ANDES ROAD","A1","","ISSUED","06/23/2021","06/25/2022",2021-06-25,40.692552,-74.016281
"3947",2013636,"BRONX","2069","ANTHONY AVENUE","NB","","ISSUED","11/19/2020","06/13/2021",2020-02-27,40.852697,-73.902066
"3948",1029933,"MANHATTAN","121","WEST 72 STREET","A1","","ISSUED","11/17/2020","05/14/2021",2020-11-19,40.777762,-73.979607
"3949",4619474,"QUEENS","108-60","HORACE HARDING EXPWY","NB","PL","ISSUED","11/24/2020","11/24/2021",2020-11-24,NA,NA
"3950",2014115,"BRONX","2389","WALTON AVENUE","A2","OT","ISSUED","11/20/2020","08/17/2021",2020-11-20,40.860889,-73.901262
"3951",4290555,"QUEENS","257-40","147 DRIVE","A2","OT","ISSUED","08/18/2021","10/01/2021",2021-08-18,40.655734,-73.731508
"3952",3426347,"BROOKLYN","689","FRANKLIN AVE","NB","","ISSUED","06/18/2021","06/28/2022",2021-06-28,40.674915,-73.956422
"3953",4619097,"QUEENS","104-16","TUCKERTON STREET","NB","","ISSUED","06/30/2021","06/30/2022",2021-06-30,40.698219,-73.801037
"3954",3008018,"BROOKLYN","429","COURT STREET","A2","OT","ISSUED","07/01/2021","06/29/2022",2020-08-14,40.6785,-73.997747
"3955",1077417,"MANHATTAN","23","ST. JAMES PL.","A2","PL","ISSUED","07/13/2021","07/13/2022",2021-07-13,40.711618,-73.999852
"3956",2092082,"BRONX","3603","THIRD AVENUE","A2","MH","ISSUED","07/15/2021","11/11/2021",2021-07-15,40.83308,-73.904809
"3957",3391632,"BROOKLYN","692","LINCOLN AVENUE","A2","OT","ISSUED","07/22/2021","04/21/2022",2021-07-22,40.67226,-73.86635
"3958",1038761,"MANHATTAN","304","E 45TH ST","A2","OT","ISSUED","07/21/2021","08/09/2022",2021-05-03,40.75157,-73.970393
"3959",4156196,"QUEENS","80-74","188 STREET","DM","","ISSUED","07/21/2021","11/17/2021",2021-07-23,40.727136,-73.780205
"3960",2130558,"BRONX","6327","BROADWAY","NB","","ISSUED","05/12/2021","05/23/2022",2020-12-23,NA,NA
"3961",3004546,"BROOKLYN","207","PRESIDENT STREET","A1","","ISSUED","08/01/2021","07/17/2022",2020-12-21,40.682482,-73.998861
"3962",3054518,"BROOKLYN","130","RYERSON ST","A1","","IN PROCESS","08/04/2021","",2022-04-14,40.694109,-73.965114
"3963",1076225,"MANHATTAN","25","CENTRAL PARK WEST","A2","OT","ISSUED","08/04/2021","06/03/2022",2222-08-19,40.770148,-73.9804
"3964",4271128,"QUEENS","140-31","173 STREET","A2","OT","ISSUED","08/26/2021","06/01/2022",2021-08-26,40.670851,-73.767363
"3965",1084771,"MANHATTAN","301","PARK AVENUE","A3","EQ","ISSUED","08/25/2021","08/25/2022",2020-09-15,40.756648,-73.974358
"3966",2004358,"BRONX","844","ST ANNS AVENUE","A2","OT","ISSUED","08/26/2021","08/30/2022",2020-12-11,40.821781,-73.909692
"3967",4008138,"QUEENS","34-02","31 STREET","A1","","ISSUED","09/08/2021","01/01/2022",2020-09-24,40.759422,-73.927464
"3968",4271921,"QUEENS","118-42","200TH STREET","A2","OT","ISSUED","09/15/2021","11/01/2021",2021-09-15,40.692603,-73.751712
"3969",5133590,"STATEN ISLAND","76","PITNEY AVENUE","A2","OT","ISSUED","09/29/2021","10/01/2021",2021-10-01,40.530278,-74.220356
"3970",1088749,"MANHATTAN","1","MADISON AVENUE","A3","EQ","ISSUED","09/29/2021","09/30/2022",2021-09-30,40.740909,-73.987947
"3971",4267787,"QUEENS","119-56","167 STREET","A1","","ISSUED","10/08/2021","10/13/2022",2021-10-13,40.68271,-73.778008
"3972",5025279,"STATEN ISLAND","70","PORT RICHMOND AVE","A1","","ISSUED","10/08/2021","09/22/2022",2021-03-09,40.639236,-74.132424
"3973",4624027,"QUEENS","20-50","NAMEOKE AVENUE","NB","","ISSUED","06/30/2021","09/27/2021",2021-06-30,40.607683,-73.75205
"3974",4074432,"QUEENS","67-47","ALDERTON STREET","NB","","ISSUED","10/05/2021","08/26/2022",2020-11-16,40.716587,-73.858754
"3975",3000519,"BROOKLYN","285","SCHERMERHORN STREET","A3","EQ","ISSUED","10/28/2021","10/28/2022",2020-11-04,40.687759,-73.982898
"3976",1001877,"MANHATTAN","66","LEONARD STREET","A2","OT","ISSUED","10/22/2021","09/16/2022",2020-11-03,40.717549,-74.005523
"3977",3426198,"BROOKLYN","540","NEPTUNE AVENUE","DM","EQ","ISSUED","11/05/2021","11/05/2022",2021-11-05,40.579879,-73.973184
"3978",3426198,"BROOKLYN","532","NEPTUNE AVENUE","DM","EQ","ISSUED","11/05/2021","11/05/2022",2021-11-05,40.579868,-73.973025
"3979",3429225,"BROOKLYN","318","NEVINS STREET","A2","MH","IN PROCESS","04/16/2021","",2021-04-16,40.678568,-73.987767
"3980",3332256,"BROOKLYN","488","MARCUS GARVEY BOULEVARD","NB","PL","ISSUED","11/12/2021","11/12/2022",2021-11-12,40.680204,-73.937501
"3981",4567876,"QUEENS","209-59REA","46 AVE.","A2","OT","ISSUED","02/28/2022","03/02/2023",2020-02-10,NA,NA
"3982",3084024,"BROOKLYN","234","HINSDALE STREET","A2","OT","ISSUED","12/06/2021","01/26/2022",2021-12-06,40.669442,-73.900068
"3983",3332217,"BROOKLYN","92","CENTRE MALL","A2","OT","ISSUED","12/13/2021","01/01/2023",2020-06-29,40.674833,-74.003558
"3984",3019597,"BROOKLYN","180","6TH AVENUE","A2","OT","ISSUED","12/13/2021","08/26/2022",2021-12-13,40.67634,-73.977367
"3985",3426528,"BROOKLYN","2735","EAST 13 STREET","A3","EQ","ISSUED","12/14/2021","12/14/2022",2020-12-31,40.584592,-73.955591
"3986",2010971,"BRONX","1923","WEST FARMS ROAD","NB","PL","ISSUED","12/20/2021","12/20/2022",2020-12-29,40.83877,-73.880999
"3987",3246888,"BROOKLYN","2971","CONEY ISLAND AVENUE","NB","","ISSUED","12/27/2021","01/01/2023",2020-08-28,40.583965,-73.959991
"3988",4431430,"QUEENS","35-31","85TH STREET","A2","OT","ISSUED","01/03/2022","01/01/2023",2021-04-23,40.751738,-73.881819
"3989",3129337,"BROOKLYN","1520","50TH STREET","A1","","ISSUED","01/04/2022","12/31/2022",2020-06-16,40.631409,-73.987661
"3990",3202030,"BROOKLYN","1719","AVENUE X","A2","OT","ISSUED","01/10/2022","05/23/2022",2020-12-08,40.592449,-73.952994
"3991",1091717,"MANHATTAN","155","WEST 29TH STREET","NB","","ISSUED","10/06/2021","10/01/2022",2021-07-13,40.747308,-73.991587
"3992",5082634,"STATEN ISLAND","100","LUTEN AVENUE","A2","OT","RE-ISSUED","01/12/2022","04/01/2022",2022-01-12,40.528092,-74.192032
"3993",3006277,"BROOKLYN","58","SAINT MARKS PLACE","A3","EQ","ISSUED","08/18/2021","08/18/2022",2020-09-15,40.682113,-73.980718
"3994",3236919,"BROOKLYN","2052","E 63RD STREET","A2","OT","ISSUED","01/18/2022","12/07/2022",2021-11-11,40.616567,-73.913834
"3995",4074432,"QUEENS","6747","ALDERTON STREET","A2","OT","ISSUED","01/21/2022","08/26/2022",2022-01-21,40.716587,-73.858754
"3996",2092077,"BRONX","1428","WEBSTER AVENUE","A2","OT","ISSUED","01/25/2022","10/17/2022",2022-01-25,40.836982,-73.906921
"3997",3043367,"BROOKLYN","859","LAFAYETTE AVE","DM","","ISSUED","01/26/2022","01/26/2023",2022-01-26,40.691397,-73.938219
"3998",3057470,"BROOKLYN","625","ATLANTIC AVENUE","A2","OT","ISSUED","01/31/2022","02/01/2023",2021-08-16,40.683457,-73.975616
"3999",3429283,"BROOKLYN","763","PARK AVENUE","NB","","ISSUED","01/27/2022","01/27/2023",2021-11-30,40.698136,-73.944805
"4000",3429283,"BROOKLYN","763","PARK AVENUE","NB","","ISSUED","01/27/2022","01/27/2023",2021-11-30,40.698136,-73.944805
"4001",3179617,"BROOKLYN","1417","AVENUE J","A2","SP","ISSUED","02/07/2022","02/07/2023",2022-02-07,40.625116,-73.962074
"4002",1088749,"MANHATTAN","1","MADISON AVENUE","A2","EQ","ISSUED","01/29/2022","01/29/2023",2022-01-29,40.740909,-73.987947
"4003",4090665,"QUEENS","61-18","COOPER AVE","A2","OT","ISSUED","02/08/2022","01/28/2023",2022-02-11,40.697268,-73.893261
"4004",3156199,"BROOKLYN","9948","FORT HAMILTON PARKWAY","A2","OT","ISSUED","12/17/2021","11/30/2022",2021-11-03,40.611739,-74.032059
"4005",3027710,"BROOKLYN","942","PACIFIC ST","A1","","ISSUED","02/10/2022","08/09/2022",2021-06-30,40.679852,-73.962432
"4006",3377687,"BROOKLYN","3065 GAR","BRIGHTON 6TH STREET","DM","","IN PROCESS","02/10/2022","",2021-01-07,40.578155,-73.961643
"4007",2012457,"BRONX","2321","BELMONT AVENUE","A3","OT","ISSUED","02/17/2022","12/24/2022",2020-01-22,40.85329,-73.88684
"4008",3428543,"BROOKLYN","353","20TH STREET","NB","PL","ISSUED","02/17/2022","02/17/2023",2021-02-02,40.659703,-73.989162
"4009",5143867,"STATEN ISLAND","789GAR","WILLOW ROAD WEST","DM","EQ","ISSUED","02/18/2022","02/18/2023",2022-02-18,40.614625,-74.155131
"4010",3035761,"BROOKLYN","1580","DEAN STREET","A2","PL","ISSUED","03/04/2022","03/04/2023",2022-03-04,40.676094,-73.935688
"4011",2023352,"BRONX","1464","WATSON AVENUE","A1","","ISSUED","03/04/2022","03/12/2023",2021-07-20,40.825672,-73.881178
"4012",2057045,"BRONX","800","EAST GUN HILL ROAD","A2","MH","ISSUED","05/09/2022","05/01/2023",2021-11-22,40.875953,-73.86197
"4013",5082634,"STATEN ISLAND","100","LUTEN AVENUE","A2","MH","ISSUED","05/09/2022","05/01/2023",2022-01-28,40.528092,-74.192032
"4014",3400905,"BROOKLYN","1038","JEFFERSON AVENUE","NB","","ISSUED","03/08/2022","12/11/2022",2022-03-08,40.68739,-73.917085
"4015",3400905,"BROOKLYN","1038","JEFFERSON AVENUE","NB","","ISSUED","03/08/2022","12/11/2022",2022-03-08,40.68739,-73.917085
"4016",4135975,"QUEENS","34-06","214 LANE","NB","","ISSUED","03/16/2022","03/16/2023",2021-12-23,40.769875,-73.770692
"4017",3052413,"BROOKLYN","407","TOMPKINS AVE","A1","","ISSUED","03/18/2022","04/04/2023",2021-07-16,40.683536,-73.943937
"4018",2000140,"BRONX","91","BRUCKNER BOULEVARD","DM","","ISSUED","03/18/2022","09/20/2022",2022-03-18,40.805639,-73.924596
"4019",1063247,"MANHATTAN","780","RIVERSIDE DRIVE","A2","OT","ISSUED","03/17/2022","03/17/2023",2022-03-17,40.834208,-73.9481
"4020",2017263,"BRONX","261","E 202 ST","NB","","ISSUED","02/23/2022","01/01/2023",2020-12-04,40.872791,-73.884688
"4021",3429595,"BROOKLYN","180","ASHLAND PLACE","NB","","ISSUED","03/23/2022","03/31/2023",2022-03-31,40.689356,-73.978567
"4022",3071418,"BROOKLYN","325","BUSHWICK AVENUE","A2","OT","ISSUED","03/28/2022","03/01/2023",2020-02-13,40.705204,-73.939407
"4023",4619097,"QUEENS","104-16","TUCKERTON STREET","NB","","ISSUED","03/28/2022","07/15/2023",2021-06-30,40.698219,-73.801037
"4024",1017224,"MANHATTAN","415","5TH AVE","A3","EQ","ISSUED","03/30/2022","03/30/2023",2022-03-30,40.750603,-73.982972
"4025",5044038,"STATEN ISLAND","293","MARYLAND AVENUE","A2","OT","ISSUED","03/30/2022","10/21/2022",2022-03-30,40.610599,-74.071136
"4026",3332224,"BROOKLYN","748","HENRY STREET","A2","MH","ISSUED","03/31/2022","04/01/2023",2020-06-26,40.675409,-74.003612
"4027",3428817,"BROOKLYN","268","BARBEY STREET","NB","PL","ISSUED","04/04/2022","04/08/2023",2022-04-08,40.676365,-73.888452
"4028",3428817,"BROOKLYN","268","BARBEY STREET","NB","PL","ISSUED","04/04/2022","04/08/2023",2022-04-08,40.676365,-73.888452
"4029",4619474,"QUEENS","108-60","HORACE HARDING EXPWY","NB","","ISSUED","04/07/2022","11/01/2022",2020-01-23,NA,NA
"4030",3246888,"BROOKLYN","2971","CONEY ISLAND AVENUE","NB","","ISSUED","04/08/2022","03/01/2023",2020-09-02,40.583965,-73.959991
"4031",3069262,"BROOKLYN","302","GRAHAM AVENUE","NB","PL","ISSUED","04/04/2022","04/04/2023",2022-04-04,40.712768,-73.944086
"4032",4624506,"QUEENS","52-35","74TH STREET","NB","","ISSUED","04/14/2022","04/08/2023",2020-06-30,40.73288,-73.888332
"4033",3180681,"BROOKLYN","1609","AVENUE M","A1","","ISSUED","04/13/2022","10/29/2022",2021-09-10,40.618143,-73.958908
"4034",2004303,"BRONX","610","EAST 169TH STREET","A2","OT","ISSUED","04/15/2022","05/01/2023",2020-01-29,40.831387,-73.90213
"4035",1036505,"MANHATTAN","425","PARK AVENUE","A2","OT","ISSUED","04/18/2022","04/20/2023",2021-02-03,40.760512,-73.971541
"4036",2010971,"BRONX","1923","WEST FARMS ROAD","A3","EQ","ISSUED","04/21/2022","04/21/2023",2022-04-21,40.83877,-73.880999
"4037",4043911,"QUEENS","97-06","37 AVE","A1","EQ","ISSUED","04/22/2022","04/22/2023",2022-04-22,40.751832,-73.869774
"4038",5082634,"STATEN ISLAND","100","LUTEN AVENUE","A2","OT","ISSUED","04/22/2022","04/01/2023",2022-01-12,40.528092,-74.192032
"4039",3320833,"BROOKLYN","142","AVENUE O","DM","","IN PROCESS","04/22/2022","",2022-04-22,40.610682,-73.979647
"4040",1004054,"MANHATTAN","228","EAST BROADWAY","A2","OT","ISSUED","04/25/2022","07/01/2022",2020-01-23,40.714359,-73.986707
"4041",2826970,"BRONX","334","EAST 176TH STREET","NB","","ISSUED","04/27/2022","04/27/2023",2022-04-27,40.847527,-73.903028
"4042",4436311,"QUEENS","81-03","HAMMELS BLVD","A2","MH","ISSUED","04/29/2022","05/01/2023",2020-03-03,40.589896,-73.807556
"4043",4261372,"QUEENS","120-26","144TH STREET","A2","OT","IN PROCESS","05/02/2022","",2022-05-02,40.675787,-73.79557
"4044",5171798,"STATEN ISLAND","168","MACGREGOR STREET","NB","PL","ISSUED","06/23/2021","06/23/2022",2021-06-23,40.523635,-74.199475
"4045",4060553,"QUEENS","61-12","56 ROAD","NB","PL","ISSUED","05/04/2022","05/04/2023",2021-04-27,40.724355,-73.903976
"4046",4135975,"QUEENS","214-43","35TH AVENUE","A2","OT","ISSUED","04/28/2022","09/10/2022",2021-05-18,40.769601,-73.770863
"4047",4624506,"QUEENS","52-35","74TH STREET","NB","","ISSUED","11/15/2024","12/01/2025",2020-06-30,40.73288,-73.888332
"4048",4005002,"QUEENS","41-08","CRESCENT STREET","NB","PL","ISSUED","11/15/2024","11/15/2025",2024-11-15,40.751972,-73.93935
"4049",4624506,"QUEENS","52-35","74TH STREET","NB","","ISSUED","11/15/2024","12/01/2025",2020-06-30,40.73288,-73.888332
